{
    "orig": {
        "aktenzeichen": "HRB 29934",
        "amtsgericht": "Dresden",
        "event_date": "2014-01-30",
        "event_type": "Veränderungen",
        "federal_state": "sn",
        "full_text": "Amtsgericht Dresden Aktenzeichen: HRB 29934 \nBekannt gemacht am: 30.01.2014 16:39 Uhr\n\n\n\n\nDie in () gesetzten Angaben der Geschäftsanschrift und des  Unternehmensgegenstandes erfolgen ohne Gewähr.\nVeränderungen\n30.01.2014\n\nHRB 29934:LoZeiT-Laden UG (haftungsbeschränkt), Dresden, Bürgerstr. 62, 01127 Dresden.Von Amts wegen eingetragen: Die Gesellschaft wird durch den/die Liquidator/en vertreten. Von Amts wegen eingetragen: Liquidator: Schreiber, Regina, Coswig, *28.07.1954. Durch Beschluss des Amtsgerichts Dresden vom 08.01.2014, AZ: 534 IN 1823/13, wurde der Antrag auf Eröffnung des Insolvenzverfahrens mangels Masse abgelehnt. Die Gesellschaft ist aufgelöst. Von Amts wegen eingetragen gemäß § 65 Abs. 1 GmbHG.",
        "gesellschafter": null,
        "inhaber": null,
        "name": "HRB 29934:LoZeiT-Laden UG (haftungsbeschränkt)",
        "notice_id": "165054",
        "posted_on": "2014-01-30",
        "rechtsform": null,
        "sitz": null,
        "url": "https://www.handelsregisterbekanntmachungen.de/en/skripte/hrb.php?rb_id=165054&land_abk=sn"
    },
    "parsed": {
        "flags": [
            {
                "flag": "CompanyClosed",
                "text": "Die\\ Gesellschaft\\ ist\\ aufgel\\öst\\."
            }
        ],
        "officers": [
            {
                "class": "Liquidator",
                "payload": {
                    "city": "Coswig",
                    "dob": "1954-07-28",
                    "lastname": "Schreiber",
                    "name": "Regina"
                },
                "text": " Schreiber, Regina, Coswig, *28.07.1954."
            }
        ]
    }
}