{
    "orig": {
        "aktenzeichen": "hrb 40265",
        "amtsgericht": "mainz",
        "event_date": "2017-12-22",
        "event_type": "veränderungen",
        "federal_state": "rp",
        "full_text": "amtsgericht mainz aktenzeichen: hrb 40265 \nbekannt gemacht am: 22.12.2017 20:06 uhr\n\n\n\n\ndie in () gesetzten angaben der anschrift und des geschäftszweiges erfolgen ohne gewähr.\nveränderungen\n22.12.2017\n\nhrb 40265: freiheitblau gmbh, mainz, untere zahlbacher str. 60, 55131 mainz. die gesellschafterversammlung vom 19.12.2017 hat die vollständige neufassung des gesellschaftsvertrages, insbesondere in § 2 (gegenstand des (unternehmens) und mit ihr die änderung des unternehmensgegenstandes beschlossen. geändert, jetzt: der betrieb einer agentur für live-marketing, ferner die erbringung folgender dienstleistungen: kreation, kundenberatung, erstellung von emotionalen designs und dramaturgien, erstellung von aktionsmitteln, ausschreibung, koordination und beauftragung von dienstleistungen, qualitätssicherung in der umsetzung aller maßnahmen, erfolgskontrolle administrative rückabwicklung. schwerpunkte bestehen ebenfalls in den bereichen content development und technologiegetriebene kommunikationsstrategien. einzelprokura: feddersen, régis, saulheim, *02.02.1977; röger, thomas, mainz-kastel, *27.06.1977.",
        "gesellschafter": null,
        "inhaber": null,
        "name": "hrb 40265: freiheitblau gmbh",
        "notice_id": "235313",
        "posted_on": "2017-12-22",
        "rechtsform": null,
        "sitz": null,
        "url": "https://www.handelsregisterbekanntmachungen.de/en/skripte/hrb.php?rb_id=235313&land_abk=rp"
    },
    "parsed": {
        "officers": [
            {
                "class": "SingleProcuration",
                "payload": {
                    "city": "saulheim",
                    "dob": "1977-02-02",
                    "lastname": "feddersen",
                    "name": "régis"
                },
                "text": " feddersen, régis, saulheim, *02.02.1977"
            }
        ]
    }
}