{
    "orig": {
        "aktenzeichen": "HRB 124426",
        "amtsgericht": "Hamburg",
        "event_date": "2016-02-26",
        "event_type": "Veränderungen",
        "federal_state": "hh",
        "full_text": "Amtsgericht Hamburg Aktenzeichen: HRB 124426 \nBekannt gemacht am: 26.02.2016 13:53 Uhr\n\n\n\n\nIn () gesetzte Angaben der Anschrift und des Geschäftszweiges erfolgen ohne Gewähr.\nVeränderungen\n26.02.2016\n\nHRB 124426: Datadiving Verwaltungs GmbH, Hamburg, Övelgönner Straße 25, 20257 Hamburg. Ist nur ein Liquidator bestellt, so vertritt er die Gesellschaft allein. Sind mehrere Liquidatoren bestellt, so wird die Gesellschaft durch zwei Liquidatoren oder durch einen Liquidator gemeinsam mit einem Prokuristen vertreten. Alleinvertretungsbefugnis kann erteilt werden. Liquidatoren können ermächtigt werden, im Namen der Gesellschaft mit sich im eigenen Namen oder als Vertreter eines Dritten Rechtsgeschäfte vorzunehmen. der bisheriger Geschäftsführer ist nunmehr Liquidator: Kanstinger, Philipp, Hamburg, *18.06.1978, einzelvertretungsberechtigt; mit der Befugnis, im Namen der Gesellschaft mit sich im eigenen Namen oder als Vertreter eines Dritten Rechtsgeschäfte abzuschließen. Ausgeschieden Geschäftsführer: Dederer, Gabriele, Konstanz, *12.04.1981; Krone, Roland, Bremen, *19.11.1974; Krämer, Philipp, Hude, *02.01.1982; Schneider, Christof, Hamburg, *09.12.1977. Die Gesellschaft ist aufgelöst.",
        "gesellschafter": null,
        "inhaber": null,
        "name": "HRB 124426: Datadiving Verwaltungs GmbH",
        "notice_id": "291042",
        "posted_on": "2016-02-26",
        "rechtsform": null,
        "sitz": null,
        "url": "https://www.handelsregisterbekanntmachungen.de/en/skripte/hrb.php?rb_id=291042&land_abk=hh"
    },
    "parsed": {
        "flags": [
            {
                "flag": "Exclusive power of representation can be granted.",
                "text": "Alleinvertretungsbefugnis\\ kann\\ erteilt\\ werden\\."
            },
            {
                "flag": "with the power to enter into legal transactions on behalf of the Company with itself or as a representative of a third party",
                "text": "mit\\ der\\ Befugnis\\,\\ im\\ Namen\\ der\\ Gesellschaft\\ mit\\ sich\\ im\\ eigenen\\ Namen\\ oder\\ als\\ Vertreter\\ eines\\ Dritten\\ Rechtsgesch\\äfte\\ abzuschlie\\ßen\\."
            },
            {
                "flag": "CompanyClosed",
                "text": "Die\\ Gesellschaft\\ ist\\ aufgel\\öst\\."
            }
        ],
        "officers": [
            {
                "class": "Liquidator",
                "payload": {
                    "city": "Hamburg",
                    "dob": "1978-06-18",
                    "flag": "sole representation",
                    "lastname": "Kanstinger",
                    "name": "Philipp"
                },
                "text": " Kanstinger, Philipp, Hamburg, *18.06.1978, einzelvertretungsberechtigt"
            },
            {
                "class": "Liquidator",
                "payload": {
                    "lastname": "mit der Befugnis",
                    "name": "im Namen der Gesellschaft mit sich im eigenen Namen oder als Vertreter eines Dritten Rechtsgeschäfte abzuschließen"
                },
                "text": " mit der Befugnis, im Namen der Gesellschaft mit sich im eigenen Namen oder als Vertreter eines Dritten Rechtsgeschäfte abzuschließen."
            },
            {
                "class": "RetiredManagingDirector",
                "payload": {
                    "city": "Konstanz",
                    "dismissed": true,
                    "dob": "1981-04-12",
                    "lastname": "Dederer",
                    "name": "Gabriele"
                },
                "text": " Dederer, Gabriele, Konstanz, *12.04.1981"
            },
            {
                "class": "RetiredManagingDirector",
                "payload": {
                    "city": "Bremen",
                    "dismissed": true,
                    "dob": "1974-11-19",
                    "lastname": "Krone",
                    "name": "Roland"
                },
                "text": " Krone, Roland, Bremen, *19.11.1974"
            },
            {
                "class": "RetiredManagingDirector",
                "payload": {
                    "city": "Hude",
                    "dismissed": true,
                    "dob": "1982-01-02",
                    "lastname": "Krämer",
                    "name": "Philipp"
                },
                "text": " Krämer, Philipp, Hude, *02.01.1982"
            },
            {
                "class": "RetiredManagingDirector",
                "payload": {
                    "city": "Hamburg",
                    "dismissed": true,
                    "dob": "1977-12-09",
                    "lastname": "Schneider",
                    "name": "Christof"
                },
                "text": " Schneider, Christof, Hamburg, *09.12.1977."
            }
        ]
    }
}