{
    "orig": {
        "aktenzeichen": "hra 5205",
        "amtsgericht": "siegburg",
        "event_date": "2009-10-12",
        "event_type": "neueintragungen",
        "federal_state": "nw",
        "full_text": "amtsgericht siegburg aktenzeichen: hra 5205 \nbekannt gemacht am: 19.10.2009 12:00 uhr\n\n\n\n\nin () gesetzte angaben der anschrift und des geschäftszweiges erfolgen ohne gewähr.\nneueintragungen\n12.10.2009\n\nkabeltrommel gesellschaft mit beschränkter haftung & co kommanditgesellschaft, troisdorf, camp-spich-str. 55/59, 53842 troisdorf.kommanditgesellschaft beginn: 10.11.1971.der sitz ist von köln (bisher amtsgericht köln, hra 7767) nach troisdorf verlegt. geschäftsanschrift: camp-spich-str. 55/59, 53842 troisdorf. jeder persönlich haftende gesellschafter vertritt einzeln. persönlich haftender gesellschafter: kabeltrommel-gesellschaft mit beschränkter haftung, troisdorf (amtsgericht siegburg hrb 10760), mit der befugnis im namen der gesellschaft mit sich im eigenen namen rechtsgeschäfte abzuschließen.",
        "gesellschafter": null,
        "inhaber": null,
        "name": "kabeltrommel gesellschaft mit beschränkter haftung & co kommanditgesellschaft",
        "notice_id": "482831",
        "posted_on": "2009-10-19",
        "rechtsform": null,
        "sitz": null,
        "url": "https://www.handelsregisterbekanntmachungen.de/en/skripte/hrb.php?rb_id=482831&land_abk=nw"
    },
    "parsed": {
        "labels": [
            {
                "label": "address",
                "text": " camp-spich-str."
            }
        ],
        "officers": [
            {
                "class": "PersonalPartner",
                "payload": {
                    "city": "mit der befugnis im namen der gesellschaft mit sich im eigenen namen rechtsgeschäfte abzuschließen",
                    "lastname": "kabeltrommel-gesellschaft mit beschränkter haftung",
                    "name": "troisdorf (amtsgericht siegburg hrb 10760)"
                },
                "text": " kabeltrommel-gesellschaft mit beschränkter haftung, troisdorf (amtsgericht siegburg hrb 10760), mit der befugnis im namen der gesellschaft mit sich im eigenen namen rechtsgeschäfte abzuschließen."
            }
        ]
    }
}