{
    "orig": {
        "aktenzeichen": "HRB 18838",
        "amtsgericht": "Dresden",
        "event_date": "2008-06-18",
        "event_type": "Veränderungen",
        "federal_state": "sn",
        "full_text": "Amtsgericht Dresden Aktenzeichen: HRB 18838 \nBekannt gemacht am: 19.06.2008 12:00 Uhr\n\n\n\n\nDie in () gesetzten Angaben der Geschäftsanschrift und des  Unternehmensgegenstandes erfolgen ohne Gewähr.\nVeränderungen\n18.06.2008\n\nBartsch & Collegen GmbH Steuerberatungsgesellschaft, Löbau (Wettiner Platz 3, 02708 Löbau). Vertretungsbefugnis und Wohnort geändert, nun: Geschäftsführer: Bartsch, Uwe F., Berlin-Lichtenberg, *15.10.1946. Bestellt: Geschäftsführer: Migga, Manuela, Görlitz, *12.04.1971. Bestellt: Geschäftsführer: Arndt, Matthias, Görlitz, *27.01.1963, einzelvertretungsberechtigt; mit der Befugnis, im Namen der Gesellschaft mit sich im eigenen Namen oder als Vertreter eines Dritten Rechtsgeschäfte abzuschließen.",
        "gesellschafter": null,
        "inhaber": null,
        "name": "Bartsch & Collegen GmbH Steuerberatungsgesellschaft",
        "notice_id": "54677",
        "posted_on": "2008-06-19",
        "rechtsform": null,
        "sitz": null,
        "url": "https://www.handelsregisterbekanntmachungen.de/en/skripte/hrb.php?rb_id=54677&land_abk=sn"
    },
    "parsed": {
        "flags": [
            {
                "flag": "with the power to enter into legal transactions on behalf of the Company with itself or as a representative of a third party",
                "text": "mit\\ der\\ Befugnis\\,\\ im\\ Namen\\ der\\ Gesellschaft\\ mit\\ sich\\ im\\ eigenen\\ Namen\\ oder\\ als\\ Vertreter\\ eines\\ Dritten\\ Rechtsgesch\\äfte\\ abzuschlie\\ßen\\."
            }
        ],
        "officers": [
            {
                "class": "ManagingDirector",
                "payload": {
                    "city": "Berlin-Lichtenberg",
                    "dob": "1946-10-15",
                    "lastname": "Bartsch",
                    "name": "Uwe F"
                },
                "text": " Bartsch, Uwe F., Berlin-Lichtenberg, *15.10.1946."
            },
            {
                "class": "AppointedManagingDirector",
                "payload": {
                    "city": "Görlitz",
                    "dob": "1971-04-12",
                    "lastname": "Migga",
                    "name": "Manuela"
                },
                "text": " Migga, Manuela, Görlitz, *12.04.1971."
            },
            {
                "class": "AppointedManagingDirector",
                "payload": {
                    "city": "Görlitz",
                    "dob": "1963-01-27",
                    "flag": "sole representation",
                    "lastname": "Arndt",
                    "name": "Matthias"
                },
                "text": " Arndt, Matthias, Görlitz, *27.01.1963, einzelvertretungsberechtigt"
            },
            {
                "class": "AppointedManagingDirector",
                "payload": {
                    "lastname": "mit der Befugnis",
                    "name": "im Namen der Gesellschaft mit sich im eigenen Namen oder als Vertreter eines Dritten Rechtsgeschäfte abzuschließen"
                },
                "text": " mit der Befugnis, im Namen der Gesellschaft mit sich im eigenen Namen oder als Vertreter eines Dritten Rechtsgeschäfte abzuschließen."
            }
        ]
    }
}