{
    "orig": {
        "aktenzeichen": "HRB 102235 B",
        "amtsgericht": "Charlottenburg (Berlin)",
        "event_date": "2008-02-21",
        "event_type": "Veränderungen",
        "federal_state": "be",
        "full_text": "Amtsgericht Charlottenburg (Berlin) Aktenzeichen: HRB 102235 B  \nBekannt gemacht am: 25.02.2008 12:00 Uhr\n\n\n\n\nFür die Angaben in (), die den Unternehmensgegenstand und die Anschrift betreffen, keine Gewähr. In das Handelsregister ist folgendes eingetragen worden.\nVeränderungen\n21.02.2008\n\nKLARO GmbH, Berlin(Selerweg 44, 12169  Berlin). Vertretungsregelung: Ist ein Liquidator bestellt, so vertritt er die Gesellschaft allein. Sind mehrere Liquidatoren bestellt, wird die Gesellschaft durch sämtliche Liquidatoren gemeinschaftlich vertreten. Änderung zu Nr. 1:; Liquidator:; Becelewski, Klaus, *10.02.1948, Berlin Rechtsverhaeltnis: Durch Beschluss der Gesellschafterversammlung vom 27.12.2007 ist die Gesellschaft zum 31.12.2007 aufgelöst..",
        "gesellschafter": null,
        "inhaber": null,
        "name": "KLARO GmbH",
        "notice_id": "60726",
        "posted_on": "2008-02-25",
        "rechtsform": null,
        "sitz": null,
        "url": "https://www.handelsregisterbekanntmachungen.de/en/skripte/hrb.php?rb_id=60726&land_abk=be"
    },
    "parsed": {
        "officers": [
            {
                "class": "Liquidator",
                "payload": {
                    "city": "Berlin Rechtsverhaeltnis: Durch Beschluss der Gesellschafterversammlung vom 27.12.2007 ist die Gesellschaft zum 31.12.2007 aufgelöst",
                    "dob": "1948-10-02",
                    "lastname": "Becelewski",
                    "name": "Klaus"
                },
                "text": " Becelewski, Klaus, *10.02.1948, Berlin Rechtsverhaeltnis: Durch Beschluss der Gesellschafterversammlung vom 27.12.2007 ist die Gesellschaft zum 31.12.2007 aufgelöst.."
            }
        ]
    }
}