{
    "orig": {
        "aktenzeichen": "hrb 74008",
        "amtsgericht": "frankfurt am main",
        "event_date": "2006-06-28",
        "event_type": "veränderungen",
        "federal_state": "he",
        "full_text": "amtsgericht frankfurt am main aktenzeichen: hrb 74008 \nbekannt gemacht am: 03.07.2006 07:59 uhr\n\n\n\n\nveröffentlichungen des amtsgerichts frankfurt am main\r\r\rdie in () gesetzten angaben der geschäftsanschrift und des geschäftszweiges erfolgen ohne gewähr.\nveränderungen\n28.06.2006\n\nclariant erste chemie gmbh, frankfurt am main (brüningstraße 50, 65926 frankfurt am main). die gesellschafterversammlung vom 24.05.2006 hat die neufassung des gesellschaftsvertrages, insbesondere die änderung von firma und gegenstand beschlossen. die ebenfalls beschlossene sitzverlegung ist noch nicht gegenstand der eintragung. neue firma: technische services gersthofen gmbh. neuer gegenstand: die erbringung und beschaffung von dienstleistungen insbesondere in den bereichen instandhaltung und engineering sowie die beschaffung, verwaltung und vermarktung von technischen materialien. bestellt als geschäftsführer: dr. henrich, michael, brühl, *12.09.1952. gesamtprokura gemeinsam mit einem geschäftsführer oder einem anderen prokuristen: barthel, clemens, hofheim am taunus, *03.01.1949; brüstl, robert, kühlenthal, *21.07.1961; conze, ingo, kelkheim, *16.07.1966; de wall, udo karl, mainz, *12.11.1963; jansson, lars, kelkheim, *20.05.1970; dr. klak, alexander, wiesbaden, *10.07.1955; pechatschek, robert, augsburg, *29.01.1960; dr. posner, thorsten, bad vilbel, *15.04.1966; prommer, gerhard, obermeitingen, *15.02.1965; somia, anette, wiesbaden, *28.02.1968.",
        "gesellschafter": null,
        "inhaber": null,
        "name": "clariant erste chemie gmbh",
        "notice_id": "9508",
        "posted_on": "2006-07-03",
        "rechtsform": null,
        "sitz": null,
        "url": "https://www.handelsregisterbekanntmachungen.de/en/skripte/hrb.php?rb_id=9508&land_abk=he"
    },
    "parsed": {
        "errors": [
            {
                "kls": "ParsingError",
                "text": "Cannot parse a AppointedManagingDirector from  dr. henrich, michael, brühl, *12.09.1952. gesamtprokura gemeinsam mit einem geschäftsführer oder einem anderen prokuristen: barthel, clemens, hofheim am taunus, *03.01.1949, error text was no valid patter found, number of chunks: 7"
            },
            {
                "kls": "ParsingError",
                "text": "Cannot parse a ManagingDirector from  dr. henrich, michael, brühl, *12.09.1952. gesamtprokura gemeinsam mit einem geschäftsführer oder einem anderen prokuristen: barthel, clemens, hofheim am taunus, *03.01.1949, error text was no valid patter found, number of chunks: 7"
            }
        ],
        "notices": [
            {
                "court": null,
                "registration": null,
                "text": " ist noch nicht gegenstand der eintragung.",
                "used_regex": ""
            }
        ],
        "officers": [
            {
                "class": "CommonProcuration",
                "payload": {
                    "city": "hofheim am taunus",
                    "dob": "1949-01-03",
                    "lastname": "barthel",
                    "name": "clemens"
                },
                "text": " barthel, clemens, hofheim am taunus, *03.01.1949"
            },
            {
                "class": "CommonProcuration",
                "payload": {
                    "city": "kühlenthal",
                    "dob": "1961-07-21",
                    "lastname": "brüstl",
                    "name": "robert"
                },
                "text": " brüstl, robert, kühlenthal, *21.07.1961"
            },
            {
                "class": "CommonProcuration",
                "payload": {
                    "city": "kelkheim",
                    "dob": "1966-07-16",
                    "lastname": "conze",
                    "name": "ingo"
                },
                "text": " conze, ingo, kelkheim, *16.07.1966"
            },
            {
                "class": "CommonProcuration",
                "payload": {
                    "city": "mainz",
                    "dob": "1963-11-12",
                    "lastname": "de wall",
                    "name": "udo karl"
                },
                "text": " de wall, udo karl, mainz, *12.11.1963"
            },
            {
                "class": "CommonProcuration",
                "payload": {
                    "city": "kelkheim",
                    "dob": "1970-05-20",
                    "lastname": "jansson",
                    "name": "lars"
                },
                "text": " jansson, lars, kelkheim, *20.05.1970"
            },
            {
                "class": "CommonProcuration",
                "payload": {
                    "city": "wiesbaden",
                    "dob": "1955-07-10",
                    "lastname": "dr. klak",
                    "name": "alexander"
                },
                "text": " dr. klak, alexander, wiesbaden, *10.07.1955"
            },
            {
                "class": "CommonProcuration",
                "payload": {
                    "city": "augsburg",
                    "dob": "1960-01-29",
                    "lastname": "pechatschek",
                    "name": "robert"
                },
                "text": " pechatschek, robert, augsburg, *29.01.1960"
            },
            {
                "class": "CommonProcuration",
                "payload": {
                    "city": "bad vilbel",
                    "dob": "1966-04-15",
                    "lastname": "dr. posner",
                    "name": "thorsten"
                },
                "text": " dr. posner, thorsten, bad vilbel, *15.04.1966"
            },
            {
                "class": "CommonProcuration",
                "payload": {
                    "city": "obermeitingen",
                    "dob": "1965-02-15",
                    "lastname": "prommer",
                    "name": "gerhard"
                },
                "text": " prommer, gerhard, obermeitingen, *15.02.1965"
            },
            {
                "class": "CommonProcuration",
                "payload": {
                    "city": "wiesbaden",
                    "dob": "1968-02-28",
                    "lastname": "somia",
                    "name": "anette"
                },
                "text": " somia, anette, wiesbaden, *28.02.1968."
            }
        ]
    }
}