{
    "orig": {
        "aktenzeichen": "HRB 145837",
        "amtsgericht": "München",
        "event_date": "2006-05-24",
        "event_type": "Veränderungen",
        "federal_state": "by",
        "full_text": "Amtsgericht München Aktenzeichen: HRB 145837 \nBekannt gemacht am: 31.05.2006 09:42 Uhr\n\n\n\n\nDie in ( ) gesetzten Angaben der Geschäftsanschrift und des Geschäftszweiges erfolgen ohne Gewähr.\nVeränderungen\n24.05.2006\n\nKabel Deutschland GmbH, Unterföhring, Landkreis München (Betastraße 6-8, 85774 Unterföhring). Prokura erloschen: Geisler, Gerd, Hofheim, *24.10.1946; Uhlig, Ernst, Oberursel, *17.04.1941. Gesamtprokura gemeinsam mit einem Geschäftsführer oder einem anderen Prokuristen mit der Befugnis, im Namen der Gesellschaft mit sich als Vertreter eines Dritten Rechtsgeschäfte abzuschließen: Enge, Jana, Hohenbrunn, *11.07.1969; Kottke, Roland J., Feldafing, *19.01.1968.",
        "gesellschafter": null,
        "inhaber": null,
        "name": "Kabel Deutschland GmbH",
        "notice_id": "100323",
        "posted_on": "2006-05-31",
        "rechtsform": null,
        "sitz": null,
        "url": "https://www.handelsregisterbekanntmachungen.de/en/skripte/hrb.php?rb_id=100323&land_abk=by"
    },
    "parsed": {
        "officers": [
            {
                "class": "ProcurationCancelled",
                "payload": {
                    "city": "Hofheim",
                    "dismissed": true,
                    "dob": "1946-10-24",
                    "lastname": "Geisler",
                    "name": "Gerd"
                },
                "text": " Geisler, Gerd, Hofheim, *24.10.1946"
            },
            {
                "class": "ProcurationCancelled",
                "payload": {
                    "city": "Oberursel",
                    "dismissed": true,
                    "dob": "1941-04-17",
                    "lastname": "Uhlig",
                    "name": "Ernst"
                },
                "text": " Uhlig, Ernst, Oberursel, *17.04.1941."
            }
        ]
    }
}