{
    "orig": {
        "aktenzeichen": "HRB 12170",
        "amtsgericht": "Coesfeld",
        "event_date": "2014-03-05",
        "event_type": "Veränderungen",
        "federal_state": "nw",
        "full_text": "Amtsgericht Coesfeld Aktenzeichen: HRB 12170 \nBekannt gemacht am: 05.03.2014 19:57 Uhr\n\n\n\n\nIn () gesetzte Angaben der Anschrift und des Geschäftszweiges erfolgen ohne Gewähr.\nVeränderungen\n05.03.2014\n\nHRB 12170:Klünker Bau Unternehmergesellschaft (haftungsbeschränkt), Dülmen, Coesfelder Straße 102a, 48249 Dülmen.Von Amts wegen geändert, nunmehr: Die Gesellschaft wird durch den/die Liquidator/en vertreten. Von Amts wegen geändert, nunmehr Liquidator: Klünker, Heike, Dülmen, *20.04.1964. Durch rechtskräftigen Beschluss des Amtsgerichts Münster (72 IN 80/10) vom 02.01.2014 ist das Insolvenzverfahren eingestellt. Von Amts wegen eingetragen.",
        "gesellschafter": null,
        "inhaber": null,
        "name": "HRB 12170:Klünker Bau Unternehmergesellschaft (haftungsbeschränkt)",
        "notice_id": "1012199",
        "posted_on": "2014-03-05",
        "rechtsform": null,
        "sitz": null,
        "url": "https://www.handelsregisterbekanntmachungen.de/en/skripte/hrb.php?rb_id=1012199&land_abk=nw"
    },
    "parsed": {
        "officers": [
            {
                "class": "Liquidator",
                "payload": {
                    "city": "Dülmen",
                    "dob": "1964-04-20",
                    "lastname": "Klünker",
                    "name": "Heike"
                },
                "text": " Klünker , Heike , Dülmen , * 20.04.1964 ."
            }
        ]
    }
}