{
    "orig": {
        "aktenzeichen": "HRB 210369",
        "amtsgericht": "Stendal",
        "event_date": "2017-11-09",
        "event_type": "Veränderungen",
        "federal_state": "st",
        "full_text": "Amtsgericht Stendal Aktenzeichen: HRB 210369 \nBekannt gemacht am: 09.11.2017 14:21 Uhr\n\n\n\n\nDie in () gesetzten Angaben der Geschäftsanschrift und des Geschäftszweiges erfolgen ohne Gewähr.\nVeränderungen\n09.11.2017\n\nHRB 210369: Autohaus Baum GmbH, Halle/S (Delitzscher Straße 293, 06116 Halle). Von Amts wegen gem. § 384 Abs. 2 FamFG berichtigt. Die Gesellschaft wird durch den/die Liquidator/en vertreten. Von Amts wegen gem. § 384 Abs. 2 FamFG berichtigt. Liquidator: Baum, Heiko, Halle(Saale), *24.12.1970; Föllner, Henry, Halle(Saale), *22.03.1964. Das Insolvenzverfahren ist durch Beschluss des Amtsgerichts Halle (Saale) vom 22.07.2014 (Az. 59 IN 963/08) nach Schlussverteilung aufgehoben worden.",
        "gesellschafter": null,
        "inhaber": null,
        "name": "HRB 210369: Autohaus Baum GmbH",
        "notice_id": "104978",
        "posted_on": "2017-11-09",
        "rechtsform": null,
        "sitz": null,
        "url": "https://www.handelsregisterbekanntmachungen.de/en/skripte/hrb.php?rb_id=104978&land_abk=st"
    },
    "parsed": {
        "officers": [
            {
                "class": "Liquidator",
                "payload": {
                    "city": "Halle(Saale)",
                    "dob": "1970-12-24",
                    "lastname": "Baum",
                    "name": "Heiko"
                },
                "text": " Baum, Heiko, Halle(Saale), *24.12.1970"
            }
        ]
    }
}