{
    "orig": {
        "aktenzeichen": "HRB 140868",
        "amtsgericht": "Oldenburg",
        "event_date": "2009-11-05",
        "event_type": "Veränderungen",
        "federal_state": "ni",
        "full_text": "Amtsgericht Oldenburg Aktenzeichen: HRB 140868 \nBekannt gemacht am: 06.11.2009 12:00 Uhr\n\n\n\n\nIn () gesetzte Angaben der Anschrift und des Geschäftszweiges erfolgen ohne Gewähr.\nVeränderungen\n05.11.2009\n\nBioKraft BOS GmbH, Großenkneten-Huntlosen, Bahnhofstraße 82, 26197 Großenkneten/Huntlosen.Geschäftsanschrift: Bahnhofstraße 82, 26197 Großenkneten/Huntlosen. Ist nur ein Liquidator bestellt, so vertritt dieser die Gesellschaft allein. Sind mehrere Liquidatoren bestellt, so wird die Gesellschaft durch zwei Liquidatoren gemeinsam vertreten. Geändert, nun: Liquidator: Goedecke, Georg, Ganderkesee, *18.01.1949. Prokura erloschen: Langenbeck-Waldeck, Garloff, Bordesholm, *30.12.1962. Die Gesellschaft ist mit Beschluss der Gesellschafterversammlung vom 19.11.2007 aufgelöst.",
        "gesellschafter": null,
        "inhaber": null,
        "name": "BioKraft BOS GmbH",
        "notice_id": "105910",
        "posted_on": "2009-11-06",
        "rechtsform": null,
        "sitz": null,
        "url": "https://www.handelsregisterbekanntmachungen.de/en/skripte/hrb.php?rb_id=105910&land_abk=ni"
    },
    "parsed": {
        "labels": [
            {
                "label": "address",
                "text": " Bahnhofstraße 82, 26197 Großenkneten/Huntlosen."
            }
        ],
        "officers": [
            {
                "class": "Liquidator",
                "payload": {
                    "city": "Ganderkesee",
                    "dob": "1949-01-18",
                    "lastname": ": Goedecke",
                    "name": "Georg"
                },
                "text": ": Goedecke, Georg, Ganderkesee, *18.01.1949."
            },
            {
                "class": "ProcurationCancelled",
                "payload": {
                    "city": "Bordesholm",
                    "dismissed": true,
                    "dob": "1962-12-30",
                    "lastname": "Langenbeck-Waldeck",
                    "name": "Garloff"
                },
                "text": " Langenbeck-Waldeck, Garloff, Bordesholm, *30.12.1962."
            }
        ]
    }
}