{
    "orig": {
        "aktenzeichen": "HRB 14238",
        "amtsgericht": "Krefeld",
        "event_date": "2014-08-14",
        "event_type": "Veränderungen",
        "federal_state": "nw",
        "full_text": "Amtsgericht Krefeld Aktenzeichen: HRB 14238 \nBekannt gemacht am: 14.08.2014 20:06 Uhr\n\n\n\n\nIn () gesetzte Angaben der Anschrift und des Geschäftszweiges erfolgen ohne Gewähr.\nVeränderungen\n14.08.2014\n\nHRB 14238:BoHa Lieferservice UG (haftungsbeschränkt), Nettetal, Am Hegbaum 31, 41334 Nettetal.Ist nur ein Liquidator bestellt, so vertritt er die Gesellschaft allein. Sind mehrere Liquidatoren bestellt, so wird die Gesellschaft durch die Liquidatoren gemeinsam vertreten. Nicht mehr Geschäftsführer: Bork, Christian, Nettetal, *06.05.1989. Bestellt als Liquidator: Hanto, Volker Carsten, Nettetal, *20.09.1984. Die Gesellschaft ist aufgelöst.",
        "gesellschafter": null,
        "inhaber": null,
        "name": "HRB 14238:BoHa Lieferservice UG (haftungsbeschränkt)",
        "notice_id": "1065136",
        "posted_on": "2014-08-14",
        "rechtsform": null,
        "sitz": null,
        "url": "https://www.handelsregisterbekanntmachungen.de/en/skripte/hrb.php?rb_id=1065136&land_abk=nw"
    },
    "parsed": {
        "flags": [
            {
                "flag": "CompanyClosed",
                "text": "Die\\ Gesellschaft\\ ist\\ aufgel\\öst\\."
            }
        ],
        "officers": [
            {
                "class": "DismissedManagingDirector",
                "payload": {
                    "city": "Nettetal",
                    "dismissed": true,
                    "dob": "1989-06-05",
                    "lastname": "Bork",
                    "name": "Christian"
                },
                "text": " Bork, Christian, Nettetal, *06.05.1989."
            },
            {
                "class": "Liquidator",
                "payload": {
                    "city": "Nettetal",
                    "dob": "1984-09-20",
                    "lastname": "Hanto",
                    "name": "Volker Carsten"
                },
                "text": " Hanto, Volker Carsten, Nettetal, *20.09.1984."
            }
        ]
    }
}