{
    "orig": {
        "aktenzeichen": "HRB 19647",
        "amtsgericht": "Stendal",
        "event_date": "2018-01-04",
        "event_type": "Veränderungen",
        "federal_state": "st",
        "full_text": "Amtsgericht Stendal Aktenzeichen: HRB 19647 \nBekannt gemacht am: 04.01.2018 13:00 Uhr\n\n\n\n\nDie in () gesetzten Angaben der Geschäftsanschrift und des Geschäftszweiges erfolgen ohne Gewähr.\nVeränderungen\n04.01.2018\n\nHRB 19647: City Marketing Magdeburg UG (haftungsbeschränkt), Magdeburg, Siriusweg 14, 39118 Magdeburg. Ist nur ein Liquidator bestellt, so vertritt er die Gesellschaft allein. Sind mehrere Liquidatoren bestellt, so wird die Gesellschaft durch die Liquidatoren gemeinsam vertreten. Geändert, nun: Liquidator: Hitzeroth, Jens Walter, Magdeburg, *16.03.1964; Jahns, Jens-Uwe, Magdeburg, *11.01.1960. Die Gesellschaft ist aufgelöst.",
        "gesellschafter": null,
        "inhaber": null,
        "name": "HRB 19647: City Marketing Magdeburg UG (haftungsbeschränkt)",
        "notice_id": "106538",
        "posted_on": "2018-01-04",
        "rechtsform": null,
        "sitz": null,
        "url": "https://www.handelsregisterbekanntmachungen.de/en/skripte/hrb.php?rb_id=106538&land_abk=st"
    },
    "parsed": {
        "flags": [
            {
                "flag": "ignore_for_now",
                "text": "Die\\ Gesellschaft\\ ist\\ aufgel\\öst\\."
            }
        ],
        "officers": [
            {
                "class": "Liquidator",
                "payload": {
                    "city": "Magdeburg",
                    "dob": "1964-03-16",
                    "lastname": ": Hitzeroth",
                    "name": "Jens Walter"
                },
                "text": ": Hitzeroth, Jens Walter, Magdeburg, *16.03.1964"
            }
        ]
    }
}