{
    "orig": {
        "aktenzeichen": "HRB 9762 PI",
        "amtsgericht": "Pinneberg",
        "event_date": "2012-01-27",
        "event_type": "Neueintragungen",
        "federal_state": "sh",
        "full_text": "Amtsgericht Pinneberg Aktenzeichen: HRB 9762 PI \nBekannt gemacht am: 01.02.2012 10:20 Uhr\n\n\n\n\nIn () gesetzte Angaben der Anschrift und des Unternehmensgegenstandes erfolgen ohne Gewähr:\nNeueintragungen\n27.01.2012\n\nHRB 9762 PI: BeBa Solarpark Brunsbüttel Verwaltungs UG (haftungsbeschränkt), Brunsbüttel, Fritz-Staiger-Straße 45, 25541 Brunsbüttel. Gegenstand: Die Übernahme der persönlichen Haftung als Komplementärin an der BeBa Solarpark Brunsbüttel GmbH & Co. KG - Amtsgericht Pinneberg HRA 6039 PI -. Kapital: 500,00 EUR; Vertretungsregelung: Die Gesellschaft hat einen Geschäftsführer. Der Geschäftsführer vertritt die Gesellschaft allein. Der Geschäftsführer darf Rechtsgeschäfte mit sich selbst oder als Vertreter Dritter abschließen. Geschäftsführer: Bartels, Bernd, *08.02.1973, Kaiser-Wilhelm-Koog; Einzelprokura: Kahl, Lars Ulrich, *20.06.1968, Schwerte; Prokura gemeinsam mit einem Geschäftsführer oder einem weiteren Prokuristen: Reiß, Antje, *16.07.1965, Sarzbüttel; Rechtsform: Gesellschaft mit beschränkter Haftung; Gesellschaftsvertrag vom: 05.01.2012.",
        "gesellschafter": null,
        "inhaber": null,
        "name": "HRB 9762 PI: BeBa Solarpark Brunsbüttel Verwaltungs UG (haftungsbeschränkt)",
        "notice_id": "107980",
        "posted_on": "2012-02-01",
        "rechtsform": null,
        "sitz": null,
        "url": "https://www.handelsregisterbekanntmachungen.de/en/skripte/hrb.php?rb_id=107980&land_abk=sh"
    },
    "parsed": {
        "officers": [
            {
                "class": "ManagingDirector",
                "payload": {
                    "city": "Kaiser-Wilhelm-Koog",
                    "dob": "1973-08-02",
                    "lastname": "Bartels",
                    "name": "Bernd"
                },
                "text": " Bartels, Bernd, *08.02.1973, Kaiser-Wilhelm-Koog"
            },
            {
                "class": "SingleProcuration",
                "payload": {
                    "city": "Schwerte",
                    "dob": "1968-06-20",
                    "lastname": "Kahl",
                    "name": "Lars Ulrich"
                },
                "text": " Kahl, Lars Ulrich, *20.06.1968, Schwerte"
            }
        ]
    }
}