{
    "orig": {
        "aktenzeichen": "HRB 6489",
        "amtsgericht": "Duisburg",
        "event_date": "2014-10-15",
        "event_type": "Veränderungen",
        "federal_state": "nw",
        "full_text": "Amtsgericht Duisburg Aktenzeichen: HRB 6489 \nBekannt gemacht am: 15.10.2014 20:01 Uhr\n\n\n\n\nIn () gesetzte Angaben der Anschrift und des Geschäftszweiges erfolgen ohne Gewähr.\nVeränderungen\n15.10.2014\n\nHRB 6489:Wilson NRL Transport GmbH, Duisburg, Vinckeweg 22, 47119 Duisburg.Die Gesellschafterversammlung vom 29.09.2014 hat eine Änderung des Gesellschaftsvertrages in § 1 und mit ihr die Änderung der Firma beschlossen. Neue Firma: HSW Logistics GmbH. Nicht mehr Geschäftsführer: Gjerde, Oyvind, Haugesund/Norwegen, *14.11.1962. Bestellt als Geschäftsführer: Lehmann, Lutz, Duisburg, *31.03.1961; Zirotzki, Björn, Duisburg, *04.01.1976, jeweils mit der Befugnis im Namen der Gesellschaft mit sich als Vertreter eines Dritten Rechtsgeschäfte abzuschließen.",
        "gesellschafter": null,
        "inhaber": null,
        "name": "HRB 6489:Wilson NRL Transport GmbH",
        "notice_id": "1085075",
        "posted_on": "2014-10-15",
        "rechtsform": null,
        "sitz": null,
        "url": "https://www.handelsregisterbekanntmachungen.de/en/skripte/hrb.php?rb_id=1085075&land_abk=nw"
    },
    "parsed": {
        "officers": [
            {
                "class": "DismissedManagingDirector",
                "payload": {
                    "city": "Haugesund/Norwegen",
                    "dismissed": true,
                    "dob": "1962-11-14",
                    "lastname": "Gjerde",
                    "name": "Oyvind"
                },
                "text": " Gjerde, Oyvind, Haugesund/Norwegen, *14.11.1962."
            },
            {
                "class": "AppointedManagingDirector",
                "payload": {
                    "city": "Duisburg",
                    "dob": "1961-03-31",
                    "lastname": "Lehmann",
                    "name": "Lutz"
                },
                "text": " Lehmann, Lutz, Duisburg, *31.03.1961"
            }
        ]
    }
}