{
    "orig": {
        "aktenzeichen": "HRB 110797",
        "amtsgericht": "Hannover",
        "event_date": "2009-11-23",
        "event_type": "Veränderungen",
        "federal_state": "ni",
        "full_text": "Amtsgericht Hannover Aktenzeichen: HRB 110797 \nBekannt gemacht am: 10.12.2009 12:00 Uhr\n\n\n\n\nIn () gesetzte Angaben der Anschrift und des Geschäftszweiges erfolgen ohne Gewähr.\nVeränderungen\n23.11.2009\n\nErste Neustädter Projektgesellschaft mbH, Neustadt a. Rbge., Mitobiusweg 13, 31535 Neustadt.Geschäftsanschrift: Mitobiusweg 13, 31535 Neustadt. Jeder Liquidator vertritt einzeln. Jeder Liquidator ist befugt, im Namen der Gesellschaft mit sich im eigenen Namen oder als Vertreter eines Dritten Rechtsgeschäfte vorzunehmen. Geändert, nun: Liquidator: Luiking, Friedrich, Neustadt, *16.01.1932; Sakuth, Peter, Bremen, *22.01.1948. Die Gesellschaft ist aufgelöst.",
        "gesellschafter": null,
        "inhaber": null,
        "name": "Erste Neustädter Projektgesellschaft mbH",
        "notice_id": "109277",
        "posted_on": "2009-12-10",
        "rechtsform": null,
        "sitz": null,
        "url": "https://www.handelsregisterbekanntmachungen.de/en/skripte/hrb.php?rb_id=109277&land_abk=ni"
    },
    "parsed": {
        "flags": [
            {
                "flag": "CompanyClosed",
                "text": "Die\\ Gesellschaft\\ ist\\ aufgel\\öst\\."
            }
        ],
        "labels": [
            {
                "label": "address",
                "text": " Mitobiusweg 13, 31535 Neustadt."
            }
        ],
        "officers": [
            {
                "class": "Liquidator",
                "payload": {
                    "city": "Neustadt",
                    "dob": "1932-01-16",
                    "lastname": "Luiking",
                    "name": "Friedrich"
                },
                "text": ": Luiking, Friedrich, Neustadt, *16.01.1932"
            },
            {
                "class": "Liquidator",
                "payload": {
                    "city": "Bremen",
                    "dob": "1948-01-22",
                    "lastname": "Sakuth",
                    "name": "Peter"
                },
                "text": " Sakuth, Peter, Bremen, *22.01.1948."
            }
        ]
    }
}