{
    "orig": {
        "aktenzeichen": "HRB 43642",
        "amtsgericht": "Köln",
        "event_date": "2014-11-06",
        "event_type": "Veränderungen",
        "federal_state": "nw",
        "full_text": "Amtsgericht Köln Aktenzeichen: HRB 43642 \nBekannt gemacht am: 06.11.2014 20:01 Uhr\n\n\n\n\nIn () gesetzte Angaben der Anschrift und des Geschäftszweiges erfolgen ohne Gewähr.\nVeränderungen\n06.11.2014\n\nHRB 43642: Phantasialand Gastronomie GmbH, Brühl, Berggeiststraße 31 - 41, 50321 Brühl. Nach Ergänzung des Geburtsdatums von Amts wegen weiterhin Geschäftsführer: Löffelhardt, Robert, Brühl, *13.04.1964. Zwischen der Phantasialand Gastronomie GmbH als beherrschter Gesellschaft und der Löffelhardt Grundbesitz GmbH & Co. KG mit Sitz in Brühl (Amtsgericht Köln, HRA 20042) besteht ein Beherrschungs- und Ergebnisabführungsvertrag vom 04.11.2014. Diesem Vertrag hat die Gesellschafterversammlung der Phantasialand Gastronomie GmbH durch Beschluss vom 04.11.2014 zugestimmt.",
        "gesellschafter": null,
        "inhaber": null,
        "name": "HRB 43642: Phantasialand Gastronomie GmbH",
        "notice_id": "1092153",
        "posted_on": "2014-11-06",
        "rechtsform": null,
        "sitz": null,
        "url": "https://www.handelsregisterbekanntmachungen.de/en/skripte/hrb.php?rb_id=1092153&land_abk=nw"
    },
    "parsed": {
        "officers": [
            {
                "class": "ManagingDirector",
                "payload": {
                    "city": "Brühl",
                    "dob": "1964-04-13",
                    "lastname": "Löffelhardt",
                    "name": "Robert"
                },
                "text": " Löffelhardt, Robert, Brühl, *13.04.1964."
            }
        ]
    }
}