{
    "orig": {
        "aktenzeichen": "HRB 9580",
        "amtsgericht": "Kleve",
        "event_date": "2014-12-02",
        "event_type": "Berichtigungen",
        "federal_state": "nw",
        "full_text": "Amtsgericht Kleve Aktenzeichen: HRB 9580 \nBekannt gemacht am: 02.12.2014 20:01 Uhr\n\n\n\n\nIn () gesetzte Angaben der Anschrift und des Geschäftszweiges erfolgen ohne Gewähr.\nBerichtigungen\n02.12.2014\n\nHRB 9580: Klümpen Danners Beteiligungen GmbH, Straelen, Veilingstraße B 147, 47638 Straelen. Bestellt als Geschäftsführer: Swinkels, Gertruda Petronella Maria, Venray / Niederlande, *18.09.1956; Vormbaum, Georg, Köln, *04.02.1961, jeweils vertretungsberechtigt gemeinsam mit einem anderen Geschäftsführer oder einem Prokuristen mit der Befugnis im Namen der Gesellschaft mit sich als Vertreter eines Dritten Rechtsgeschäfte abzuschließen.",
        "gesellschafter": null,
        "inhaber": null,
        "name": "HRB 9580: Klümpen Danners Beteiligungen GmbH",
        "notice_id": "1100582",
        "posted_on": "2014-12-02",
        "rechtsform": null,
        "sitz": null,
        "url": "https://www.handelsregisterbekanntmachungen.de/en/skripte/hrb.php?rb_id=1100582&land_abk=nw"
    },
    "parsed": {
        "officers": [
            {
                "class": "AppointedManagingDirector",
                "payload": {
                    "city": "Venray / Niederlande",
                    "dob": "1956-09-18",
                    "lastname": "Swinkels",
                    "name": "Gertruda Petronella Maria"
                },
                "text": " Swinkels, Gertruda Petronella Maria, Venray / Niederlande, *18.09.1956"
            }
        ]
    }
}