{
    "orig": {
        "aktenzeichen": "HRB 11871",
        "amtsgericht": "Stendal",
        "event_date": "2018-06-08",
        "event_type": "Veränderungen",
        "federal_state": "st",
        "full_text": "Amtsgericht Stendal Aktenzeichen: HRB 11871 \nBekannt gemacht am: 08.06.2018 10:20 Uhr\n\n\n\n\nDie in () gesetzten Angaben der Geschäftsanschrift und des Geschäftszweiges erfolgen ohne Gewähr.\nVeränderungen\n08.06.2018\n\nHRB 11871: HOPPE UG (haftungsbeschränkt) Dachbeschichtung - Fassadengestaltung, Coswig, An der Kirche 6, 06869 Buko (Coswig). Von Amts wegen gem. § 384 Abs. 2 FamFG geändert, nun: Die Gesellschaft wird durch den/die Liquidator/en vertreten. Von Amts wegen gem. § 384 Abs. 2 FamFG geändert, nun: Geschäftsführer: Hoppe, Mike, Coswig (Anhalt), *23.11.1970. Die Gesellschaft ist durch rechtskräftige Abweisung eines Antrags auf Eröffnung des Insolvenzverfahrens mangels Masse aufgelöst (Az. 2 IN 63/18 Amtsgericht Dessau-Roßlau). Von Amts wegen eingetragen.",
        "gesellschafter": null,
        "inhaber": null,
        "name": "HRB 11871: HOPPE UG (haftungsbeschränkt) Dachbeschichtung - Fassadengestaltung",
        "notice_id": "110456",
        "posted_on": "2018-06-08",
        "rechtsform": null,
        "sitz": null,
        "url": "https://www.handelsregisterbekanntmachungen.de/en/skripte/hrb.php?rb_id=110456&land_abk=st"
    },
    "parsed": {
        "officers": [
            {
                "class": "ManagingDirector",
                "payload": {
                    "city": "Coswig (Anhalt)",
                    "dob": "1970-11-23",
                    "lastname": "Hoppe",
                    "name": "Mike"
                },
                "text": " Hoppe, Mike, Coswig (Anhalt), *23.11.1970."
            }
        ]
    }
}