{
    "orig": {
        "aktenzeichen": "HRB 7334",
        "amtsgericht": "Siegen",
        "event_date": "2014-12-29",
        "event_type": "Veränderungen",
        "federal_state": "nw",
        "full_text": "Amtsgericht Siegen Aktenzeichen: HRB 7334 \nBekannt gemacht am: 29.12.2014 20:00 Uhr\n\n\n\n\nIn () gesetzte Angaben der Anschrift und des Geschäftszweiges erfolgen ohne Gewähr.\nVeränderungen\n29.12.2014\n\nHRB 7334: Rademacher Verwaltungs GmbH, Olpe, In der Trift 14, 57462 Olpe. Die Gesellschafterversammlung vom 28. November 2014 hat die vollständige Neufassung des Gesellschaftsvertrages beschlossen. Nicht mehr Geschäftsführer: Rademacher, Klaus, Olpe, *08.04.1943; Rademacher, Sabine, Olpe, *08.05.1941. Bestellt als Geschäftsführer: Rehse, Christine, Olpe, *22.04.1968; Rehse, Frank, Olpe, *09.11.1967, jeweils einzelvertretungsberechtigt mit der Befugnis im Namen der Gesellschaft mit sich im eigenen Namen oder als Vertreter eines Dritten Rechtsgeschäfte abzuschließen.",
        "gesellschafter": null,
        "inhaber": null,
        "name": "HRB 7334: Rademacher Verwaltungs GmbH",
        "notice_id": "1109813",
        "posted_on": "2014-12-29",
        "rechtsform": null,
        "sitz": null,
        "url": "https://www.handelsregisterbekanntmachungen.de/en/skripte/hrb.php?rb_id=1109813&land_abk=nw"
    },
    "parsed": {
        "officers": [
            {
                "class": "DismissedManagingDirector",
                "payload": {
                    "city": "Olpe",
                    "dismissed": true,
                    "dob": "1943-08-04",
                    "lastname": "Rademacher",
                    "name": "Klaus"
                },
                "text": " Rademacher, Klaus, Olpe, *08.04.1943"
            },
            {
                "class": "AppointedManagingDirector",
                "payload": {
                    "city": "Olpe",
                    "dob": "1968-04-22",
                    "lastname": "Rehse",
                    "name": "Christine"
                },
                "text": " Rehse, Christine, Olpe, *22.04.1968"
            }
        ]
    }
}