{
    "orig": {
        "aktenzeichen": "HRB 13789",
        "amtsgericht": "Dortmund",
        "event_date": "2015-01-06",
        "event_type": "Veränderungen",
        "federal_state": "nw",
        "full_text": "Amtsgericht Dortmund Aktenzeichen: HRB 13789 \nBekannt gemacht am: 06.01.2015 20:02 Uhr\n\n\n\n\nIn () gesetzte Angaben der Anschrift und des Geschäftszweiges erfolgen ohne Gewähr.\nVeränderungen\n06.01.2015\n\nHRB 13789: DS-Rendite-Fonds Nr. 67 VLCC Front Century GmbH, Dortmund, Westfalendamm 98, 44141 Dortmund. Ist nur ein Liquidator bestellt, so vertritt er die Gesellschaft allein. Sind mehrere Liquidatoren bestellt, so wird die Gesellschaft durch die Liquidatoren gemeinsam vertreten. Nicht mehr Geschäftsführer: Sacksteder, Herbert, Essen, *27.08.1932; Vogel, Herbert, Velbert, *29.11.1956. Bestellt als Liquidator: Gesellschaft für die Verwaltung von Beteiligungen an Tankschiffen m.b.H., Dortmund (Amtsgericht Dortmund HRB 13444). Die Gesellschaft ist aufgelöst.",
        "gesellschafter": null,
        "inhaber": null,
        "name": "HRB 13789: DS-Rendite-Fonds Nr. 67 VLCC Front Century GmbH",
        "notice_id": "1112422",
        "posted_on": "2015-01-06",
        "rechtsform": null,
        "sitz": null,
        "url": "https://www.handelsregisterbekanntmachungen.de/en/skripte/hrb.php?rb_id=1112422&land_abk=nw"
    },
    "parsed": {
        "flags": [
            {
                "flag": "ignore_for_now",
                "text": "Die\\ Gesellschaft\\ ist\\ aufgel\\öst\\."
            }
        ],
        "officers": [
            {
                "class": "DismissedManagingDirector",
                "payload": {
                    "city": "Essen",
                    "dismissed": true,
                    "dob": "1932-08-27",
                    "lastname": "Sacksteder",
                    "name": "Herbert"
                },
                "text": " Sacksteder, Herbert, Essen, *27.08.1932"
            },
            {
                "class": "Liquidator",
                "payload": {
                    "lastname": "Gesellschaft für die Verwaltung von Beteiligungen an Tankschiffen m.b.H",
                    "name": "Dortmund (Amtsgericht Dortmund HRB 13444)"
                },
                "text": " Gesellschaft für die Verwaltung von Beteiligungen an Tankschiffen m.b.H., Dortmund (Amtsgericht Dortmund HRB 13444)."
            }
        ]
    }
}