{
    "orig": {
        "aktenzeichen": "HRB 41164",
        "amtsgericht": "Mainz",
        "event_date": "2011-12-09",
        "event_type": "Veränderungen",
        "federal_state": "rp",
        "full_text": "Amtsgericht Mainz Aktenzeichen: HRB 41164   \nBekannt gemacht am: 16.12.2011 12:00 Uhr\n\n\n\n\nDie in () gesetzten Angaben der Anschrift und des Geschäftszweiges erfolgen ohne Gewähr.\nVeränderungen\n09.12.2011\n\nS.A.F.T. Büroservice GmbH, Mainz (Wilhelm-Theodor-Römheld-Straße 14, 55130 Mainz). Von Amts wegen berichtigt: Die Gesellschaft wird durch den/die Liquidator/en vertreten. Von Amts wegen berichtigt: Liquidator: Krug, Wolfgang, Alzenau, *15.05.1957. Von Amts wegen eingetragen: Durch rechtskräftigen Beschluss des Amtsgerichts Mainz (280 IN 18/08) vom 06.10.2011 ist das Insolvenzverfahren mangels einer die Kosten des Verfahrens deckenden Masse eingestellt.",
        "gesellschafter": null,
        "inhaber": null,
        "name": "S.A.F.T. Büroservice GmbH",
        "notice_id": "111435",
        "posted_on": "2011-12-16",
        "rechtsform": null,
        "sitz": null,
        "url": "https://www.handelsregisterbekanntmachungen.de/en/skripte/hrb.php?rb_id=111435&land_abk=rp"
    },
    "parsed": {
        "officers": [
            {
                "class": "Liquidator",
                "payload": {
                    "city": "Alzenau",
                    "dob": "1957-05-15",
                    "lastname": "Krug",
                    "name": "Wolfgang"
                },
                "text": " Krug, Wolfgang, Alzenau, *15.05.1957."
            }
        ]
    }
}