{
    "orig": {
        "aktenzeichen": "HRB 25430",
        "amtsgericht": "Essen",
        "event_date": "2015-02-19",
        "event_type": "Veränderungen",
        "federal_state": "nw",
        "full_text": "Amtsgericht Essen Aktenzeichen: HRB 25430 \nBekannt gemacht am: 19.02.2015 20:01 Uhr\n\n\n\n\nIn () gesetzte Angaben der Anschrift und des Geschäftszweiges erfolgen ohne Gewähr.\nVeränderungen\n19.02.2015\n\nHRB 25430: ESCONSULT GmbH, Sprockhövel, Zum Strandbad 4, 45549 Sprockhövel. Die Gesellschaft ist aufgelöst. Ist nur ein Liquidator bestellt, so vertritt er die Gesellschaft allein. Sind mehrere Liquidatoren bestellt, so wird die Gesellschaft durch die Liquidatoren gemeinsam vertreten. Nicht mehr Geschäftsführer, sondern nunmehr bestellt zum Liquidator: Taddey, Sandra, Limburg a. d. Lahn, *04.04.1975.",
        "gesellschafter": null,
        "inhaber": null,
        "name": "HRB 25430: ESCONSULT GmbH",
        "notice_id": "1130173",
        "posted_on": "2015-02-19",
        "rechtsform": null,
        "sitz": null,
        "url": "https://www.handelsregisterbekanntmachungen.de/en/skripte/hrb.php?rb_id=1130173&land_abk=nw"
    },
    "parsed": {
        "flags": [
            {
                "flag": "ignore_for_now",
                "text": "Die\\ Gesellschaft\\ ist\\ aufgel\\öst\\."
            }
        ],
        "officers": [
            {
                "class": "Liquidator",
                "payload": {
                    "city": "Limburg a. d. Lahn",
                    "dob": "1975-04-04",
                    "lastname": "Taddey",
                    "name": "Sandra"
                },
                "text": " Taddey, Sandra, Limburg a. d. Lahn, *04.04.1975."
            }
        ]
    }
}