{
    "orig": {
        "aktenzeichen": "HRB 11786",
        "amtsgericht": "Krefeld",
        "event_date": "2015-04-28",
        "event_type": "Veränderungen",
        "federal_state": "nw",
        "full_text": "Amtsgericht Krefeld Aktenzeichen: HRB 11786 \nBekannt gemacht am: 28.04.2015 20:01 Uhr\n\n\n\n\nIn () gesetzte Angaben der Anschrift und des Geschäftszweiges erfolgen ohne Gewähr.\nVeränderungen\n28.04.2015\n\nHRB 11786: C.C. Holding GmbH, Krefeld, Bataverstraße 25, 47809 Krefeld. Nicht mehr Geschäftsführer: Bollig, Marc-Johann, Kleve, *20.10.1964; Kersting, Dieter, Herdecke, *09.05.1958. Bestellt als Geschäftsführer: Kemmer, Stefan, Spangenberg, *05.02.1967; Kleiber, Kjell, Kaarst, *01.01.1974. Prokura erloschen: Kleiber, Kjell, Kaarst, *01.01.1974. Gesamtprokura gemeinsam mit einem Geschäftsführer oder einem anderen Prokuristen: Philippen, David Wilko, Viersen, *26.02.1980; Wolfers, Gerlinde, Grefrath, *23.08.1969.",
        "gesellschafter": null,
        "inhaber": null,
        "name": "HRB 11786: C.C. Holding GmbH",
        "notice_id": "1153209",
        "posted_on": "2015-04-28",
        "rechtsform": null,
        "sitz": null,
        "url": "https://www.handelsregisterbekanntmachungen.de/en/skripte/hrb.php?rb_id=1153209&land_abk=nw"
    },
    "parsed": {
        "officers": [
            {
                "class": "DismissedManagingDirector",
                "payload": {
                    "city": "Kleve",
                    "dismissed": true,
                    "dob": "1964-10-20",
                    "lastname": "Bollig",
                    "name": "Marc-Johann"
                },
                "text": " Bollig, Marc-Johann, Kleve, *20.10.1964"
            },
            {
                "class": "AppointedManagingDirector",
                "payload": {
                    "city": "Spangenberg",
                    "dob": "1967-05-02",
                    "lastname": "Kemmer",
                    "name": "Stefan"
                },
                "text": " Kemmer, Stefan, Spangenberg, *05.02.1967"
            },
            {
                "class": "ProcurationCancelled",
                "payload": {
                    "city": "Kaarst",
                    "dismissed": true,
                    "dob": "1974-01-01",
                    "lastname": "Kleiber",
                    "name": "Kjell"
                },
                "text": " Kleiber, Kjell, Kaarst, *01.01.1974."
            },
            {
                "class": "CommonProcuration",
                "payload": {
                    "city": "Viersen",
                    "dob": "1980-02-26",
                    "lastname": "Philippen",
                    "name": "David Wilko"
                },
                "text": " Philippen, David Wilko, Viersen, *26.02.1980"
            }
        ]
    }
}