{
    "orig": {
        "aktenzeichen": "GnR 667",
        "amtsgericht": "Köln",
        "event_date": "2015-05-28",
        "event_type": "Veränderungen",
        "federal_state": "nw",
        "full_text": "Amtsgericht Köln Aktenzeichen: GnR 667 \nBekannt gemacht am: 28.05.2015 20:03 Uhr\n\n\n\n\nIn () gesetzte Angaben der Anschrift und des Geschäftszweiges erfolgen ohne Gewähr.\nVeränderungen\n28.05.2015\n\nGnR 667: TAXI RUF Köln Wirtschaftliche Vereinigung Kölner Taxiunternehmer eG, Köln (Bonner Wall 37, 50677 Köln). Die Generalversammlung vom 18.06.2014 hat eine Änderung der Satzung in § 2 Absatz 2 g) (Zweck und Gegenstand) und mit ihr die Änderung des Unternehmensgegenstandes beschlossen. Neuer Gegenstand: Absatz (2) a) der Betrieb einer Funk- und Telefonzentrale und anderer Einrichtungen zur Vermittlung von Fahraufträgen für Personen- und Sachtransporte an die Mitglieder und assoziierte Teilnehmer, b) der Abschluss von Rahmenverträgen zur Personenbeförderung mit Krankenkassen, Berufsgenossenschaften und sonstigen Institutionen öffentlichen Rechts, c) der Abschluss von Beförderungsverträgen mit öffentlichen Verkehrsträgern, Großkunden und Firmen, d) der Ein- und Verkauf von Waren für den Bedarf der Mitglieder und assoziierten Teilnehmer sowie die Vermittlung solcher Geschäfte, e) das Inkasso von Beförderungsentgelten und deren Auszahlung, f) der Betrieb sonstiger Einrichtungen und die Erbringung sonstiger Dienstleistungen zur Erreichung des Zwecks der Genossenschaft, g) die Förderung des lauteren Wettbewerbs und der Wettbewerbsinteressen der Mitglieder sowie die Verfolgung von Wettbewerbsverstößen im Bereich der Personenbeförderung und des Transportwesens. Die Genossenschaft kann sich zur Erreichung ihres Zwecks und zur Verwirklichung der Gegenstände des Unternehmens an anderen Unternehmen beteiligen, solche erwerben oder gründen. Die Ausdehnung des Geschäftsbetriebs auf Nichtmitglieder ist zulässig. Nicht mehr Vorstand: Argomand Khageh, Jamshid, Köln, *24.08.1959. Bestellt als Vorstand: Mohsenzadeh Motlagh, Borzoyeh, Frechen, *28.12.1964.",
        "gesellschafter": null,
        "inhaber": null,
        "name": "GnR 667: TAXI RUF Köln Wirtschaftliche Vereinigung Kölner Taxiunternehmer eG",
        "notice_id": "1162673",
        "posted_on": "2015-05-28",
        "rechtsform": null,
        "sitz": null,
        "url": "https://www.handelsregisterbekanntmachungen.de/en/skripte/hrb.php?rb_id=1162673&land_abk=nw"
    },
    "parsed": {
        "officers": [
            {
                "class": "Person",
                "payload": {
                    "city": "Köln",
                    "dob": "1959-08-24",
                    "lastname": "Argomand Khageh",
                    "name": "Jamshid"
                },
                "text": " Argomand Khageh, Jamshid, Köln, *24.08.1959."
            },
            {
                "class": "Person",
                "payload": {
                    "city": "Frechen",
                    "dob": "1964-12-28",
                    "lastname": ": Mohsenzadeh Motlagh",
                    "name": "Borzoyeh"
                },
                "text": ": Mohsenzadeh Motlagh, Borzoyeh, Frechen, *28.12.1964."
            }
        ]
    }
}