{
    "orig": {
        "aktenzeichen": "HRA 5049",
        "amtsgericht": "Bad Oeynhausen",
        "event_date": "2015-06-26",
        "event_type": "Veränderungen",
        "federal_state": "nw",
        "full_text": "Amtsgericht Bad Oeynhausen Aktenzeichen: HRA 5049 \nBekannt gemacht am: 26.06.2015 13:33 Uhr\n\n\n\n\nIn () gesetzte Angaben der Anschrift und des Geschäftszweiges erfolgen ohne Gewähr.\nVeränderungen\n26.06.2015\n\nHRA 5049: Jeschkowsky & Holzmeier OHG Nachf. Holger Holzmeier e.K., Hiddenhausen, Zur Kokenheide 2, 32120 Hiddenhausen. Neue Firma: Holger Holzmeier e.K. Herford. Änderung zur Geschäftsanschrift: Richard-Sprick-Weg 11, 32052 Herford. Umschreibung zur Fortführung auf EDV gem. § 319 auf Grund eines Schreibfehlers berichtigt und Wohnort gem. § 319 ZPO von Amts wegen geändert. Nun Inhaber: Holzmeier, Holger, Herford, *09.01.1970. Die Niederlassung ist nach Herford verlegt.",
        "gesellschafter": null,
        "inhaber": null,
        "name": "HRA 5049: Jeschkowsky & Holzmeier OHG Nachf. Holger Holzmeier e.K.",
        "notice_id": "1170899",
        "posted_on": "2015-06-26",
        "rechtsform": null,
        "sitz": null,
        "url": "https://www.handelsregisterbekanntmachungen.de/en/skripte/hrb.php?rb_id=1170899&land_abk=nw"
    },
    "parsed": {
        "labels": [
            {
                "label": "address",
                "text": " Richard-Sprick-Weg 11, 32052 Herford."
            }
        ],
        "officers": [
            {
                "class": "Owner",
                "payload": {
                    "city": "Herford",
                    "dob": "1970-09-01",
                    "lastname": "Holzmeier",
                    "name": "Holger"
                },
                "text": " Holzmeier, Holger, Herford, *09.01.1970."
            }
        ]
    }
}