{
    "orig": {
        "aktenzeichen": "HRB 24449",
        "amtsgericht": "Essen",
        "event_date": "2015-09-22",
        "event_type": "Veränderungen",
        "federal_state": "nw",
        "full_text": "Amtsgericht Essen Aktenzeichen: HRB 24449 \nBekannt gemacht am: 22.09.2015 20:05 Uhr\n\n\n\n\nIn () gesetzte Angaben der Anschrift und des Geschäftszweiges erfolgen ohne Gewähr.\nVeränderungen\n22.09.2015\n\nHRB 24449: HOCHTIEF Krankenhauspartner UK Jena Verwaltungs GmbH, Essen, Alfredstraße 236, 45133 Essen. Die Gesellschafterversammlung hat am 17.09.2015 beschlossen, die Firma, den Gegenstand des Unternehmens und entsprechend den Gesellschaftsvertrag in §§ 1 (Firma, Sitz) und 2 (Gegenstand des Unternehmens) zu ändern. Neue Firma: HOCHTIEF PPAC GmbH. Neuer Unternehmensgegenstand: Die Planung, der Bau, die Finanzierung - ausgenommen genehmigungsbedürftige Leistungen nach dem Kreditwesengesetz - und die langfristige Vermietung sowie die Bewirtschaftung und Instandhaltung (inklusive Energielieferung und -versorgung) des Projektes Polizeipräsidium Aachen einschließlich des Erwerbs des für die Bebauung erforderlichen Grundbesitzes. Nicht mehr Geschäftsführer: Arendt, Sandra, Recklinghausen, *09.11.1966. Bestellt zum Geschäftsführer: Koch, Marc, Castrop-Rauxel, *12.09.1980; Puzicha, Jörg, Essen, *02.11.1976. Gesamtprokura gemeinsam mit einem Geschäftsführer oder einem anderen Prokuristen mit der Befugnis im Namen der Gesellschaft mit sich im eigenen Namen oder als Vertreter eines Dritten Rechtsgeschäfte abzuschließen mit der Ermächtigung zur Veräußerung und Belastung von Grundstücken: Arendt, Sandra, Recklinghausen, *09.11.1966; Jonas, Irmgard, Düsseldorf, *16.03.1964; Lorenz, Tobias, Essen, *20.03.1975.",
        "gesellschafter": null,
        "inhaber": null,
        "name": "HRB 24449: HOCHTIEF Krankenhauspartner UK Jena Verwaltungs GmbH",
        "notice_id": "1201363",
        "posted_on": "2015-09-22",
        "rechtsform": null,
        "sitz": null,
        "url": "https://www.handelsregisterbekanntmachungen.de/en/skripte/hrb.php?rb_id=1201363&land_abk=nw"
    },
    "parsed": {
        "officers": [
            {
                "class": "DismissedManagingDirector",
                "payload": {
                    "city": "Recklinghausen",
                    "dismissed": true,
                    "dob": "1966-09-11",
                    "lastname": "Arendt",
                    "name": "Sandra"
                },
                "text": " Arendt, Sandra, Recklinghausen, *09.11.1966."
            },
            {
                "class": "ManagingDirector",
                "payload": {
                    "city": "Castrop-Rauxel",
                    "dob": "1980-12-09",
                    "lastname": "Koch",
                    "name": "Marc"
                },
                "text": " Koch, Marc, Castrop-Rauxel, *12.09.1980"
            }
        ]
    }
}