{
    "orig": {
        "aktenzeichen": "HRB 18608",
        "amtsgericht": "Essen",
        "event_date": "2015-10-23",
        "event_type": "Veränderungen",
        "federal_state": "nw",
        "full_text": "Amtsgericht Essen Aktenzeichen: HRB 18608 \nBekannt gemacht am: 23.10.2015 20:04 Uhr\n\n\n\n\nIn () gesetzte Angaben der Anschrift und des Geschäftszweiges erfolgen ohne Gewähr.\nVeränderungen\n23.10.2015\n\nHRB 18608: Immeo Grundstücks GmbH, Essen, Keplerstraße 110 - 112, 45147 Essen. Nicht mehr Geschäftsführer: Heuken, Jürgen, Mülheim an der Ruhr, *01.08.1956. Gesamtprokura gemeinsam mit einem Geschäftsführer oder einem anderen Prokuristen mit der Befugnis im Namen der Gesellschaft mit sich als Vertreter eines Dritten Rechtsgeschäfte abzuschließen mit der Ermächtigung zur Veräußerung und Belastung von Grundstücken: Heitmann, Thorsten, Recklinghausen, *26.04.1975.",
        "gesellschafter": null,
        "inhaber": null,
        "name": "HRB 18608: Immeo Grundstücks GmbH",
        "notice_id": "1211693",
        "posted_on": "2015-10-23",
        "rechtsform": null,
        "sitz": null,
        "url": "https://www.handelsregisterbekanntmachungen.de/en/skripte/hrb.php?rb_id=1211693&land_abk=nw"
    },
    "parsed": {
        "officers": [
            {
                "class": "DismissedManagingDirector",
                "payload": {
                    "city": "Mülheim an der Ruhr",
                    "dismissed": true,
                    "dob": "1956-01-08",
                    "lastname": "Heuken",
                    "name": "Jürgen"
                },
                "text": " Heuken, Jürgen, Mülheim an der Ruhr, *01.08.1956."
            }
        ]
    }
}