{
    "orig": {
        "aktenzeichen": "HRB 19161",
        "amtsgericht": "Bonn",
        "event_date": "2015-12-22",
        "event_type": "Veränderungen",
        "federal_state": "nw",
        "full_text": "Amtsgericht Bonn Aktenzeichen: HRB 19161 \nBekannt gemacht am: 22.12.2015 20:02 Uhr\n\n\n\n\nIn () gesetzte Angaben der Anschrift und des Geschäftszweiges erfolgen ohne Gewähr.\nVeränderungen\n22.12.2015\n\nHRB 19161: Solarmapper UG (haftungsbeschränkt), Bonn, Oberaustraße 44, 53179 Bonn. Ist nur ein Liquidator bestellt, so vertritt er die Gesellschaft allein. Sind mehrere Liquidatoren bestellt, so wird die Gesellschaft durch die Liquidatoren gemeinsam vertreten. Nicht mehr Geschäftsführer: Ackermann, Frank Friedrich, Bonn, *21.12.1971. Bestellt zum Liquidator: Rushkov, Branimir Blagoev, 1504 Sofia / Bulgarien, *15.01.1970. Die Gesellschaft ist aufgelöst.",
        "gesellschafter": null,
        "inhaber": null,
        "name": "HRB 19161: Solarmapper UG (haftungsbeschränkt)",
        "notice_id": "1232300",
        "posted_on": "2015-12-22",
        "rechtsform": null,
        "sitz": null,
        "url": "https://www.handelsregisterbekanntmachungen.de/en/skripte/hrb.php?rb_id=1232300&land_abk=nw"
    },
    "parsed": {
        "flags": [
            {
                "flag": "CompanyClosed",
                "text": "Die\\ Gesellschaft\\ ist\\ aufgel\\öst\\."
            }
        ],
        "officers": [
            {
                "class": "DismissedManagingDirector",
                "payload": {
                    "city": "Bonn",
                    "dismissed": true,
                    "dob": "1971-12-21",
                    "lastname": "Ackermann",
                    "name": "Frank Friedrich"
                },
                "text": " Ackermann, Frank Friedrich, Bonn, *21.12.1971."
            },
            {
                "class": "Liquidator",
                "payload": {
                    "city": "1504 Sofia / Bulgarien",
                    "dob": "1970-01-15",
                    "lastname": "Rushkov",
                    "name": "Branimir Blagoev"
                },
                "text": " Rushkov, Branimir Blagoev, 1504 Sofia / Bulgarien, *15.01.1970."
            }
        ]
    }
}