{
    "orig": {
        "aktenzeichen": "HRB 8990",
        "amtsgericht": "Siegen",
        "event_date": "2016-04-25",
        "event_type": "Veränderungen",
        "federal_state": "nw",
        "full_text": "Amtsgericht Siegen Aktenzeichen: HRB 8990 \nBekannt gemacht am: 25.04.2016 20:08 Uhr\n\n\n\n\nIn () gesetzte Angaben der Anschrift und des Geschäftszweiges erfolgen ohne Gewähr.\nVeränderungen\n25.04.2016\n\nHRB 8990: Brotbanckh UG (haftungsbeschränkt), Erndtebrück, Struthstraße 19, 57339 Erndtebrück. Ist nur ein Liquidator bestellt, so vertritt er die Gesellschaft allein. Sind mehrere Liquidatoren bestellt, so wird die Gesellschaft durch die Liquidatoren gemeinsam vertreten. Nicht mehr Geschäftsführer, nunmehr Liquidator: Bernshausen, Thomas Friedrich, Erndtebrück, *04.12.1961. Die Gesellschaft ist aufgelöst.",
        "gesellschafter": null,
        "inhaber": null,
        "name": "HRB 8990: Brotbanckh UG (haftungsbeschränkt)",
        "notice_id": "1277645",
        "posted_on": "2016-04-25",
        "rechtsform": null,
        "sitz": null,
        "url": "https://www.handelsregisterbekanntmachungen.de/en/skripte/hrb.php?rb_id=1277645&land_abk=nw"
    },
    "parsed": {
        "flags": [
            {
                "flag": "CompanyClosed",
                "text": "Die\\ Gesellschaft\\ ist\\ aufgel\\öst\\."
            }
        ],
        "officers": [
            {
                "class": "Liquidator",
                "payload": {
                    "city": "Erndtebrück",
                    "dob": "1961-12-04",
                    "lastname": "Bernshausen",
                    "name": "Thomas Friedrich"
                },
                "text": " Bernshausen, Thomas Friedrich, Erndtebrück, *04.12.1961."
            }
        ]
    }
}