{
    "orig": {
        "aktenzeichen": "HRB 58679",
        "amtsgericht": "Frankfurt am Main",
        "event_date": "2009-04-06",
        "event_type": "Veränderungen",
        "federal_state": "he",
        "full_text": "Amtsgericht Frankfurt am Main Aktenzeichen: HRB 58679 \nBekannt gemacht am: 14.04.2009 12:00 Uhr\n\n\n\n\nVeröffentlichungen des Amtsgerichts Frankfurt am Main\r\r\rIn () gesetzte Angaben der Anschrift und des Geschäftszweiges erfolgen ohne Gewähr.\nVeränderungen\n06.04.2009\n\nHDW Grundstücks-Vermietungsgesellschaft mbH, Frankfurt am Main, Hanauer Landstr. 293, 60314 Frankfurt am Main.Geschäftsanschrift: Hanauer Landstr. 293, 60314 Frankfurt am Main. Prokura erloschen: Briel, Jörg, Düsseldorf, *07.12.1961; Liedgens, Klaus, Düsseldorf, *31.03.1952; Schrötgens, Heinz-Leo, Wassenberg, *30.07.1953; Thomsen, Jörg, Düsseldorf, *12.11.1968; Wolters, Bernd, Düsseldorf, *15.01.1964. Personenbezogene Daten geändert, nun: Gesamtprokura gemeinsam mit einem Geschäftsführer oder einem anderen Prokuristen mit der Befugnis, im Namen der Gesellschaft mit sich im eigenen Namen oder als Vertreter eines Dritten Rechtsgeschäfte abzuschließen mit der Ermächtigung zur Veräußerung und Belastung von Grundstücken: Anders, Heike, Neu-Anspach, *08.07.1961; Kuhn, Thomas, Köln, *04.07.1961; Moll, Dominik, Frankfurt am Main, *19.07.1973; Rehwald, Ulrich, Düsseldorf, *30.01.1955; Schaffeld, Frank, Düsseldorf, *17.05.1963; Seidel, Michael, Roetgen, *18.05.1972; Wagner, Hildegard, Düsseldorf, *26.02.1959; Weinbrenner, Martin, Weilburg, *22.11.1965.",
        "gesellschafter": null,
        "inhaber": null,
        "name": "HDW Grundstücks-Vermietungsgesellschaft mbH",
        "notice_id": "128790",
        "posted_on": "2009-04-14",
        "rechtsform": null,
        "sitz": null,
        "url": "https://www.handelsregisterbekanntmachungen.de/en/skripte/hrb.php?rb_id=128790&land_abk=he"
    },
    "parsed": {
        "addresses": [
            {
                "kls": "Address",
                "text": "Hanauer Landstr 293, 60314 Frankfurt am Main"
            }
        ],
        "officers": [
            {
                "class": "ProcurationCancelled",
                "payload": {
                    "city": "Düsseldorf",
                    "dismissed": true,
                    "dob": "1961-12-07",
                    "lastname": "Briel",
                    "name": "Jörg"
                },
                "text": " Briel, Jörg, Düsseldorf, *07.12.1961"
            },
            {
                "class": "ProcurationCancelled",
                "payload": {
                    "city": "Düsseldorf",
                    "dismissed": true,
                    "dob": "1952-03-31",
                    "lastname": "Liedgens",
                    "name": "Klaus"
                },
                "text": " Liedgens, Klaus, Düsseldorf, *31.03.1952"
            },
            {
                "class": "ProcurationCancelled",
                "payload": {
                    "city": "Wassenberg",
                    "dismissed": true,
                    "dob": "1953-07-30",
                    "lastname": "Schrötgens",
                    "name": "Heinz-Leo"
                },
                "text": " Schrötgens, Heinz-Leo, Wassenberg, *30.07.1953"
            },
            {
                "class": "ProcurationCancelled",
                "payload": {
                    "city": "Düsseldorf",
                    "dismissed": true,
                    "dob": "1968-11-12",
                    "lastname": "Thomsen",
                    "name": "Jörg"
                },
                "text": " Thomsen, Jörg, Düsseldorf, *12.11.1968"
            },
            {
                "class": "ProcurationCancelled",
                "payload": {
                    "city": "Düsseldorf",
                    "dismissed": true,
                    "dob": "1964-01-15",
                    "lastname": "Wolters",
                    "name": "Bernd"
                },
                "text": " Wolters, Bernd, Düsseldorf, *15.01.1964."
            }
        ]
    }
}