{
    "orig": {
        "aktenzeichen": "HRB 81454",
        "amtsgericht": "Köln",
        "event_date": "2016-05-31",
        "event_type": "Veränderungen",
        "federal_state": "nw",
        "full_text": "Amtsgericht Köln Aktenzeichen: HRB 81454 \nBekannt gemacht am: 31.05.2016 20:11 Uhr\n\n\n\n\nIn () gesetzte Angaben der Anschrift und des Geschäftszweiges erfolgen ohne Gewähr.\nVeränderungen\n31.05.2016\n\nHRB 81454: Phoenix UG (haftungsbeschränkt), Erftstadt, Gippenzaun 13 a, 50374 Erftstadt. Ist nur ein Liquidator bestellt, so vertritt er die Gesellschaft allein. Sind mehrere Liquidatoren bestellt, so wird die Gesellschaft durch die Liquidatoren gemeinsam vertreten. Nicht mehr Geschäftsführer, nunmehr bestellt als Liquidator: Günther, Laurenz Richard Kuno, Erftstadt, *02.03.1993. Die Gesellschaft ist aufgelöst.",
        "gesellschafter": null,
        "inhaber": null,
        "name": "HRB 81454: Phoenix UG (haftungsbeschränkt)",
        "notice_id": "1288489",
        "posted_on": "2016-05-31",
        "rechtsform": null,
        "sitz": null,
        "url": "https://www.handelsregisterbekanntmachungen.de/en/skripte/hrb.php?rb_id=1288489&land_abk=nw"
    },
    "parsed": {
        "flags": [
            {
                "flag": "ignore_for_now",
                "text": "Die\\ Gesellschaft\\ ist\\ aufgel\\öst\\."
            }
        ],
        "officers": [
            {
                "class": "Liquidator",
                "payload": {
                    "city": "Erftstadt",
                    "dob": "1993-02-03",
                    "lastname": "Günther",
                    "name": "Laurenz Richard Kuno"
                },
                "text": " Günther, Laurenz Richard Kuno, Erftstadt, *02.03.1993."
            }
        ]
    }
}