{
    "orig": {
        "aktenzeichen": "HRA 41819",
        "amtsgericht": "Mainz",
        "event_date": "2013-01-15",
        "event_type": "Neueintragungen",
        "federal_state": "rp",
        "full_text": "Amtsgericht Mainz Aktenzeichen: HRA 41819   \nBekannt gemacht am: 22.01.2013 22:00 Uhr\n\n\n\n\nDie in () gesetzten Angaben der Anschrift und des Geschäftszweiges erfolgen ohne Gewähr.\nNeueintragungen\n15.01.2013\n\nWIBROS Management oHG, Heidesheim, Moselstraße 22e, 55262 Heidesheim. (Verwaltung eigenen Vermögens sowie der Handel mit, die Vermietung und Lizensierung von Internet-Domains sowie ferner die Erbringung von Dienstleistungen in folgenden Bereichen: Internet Hosting, Domains, Serveradministration, eCommerce, Online Marketing, Web Analyse.). Offene Handelsgesellschaft. Geschäftsanschrift: Moselstraße 22e, 55262 Heidesheim. Allgemeine Vertretungsregelung: Jeder persönlich haftende Gesellschafter vertritt einzeln. Jeder persönlich haftende Gesellschafter ist befugt, im Namen der Gesellschaft mit sich im eigenen Namen oder als Vertreter eines Dritten Rechtsgeschäfte vorzunehmen. Persönlich haftender Gesellschafter: Slovig, Matthias Carsten, Mainz, *24.05.1977; Wiedmaier, Marc, Heidesheim, *02.08.1971; Wiedmaier, Arndt, Mainz, *08.09.1968.",
        "gesellschafter": null,
        "inhaber": null,
        "name": "WIBROS Management oHG",
        "notice_id": "132456",
        "posted_on": "2013-01-22",
        "rechtsform": null,
        "sitz": null,
        "url": "https://www.handelsregisterbekanntmachungen.de/en/skripte/hrb.php?rb_id=132456&land_abk=rp"
    },
    "parsed": {
        "labels": [
            {
                "label": "address",
                "text": " Moselstraße 22e, 55262 Heidesheim."
            }
        ],
        "officers": [
            {
                "class": "PersonalPartner",
                "payload": {
                    "city": "Mainz",
                    "dob": "1977-05-24",
                    "lastname": "Slovig",
                    "name": "Matthias Carsten"
                },
                "text": " Slovig, Matthias Carsten, Mainz, *24.05.1977"
            },
            {
                "class": "PersonalPartner",
                "payload": {
                    "city": "Heidesheim",
                    "dob": "1971-08-02",
                    "lastname": "Wiedmaier",
                    "name": "Marc"
                },
                "text": " Wiedmaier, Marc, Heidesheim, *02.08.1971"
            },
            {
                "class": "PersonalPartner",
                "payload": {
                    "city": "Mainz",
                    "dob": "1968-09-08",
                    "lastname": "Wiedmaier",
                    "name": "Arndt"
                },
                "text": " Wiedmaier, Arndt, Mainz, *08.09.1968."
            }
        ]
    }
}