{
    "orig": {
        "aktenzeichen": "HRB 114636 B",
        "amtsgericht": "Charlottenburg (Berlin)",
        "event_date": "2010-06-21",
        "event_type": "Veränderungen",
        "federal_state": "be",
        "full_text": "Amtsgericht Charlottenburg (Berlin) Aktenzeichen: HRB 114636 B  \nBekannt gemacht am: 23.06.2010 12:00 Uhr\n\n\n\n\nIn () gesetzte Angaben der Anschrift und des Geschäftszweiges erfolgen ohne Gewähr.\nVeränderungen\n21.06.2010\n\nFM Compact GmbH, Berlin, Düsterhauptstr. 13/Florastr. 4, 13469 Berlin. Vertretungsregelung: Ist ein Liquidator bestellt, vertritt er die Gesellschaft allein. Sind mehrere Liquidatoren bestellt, vertreten sie die Gesellschaft gemeinsam. Änderung zu Nr. 1:; Nunmehr:; Liquidator:; Hein, Peter, *23.09.1969, Berlin Rechtsverhaeltnis: Durch Beschluss der Gesellschafterversammlung vom 14.12.2009 ist die Gesellschaft aufgelöst..",
        "gesellschafter": null,
        "inhaber": null,
        "name": "FM Compact GmbH",
        "notice_id": "134800",
        "posted_on": "2010-06-23",
        "rechtsform": null,
        "sitz": null,
        "url": "https://www.handelsregisterbekanntmachungen.de/en/skripte/hrb.php?rb_id=134800&land_abk=be"
    },
    "parsed": {
        "officers": [
            {
                "class": "Liquidator",
                "payload": {
                    "city": "Berlin Rechtsverhaeltnis: Durch Beschluss der Gesellschafterversammlung vom 14.12.2009 ist die Gesellschaft aufgelöst",
                    "dob": "1969-09-23",
                    "lastname": "Hein",
                    "name": "Peter"
                },
                "text": " Hein, Peter, *23.09.1969, Berlin Rechtsverhaeltnis: Durch Beschluss der Gesellschafterversammlung vom 14.12.2009 ist die Gesellschaft aufgelöst.."
            }
        ]
    }
}