{
    "orig": {
        "aktenzeichen": "HRB 4800",
        "amtsgericht": "Düren",
        "event_date": "2017-01-13",
        "event_type": "Veränderungen",
        "federal_state": "nw",
        "full_text": "Amtsgericht Düren Aktenzeichen: HRB 4800 \nBekannt gemacht am: 13.01.2017 20:01 Uhr\n\n\n\n\nIn () gesetzte Angaben der Anschrift und des Geschäftszweiges erfolgen ohne Gewähr.\nVeränderungen\n13.01.2017\n\nHRB 4800: marx IT-Consulting GmbH, Düren, Im Kohnental 11, 52353 Düren. Die Gesellschafterversammlung vom 19.12.2016 hat eine Änderung des Gesellschaftsvertrages in § 1 Abs. 1. und mit ihr die Änderung der Firma sowie in § 2 Abs. 1. und mit ihr die Änderung des Unternehmensgegenstandes beschlossen. Weiterhin hat sie eine Änderung des Gesellschaftsvertrages in § 5 (Stammkapital) und in § 14 (Geschäftsführung und Vertretung) beschlossen, wobei Abs. 5 des § 14 gestrichen wurde. Neue Firma: Marx Personaldienste GmbH. Neuer Unternehmensgegenstand: Arbeitnehmerüberlassung, Personalvermittlung und Zeitarbeit. Nicht mehr Geschäftsführer: Tumma, Markus, Aachen, *10.09.1975. Einzelprokura: Lüth, Dominik, Düren, *20.07.1990.",
        "gesellschafter": null,
        "inhaber": null,
        "name": "HRB 4800: marx IT-Consulting GmbH",
        "notice_id": "1367567",
        "posted_on": "2017-01-13",
        "rechtsform": null,
        "sitz": null,
        "url": "https://www.handelsregisterbekanntmachungen.de/en/skripte/hrb.php?rb_id=1367567&land_abk=nw"
    },
    "parsed": {
        "flags": [
            {
                "flag": "Single procuration",
                "text": "Einzelprokura"
            }
        ],
        "officers": [
            {
                "class": "DismissedManagingDirector",
                "payload": {
                    "city": "Aachen",
                    "dismissed": true,
                    "dob": "1975-10-09",
                    "lastname": "Tumma",
                    "name": "Markus"
                },
                "text": " Tumma, Markus, Aachen, *10.09.1975."
            },
            {
                "class": "SingleProcuration",
                "payload": {
                    "city": "Düren",
                    "dob": "1990-07-20",
                    "lastname": "Lüth",
                    "name": "Dominik"
                },
                "text": " Lüth, Dominik, Düren, *20.07.1990."
            }
        ]
    }
}