{
    "orig": {
        "aktenzeichen": "HRB 15220 P",
        "amtsgericht": "Potsdam",
        "event_date": "2016-12-29",
        "event_type": "Veränderungen",
        "federal_state": "br",
        "full_text": "Amtsgericht Potsdam Aktenzeichen: HRB 15220 P \nBekannt gemacht am: 11.01.2017 21:57 Uhr\n\n\n\n\nIn () gesetzte Angaben der Anschrift und des Unternehmensgegenstandes erfolgen ohne Gewähr:\nVeränderungen\n29.12.2016\n\nHRB 15220 P: EGWI Baubetreuungs GmbH, Brandenburg an der Havel, Bergstraße 6, 14770 Brandenburg an der Havel. Vertretungsregelung: Ist ein Liquidator bestellt, so vertritt er die Gesellschaft allein. Sind mehrere Liquidatoren bestellt, wird die Gesellschaft gemeinschaftlich durch zwei Liquidatoren vertreten. Nicht mehr Geschäftsführer: Winkelmann, Renate; Liquidator: Eggebrecht, André, *28.06.1963, Brandenburg an der Havel; Rechtsverhaeltnis: Durch Beschluss der Gesellschafterversammlung vom 15.12.2016 ist die Gesellschaft aufgelöst",
        "gesellschafter": null,
        "inhaber": null,
        "name": "HRB 15220 P: EGWI Baubetreuungs GmbH",
        "notice_id": "137182",
        "posted_on": "2017-01-11",
        "rechtsform": null,
        "sitz": null,
        "url": "https://www.handelsregisterbekanntmachungen.de/en/skripte/hrb.php?rb_id=137182&land_abk=br"
    },
    "parsed": {
        "officers": [
            {
                "class": "DismissedManagingDirector",
                "payload": {
                    "dismissed": true,
                    "lastname": "Winkelmann",
                    "name": "Renate"
                },
                "text": " Winkelmann, Renate"
            },
            {
                "class": "Liquidator",
                "payload": {
                    "city": "Brandenburg an der Havel",
                    "dob": "1963-06-28",
                    "lastname": "Eggebrecht",
                    "name": "André"
                },
                "text": " Eggebrecht, André, *28.06.1963, Brandenburg an der Havel"
            }
        ]
    }
}