{
    "orig": {
        "aktenzeichen": "HRB 2273",
        "amtsgericht": "Lemgo",
        "event_date": "2017-01-27",
        "event_type": "Veränderungen",
        "federal_state": "nw",
        "full_text": "Amtsgericht Lemgo Aktenzeichen: HRB 2273 \nBekannt gemacht am: 27.01.2017 20:01 Uhr\n\n\n\n\nIn () gesetzte Angaben der Anschrift und des Geschäftszweiges erfolgen ohne Gewähr.\nVeränderungen\n27.01.2017\n\nHRB 2273: R. Gronemeyer GmbH, Karosseriebau, Leopoldshöhe, Schuckenteichweg 27, 33818 Leopoldshöhe. Die Gesellschafterversammlung vom 24.01.2017 hat die Änderung des Gesellschaftsvertrages in § 6 (Gesellschafterversammlung) beschlossen. Einzelprokura mit der Befugnis im Namen der Gesellschaft mit sich im eigenen Namen oder als Vertreter eines Dritten Rechtsgeschäfte abzuschließen: Gronemeyer, Mona Teresa, Leopoldshöhe, *31.10.1991.",
        "gesellschafter": null,
        "inhaber": null,
        "name": "HRB 2273: R. Gronemeyer GmbH",
        "notice_id": "1373362",
        "posted_on": "2017-01-27",
        "rechtsform": null,
        "sitz": null,
        "url": "https://www.handelsregisterbekanntmachungen.de/en/skripte/hrb.php?rb_id=1373362&land_abk=nw"
    },
    "parsed": {
        "officers": [
            {
                "class": "SingleProcuration",
                "payload": {
                    "city": "Leopoldshöhe",
                    "dob": "1991-10-31",
                    "lastname": "Gronemeyer",
                    "name": "Mona Teresa"
                },
                "text": " Gronemeyer, Mona Teresa, Leopoldshöhe, *31.10.1991."
            }
        ]
    }
}