{
    "orig": {
        "aktenzeichen": "HRB 11183",
        "amtsgericht": "Kleve",
        "event_date": "2017-02-15",
        "event_type": "Veränderungen",
        "federal_state": "nw",
        "full_text": "Amtsgericht Kleve Aktenzeichen: HRB 11183 \nBekannt gemacht am: 15.02.2017 20:00 Uhr\n\n\n\n\nIn () gesetzte Angaben der Anschrift und des Geschäftszweiges erfolgen ohne Gewähr.\nVeränderungen\n15.02.2017\n\nHRB 11183: IMA-Team UG (haftungsbeschränkt), Issum, Bertastraße 63, 47661 Issum. Die Gesellschaft wird durch einen oder mehrere Liquidatoren gerichtlich und außergerichtlich vertreten. Ist nur ein Liquidator vorhanden, so vertritt er die Firma allein. Sind mehrere Liquidatoren vorhanden, so vertreten diese die Gesellschaft gemeinsam. Nicht mehr Geschäftsführer: Becker, Igor, Issum, *22.02.1978; Reinke, Andreas, Moers, *15.06.1981. Bestellt als Liquidator: Reinke, Andreas, Geldern, *15.06.1981. Durch Beschluss der Gesellschafterversammlung vom 05.09.2016 ist die Gesellschaft aufgelöst.",
        "gesellschafter": null,
        "inhaber": null,
        "name": "HRB 11183: IMA-Team UG (haftungsbeschränkt)",
        "notice_id": "1380719",
        "posted_on": "2017-02-15",
        "rechtsform": null,
        "sitz": null,
        "url": "https://www.handelsregisterbekanntmachungen.de/en/skripte/hrb.php?rb_id=1380719&land_abk=nw"
    },
    "parsed": {
        "officers": [
            {
                "class": "DismissedManagingDirector",
                "payload": {
                    "city": "Issum",
                    "dismissed": true,
                    "dob": "1978-02-22",
                    "lastname": "Becker",
                    "name": "Igor"
                },
                "text": " Becker, Igor, Issum, *22.02.1978"
            },
            {
                "class": "Liquidator",
                "payload": {
                    "city": "Geldern",
                    "dob": "1981-06-15",
                    "lastname": "Reinke",
                    "name": "Andreas"
                },
                "text": " Reinke, Andreas, Geldern, *15.06.1981."
            }
        ]
    }
}