{
    "orig": {
        "aktenzeichen": "HRB 16101",
        "amtsgericht": "Krefeld",
        "event_date": "2017-02-24",
        "event_type": "Veränderungen",
        "federal_state": "nw",
        "full_text": "Amtsgericht Krefeld Aktenzeichen: HRB 16101 \nBekannt gemacht am: 24.02.2017 20:00 Uhr\n\n\n\n\nIn () gesetzte Angaben der Anschrift und des Geschäftszweiges erfolgen ohne Gewähr.\nVeränderungen\n24.02.2017\n\nHRB 16101: Gebr. Gossens GmbH, Krefeld, Meisenweg 27, 47804 Krefeld. Änderung zur Geschäftsanschrift: Wettener Straße 18, 47623 Kevelaer. Nicht mehr Geschäftsführer: Gossens, Helmut, Krefeld, *20.02.1943. Bestellt als Geschäftsführer: Holtermann, Sven, Geldern, *19.09.1964; Lacek-Herbrand, Richard, Kevelaer, *22.08.1972, jeweils mit der Befugnis im Namen der Gesellschaft mit sich im eigenen Namen oder als Vertreter eines Dritten Rechtsgeschäfte abzuschließen.",
        "gesellschafter": null,
        "inhaber": null,
        "name": "HRB 16101: Gebr. Gossens GmbH",
        "notice_id": "1384301",
        "posted_on": "2017-02-24",
        "rechtsform": null,
        "sitz": null,
        "url": "https://www.handelsregisterbekanntmachungen.de/en/skripte/hrb.php?rb_id=1384301&land_abk=nw"
    },
    "parsed": {
        "labels": [
            {
                "label": "address",
                "text": " Wettener Straße 18, 47623 Kevelaer."
            }
        ],
        "officers": [
            {
                "class": "DismissedManagingDirector",
                "payload": {
                    "city": "Krefeld",
                    "dismissed": true,
                    "dob": "1943-02-20",
                    "lastname": "Gossens",
                    "name": "Helmut"
                },
                "text": " Gossens, Helmut, Krefeld, *20.02.1943."
            },
            {
                "class": "AppointedManagingDirector",
                "payload": {
                    "city": "Geldern",
                    "dob": "1964-09-19",
                    "lastname": "Holtermann",
                    "name": "Sven"
                },
                "text": " Holtermann, Sven, Geldern, *19.09.1964"
            }
        ]
    }
}