{
    "orig": {
        "aktenzeichen": "HRA 31963",
        "amtsgericht": "Köln",
        "event_date": "2017-03-01",
        "event_type": "Veränderungen",
        "federal_state": "nw",
        "full_text": "Amtsgericht Köln Aktenzeichen: HRA 31963 \nBekannt gemacht am: 01.03.2017 20:02 Uhr\n\n\n\n\nIn () gesetzte Angaben der Anschrift und des Geschäftszweiges erfolgen ohne Gewähr.\nVeränderungen\n01.03.2017\n\nHRA 31963: Peter Lucke Oberflächentechnik e.K., Bergisch Gladbach, Herweg 92a, 51429 Bergisch Gladbach. Nach Änderung der Firma nunmehr: Peter Lucke Oberflächentechnik e.K., Inhaber Simon Zubcic. Änderung zur Geschäftsanschrift: Herweg 92, 51429 Bergisch Gladbach. Nicht mehr Inhaber: Lucke, Peter, Bergisch Gladbach, *22.12.1953. Nunmehr Inhaber: Zubcic, Simon, Bergisch Gladbach, *23.01.1977. Der Übergang der in dem Betriebe des Geschäfts entstandenen Verbindlichkeiten und Forderungen ist beim Erwerb des Geschäfts durch den neuen Inhaber ausgeschlossen.",
        "gesellschafter": null,
        "inhaber": null,
        "name": "HRA 31963: Peter Lucke Oberflächentechnik e.K.",
        "notice_id": "1385727",
        "posted_on": "2017-03-01",
        "rechtsform": null,
        "sitz": null,
        "url": "https://www.handelsregisterbekanntmachungen.de/en/skripte/hrb.php?rb_id=1385727&land_abk=nw"
    },
    "parsed": {
        "labels": [
            {
                "label": "address",
                "text": " Herweg 92, 51429 Bergisch Gladbach."
            }
        ],
        "officers": [
            {
                "class": "NotLongerOwner",
                "payload": {
                    "city": "Bergisch Gladbach",
                    "dismissed": true,
                    "dob": "1953-12-22",
                    "lastname": "Lucke",
                    "name": "Peter"
                },
                "text": " Lucke, Peter, Bergisch Gladbach, *22.12.1953."
            },
            {
                "class": "Owner",
                "payload": {
                    "city": "Bergisch Gladbach",
                    "dob": "1977-01-23",
                    "lastname": "Zubcic",
                    "name": "Simon"
                },
                "text": " Zubcic, Simon, Bergisch Gladbach, *23.01.1977."
            }
        ]
    }
}