{
    "orig": {
        "aktenzeichen": "HRB 15175",
        "amtsgericht": "Duisburg",
        "event_date": "2017-07-06",
        "event_type": "Veränderungen",
        "federal_state": "nw",
        "full_text": "Amtsgericht Duisburg Aktenzeichen: HRB 15175 \nBekannt gemacht am: 06.07.2017 20:02 Uhr\n\n\n\n\nIn () gesetzte Angaben der Anschrift und des Geschäftszweiges erfolgen ohne Gewähr.\nVeränderungen\n06.07.2017\n\nHRB 15175: OTTER SCHUTZ Gesellschaft für Entwicklung und Vertrieb persönlicher Schutzausrüstungen mbH, Mülheim an der Ruhr, Xantener Str. 6, 45479 Mülheim an der Ruhr. Bestellt als Geschäftsführer: Touchais, Olivier, Paris / Frankreich, *11.11.1970; Vasilevski, Andrea Michelle, Zürich / Schweiz, *05.05.1983, jeweils einzelvertretungsberechtigt mit der Befugnis im Namen der Gesellschaft mit sich im eigenen Namen oder als Vertreter eines Dritten Rechtsgeschäfte abzuschließen.",
        "gesellschafter": null,
        "inhaber": null,
        "name": "HRB 15175: OTTER SCHUTZ Gesellschaft für Entwicklung und Vertrieb persönlicher Schutzausrüstungen mbH",
        "notice_id": "1427346",
        "posted_on": "2017-07-06",
        "rechtsform": null,
        "sitz": null,
        "url": "https://www.handelsregisterbekanntmachungen.de/en/skripte/hrb.php?rb_id=1427346&land_abk=nw"
    },
    "parsed": {
        "officers": [
            {
                "class": "AppointedManagingDirector",
                "payload": {
                    "city": "Paris / Frankreich",
                    "dob": "1970-11-11",
                    "lastname": "Touchais",
                    "name": "Olivier"
                },
                "text": " Touchais, Olivier, Paris / Frankreich, *11.11.1970"
            }
        ]
    }
}