{
    "orig": {
        "aktenzeichen": "HRB 20060",
        "amtsgericht": "Frankfurt am Main",
        "event_date": "2009-08-10",
        "event_type": "Veränderungen",
        "federal_state": "he",
        "full_text": "Amtsgericht Frankfurt am Main Aktenzeichen: HRB 20060 \nBekannt gemacht am: 17.08.2009 12:00 Uhr\n\n\n\n\nVeröffentlichungen des Amtsgerichts Frankfurt am Main\r\r\rIn () gesetzte Angaben der Anschrift und des Geschäftszweiges erfolgen ohne Gewähr.\nVeränderungen\n10.08.2009\n\nMAZARS GmbH Wirtschaftsprüfungsgesellschaft, Frankfurt am Main, Rennbahnstr. 72, 60528 Frankfurt am Main.Geschäftsanschrift: Rennbahnstr. 72, 60528 Frankfurt am Main. Prokura erloschen: App, Jürgen, Gensingen, *02.12.1969; Baumgartner, Hubert, Wiesbaden, *24.03.1967; Crombach, Ulrich, Mettmann, *08.09.1966; Debrun, Christof, Düsseldorf, *20.08.1977; Dreher, Ekhard, Bad Homburg, *19.09.1968; Günther, Kathrin, Unterhaching, *24.02.1973; Nicolay, Matthias, Frankfurt am Main, *24.06.1968; Schimpfermann, Sascha, Hanau, *08.03.1971; Thees, Alexander, Düsseldorf, *04.08.1976; Wutz, Markus, Erding, *21.03.1976.",
        "gesellschafter": null,
        "inhaber": null,
        "name": "MAZARS GmbH Wirtschaftsprüfungsgesellschaft",
        "notice_id": "143752",
        "posted_on": "2009-08-17",
        "rechtsform": null,
        "sitz": null,
        "url": "https://www.handelsregisterbekanntmachungen.de/en/skripte/hrb.php?rb_id=143752&land_abk=he"
    },
    "parsed": {
        "addresses": [
            {
                "kls": "Address",
                "text": "Rennbahnstr 72, 60528 Frankfurt am Main"
            }
        ],
        "officers": [
            {
                "class": "ProcurationCancelled",
                "payload": {
                    "city": "Gensingen",
                    "dismissed": true,
                    "dob": "1969-12-02",
                    "lastname": "App",
                    "name": "Jürgen"
                },
                "text": " App, Jürgen, Gensingen, *02.12.1969"
            },
            {
                "class": "ProcurationCancelled",
                "payload": {
                    "city": "Wiesbaden",
                    "dismissed": true,
                    "dob": "1967-03-24",
                    "lastname": "Baumgartner",
                    "name": "Hubert"
                },
                "text": " Baumgartner, Hubert, Wiesbaden, *24.03.1967"
            },
            {
                "class": "ProcurationCancelled",
                "payload": {
                    "city": "Mettmann",
                    "dismissed": true,
                    "dob": "1966-09-08",
                    "lastname": "Crombach",
                    "name": "Ulrich"
                },
                "text": " Crombach, Ulrich, Mettmann, *08.09.1966"
            },
            {
                "class": "ProcurationCancelled",
                "payload": {
                    "city": "Düsseldorf",
                    "dismissed": true,
                    "dob": "1977-08-20",
                    "lastname": "Debrun",
                    "name": "Christof"
                },
                "text": " Debrun, Christof, Düsseldorf, *20.08.1977"
            },
            {
                "class": "ProcurationCancelled",
                "payload": {
                    "city": "Bad Homburg",
                    "dismissed": true,
                    "dob": "1968-09-19",
                    "lastname": "Dreher",
                    "name": "Ekhard"
                },
                "text": " Dreher, Ekhard, Bad Homburg, *19.09.1968"
            },
            {
                "class": "ProcurationCancelled",
                "payload": {
                    "city": "Unterhaching",
                    "dismissed": true,
                    "dob": "1973-02-24",
                    "lastname": "Günther",
                    "name": "Kathrin"
                },
                "text": " Günther, Kathrin, Unterhaching, *24.02.1973"
            },
            {
                "class": "ProcurationCancelled",
                "payload": {
                    "city": "Frankfurt am Main",
                    "dismissed": true,
                    "dob": "1968-06-24",
                    "lastname": "Nicolay",
                    "name": "Matthias"
                },
                "text": " Nicolay, Matthias, Frankfurt am Main, *24.06.1968"
            },
            {
                "class": "ProcurationCancelled",
                "payload": {
                    "city": "Hanau",
                    "dismissed": true,
                    "dob": "1971-03-08",
                    "lastname": "Schimpfermann",
                    "name": "Sascha"
                },
                "text": " Schimpfermann, Sascha, Hanau, *08.03.1971"
            },
            {
                "class": "ProcurationCancelled",
                "payload": {
                    "city": "Düsseldorf",
                    "dismissed": true,
                    "dob": "1976-08-04",
                    "lastname": "Thees",
                    "name": "Alexander"
                },
                "text": " Thees, Alexander, Düsseldorf, *04.08.1976"
            },
            {
                "class": "ProcurationCancelled",
                "payload": {
                    "city": "Erding",
                    "dismissed": true,
                    "dob": "1976-03-21",
                    "lastname": "Wutz",
                    "name": "Markus"
                },
                "text": " Wutz, Markus, Erding, *21.03.1976."
            }
        ]
    }
}