{
    "orig": {
        "aktenzeichen": "HRA 4125",
        "amtsgericht": "Steinfurt",
        "event_date": "2006-07-12",
        "event_type": "Veränderungen",
        "federal_state": "nw",
        "full_text": "Amtsgericht Steinfurt Aktenzeichen: HRA 4125 \nBekannt gemacht am: 15.07.2006 10:22 Uhr\n\n\n\n\nDie in () gesetzten Angaben der Geschäftsanschrift und des Unternehmensgegenstandes erfolgen ohne Gewähr.\nVeränderungen\n12.07.2006\n\nSonnen-Apotheke, Inhaber Rüdiger Stüven, Mettingen (Rathausplatz 6, 49497 Mettingen, Nach Firmenänderung Sonnen-Apotheke, Inhaberin Silke Lohnes e.K. Nunmehr Inhaber: Lohnes, Silke, Osnabrück, *26.06.1969. Nicht mehr Inhaber: Stüven, Rüdiger, Mettingen, *17.06.1957. Der Übergang der in dem Betriebe des Geschäfts entstandenen Verbindlichkeiten ist beim Erwerb des Geschäfts durch den neuen Inhaber ausgeschlossen.",
        "gesellschafter": null,
        "inhaber": null,
        "name": "Sonnen-Apotheke",
        "notice_id": "144068",
        "posted_on": "2006-07-15",
        "rechtsform": null,
        "sitz": null,
        "url": "https://www.handelsregisterbekanntmachungen.de/en/skripte/hrb.php?rb_id=144068&land_abk=nw"
    },
    "parsed": {
        "officers": [
            {
                "class": "Owner",
                "payload": {
                    "city": "Osnabrück",
                    "dob": "1969-06-26",
                    "lastname": "Lohnes",
                    "name": "Silke"
                },
                "text": " Lohnes, Silke, Osnabrück, *26.06.1969."
            },
            {
                "class": "NotLongerOwner",
                "payload": {
                    "city": "Mettingen",
                    "dismissed": true,
                    "dob": "1957-06-17",
                    "lastname": "Stüven",
                    "name": "Rüdiger"
                },
                "text": " Stüven, Rüdiger, Mettingen, *17.06.1957."
            }
        ]
    }
}