{
    "orig": {
        "aktenzeichen": "HRB 13020",
        "amtsgericht": "Kleve",
        "event_date": "2017-09-12",
        "event_type": "Veränderungen",
        "federal_state": "nw",
        "full_text": "Amtsgericht Kleve Aktenzeichen: HRB 13020 \nBekannt gemacht am: 12.09.2017 20:03 Uhr\n\n\n\n\nIn () gesetzte Angaben der Anschrift und des Geschäftszweiges erfolgen ohne Gewähr.\nVeränderungen\n12.09.2017\n\nHRB 13020: I M K Immobilien Management Kliese UG (haftungsbeschränkt), Geldern, Venloer Straße 135, 47608 Geldern. Die Gesellschaft ist aufgelöst. Ist nur ein Liquidator bestellt, so vertritt er die Gesellschaft allein. Sind mehrere Liquidatoren bestellt, so wird die Gesellschaft durch zwei Liquidatoren gemeinsam vertreten. Geändert; nunmehr bestellt als Liquidator: Kliese, Kyra Sabine, Geldern, *14.01.1967. Die Gesellschaft ist aufgelöst.",
        "gesellschafter": null,
        "inhaber": null,
        "name": "HRB 13020: I M K Immobilien Management Kliese UG (haftungsbeschränkt)",
        "notice_id": "1451961",
        "posted_on": "2017-09-12",
        "rechtsform": null,
        "sitz": null,
        "url": "https://www.handelsregisterbekanntmachungen.de/en/skripte/hrb.php?rb_id=1451961&land_abk=nw"
    },
    "parsed": {
        "flags": [
            {
                "flag": "ignore_for_now",
                "text": "Die\\ Gesellschaft\\ ist\\ aufgel\\öst\\."
            },
            {
                "flag": "ignore_for_now",
                "text": "Die\\ Gesellschaft\\ ist\\ aufgel\\öst\\."
            }
        ],
        "officers": [
            {
                "class": "Liquidator",
                "payload": {
                    "city": "Geldern",
                    "dob": "1967-01-14",
                    "lastname": "Kliese",
                    "name": "Kyra Sabine"
                },
                "text": " Kliese, Kyra Sabine, Geldern, *14.01.1967."
            }
        ]
    }
}