{
    "orig": {
        "aktenzeichen": "HRA 5069",
        "amtsgericht": "Recklinghausen",
        "event_date": "2017-10-10",
        "event_type": "Neueintragungen",
        "federal_state": "nw",
        "full_text": "Amtsgericht Recklinghausen Aktenzeichen: HRA 5069 \nBekannt gemacht am: 10.10.2017 20:02 Uhr\n\n\n\n\nIn () gesetzte Angaben der Anschrift und des Geschäftszweiges erfolgen ohne Gewähr.\nNeueintragungen\n10.10.2017\n\nHRA 5069: Neuhaus & Ritzi OHG, Recklinghausen, Kaiserwall 19, 45657 Recklinghausen. (Telefonmarketing und vertriebsunterstützende Maßnahmen). Offene Handelsgesellschaft. Geschäftsanschrift: Kaiserwall 19, 45657 Recklinghausen. Jeder persönlich haftende Gesellschafter vertritt einzeln. Persönlich haftender Gesellschafter: Neuhaus, Claudia, Waltrop, *29.11.1978; Ritzi, Wolfgang Adolf, Recklinghausen, *22.08.1969, jeweils mit der Befugnis im Namen der Gesellschaft mit sich im eigenen Namen oder als Vertreter eines Dritten Rechtsgeschäfte abzuschließen.",
        "gesellschafter": null,
        "inhaber": null,
        "name": "HRA 5069: Neuhaus & Ritzi OHG",
        "notice_id": "1460554",
        "posted_on": "2017-10-10",
        "rechtsform": null,
        "sitz": null,
        "url": "https://www.handelsregisterbekanntmachungen.de/en/skripte/hrb.php?rb_id=1460554&land_abk=nw"
    },
    "parsed": {
        "labels": [
            {
                "label": "address",
                "text": " Kaiserwall 19, 45657 Recklinghausen."
            }
        ],
        "officers": [
            {
                "class": "PersonalPartner",
                "payload": {
                    "city": "Waltrop",
                    "dob": "1978-11-29",
                    "lastname": "Neuhaus",
                    "name": "Claudia"
                },
                "text": " Neuhaus, Claudia, Waltrop, *29.11.1978"
            }
        ]
    }
}