{
    "orig": {
        "aktenzeichen": "HRB 50291",
        "amtsgericht": "Düsseldorf",
        "event_date": "2017-11-09",
        "event_type": "Veränderungen",
        "federal_state": "nw",
        "full_text": "Amtsgericht Düsseldorf Aktenzeichen: HRB 50291 \nBekannt gemacht am: 09.11.2017 20:00 Uhr\n\n\n\n\nIn () gesetzte Angaben der Anschrift und des Geschäftszweiges erfolgen ohne Gewähr.\nVeränderungen\n09.11.2017\n\nHRB 50291: MMS Germany Holdings GmbH, Düsseldorf, Toulouser Allee 1, 40211 Düsseldorf. Nicht mehr Geschäftsführer: Cyrkel, Hartmut, Düsseldorf, *30.09.1968. Bestellt als Geschäftsführer: Nobels, Arco, Vijfhuizen / Niederlande, *14.11.1970; Ziegelbauer, Thomas, Bonn, *13.07.1965, jeweils mit der Befugnis im Namen der Gesellschaft mit sich im eigenen Namen oder als Vertreter eines Dritten Rechtsgeschäfte abzuschließen.",
        "gesellschafter": null,
        "inhaber": null,
        "name": "HRB 50291: MMS Germany Holdings GmbH",
        "notice_id": "1469596",
        "posted_on": "2017-11-09",
        "rechtsform": null,
        "sitz": null,
        "url": "https://www.handelsregisterbekanntmachungen.de/en/skripte/hrb.php?rb_id=1469596&land_abk=nw"
    },
    "parsed": {
        "officers": [
            {
                "class": "DismissedManagingDirector",
                "payload": {
                    "city": "Düsseldorf",
                    "dismissed": true,
                    "dob": "1968-09-30",
                    "lastname": "Cyrkel",
                    "name": "Hartmut"
                },
                "text": " Cyrkel, Hartmut, Düsseldorf, *30.09.1968."
            },
            {
                "class": "AppointedManagingDirector",
                "payload": {
                    "city": "Vijfhuizen / Niederlande",
                    "dob": "1970-11-14",
                    "lastname": "Nobels",
                    "name": "Arco"
                },
                "text": " Nobels, Arco, Vijfhuizen / Niederlande, *14.11.1970"
            }
        ]
    }
}