{
    "orig": {
        "aktenzeichen": "HRB 1132 KI",
        "amtsgericht": "Kiel",
        "event_date": "2014-02-20",
        "event_type": "Veränderungen",
        "federal_state": "sh",
        "full_text": "Amtsgericht Kiel Aktenzeichen: HRB 1132 KI \nBekannt gemacht am: 25.02.2014 15:10 Uhr\n\n\n\n\nIn () gesetzte Angaben der Anschrift und des Unternehmensgegenstandes erfolgen ohne Gewähr:\nVeränderungen\n20.02.2014\n\nHRB 1132 KI: KFM Kabel-und Fernmelde-Montage- Gesellschaft mbH, Schwentinental, Mühlenkoppel 6, 24222 Schwentinental. Sitz der Firma: Sitz/Niederlassung: Schwentinental; Kapital: 260.000 EUR; Vertretungsregelung: Die Gesellschaft hat einen oder mehrere Geschäftsführer.\nJeder Geschäftsführer vertritt die Gesellschaft allein.\nDie Geschäftsführerin Inga Nowak darf Rechtsgeschäfte mit sich selbst oder als Vertreter Dritter abschließen. Vorstand: Änderung zu Nr. 1: Geschäftsführer: Nowak, Inga, *07.04.1966, Schwentinental; Änderung zu Nr. 2: Geschäftsführer: Schulz, Markus; Rechtsform: Durch Beschluss der Gesellschafterversammlung vom 12.02.2014 ist das Stammkapital auf 255.645,94 EUR umgestellt, sodann auf 260.000 EUR erhöht und der Gesellschaftsvertrag insgesamt neu gefasst und im Zuge dessen geändert hinsichtlich Sitz, Stammkapital und allgemeiner Vertretungsregelung.",
        "gesellschafter": null,
        "inhaber": null,
        "name": "Die Geschäftsführerin Inga Nowak darf Rechtsgeschäfte mit sich selbst oder als Vertreter Dritter abschließen. Vorstand: Änderung zu Nr. 1: Geschäftsführer: Nowak",
        "notice_id": "147315",
        "posted_on": "2014-02-25",
        "rechtsform": null,
        "sitz": null,
        "url": "https://www.handelsregisterbekanntmachungen.de/en/skripte/hrb.php?rb_id=147315&land_abk=sh"
    },
    "parsed": {
        "officers": [
            {
                "class": "ManagingDirector",
                "payload": {
                    "city": "Schwentinental",
                    "dob": "1966-07-04",
                    "lastname": "Nowak",
                    "name": "Inga"
                },
                "text": " Nowak, Inga, *07.04.1966, Schwentinental"
            },
            {
                "class": "ManagingDirector",
                "payload": {
                    "lastname": "Schulz",
                    "name": "Markus"
                },
                "text": " Schulz, Markus"
            }
        ]
    }
}