{
    "orig": {
        "aktenzeichen": "HRB 70237",
        "amtsgericht": "Köln",
        "event_date": "2017-11-29",
        "event_type": "Veränderungen",
        "federal_state": "nw",
        "full_text": "Amtsgericht Köln Aktenzeichen: HRB 70237 \nBekannt gemacht am: 29.11.2017 20:01 Uhr\n\n\n\n\nIn () gesetzte Angaben der Anschrift und des Geschäftszweiges erfolgen ohne Gewähr.\nVeränderungen\n29.11.2017\n\nHRB 70237: ELSTA GmbH, Köln, Rösrather Straße 19, 51107 Köln. Prokura erloschen: Gutsche, Gisela Anneliese, Pulheim, *05.02.1953. Zwischen der Gesellschaft als beherrschter Gesellschaft und der Arcon Personalservice GmbH mit Sitz in Köln (Amtsgericht Köln HRB 91919) besteht ein Gewinnabführungsvertrag vom 22.11.2017. Diesem Vertrag hat die Gesellschafterversammlung der Gesellschaft durch Beschluss vom 22.11.2017 zugestimmt. Der infolge Abspaltung zuletzt mit der Arcon Arbeitnehmerüberlassung und Constructions GmbH & Co. KG, Köln (Amtsgericht Köln, HRA 15747) bestehende Beherrschungs- und Gewinnabführungsvertrag vom 27.10.2010 ist durch Kündigung vom 20.06.2016 zum 31.12.2016 beendet. Als nicht eingetragen wird bekannt gemacht: Den Gläubigern der Gesellschaft, deren Forderungen begründet worden sind, bevor die Eintragung der Beendigung des Vertrages in das Handelsregister nach § 10 HGB als bekanntgemacht gilt, ist vom anderen Vertragsteil Sicherheit zu leisten, wenn sie sich binnen sechs Monaten nach der Bekanntmachung zu diesem Zweck bei ihm melden.",
        "gesellschafter": null,
        "inhaber": null,
        "name": "HRB 70237: ELSTA GmbH",
        "notice_id": "1476370",
        "posted_on": "2017-11-29",
        "rechtsform": null,
        "sitz": null,
        "url": "https://www.handelsregisterbekanntmachungen.de/en/skripte/hrb.php?rb_id=1476370&land_abk=nw"
    },
    "parsed": {
        "officers": [
            {
                "class": "ProcurationCancelled",
                "payload": {
                    "city": "Pulheim",
                    "dismissed": true,
                    "dob": "1953-05-02",
                    "lastname": "Gutsche",
                    "name": "Gisela Anneliese"
                },
                "text": " Gutsche, Gisela Anneliese, Pulheim, *05.02.1953."
            }
        ]
    }
}