{
    "orig": {
        "aktenzeichen": "HRA 6017",
        "amtsgericht": "Siegen",
        "event_date": "2018-01-02",
        "event_type": "Veränderungen",
        "federal_state": "nw",
        "full_text": "Amtsgericht Siegen Aktenzeichen: HRA 6017 \nBekannt gemacht am: 02.01.2018 20:01 Uhr\n\n\n\n\nIn () gesetzte Angaben der Anschrift und des Geschäftszweiges erfolgen ohne Gewähr.\nVeränderungen\n02.01.2018\n\nHRA 6017: Fleischerei Nöll GmbH & Co. KG, Kreuztal-Buschhütten, Siegener Straße 107, 57223 Kreuztal. Die Liquidatoren vertreten gemeinsam. Nicht mehr vertretungsberechtigt, weiterhin Persönlich haftender Gesellschafter: Fleischerei Nöll Verwaltungs-GmbH, Sitz: Kreuztal-Buschhütten (AG Siegen HR B 4541). Eingetreten als Liquidator: Nöll, Heiner, Kreuztal, *03.07.1964, einzelvertretungsberechtigt. Die Gesellschaft ist aufgelöst.",
        "gesellschafter": null,
        "inhaber": null,
        "name": "HRA 6017: Fleischerei Nöll GmbH & Co. KG",
        "notice_id": "1488018",
        "posted_on": "2018-01-02",
        "rechtsform": null,
        "sitz": null,
        "url": "https://www.handelsregisterbekanntmachungen.de/en/skripte/hrb.php?rb_id=1488018&land_abk=nw"
    },
    "parsed": {
        "flags": [
            {
                "flag": "CompanyClosed",
                "text": "Die\\ Gesellschaft\\ ist\\ aufgel\\öst\\."
            }
        ],
        "officers": [
            {
                "class": "PersonalPartner",
                "payload": {
                    "lastname": "Fleischerei Nöll Verwaltungs-GmbH",
                    "name": "Sitz: Kreuztal-Buschhütten (AG Siegen HR B 4541)"
                },
                "text": " Fleischerei Nöll Verwaltungs-GmbH, Sitz: Kreuztal-Buschhütten (AG Siegen HR B 4541)."
            },
            {
                "class": "Liquidator",
                "payload": {
                    "city": "Kreuztal",
                    "dob": "1964-03-07",
                    "flag": "sole representation",
                    "lastname": "Nöll",
                    "name": "Heiner"
                },
                "text": " Nöll, Heiner, Kreuztal, *03.07.1964, einzelvertretungsberechtigt."
            }
        ]
    }
}