{
    "orig": {
        "aktenzeichen": "HRB 77251 B",
        "amtsgericht": "Charlottenburg (Berlin)",
        "event_date": "2006-05-17",
        "event_type": "Veränderungen",
        "federal_state": "be",
        "full_text": "Amtsgericht Charlottenburg (Berlin) Aktenzeichen: HRB 77251 B  \nBekannt gemacht am: 19.05.2006 07:56 Uhr\n\n\n\n\nFür die Angaben in (), die den Unternehmensgegenstand und die Anschrift betreffen, keine Gewähr. In das Handelsregister ist folgendes eingetragen worden.\nVeränderungen\n17.05.2006\n\nBBD Verkehrsconsult GmbH, Berlin(Hubertusallee 28, 14193  Berlin). Vertretungsregelung: Ist ein Liquidator bestellt, vertritt er die Gesellschaft allein. Sind mehrere Liquidatoren bestellt, wird die Gesellschaft durch sämtliche Liquidatoren vertreten. Nicht mehr Geschäftsführer:; 1. Feicht, Andreas; Liquidator:; Fresch, Axel, *13.09.1956, Hamburg Rechtsverhaeltnis: Durch Beschluss der Gesellschafterversammlung vom 13.04.2006 ist die Gesellschaft aufgelöst..",
        "gesellschafter": null,
        "inhaber": null,
        "name": "BBD Verkehrsconsult GmbH",
        "notice_id": "15265",
        "posted_on": "2006-05-19",
        "rechtsform": null,
        "sitz": null,
        "url": "https://www.handelsregisterbekanntmachungen.de/en/skripte/hrb.php?rb_id=15265&land_abk=be"
    },
    "parsed": {
        "officers": [
            {
                "class": "DismissedManagingDirector",
                "payload": {
                    "dismissed": true,
                    "lastname": "Feicht",
                    "name": "Andreas",
                    "ref": 1
                },
                "text": "1) Feicht, Andreas"
            },
            {
                "class": "Liquidator",
                "payload": {
                    "city": "Hamburg Rechtsverhaeltnis: Durch Beschluss der Gesellschafterversammlung vom 13.04.2006 ist die Gesellschaft aufgelöst",
                    "dob": "1956-09-13",
                    "lastname": "Fresch",
                    "name": "Axel"
                },
                "text": " Fresch, Axel, *13.09.1956, Hamburg Rechtsverhaeltnis: Durch Beschluss der Gesellschafterversammlung vom 13.04.2006 ist die Gesellschaft aufgelöst.."
            }
        ]
    }
}