{
    "orig": {
        "aktenzeichen": "HRB 28895",
        "amtsgericht": "Duisburg",
        "event_date": "2018-04-11",
        "event_type": "Veränderungen",
        "federal_state": "nw",
        "full_text": "Amtsgericht Duisburg Aktenzeichen: HRB 28895 \nBekannt gemacht am: 11.04.2018 20:02 Uhr\n\n\n\n\nIn () gesetzte Angaben der Anschrift und des Geschäftszweiges erfolgen ohne Gewähr.\nVeränderungen\n11.04.2018\n\nHRB 28895: die-da UG (haftungsbeschränkt), Duisburg, Kaiser-Friedrich-Str. 31, 47169 Duisburg. Nicht mehr Geschäftsführer: Baron-Schneider, Denis, Essen, *12.05.1980; Matuszewski, Lukas, Essen, *30.11.1980. Bestellt als Geschäftsführer: Baron, Alex, Essen, *11.05.1985; Istrati, Viorel, Duisburg, *21.02.1976, jeweils einzelvertretungsberechtigt mit der Befugnis im Namen der Gesellschaft mit sich im eigenen Namen oder als Vertreter eines Dritten Rechtsgeschäfte abzuschließen.",
        "gesellschafter": null,
        "inhaber": null,
        "name": "HRB 28895: die-da UG (haftungsbeschränkt)",
        "notice_id": "1526407",
        "posted_on": "2018-04-11",
        "rechtsform": null,
        "sitz": null,
        "url": "https://www.handelsregisterbekanntmachungen.de/en/skripte/hrb.php?rb_id=1526407&land_abk=nw"
    },
    "parsed": {
        "officers": [
            {
                "class": "DismissedManagingDirector",
                "payload": {
                    "city": "Essen",
                    "dismissed": true,
                    "dob": "1980-12-05",
                    "lastname": "Baron-Schneider",
                    "name": "Denis"
                },
                "text": " Baron-Schneider, Denis, Essen, *12.05.1980"
            },
            {
                "class": "AppointedManagingDirector",
                "payload": {
                    "city": "Essen",
                    "dob": "1985-11-05",
                    "lastname": "Baron",
                    "name": "Alex"
                },
                "text": " Baron, Alex, Essen, *11.05.1985"
            }
        ]
    }
}