{
    "orig": {
        "aktenzeichen": "HRA 9801",
        "amtsgericht": "Augsburg",
        "event_date": "2007-03-14",
        "event_type": "Veränderungen",
        "federal_state": "by",
        "full_text": "Amtsgericht Augsburg Aktenzeichen: HRA 9801 \nBekannt gemacht am: 20.03.2007 07:13 Uhr\n\n\n\n\nDie in ( ) gesetzten Angaben der Geschäftsanschrift und des Geschäftszweiges erfolgen ohne Gewähr.\nVeränderungen\n14.03.2007\n\nFridolin Fluhr e. K., Fischach (Buschelbergstraße 4, 86850 Fischach, Entwicklung, Herstellung und Vertrieb von Draht- und Metallwaren, insbesondere von Verkaufs- und Präsentationsdisplays). Firma geändert, nun: Fluhr Displays e.K. Personendaten (Wohnort) geändert, nun: Inhaber: Fluhr, Gottfried M., Biburg, *24.11.1966. Je Einzelprokura: Mayr, Isolde, Walkertshofen, *11.09.1960; Schleicher, Peter, Augsburg, *20.04.1963; Stöckle, Jürgen, Zusmarshausen, *20.05.1965. Die F. Fluhr Draht- u. Metallwarenfabrik GmbH mit dem Sitz in Fischach (Amtsgericht Augsburg HRB 7310 ) ist aufgrund Verschmelzungsvertrags- und -beschlusses vom 27.02.2007 mit dem Vermögen ihres Alleingesellschafters Fluhr Gottfried M. verschmolzen. Nicht eingetragen: Den Gläubigern der an der Verschmelzung beteiligten Rechtsträger ist, wenn sie binnen sechs Monaten nach dem Tag, an dem die Eintragung der Verschmelzung in das Register des Sitzes desjenigen Rechtsträgers, dessen Gläubiger sie sind, nach § 19 Abs. 3 UmwG bekannt gemacht worden ist, ihren Anspruch nach Grund und Höhe schriftlich anmelden, Sicherheit zu leisten, soweit sie nicht Befriedigung verlangen können. Dieses Recht steht ihnen jedoch nur zu, wenn sie glaubhaft machen, dass durch die Verschmelzung die Erfüllung ihrer Forderung gefährdet wird.",
        "gesellschafter": null,
        "inhaber": null,
        "name": "Fridolin Fluhr e. K.",
        "notice_id": "155528",
        "posted_on": "2007-03-20",
        "rechtsform": null,
        "sitz": null,
        "url": "https://www.handelsregisterbekanntmachungen.de/en/skripte/hrb.php?rb_id=155528&land_abk=by"
    },
    "parsed": {
        "officers": [
            {
                "class": "Owner",
                "payload": {
                    "city": "Biburg",
                    "dob": "1966-11-24",
                    "lastname": "Fluhr",
                    "name": "Gottfried M"
                },
                "text": " Fluhr, Gottfried M., Biburg, *24.11.1966."
            },
            {
                "class": "SingleProcuration",
                "payload": {
                    "city": "Walkertshofen",
                    "dob": "1960-11-09",
                    "lastname": "Mayr",
                    "name": "Isolde"
                },
                "text": " Mayr, Isolde, Walkertshofen, *11.09.1960"
            }
        ]
    }
}