{
    "orig": {
        "aktenzeichen": "HRB 90509 B",
        "amtsgericht": "Charlottenburg (Berlin)",
        "event_date": "2011-01-31",
        "event_type": "Veränderungen",
        "federal_state": "be",
        "full_text": "Amtsgericht Charlottenburg (Berlin) Aktenzeichen: HRB 90509 B \nBekannt gemacht am: 02.02.2011 12:00 Uhr\n\n\n\n\nIn () gesetzte Angaben der Anschrift und des Geschäftszweiges erfolgen ohne Gewähr.\nVeränderungen\n31.01.2011\n\nSOLUTION Sonnenstudio Betriebsgesellschaft mbH, Berlin, Halemweg 17-19, 13627 Berlin. Vertretungsregelung: Ist ein Liquidator bestellt, so vertritt er die Gesellschaft allein. Sind mehrere Liquidatoren bestellt, vertreten sie die Gesellschaft gemeinsam . Änderung zu Nr. 2:; Liquidator:; Wenkheimer, Sven, *15.12.1972, Berlin Rechtsverhaeltnis: Durch Beschluss der Gesellschafterversammlung vom 17.01.2011 ist die Gesellschaft aufgelöst..",
        "gesellschafter": null,
        "inhaber": null,
        "name": "SOLUTION Sonnenstudio Betriebsgesellschaft mbH",
        "notice_id": "157435",
        "posted_on": "2011-02-02",
        "rechtsform": null,
        "sitz": null,
        "url": "https://www.handelsregisterbekanntmachungen.de/en/skripte/hrb.php?rb_id=157435&land_abk=be"
    },
    "parsed": {
        "officers": [
            {
                "class": "Liquidator",
                "payload": {
                    "city": "Berlin Rechtsverhaeltnis: Durch Beschluss der Gesellschafterversammlung vom 17.01.2011 ist die Gesellschaft aufgelöst",
                    "dob": "1972-12-15",
                    "lastname": "Wenkheimer",
                    "name": "Sven"
                },
                "text": " Wenkheimer, Sven, *15.12.1972, Berlin Rechtsverhaeltnis: Durch Beschluss der Gesellschafterversammlung vom 17.01.2011 ist die Gesellschaft aufgelöst.."
            }
        ]
    }
}