{
    "orig": {
        "aktenzeichen": "HRB 3628 HL",
        "amtsgericht": "Lübeck",
        "event_date": "2015-01-07",
        "event_type": "Veränderungen",
        "federal_state": "sh",
        "full_text": "Amtsgericht Lübeck Aktenzeichen: HRB 3628 HL \nBekannt gemacht am: 07.01.2015 10:33 Uhr\n\n\n\n\nIn () gesetzte Angaben der Anschrift und des Unternehmensgegenstandes erfolgen ohne Gewähr:\nVeränderungen\n07.01.2015\n\nHRB 3628 HL: Bojens Truck- und Trailerservice GmbH, Lübeck, Spenglerstr. 33, 23556 Lübeck. Vorstand: Nicht mehr Geschäftsführer: 1. Bojens, Holger; Nicht mehr Geschäftsführer: 2. Bojens, Hannelore; Geschäftsführer: 3.\nBojens, Florian, *06.05.1980, Lübeck; mit der Befugnis die Gesellschaft allein zu vertreten\nmit der Befugnis Rechtsgeschäfte als Vertreter Dritter abzuschließen; Geschäftsführer: 4.\nLütgens, Marcus, *19.07.1976, Offenbach a.M. mit der Befugnis die Gesellschaft allein zu vertreten\nmit der Befugnis Rechtsgeschäfte als Vertreter Dritter abzuschließen",
        "gesellschafter": null,
        "inhaber": null,
        "name": "mit der Befugnis Rechtsgeschäfte als Vertreter Dritter abzuschließen",
        "notice_id": "162745",
        "posted_on": "2015-01-07",
        "rechtsform": null,
        "sitz": null,
        "url": "https://www.handelsregisterbekanntmachungen.de/en/skripte/hrb.php?rb_id=162745&land_abk=sh"
    },
    "parsed": {
        "flags": [
            {
                "flag": "with the power to represent the company alone",
                "text": "mit\\ der\\ Befugnis\\ die\\ Gesellschaft\\ allein\\ zu\\ vertreten"
            },
            {
                "flag": "with the power to represent the company alone",
                "text": "mit\\ der\\ Befugnis\\ die\\ Gesellschaft\\ allein\\ zu\\ vertreten"
            }
        ],
        "officers": [
            {
                "class": "DismissedManagingDirector",
                "payload": {
                    "dismissed": true,
                    "lastname": "Bojens",
                    "name": "Holger"
                },
                "text": " Bojens, Holger"
            },
            {
                "class": "DismissedManagingDirector",
                "payload": {
                    "dismissed": true,
                    "lastname": "Bojens",
                    "name": "Hannelore"
                },
                "text": " Bojens, Hannelore"
            },
            {
                "class": "ManagingDirector",
                "payload": {
                    "city": "Lübeck",
                    "dob": "1980-06-05",
                    "lastname": "Bojens",
                    "name": "Florian"
                },
                "text": " Bojens, Florian, *06.05.1980, Lübeck"
            },
            {
                "class": "ManagingDirector",
                "payload": {
                    "city": "Offenbach a.M",
                    "dob": "1976-07-19",
                    "lastname": "Lütgens",
                    "name": "Marcus"
                },
                "text": " Lütgens, Marcus, *19.07.1976, Offenbach a.M."
            }
        ]
    }
}