{
    "orig": {
        "aktenzeichen": "HRB 15559",
        "amtsgericht": "Koblenz",
        "event_date": "2014-07-24",
        "event_type": "Veränderungen",
        "federal_state": "rp",
        "full_text": "Amtsgericht Koblenz Aktenzeichen: HRB 15559 \nBekannt gemacht am: 24.07.2014 20:06 Uhr\n\n\n\n\nDie in () gesetzten Angaben der Geschäftsanschrift und des Unternehmensgegenstandes erfolgen ohne Gewähr.\nVeränderungen\n24.07.2014\n\nHRB 15559:Solarstrom Ahrweiler GmbH, Bad Neuenahr-Ahrweiler, Wilhelmstraße 24-30, 53474 Bad Neuenahr-Ahrweiler.Rötung lfd. Nr. 1 Spalte 4 von Amts wegen nachgeholt Geschäftsführer: Wiemer, Herbert, Bad Neuenahr-Ahrweiler, *09.10.1966. Prokura erloschen: Nisius, Guido, Wiesemscheid, *25.01.1967. Einzelprokura mit der Befugnis im Namen der Gesellschaft mit sich im eigenen Namen oder als Vertreter eines Dritten Rechtsgeschäfte abzuschließen: Birkenbeil, Michael, Neuwied, *02.03.1970.",
        "gesellschafter": null,
        "inhaber": null,
        "name": "HRB 15559:Solarstrom Ahrweiler GmbH",
        "notice_id": "163553",
        "posted_on": "2014-07-24",
        "rechtsform": null,
        "sitz": null,
        "url": "https://www.handelsregisterbekanntmachungen.de/en/skripte/hrb.php?rb_id=163553&land_abk=rp"
    },
    "parsed": {
        "officers": [
            {
                "class": "ManagingDirector",
                "payload": {
                    "city": "Bad Neuenahr-Ahrweiler",
                    "dob": "1966-09-10",
                    "lastname": "Wiemer",
                    "name": "Herbert"
                },
                "text": " Wiemer, Herbert, Bad Neuenahr-Ahrweiler, *09.10.1966."
            },
            {
                "class": "ProcurationCancelled",
                "payload": {
                    "city": "Wiesemscheid",
                    "dismissed": true,
                    "dob": "1967-01-25",
                    "lastname": "Nisius",
                    "name": "Guido"
                },
                "text": " Nisius, Guido, Wiesemscheid, *25.01.1967."
            },
            {
                "class": "SingleProcuration",
                "payload": {
                    "city": "Neuwied",
                    "dob": "1970-02-03",
                    "lastname": "Birkenbeil",
                    "name": "Michael"
                },
                "text": " Birkenbeil, Michael, Neuwied, *02.03.1970."
            }
        ]
    }
}