{
    "orig": {
        "aktenzeichen": "HRB 1078",
        "amtsgericht": "Bad Homburg",
        "event_date": "2010-01-19",
        "event_type": "Veränderungen",
        "federal_state": "he",
        "full_text": "Amtsgericht Bad Homburg Aktenzeichen: HRB 1078 \nBekannt gemacht am: 22.01.2010 12:00 Uhr\n\n\n\n\nVeröffentlichungen des Amtsgerichts Bad Homburg v.d. Höhe\r\r\rIn () gesetzte Angaben der Anschrift und des Geschäftszweiges erfolgen ohne Gewähr.\nVeränderungen\n19.01.2010\n\nUnterstützungskasse Gesellschaft mit beschränkter Haftung der MILUPA Aktiengesellschaft, Friedrichsdorf, Bahnstraße 14-30, 61381 Friedrichsdorf.Ist nur ein Liquidator bestellt, so vertritt er die Gesellschaft allein. Sind mehrere Liquidatoren bestellt, so wird die Gesellschaft durch zwei Liquidatoren gemeinsam vertreten. Bestellt als Liquidator: Luick-Nijboer, Susanne, Oberursel (Taunus), *10.08.1961; Marz, Vera, Bad Nauheim, *15.07.1949, jeweils vertretungsberechtigt gemeinsam mit einem anderen Liquidator. Nicht mehr Geschäftsführerin: Levointurier, Celine, Königstein im Taunus, *04.03.1972; Luick-Nijboer, Susanne, Oberursel (Taunus), *10.08.1961; Marz, Vera, Bad Nauheim, *15.07.1949. Prokura erloschen: Engelmann, Oswald, Bad Homburg v. d. Höhe, *17.03.1953. Die Gesellschaft ist aufgelöst.",
        "gesellschafter": null,
        "inhaber": null,
        "name": "Unterstützungskasse Gesellschaft mit beschränkter Haftung der MILUPA Aktiengesellschaft",
        "notice_id": "165848",
        "posted_on": "2010-01-22",
        "rechtsform": null,
        "sitz": null,
        "url": "https://www.handelsregisterbekanntmachungen.de/en/skripte/hrb.php?rb_id=165848&land_abk=he"
    },
    "parsed": {
        "flags": [
            {
                "flag": "ignore_for_now",
                "text": "Die\\ Gesellschaft\\ ist\\ aufgel\\öst\\."
            }
        ],
        "officers": [
            {
                "class": "Liquidator",
                "payload": {
                    "city": "Oberursel (Taunus)",
                    "dob": "1961-10-08",
                    "lastname": "Luick-Nijboer",
                    "name": "Susanne"
                },
                "text": " Luick-Nijboer, Susanne, Oberursel (Taunus), *10.08.1961"
            },
            {
                "class": "DismissedManagingDirector",
                "payload": {
                    "city": "Königstein im Taunus",
                    "dismissed": true,
                    "dob": "1972-04-03",
                    "lastname": "Levointurier",
                    "name": "Celine"
                },
                "text": " Levointurier, Celine, Königstein im Taunus, *04.03.1972"
            },
            {
                "class": "ProcurationCancelled",
                "payload": {
                    "city": "Bad Homburg v. d. Höhe",
                    "dismissed": true,
                    "dob": "1953-03-17",
                    "lastname": "Engelmann",
                    "name": "Oswald"
                },
                "text": " Engelmann, Oswald, Bad Homburg v. d. Höhe, *17.03.1953."
            }
        ]
    }
}