{
    "orig": {
        "aktenzeichen": "HRB 21966",
        "amtsgericht": "Bad Kreuznach",
        "event_date": "2014-12-16",
        "event_type": "Neueintragungen",
        "federal_state": "rp",
        "full_text": "Amtsgericht Bad Kreuznach Aktenzeichen: HRB 21966 \nBekannt gemacht am: 16.12.2014 20:05 Uhr\n\n\n\n\nDie in () gesetzten Angaben der Anschrift und des Geschäftszweiges erfolgen ohne Gewähr.\nNeueintragungen\n16.12.2014\n\nHRB 21966:Vital- und Nährstoffcenter Sàrl, Bundenbach, Auf Heibenacker 28, 55626 Bundenbach.Société à responsabilité limitée (Gesellschaft mit beschränkter Haftung nach französischem Recht) Satzung vom 30.04.2014 Beginn: 03.06.2014. Geschäftsanschrift: Auf Heibenacker 28, 55626 Bundenbach. Zweigniederlassung der \"VITAL- UND NÄHRSTOFFCENTER SÀRL\" mit Sitz in Strasbourg / Frankreich (Registre de Commerce, Strasbourg R.C.S. Strasbourg TI 802 224 394 Verwaltungsnr. 2014 B 1147). Gegenstand: Einzelhandel, Vertrieb von abgepackten und eingeschweißten Nahrungsmittel sowie Kosmetika, Ernährungsberatung und Vermittlung von Personal. Stammkapital: 15.000,00 EUR. Allgemeine Vertretungsregelung: Jeder Geschäftsführer vertritt einzeln. Geschäftsführer: Grünagel, Achim Werner, Bundenbach, *10.06.1958.",
        "gesellschafter": null,
        "inhaber": null,
        "name": "HRB 21966:Vital- und Nährstoffcenter Sàrl",
        "notice_id": "171408",
        "posted_on": "2014-12-16",
        "rechtsform": null,
        "sitz": null,
        "url": "https://www.handelsregisterbekanntmachungen.de/en/skripte/hrb.php?rb_id=171408&land_abk=rp"
    },
    "parsed": {
        "labels": [
            {
                "label": "address",
                "text": " Auf Heibenacker 28, 55626 Bundenbach."
            }
        ],
        "officers": [
            {
                "class": "ManagingDirector",
                "payload": {
                    "city": "Bundenbach",
                    "dob": "1958-06-10",
                    "lastname": "Grünagel",
                    "name": "Achim Werner"
                },
                "text": " Grünagel, Achim Werner, Bundenbach, *10.06.1958."
            }
        ]
    }
}