{
    "orig": {
        "aktenzeichen": "HRB 30151",
        "amtsgericht": "Kaiserslautern",
        "event_date": "2015-01-30",
        "event_type": "Veränderungen",
        "federal_state": "rp",
        "full_text": "Amtsgericht Kaiserslautern Aktenzeichen: HRB 30151 \nBekannt gemacht am: 30.01.2015 20:05 Uhr\n\n\n\n\nDie in () gesetzten Angaben der Anschrift und des Geschäftszweiges erfolgen ohne Gewähr.\nVeränderungen\n30.01.2015\n\nHRB 30151:EUROMASTER Reifenservice Deutschland GmbH, Kaiserslautern, Mainzer Str. 81, 67657 Kaiserslautern.Nicht mehr Geschäftsführer: Chapot, Yves Claudius, Chamalièrs / Frankreich / Frankreich, *25.05.1962. Bestellt als Geschäftsführer: Pekle, Guy Yves, Cebazat / Frankreich, *30.09.1963, einzelvertretungsberechtigt mit der Befugnis, im Namen der Gesellschaft mit sich als Vertreter eines Dritten Rechtsgeschäfte abzuschließen.",
        "gesellschafter": null,
        "inhaber": null,
        "name": "HRB 30151:EUROMASTER Reifenservice Deutschland GmbH",
        "notice_id": "174637",
        "posted_on": "2015-01-30",
        "rechtsform": null,
        "sitz": null,
        "url": "https://www.handelsregisterbekanntmachungen.de/en/skripte/hrb.php?rb_id=174637&land_abk=rp"
    },
    "parsed": {
        "officers": [
            {
                "class": "DismissedManagingDirector",
                "payload": {
                    "city": "Chamalièrs / Frankreich / Frankreich",
                    "dismissed": true,
                    "dob": "1962-05-25",
                    "lastname": "Chapot",
                    "name": "Yves Claudius"
                },
                "text": " Chapot, Yves Claudius, Chamalièrs / Frankreich / Frankreich, *25.05.1962."
            },
            {
                "class": "AppointedManagingDirector",
                "payload": {
                    "city": "Cebazat / Frankreich",
                    "dob": "1963-09-30",
                    "flag": "einzelvertretungsberechtigt mit der Befugnis im Namen der Gesellschaft mit sich als Vertreter eines Dritten Rechtsgeschäfte abzuschließen",
                    "lastname": "Pekle",
                    "name": "Guy Yves"
                },
                "text": " Pekle, Guy Yves, Cebazat / Frankreich, *30.09.1963, einzelvertretungsberechtigt mit der Befugnis, im Namen der Gesellschaft mit sich als Vertreter eines Dritten Rechtsgeschäfte abzuschließen."
            }
        ]
    }
}