{
    "orig": {
        "aktenzeichen": "HRB 55933",
        "amtsgericht": "Frankfurt am Main",
        "event_date": "2010-04-23",
        "event_type": "Veränderungen",
        "federal_state": "he",
        "full_text": "Amtsgericht Frankfurt am Main Aktenzeichen: HRB 55933 \nBekannt gemacht am: 26.04.2010 12:00 Uhr\n\n\n\n\nVeröffentlichungen des Amtsgerichts Frankfurt am Main\r\r\rIn () gesetzte Angaben der Anschrift und des Geschäftszweiges erfolgen ohne Gewähr.\nVeränderungen\n23.04.2010\n\nT-Systems International GmbH, Frankfurt am Main, Hahnstraße 43 d, 60528 Frankfurt am Main.Prokura erloschen: Fauth, Gunter, Urbach, *13.05.1963; Dr. Hacke, Marcus, Kronberg im Taunus, *21.07.1967; Hoee, Michael, Markkleeberg, *02.06.1957; Dr. Hofmann, Klaus, Viersen, *03.01.1955; Jakob, Georg, Steinenbronn, *16.09.1966; Landua, Eckhard, Köngernheim, *28.11.1963; Mitternacht, Bernd, Hofheim am Taunus, *15.02.1961; Dr. Neurath, Richard, Troisdorf, *16.10.1953; Ott, Friedrich, Langenargen, *06.04.1948; Paletta, Matthias, Seeheim-Jugenheim, *12.09.1965; Prochazka, Gerhard, Kernen im Renstal, *26.01.1952; Reitter, Doris, Markdorf, *08.01.1956; Saxena, Sunita, Witten, *04.01.1965; Steinert, Thomas, Lampsheim, *14.01.1965; Dr. Werner, Rolf Markus, Bonn, *24.05.1971. Gesamtprokura gemeinsam mit einem Geschäftsführer oder einem anderen Prokuristen: Fliß, Georg, Eltville am Rhein, *18.06.1971; Gesing, Stefan, Swisttal, *20.01.1978; Hildebrandt, Walter, München, *04.07.1965; Hille, Holger, Dietzenbach, *30.10.1963; Ortlepp, Jan, Berlin, *29.07.1966; Pfaff, Alfred, Bodenheim, *20.08.1959; Schlaberg, Steffen, Speyer, *18.01.1974; Spohn, Peter, Berlin, *25.04.1955.",
        "gesellschafter": null,
        "inhaber": null,
        "name": "T-Systems International GmbH",
        "notice_id": "178894",
        "posted_on": "2010-04-26",
        "rechtsform": null,
        "sitz": null,
        "url": "https://www.handelsregisterbekanntmachungen.de/en/skripte/hrb.php?rb_id=178894&land_abk=he"
    },
    "parsed": {
        "officers": [
            {
                "class": "ProcurationCancelled",
                "payload": {
                    "city": "Urbach",
                    "dismissed": true,
                    "dob": "1963-05-13",
                    "lastname": "Fauth",
                    "name": "Gunter"
                },
                "text": " Fauth, Gunter, Urbach, *13.05.1963"
            },
            {
                "class": "CommonProcuration",
                "payload": {
                    "city": "Eltville am Rhein",
                    "dob": "1971-06-18",
                    "lastname": "Fliß",
                    "name": "Georg"
                },
                "text": " Fliß, Georg, Eltville am Rhein, *18.06.1971"
            }
        ]
    }
}