{
    "orig": {
        "aktenzeichen": "HRA 30487",
        "amtsgericht": "Zweibrücken",
        "event_date": "2015-07-10",
        "event_type": "Neueintragungen",
        "federal_state": "rp",
        "full_text": "Amtsgericht Zweibrücken Aktenzeichen: HRA 30487 \nBekannt gemacht am: 10.07.2015 20:05 Uhr\n\n\n\n\nDie in () gesetzten Angaben der Anschrift und des Geschäftszweiges erfolgen ohne Gewähr.\nNeueintragungen\n10.07.2015\n\nHRA 30487:Apotheke auf der Atzel, Inh. Anneli Matheis e.Kfr., Landstuhl, Königsberger Straße 1, 66849 Landstuhl.Einzelkauffrau. Geschäftsanschrift: Königsberger Straße 1, 66849 Landstuhl. Zweigniederlassung errichtet unter Firma: Von-Sickingen-Apotheke Zweigniederlassung der Apotheke auf der Atzel, Inh. Anneli Matheis e.Kfr., 66894 Bechhofen, Geschäftsanschrift: Hauptstraße 96, 66894 Bechhofen. Die Inhaberin handelt allein. Inhaber: Matheis, Anneli, Bechhofen, *14.02.1978.",
        "gesellschafter": null,
        "inhaber": null,
        "name": "HRA 30487:Apotheke auf der Atzel",
        "notice_id": "183927",
        "posted_on": "2015-07-10",
        "rechtsform": null,
        "sitz": null,
        "url": "https://www.handelsregisterbekanntmachungen.de/en/skripte/hrb.php?rb_id=183927&land_abk=rp"
    },
    "parsed": {
        "addresses": [
            {
                "kls": "Address",
                "text": "Königsberger Straße 1, 66849 Landstuhl"
            },
            {
                "kls": "Address",
                "text": "Hauptstraße 96, 66894 Bechhofen"
            }
        ],
        "officers": [
            {
                "class": "Owner",
                "payload": {
                    "city": "Bechhofen",
                    "dob": "1978-02-14",
                    "lastname": "Matheis",
                    "name": "Anneli"
                },
                "text": " Matheis, Anneli, Bechhofen, *14.02.1978."
            }
        ]
    }
}