{
    "orig": {
        "aktenzeichen": "HRB 3679",
        "amtsgericht": "Bad Kreuznach",
        "event_date": "2015-08-20",
        "event_type": "Veränderungen",
        "federal_state": "rp",
        "full_text": "Amtsgericht Bad Kreuznach Aktenzeichen: HRB 3679 \nBekannt gemacht am: 20.08.2015 20:05 Uhr\n\n\n\n\nDie in () gesetzten Angaben der Anschrift und des Geschäftszweiges erfolgen ohne Gewähr.\nVeränderungen\n20.08.2015\n\nHRB 3679:Fuchs Hydraulik Verwaltungsgesellschaff mbH, Kirn, Obersteiner Straße 139, 55606 Kirn.Von Amts wegen geändert: Allgemeine Vertretungsregelung: Die Gesellschaft wird durch den Liquidator vertreten. Von Amts wegen geändert, nicht mehr Geschäftsführer, nun Liquidator: Fuchs, Björn, Hennweiler, *24.07.1967. Durch rechtskräftigen Beschluss des Amtsgerichts Bad Kreuznach (3 IN 50/15) vom 07.07.2015 ist die Eröffnung des Insolvenzverfahrens über das Vermögen der Gesellschaft mangels Masse abgelehnt. Die Gesellschaft ist aufgelöst. Von Amts wegen eingetragen.",
        "gesellschafter": null,
        "inhaber": null,
        "name": "HRB 3679:Fuchs Hydraulik Verwaltungsgesellschaff mbH",
        "notice_id": "186229",
        "posted_on": "2015-08-20",
        "rechtsform": null,
        "sitz": null,
        "url": "https://www.handelsregisterbekanntmachungen.de/en/skripte/hrb.php?rb_id=186229&land_abk=rp"
    },
    "parsed": {
        "flags": [
            {
                "flag": "CompanyClosed",
                "text": "Die\\ Gesellschaft\\ ist\\ aufgel\\öst\\."
            }
        ],
        "officers": [
            {
                "class": "Liquidator",
                "payload": {
                    "city": "Hennweiler",
                    "dob": "1967-07-24",
                    "lastname": "Fuchs",
                    "name": "Björn"
                },
                "text": " Fuchs, Björn, Hennweiler, *24.07.1967."
            }
        ]
    }
}