{
    "orig": {
        "aktenzeichen": "HRB 22719",
        "amtsgericht": "Koblenz",
        "event_date": "2015-10-13",
        "event_type": "Veränderungen",
        "federal_state": "rp",
        "full_text": "Amtsgericht Koblenz Aktenzeichen: HRB 22719 \nBekannt gemacht am: 13.10.2015 20:05 Uhr\n\n\n\n\nDie in () gesetzten Angaben der Geschäftsanschrift und des Unternehmensgegenstandes erfolgen ohne Gewähr.\nVeränderungen\n13.10.2015\n\nHRB 22719:Dunn Racing Agentur für Motorsportevents UG (haftungsbeschränkt), Nürburg, Nürburgring Boulevard 2, 53520 Nürburg.Gemäß § 384 Abs. 2 FamFG von Amts wegen eingetragen: Die Gesellschaft wird durch den/die Liquidator/en vertreten. Gemäß § 384 Abs. 2 FamFG von Amts wegen eingetragen: Nicht mehr Geschäfsführer, nunmehr Liquidator: Dunn, Nataliya, Müsch, *15.08.1969. Durch rechtskräftigen Beschluss des Amtsgerichts Bad Neuenahr-Ahrweiler (Az. 6 IN 72/13) vom 16.07.2015 ist das Insolvenzverfahren aufgehoben.",
        "gesellschafter": null,
        "inhaber": null,
        "name": "HRB 22719:Dunn Racing Agentur für Motorsportevents UG (haftungsbeschränkt)",
        "notice_id": "188946",
        "posted_on": "2015-10-13",
        "rechtsform": null,
        "sitz": null,
        "url": "https://www.handelsregisterbekanntmachungen.de/en/skripte/hrb.php?rb_id=188946&land_abk=rp"
    },
    "parsed": {
        "officers": [
            {
                "class": "Liquidator",
                "payload": {
                    "city": "Müsch",
                    "dob": "1969-08-15",
                    "lastname": "Dunn",
                    "name": "Nataliya"
                },
                "text": " Dunn , Nataliya , Müsch , * 15.08.1969 ."
            }
        ]
    }
}