{
    "orig": {
        "aktenzeichen": "HRB 130253",
        "amtsgericht": "Oldenburg",
        "event_date": "2011-11-08",
        "event_type": "Veränderungen",
        "federal_state": "ni",
        "full_text": "Amtsgericht Oldenburg Aktenzeichen: HRB 130253   \nBekannt gemacht am: 11.11.2011 12:00 Uhr\n\n\n\n\nIn () gesetzte Angaben der Anschrift und des Geschäftszweiges erfolgen ohne Gewähr.\nVeränderungen\n08.11.2011\n\n\"PRO-Dental-Technik GmbH\", Wilhelmshaven, Bismarckstraße 126, 26382 Wilhelmshaven. Die Gesellschaft wird durch den Liquidator vertreten. Jeder Liquidator ist befugt, im Namen der Gesellschaft mit sich im eigenen Namen oder als Vertreter eines Dritten Rechtsgeschäfte vorzunehmen. Geändert, nun: Liquidator: Girke, Petra Hildegard, Schortens, *28.07.1958. Die Gesellschaft ist mit Beschluss der Gesellschafterversammlung vom 02.11.2011 aufgelöst.",
        "gesellschafter": null,
        "inhaber": null,
        "name": "\"PRO-Dental-Technik GmbH\"",
        "notice_id": "189688",
        "posted_on": "2011-11-11",
        "rechtsform": null,
        "sitz": null,
        "url": "https://www.handelsregisterbekanntmachungen.de/en/skripte/hrb.php?rb_id=189688&land_abk=ni"
    },
    "parsed": {
        "officers": [
            {
                "class": "Liquidator",
                "payload": {
                    "city": "Schortens",
                    "dob": "1958-07-28",
                    "lastname": ": Girke",
                    "name": "Petra Hildegard"
                },
                "text": ": Girke, Petra Hildegard, Schortens, *28.07.1958."
            }
        ]
    }
}