{
    "orig": {
        "aktenzeichen": "HRB 11546 PI",
        "amtsgericht": "Pinneberg",
        "event_date": "2016-07-29",
        "event_type": "Veränderungen",
        "federal_state": "sh",
        "full_text": "Amtsgericht Pinneberg Aktenzeichen: HRB 11546 PI \nBekannt gemacht am: 01.08.2016 16:08 Uhr\n\n\n\n\nIn () gesetzte Angaben der Anschrift und des Unternehmensgegenstandes erfolgen ohne Gewähr:\nVeränderungen\n29.07.2016\n\nHRB 11546 PI: B & W Verlags GmbH, Albersdorf, Hogen Haid 8 - 10, 25767 Albersdorf. Ist ein Liquidator bestellt, so vertritt er die Gesellschaft allein. Sind mehrere Liquidatoren bestellt, wird die Gesellschaft durch sämtliche Liquidatoren gemeinsam vertreten. Liquidator: Braun, Jan, *09.11.1973, Nordhastedt; Änderung zu Nr. 1: Liquidator: Willner, Florian, *19.07.1982, Albersdorf; Durch Beschluss der Gesellschafterversammlung vom 13.05.2016 ist die Gesellschaft aufgelöst.",
        "gesellschafter": null,
        "inhaber": null,
        "name": "HRB 11546 PI: B & W Verlags GmbH",
        "notice_id": "193448",
        "posted_on": "2016-08-01",
        "rechtsform": null,
        "sitz": null,
        "url": "https://www.handelsregisterbekanntmachungen.de/en/skripte/hrb.php?rb_id=193448&land_abk=sh"
    },
    "parsed": {
        "flags": [
            {
                "flag": "If several liquidators are appointed, the company will be represented jointly by all liquidators.",
                "text": "Sind\\ mehrere\\ Liquidatoren\\ bestellt\\,\\ wird\\ die\\ Gesellschaft\\ durch\\ s\\ämtliche\\ Liquidatoren\\ gemeinsam\\ vertreten\\."
            }
        ],
        "officers": [
            {
                "class": "Liquidator",
                "payload": {
                    "city": "Nordhastedt",
                    "dob": "1973-09-11",
                    "lastname": "Braun",
                    "name": "Jan"
                },
                "text": " Braun, Jan, *09.11.1973, Nordhastedt"
            },
            {
                "class": "Liquidator",
                "payload": {
                    "city": "Albersdorf",
                    "dob": "1982-07-19",
                    "lastname": "Willner",
                    "name": "Florian"
                },
                "text": " Willner, Florian, *19.07.1982, Albersdorf"
            }
        ]
    }
}