{
    "orig": {
        "aktenzeichen": "HRB 13581",
        "amtsgericht": "Montabaur",
        "event_date": "2016-02-05",
        "event_type": "Veränderungen",
        "federal_state": "rp",
        "full_text": "Amtsgericht Montabaur Aktenzeichen: HRB 13581 \nBekannt gemacht am: 05.02.2016 20:05 Uhr\n\n\n\n\nDie in () gesetzten Angaben der Anschrift und des Geschäftszweiges erfolgen ohne Gewähr.\nVeränderungen\n05.02.2016\n\nHRB 13581: Rhein-Westerwald Nahverkehr GmbH, Montabaur, Bahnhofsplatz 1-3, 56410 Montabaur. Änderung der Geschäftsanschrift: Erthalstraße 1, 55118 Mainz. Bestellt als Geschäftsführer: Ehmann, Bernhard, Kirchheimbolanden, *18.10.1958; Heber, Marion, Bad Soden, *05.03.1967; Link, Hans-Egon, Urbar, *18.04.1956; Loeschmann, Uwe, Maikammer, *20.08.1960. Nicht mehr Geschäftsführer: Strüder, Harald, Bellingen, *07.07.1959.",
        "gesellschafter": null,
        "inhaber": null,
        "name": "HRB 13581: Rhein-Westerwald Nahverkehr GmbH",
        "notice_id": "195808",
        "posted_on": "2016-02-05",
        "rechtsform": null,
        "sitz": null,
        "url": "https://www.handelsregisterbekanntmachungen.de/en/skripte/hrb.php?rb_id=195808&land_abk=rp"
    },
    "parsed": {
        "addresses": [
            {
                "kls": "Address",
                "text": "Erthalstraße 1, 55118 Mainz"
            }
        ],
        "officers": [
            {
                "class": "AppointedManagingDirector",
                "payload": {
                    "city": "Kirchheimbolanden",
                    "dob": "1958-10-18",
                    "lastname": "Ehmann",
                    "name": "Bernhard"
                },
                "text": " Ehmann, Bernhard, Kirchheimbolanden, *18.10.1958"
            },
            {
                "class": "AppointedManagingDirector",
                "payload": {
                    "city": "Bad Soden",
                    "dob": "1967-03-05",
                    "lastname": "Heber",
                    "name": "Marion"
                },
                "text": " Heber, Marion, Bad Soden, *05.03.1967"
            },
            {
                "class": "AppointedManagingDirector",
                "payload": {
                    "city": "Urbar",
                    "dob": "1956-04-18",
                    "lastname": "Link",
                    "name": "Hans-Egon"
                },
                "text": " Link, Hans-Egon, Urbar, *18.04.1956"
            },
            {
                "class": "AppointedManagingDirector",
                "payload": {
                    "city": "Maikammer",
                    "dob": "1960-08-20",
                    "lastname": "Loeschmann",
                    "name": "Uwe"
                },
                "text": " Loeschmann, Uwe, Maikammer, *20.08.1960."
            },
            {
                "class": "DismissedManagingDirector",
                "payload": {
                    "city": "Bellingen",
                    "dismissed": true,
                    "dob": "1959-07-07",
                    "lastname": "Strüder",
                    "name": "Harald"
                },
                "text": " Strüder, Harald, Bellingen, *07.07.1959."
            }
        ]
    }
}