{
    "orig": {
        "aktenzeichen": "HRB 17312",
        "amtsgericht": "Dresden",
        "event_date": "2015-10-14",
        "event_type": "Veränderungen",
        "federal_state": "sn",
        "full_text": "Amtsgericht Dresden Aktenzeichen: HRB 17312 \nBekannt gemacht am: 14.10.2015 18:30 Uhr\n\n\n\n\nDie in () gesetzten Angaben der Geschäftsanschrift und des  Unternehmensgegenstandes erfolgen ohne Gewähr.\nVeränderungen\n14.10.2015\n\nHRB 17312: KLUGE Unternehmensgruppe GmbH, Dresden, Stuttgarter Str. 25, 01189 Dresden. Ausgeschieden: Geschäftsführer: Kluge, Reinhard, Meißen, *06.05.1949. Bestellt: Geschäftsführer: Hunold, Christian, Essen, *02.12.1979; Lange, Fritz-Klaus, Bochum, *28.08.1960. Gesamtprokura gemeinsam mit einem Geschäftsführer oder einem anderen Prokuristen: Düssel, Georg, Bochum, *04.07.1970. Prokura geändert, nun: Gesamtprokura gemeinsam mit einem Geschäftsführer oder einem anderen Prokuristen: Herrmann, Kathrin, Dresden, *30.07.1967.",
        "gesellschafter": null,
        "inhaber": null,
        "name": "HRB 17312: KLUGE Unternehmensgruppe GmbH",
        "notice_id": "199886",
        "posted_on": "2015-10-14",
        "rechtsform": null,
        "sitz": null,
        "url": "https://www.handelsregisterbekanntmachungen.de/en/skripte/hrb.php?rb_id=199886&land_abk=sn"
    },
    "parsed": {
        "officers": [
            {
                "class": "RetiredManagingDirector",
                "payload": {
                    "city": "Meißen",
                    "dismissed": true,
                    "dob": "1949-06-05",
                    "lastname": "Kluge",
                    "name": "Reinhard"
                },
                "text": " Kluge, Reinhard, Meißen, *06.05.1949."
            },
            {
                "class": "AppointedManagingDirector",
                "payload": {
                    "city": "Essen",
                    "dob": "1979-02-12",
                    "lastname": "Hunold",
                    "name": "Christian"
                },
                "text": " Hunold, Christian, Essen, *02.12.1979"
            },
            {
                "class": "CommonProcuration",
                "payload": {
                    "city": "Bochum",
                    "dob": "1970-04-07",
                    "lastname": "Düssel",
                    "name": "Georg"
                },
                "text": " Düssel, Georg, Bochum, *04.07.1970."
            },
            {
                "class": "NewProcuration",
                "payload": {
                    "city": "Dresden",
                    "dob": "1967-07-30",
                    "lastname": "Herrmann",
                    "name": "Kathrin"
                },
                "text": " Herrmann, Kathrin, Dresden, *30.07.1967."
            }
        ]
    }
}