{
    "orig": {
        "aktenzeichen": "HRB 131919",
        "amtsgericht": "Osnabrück",
        "event_date": "2012-02-01",
        "event_type": "Veränderungen",
        "federal_state": "ni",
        "full_text": "Amtsgericht Osnabrück Aktenzeichen: HRB 131919    \nBekannt gemacht am: 06.02.2012 22:00 Uhr\n\n\n\n\nIn () gesetzte Angaben der Anschrift und des Geschäftszweiges erfolgen ohne Gewähr.\nVeränderungen\n01.02.2012\n\nVogel Maschinen GmbH, Schüttorf, Salzberger Straße 3, 48465 Schüttorf. Geschäftsanschrift: Salzberger Straße 3, 48465 Schüttorf. Ist nur ein Liquidator bestellt, so vertritt er die Gesellschaft allein. Sind mehrere Liquidatoren bestellt, so wird die Gesellschaft durch die Liquidatoren gemeinsam vertreten. Geändert, nicht mehr Geschäftsführer, sondern nun: Liquidator: Deetjen-Vogel, Mareile, Schüttorf, *27.11.1943. Die Gesellschaft ist mit Beschluss der Gesellschafterversammlung vom 20.12.2011 aufgelöst.",
        "gesellschafter": null,
        "inhaber": null,
        "name": "Vogel Maschinen GmbH",
        "notice_id": "200929",
        "posted_on": "2012-02-06",
        "rechtsform": null,
        "sitz": null,
        "url": "https://www.handelsregisterbekanntmachungen.de/en/skripte/hrb.php?rb_id=200929&land_abk=ni"
    },
    "parsed": {
        "labels": [
            {
                "label": "address",
                "text": " Salzberger Straße 3, 48465 Schüttorf."
            }
        ],
        "officers": [
            {
                "class": "Liquidator",
                "payload": {
                    "city": "Schüttorf",
                    "dob": "1943-11-27",
                    "lastname": "Deetjen-Vogel",
                    "name": "Mareile"
                },
                "text": " Deetjen-Vogel, Mareile, Schüttorf, *27.11.1943."
            }
        ]
    }
}