{
    "orig": {
        "aktenzeichen": "HRB 24274",
        "amtsgericht": "Montabaur",
        "event_date": "2016-06-23",
        "event_type": "Veränderungen",
        "federal_state": "rp",
        "full_text": "Amtsgericht Montabaur Aktenzeichen: HRB 24274 \nBekannt gemacht am: 23.06.2016 20:06 Uhr\n\n\n\n\nDie in () gesetzten Angaben der Anschrift und des Geschäftszweiges erfolgen ohne Gewähr.\nVeränderungen\n23.06.2016\n\nHRB 24274: TAXCONCEPT Wirtschafts- und Steuerberatungsgesellschaft mbH, Betzdorf, Wilhemstraße 87, 57518 Betzdorf. Von Amts wegen berichtigt: Die Gesellschaft wird durch den/die Liquidator/en vertreten. Von Amts wegen berichtigt: Liquidator: Hastrich, Eugen, Betzdorf, *15.06.1950. Durch rechtskräftigen Beschluss des Amtsgerichts Montabaur vom 12.05.2016 ist gemäß § 399 FamFG ein wesentlicher Mangel des Gesellschaftsvertrags festgestellt. Die Gesellschaft ist gemäß § 60 GmbHG aufgelöst. Von Amts wegen eingetragen.",
        "gesellschafter": null,
        "inhaber": null,
        "name": "HRB 24274: TAXCONCEPT Wirtschafts- und Steuerberatungsgesellschaft mbH",
        "notice_id": "203504",
        "posted_on": "2016-06-23",
        "rechtsform": null,
        "sitz": null,
        "url": "https://www.handelsregisterbekanntmachungen.de/en/skripte/hrb.php?rb_id=203504&land_abk=rp"
    },
    "parsed": {
        "officers": [
            {
                "class": "Liquidator",
                "payload": {
                    "city": "Betzdorf",
                    "dob": "1950-06-15",
                    "lastname": "Hastrich",
                    "name": "Eugen"
                },
                "text": " Hastrich, Eugen, Betzdorf, *15.06.1950."
            }
        ]
    }
}