{
    "orig": {
        "aktenzeichen": "HRB 19551",
        "amtsgericht": "Leipzig",
        "event_date": "2015-12-29",
        "event_type": "Veränderungen",
        "federal_state": "sn",
        "full_text": "Amtsgericht Leipzig Aktenzeichen: HRB 19551 \nBekannt gemacht am: 29.12.2015 18:30 Uhr\n\n\n\n\nDie in () gesetzten Angaben der Geschäftsanschrift und des Unternehmensgegenstandes erfolgen ohne Gewähr.\nVeränderungen\n29.12.2015\n\nHRB 19551: akzent PROjektentwicklungsgesellschaft mbH, Leipzig, Menckestraße 29, 04155 Leipzig. Änderung der Geschäftsanschrift: Arndtstraße 68, 04275 Leipzig. Ist nur ein Liquidator bestellt, so vertritt er die Gesellschaft allein. Sind mehrere Liquidatoren bestellt, so wird die Gesellschaft durch die Liquidatoren gemeinsam vertreten. Nun bestellt als Liquidator: Lock, Thomas, Leipzig, *27.09.1965; Schröder, Cornelius, Leipzig, *16.10.1962. Die Gesellschaft ist aufgelöst.",
        "gesellschafter": null,
        "inhaber": null,
        "name": "HRB 19551: akzent PROjektentwicklungsgesellschaft mbH",
        "notice_id": "203820",
        "posted_on": "2015-12-29",
        "rechtsform": null,
        "sitz": null,
        "url": "https://www.handelsregisterbekanntmachungen.de/en/skripte/hrb.php?rb_id=203820&land_abk=sn"
    },
    "parsed": {
        "addresses": [
            {
                "kls": "Address",
                "text": "Arndtstraße 68, 04275 Leipzig"
            }
        ],
        "flags": [
            {
                "flag": "CompanyClosed",
                "text": "Die\\ Gesellschaft\\ ist\\ aufgel\\öst\\."
            }
        ],
        "officers": [
            {
                "class": "Liquidator",
                "payload": {
                    "city": "Leipzig",
                    "dob": "1965-09-27",
                    "lastname": "Lock",
                    "name": "Thomas"
                },
                "text": " Lock, Thomas, Leipzig, *27.09.1965"
            },
            {
                "class": "Liquidator",
                "payload": {
                    "city": "Leipzig",
                    "dob": "1962-10-16",
                    "lastname": "Schröder",
                    "name": "Cornelius"
                },
                "text": " Schröder, Cornelius, Leipzig, *16.10.1962."
            }
        ]
    }
}