{
    "orig": {
        "aktenzeichen": "HRA 4515",
        "amtsgericht": "Montabaur",
        "event_date": "2007-01-08",
        "event_type": "Veränderungen",
        "federal_state": "rp",
        "full_text": "Amtsgericht Montabaur Aktenzeichen: HRA 4515 \nBekannt gemacht am: 19.01.2007 07:50 Uhr\n\n\n\n\nDie in () gesetzten Angaben der Geschäftsanschrift und des Unternehmensgegenstandes erfolgen ohne Gewähr.\nVeränderungen\n08.01.2007\n\nMaxpol OHG, Ruppach-Goldhausen (Südring 9, 56412 Ruppach-Goldhausen). Eingetreten als Persönlich haftender Gesellschafter: Buganik, Jozef, Nordhofen, *28.12.1978; Kadela, Stanislaw, Moschheim, *05.02.1963; Przydacz, Maciej Ryszard, Salzburg, *03.12.1973, jeweils von der Vertretung ausgeschlossen. Ausgeschieden als Persönlich haftender Gesellschafter: Guzik, Tadeusz, Ruppach-Goldhausen, *16.08.1969; Kukulka, Wieslaw, Nordhofen, *16.03.1969.",
        "gesellschafter": null,
        "inhaber": null,
        "name": "Maxpol OHG",
        "notice_id": "20931",
        "posted_on": "2007-01-19",
        "rechtsform": null,
        "sitz": null,
        "url": "https://www.handelsregisterbekanntmachungen.de/en/skripte/hrb.php?rb_id=20931&land_abk=rp"
    },
    "parsed": {
        "officers": [
            {
                "class": "PersonalPartner",
                "payload": {
                    "city": "Nordhofen",
                    "dob": "1978-12-28",
                    "lastname": "Buganik",
                    "name": "Jozef"
                },
                "text": " Buganik, Jozef, Nordhofen, *28.12.1978"
            },
            {
                "class": "RetiredPersonalPartner",
                "payload": {
                    "city": "Ruppach-Goldhausen",
                    "dismissed": true,
                    "dob": "1969-08-16",
                    "lastname": "Guzik",
                    "name": "Tadeusz"
                },
                "text": " Guzik, Tadeusz, Ruppach-Goldhausen, *16.08.1969"
            }
        ]
    }
}