{
    "orig": {
        "aktenzeichen": "HRB 23073",
        "amtsgericht": "Zweibrücken",
        "event_date": "2016-10-12",
        "event_type": "Veränderungen",
        "federal_state": "rp",
        "full_text": "Amtsgericht Zweibrücken Aktenzeichen: HRB 23073 \nBekannt gemacht am: 12.10.2016 20:06 Uhr\n\n\n\n\nDie in () gesetzten Angaben der Anschrift und des Geschäftszweiges erfolgen ohne Gewähr.\nVeränderungen\n12.10.2016\n\nHRB 23073: Mayer Logistik Service GmbH, Thaleischweiler-Fröschen, Industriegebiet-West, 66987 Thaleischweiler-Fröschen. Bestellt als Geschäftsführer: Finger, Felix, Osnabrück, *04.11.1976; Stoll, Michael, Hamburg, *11.12.1965, jeweils mit der Befugnis im Namen der Gesellschaft mit sich im eigenen Namen oder als Vertreter eines Dritten Rechtsgeschäfte abzuschließen. Prokura erloschen: Finger, Felix, Osnabrück, *04.11.1976.",
        "gesellschafter": null,
        "inhaber": null,
        "name": "HRB 23073: Mayer Logistik Service GmbH",
        "notice_id": "209549",
        "posted_on": "2016-10-12",
        "rechtsform": null,
        "sitz": null,
        "url": "https://www.handelsregisterbekanntmachungen.de/en/skripte/hrb.php?rb_id=209549&land_abk=rp"
    },
    "parsed": {
        "officers": [
            {
                "class": "AppointedManagingDirector",
                "payload": {
                    "city": "Osnabrück",
                    "dob": "1976-04-11",
                    "lastname": "Finger",
                    "name": "Felix"
                },
                "text": " Finger, Felix, Osnabrück, *04.11.1976"
            },
            {
                "class": "ProcurationCancelled",
                "payload": {
                    "city": "Osnabrück",
                    "dismissed": true,
                    "dob": "1976-04-11",
                    "lastname": "Finger",
                    "name": "Felix"
                },
                "text": " Finger, Felix, Osnabrück, *04.11.1976."
            }
        ]
    }
}