{
    "orig": {
        "aktenzeichen": "HRB 10310 PI",
        "amtsgericht": "Pinneberg",
        "event_date": "2017-10-06",
        "event_type": "Veränderungen",
        "federal_state": "sh",
        "full_text": "Amtsgericht Pinneberg Aktenzeichen: HRB 10310 PI \nBekannt gemacht am: 11.10.2017 14:23 Uhr\n\n\n\n\nIn () gesetzte Angaben der Anschrift und des Unternehmensgegenstandes erfolgen ohne Gewähr:\nVeränderungen\n06.10.2017\n\nHRB 10310 PI: UTC Windparkbetriebsgesellschaft Friedrichsgabekoog mbH, Friedrichsgabekoog, c/o Anne-Grete Loy, Am Kanal 2, 25764 Friedrichsgabekoog. Nicht mehr Geschäftsführer: Carstensen, Uwe Thomas; Änderung zu Geschäftsführer Kanira, Ingo: nunmehr mit der Befugnis Rechtsgeschäfte als Vertreter Dritter abzuschließen. Geschäftsführer: Schlörmann, Alwin, *26.05.1959, Bad Zwischenahn; mit der Befugnis Rechtsgeschäfte als Vertreter Dritter abzuschließen.",
        "gesellschafter": null,
        "inhaber": null,
        "name": "HRB 10310 PI: UTC Windparkbetriebsgesellschaft Friedrichsgabekoog mbH",
        "notice_id": "216293",
        "posted_on": "2017-10-11",
        "rechtsform": null,
        "sitz": null,
        "url": "https://www.handelsregisterbekanntmachungen.de/en/skripte/hrb.php?rb_id=216293&land_abk=sh"
    },
    "parsed": {
        "officers": [
            {
                "class": "DismissedManagingDirector",
                "payload": {
                    "dismissed": true,
                    "lastname": "Carstensen",
                    "name": "Uwe Thomas"
                },
                "text": " Carstensen, Uwe Thomas"
            },
            {
                "class": "ManagingDirector",
                "payload": {
                    "city": "Bad Zwischenahn",
                    "dob": "1959-05-26",
                    "lastname": "Schlörmann",
                    "name": "Alwin"
                },
                "text": " Schlörmann, Alwin, *26.05.1959, Bad Zwischenahn"
            }
        ]
    }
}