{
    "orig": {
        "aktenzeichen": "HRB 500026",
        "amtsgericht": "Ulm",
        "event_date": "2010-11-23",
        "event_type": "Veränderungen",
        "federal_state": "bw",
        "full_text": "Amtsgericht Ulm Aktenzeichen: HRB 500026 \nBekannt gemacht am: 30.11.2010 22:00 Uhr\n\n\n\n\nIn () gesetzte Angaben der Anschrift und des Geschäftszweiges erfolgen ohne Gewähr.\nVeränderungen\n23.11.2010\n\nF. B. Lehmann Maschinenfabrik Gesellschaft mit beschränkter Haftung, Aalen, Daimlerstraße 12, 73431 Aalen. Nicht mehr Geschäftsführer: Essig, Joachim, Heubach, *09.06.1965. Bestellt als Geschäftsführer: Reisinger, Beate, München, *24.09.1957. Gesamtprokura gemeinsam mit einem anderen Prokuristen: Essig, Joachim, Heubach, *09.06.1965; Schenk, Solvej, EK Avenhorn / Niederlande, *12.01.1964. Prokura erloschen: Sommer, Jörg, Aalen, *15.03.1963.",
        "gesellschafter": null,
        "inhaber": null,
        "name": "F. B. Lehmann Maschinenfabrik Gesellschaft mit beschränkter Haftung",
        "notice_id": "218656",
        "posted_on": "2010-11-30",
        "rechtsform": null,
        "sitz": null,
        "url": "https://www.handelsregisterbekanntmachungen.de/en/skripte/hrb.php?rb_id=218656&land_abk=bw"
    },
    "parsed": {
        "officers": [
            {
                "class": "DismissedManagingDirector",
                "payload": {
                    "city": "Heubach",
                    "dismissed": true,
                    "dob": "1965-09-06",
                    "lastname": "Essig",
                    "name": "Joachim"
                },
                "text": " Essig, Joachim, Heubach, *09.06.1965."
            },
            {
                "class": "AppointedManagingDirector",
                "payload": {
                    "city": "München",
                    "dob": "1957-09-24",
                    "lastname": "Reisinger",
                    "name": "Beate"
                },
                "text": " Reisinger, Beate, München, *24.09.1957."
            },
            {
                "class": "ProcurationCancelled",
                "payload": {
                    "city": "Aalen",
                    "dismissed": true,
                    "dob": "1963-03-15",
                    "lastname": "Sommer",
                    "name": "Jörg"
                },
                "text": " Sommer, Jörg, Aalen, *15.03.1963."
            }
        ]
    }
}