{
    "orig": {
        "aktenzeichen": "HRB 142046 B",
        "amtsgericht": "Charlottenburg (Berlin)",
        "event_date": "2012-08-31",
        "event_type": "Veränderungen",
        "federal_state": "be",
        "full_text": "Amtsgericht Charlottenburg (Berlin) Aktenzeichen: HRB 142046 B   \nBekannt gemacht am: 04.09.2012 12:00 Uhr\n\n\n\n\nIn () gesetzte Angaben der Anschrift und des Geschäftszweiges erfolgen ohne Gewähr.\nVeränderungen\n31.08.2012\n\nJuwel 143. V V UG (haftungsbeschränkt), Berlin, Johannisstraße 20, 10117 Berlin. Geschäftsführer:; 3. Krieger, Steve, *10.06.1982, Berlin; mit der Befugnis die Gesellschaft allein zu vertreten mit der Befugnis Rechtsgeschäfte als Vertreter Dritter abzuschließen; Geschäftsführer:; 4. Otero, Rafael, *24.12.1973, Berlin; mit der Befugnis die Gesellschaft allein zu vertreten mit der Befugnis Rechtsgeschäfte als Vertreter Dritter abzuschließen; Geschäftsführer:; 5. Zumdieck, Alexander, *31.10.1975, Berlin; mit der Befugnis die Gesellschaft allein zu vertreten mit der Befugnis Rechtsgeschäfte als Vertreter Dritter abzuschließen; War Geschäftsführer:; 6. Pingsmann, Hanno, *22.10.1980, Düsseldorf; mit der Befugnis die Gesellschaft allein zu vertreten mit der Befugnis Rechtsgeschäfte als Vertreter Dritter abzuschließen.",
        "gesellschafter": null,
        "inhaber": null,
        "name": "Juwel 143. V V UG (haftungsbeschränkt)",
        "notice_id": "219647",
        "posted_on": "2012-09-04",
        "rechtsform": null,
        "sitz": null,
        "url": "https://www.handelsregisterbekanntmachungen.de/en/skripte/hrb.php?rb_id=219647&land_abk=be"
    },
    "parsed": {
        "flags": [
            {
                "flag": "with the power to represent the company alone",
                "text": "mit\\ der\\ Befugnis\\ die\\ Gesellschaft\\ allein\\ zu\\ vertreten"
            },
            {
                "flag": "with the power to represent the company alone",
                "text": "mit\\ der\\ Befugnis\\ die\\ Gesellschaft\\ allein\\ zu\\ vertreten"
            },
            {
                "flag": "with the power to represent the company alone",
                "text": "mit\\ der\\ Befugnis\\ die\\ Gesellschaft\\ allein\\ zu\\ vertreten"
            },
            {
                "flag": "with the power to represent the company alone",
                "text": "mit\\ der\\ Befugnis\\ die\\ Gesellschaft\\ allein\\ zu\\ vertreten"
            }
        ],
        "officers": [
            {
                "class": "ManagingDirector",
                "payload": {
                    "city": "Berlin",
                    "dob": "1982-10-06",
                    "lastname": "Krieger",
                    "name": "Steve"
                },
                "text": " Krieger, Steve, *10.06.1982, Berlin"
            },
            {
                "class": "ManagingDirector",
                "payload": {
                    "city": "Berlin",
                    "dob": "1973-12-24",
                    "lastname": "Otero",
                    "name": "Rafael"
                },
                "text": " Otero, Rafael, *24.12.1973, Berlin"
            },
            {
                "class": "ManagingDirector",
                "payload": {
                    "city": "Berlin",
                    "dob": "1975-10-31",
                    "lastname": "Zumdieck",
                    "name": "Alexander"
                },
                "text": " Zumdieck, Alexander, *31.10.1975, Berlin"
            },
            {
                "class": "ManagingDirector",
                "payload": {
                    "city": "Düsseldorf",
                    "dob": "1980-10-22",
                    "lastname": "Pingsmann",
                    "name": "Hanno"
                },
                "text": " Pingsmann, Hanno, *22.10.1980, Düsseldorf"
            }
        ]
    }
}