{
    "orig": {
        "aktenzeichen": "HRB 4582",
        "amtsgericht": "Chemnitz",
        "event_date": "2016-10-04",
        "event_type": "Veränderungen",
        "federal_state": "sn",
        "full_text": "Amtsgericht Chemnitz Aktenzeichen: HRB 4582 \nBekannt gemacht am: 04.10.2016 18:30 Uhr\n\n\n\n\nDie in () gesetzten Angaben der Geschäftsanschrift und des  Unternehmensgegenstandes erfolgen ohne Gewähr.\nVeränderungen\n04.10.2016\n\nHRB 4582: Licht & Kraft Elektro GmbH, Marienberg, Lauterbacher Straße 1, 09496 Marienberg. Ausgeschieden: Geschäftsführer: Schreiter, Andreas, Großrückerswalde, *22.02.1960. Vertretung geändert Geschäftsführer: Morgenstern, Jan, Marienberg, *04.08.1970, einzelvertretungsberechtigt; mit der Befugnis, im Namen der Gesellschaft mit sich im eigenen Namen oder als Vertreter eines Dritten Rechtsgeschäfte abzuschließen. Einzelprokura: Lange, Ines, Wolkenstein, *01.12.1971.",
        "gesellschafter": null,
        "inhaber": null,
        "name": "HRB 4582: Licht & Kraft Elektro GmbH",
        "notice_id": "219793",
        "posted_on": "2016-10-04",
        "rechtsform": null,
        "sitz": null,
        "url": "https://www.handelsregisterbekanntmachungen.de/en/skripte/hrb.php?rb_id=219793&land_abk=sn"
    },
    "parsed": {
        "flags": [
            {
                "flag": "with the power to enter into legal transactions on behalf of the Company with itself or as a representative of a third party",
                "text": "mit\\ der\\ Befugnis\\,\\ im\\ Namen\\ der\\ Gesellschaft\\ mit\\ sich\\ im\\ eigenen\\ Namen\\ oder\\ als\\ Vertreter\\ eines\\ Dritten\\ Rechtsgesch\\äfte\\ abzuschlie\\ßen\\."
            },
            {
                "flag": "Single procuration",
                "text": "Einzelprokura"
            }
        ],
        "officers": [
            {
                "class": "RetiredManagingDirector",
                "payload": {
                    "city": "Großrückerswalde",
                    "dismissed": true,
                    "dob": "1960-02-22",
                    "lastname": "Schreiter",
                    "name": "Andreas"
                },
                "text": " Schreiter, Andreas, Großrückerswalde, *22.02.1960."
            },
            {
                "class": "ManagingDirector",
                "payload": {
                    "city": "Marienberg",
                    "dob": "1970-08-04",
                    "flag": "sole representation",
                    "lastname": "Morgenstern",
                    "name": "Jan"
                },
                "text": " Morgenstern, Jan, Marienberg, *04.08.1970, einzelvertretungsberechtigt"
            },
            {
                "class": "ManagingDirector",
                "payload": {
                    "lastname": "mit der Befugnis",
                    "name": "im Namen der Gesellschaft mit sich im eigenen Namen oder als Vertreter eines Dritten Rechtsgeschäfte abzuschließen"
                },
                "text": " mit der Befugnis, im Namen der Gesellschaft mit sich im eigenen Namen oder als Vertreter eines Dritten Rechtsgeschäfte abzuschließen."
            },
            {
                "class": "SingleProcuration",
                "payload": {
                    "city": "Wolkenstein",
                    "dob": "1971-12-01",
                    "lastname": "Lange",
                    "name": "Ines"
                },
                "text": " Lange, Ines, Wolkenstein, *01.12.1971."
            }
        ]
    }
}