{
    "orig": {
        "aktenzeichen": "HRB 503091",
        "amtsgericht": "Jena",
        "event_date": "2008-12-04",
        "event_type": "Veränderungen",
        "federal_state": "th",
        "full_text": "Amtsgericht Jena Aktenzeichen: HRB 503091 \nBekannt gemacht am: 10.12.2008 22:00 Uhr\n\n\n\n\nDie in () gesetzten Angaben der Geschäftsanschrift und des Unternehmensgegenstandes erfolgen ohne Gewähr.\nVeränderungen\n04.12.2008\n\nGeiger services GmbH, Tambach-Dietharz, (Friedrichrodaer Straße 4, 99897 Tambach-Dietharz).Aufgehoben: Geiger services GmbH, 99897 Tambach-Dietharz. Prokura erloschen: Brenner, Michael, Penzberg, *02.11.1962; Gutt, Andreas, Lehrensteinsfeld, *02.03.1968; Rees, Bernhard, Farchant, *25.01.1972; Stuhler, Andrea, Farchant, *16.06.1969; Topisch, Karin, Garmisch-Partenkirchen, *19.11.1963.",
        "gesellschafter": null,
        "inhaber": null,
        "name": "Geiger services GmbH",
        "notice_id": "22409",
        "posted_on": "2008-12-10",
        "rechtsform": null,
        "sitz": null,
        "url": "https://www.handelsregisterbekanntmachungen.de/en/skripte/hrb.php?rb_id=22409&land_abk=th"
    },
    "parsed": {
        "officers": [
            {
                "class": "ProcurationCancelled",
                "payload": {
                    "city": "Penzberg",
                    "dismissed": true,
                    "dob": "1962-11-02",
                    "lastname": "Brenner",
                    "name": "Michael"
                },
                "text": " Brenner, Michael, Penzberg, *02.11.1962"
            },
            {
                "class": "ProcurationCancelled",
                "payload": {
                    "city": "Lehrensteinsfeld",
                    "dismissed": true,
                    "dob": "1968-03-02",
                    "lastname": "Gutt",
                    "name": "Andreas"
                },
                "text": " Gutt, Andreas, Lehrensteinsfeld, *02.03.1968"
            },
            {
                "class": "ProcurationCancelled",
                "payload": {
                    "city": "Farchant",
                    "dismissed": true,
                    "dob": "1972-01-25",
                    "lastname": "Rees",
                    "name": "Bernhard"
                },
                "text": " Rees, Bernhard, Farchant, *25.01.1972"
            },
            {
                "class": "ProcurationCancelled",
                "payload": {
                    "city": "Farchant",
                    "dismissed": true,
                    "dob": "1969-06-16",
                    "lastname": "Stuhler",
                    "name": "Andrea"
                },
                "text": " Stuhler, Andrea, Farchant, *16.06.1969"
            },
            {
                "class": "ProcurationCancelled",
                "payload": {
                    "city": "Garmisch-Partenkirchen",
                    "dismissed": true,
                    "dob": "1963-11-19",
                    "lastname": "Topisch",
                    "name": "Karin"
                },
                "text": " Topisch, Karin, Garmisch-Partenkirchen, *19.11.1963."
            }
        ]
    }
}