{
    "orig": {
        "aktenzeichen": "HRB 2515 RD",
        "amtsgericht": "Kiel",
        "event_date": "2018-03-16",
        "event_type": "Veränderungen",
        "federal_state": "sh",
        "full_text": "Amtsgericht Kiel Aktenzeichen: HRB 2515 RD \nBekannt gemacht am: 16.03.2018 12:25 Uhr\n\n\n\n\nIn () gesetzte Angaben der Anschrift und des Unternehmensgegenstandes erfolgen ohne Gewähr:\nVeränderungen\n16.03.2018\n\nHRB 2515 RD: Grote, Kröger, Röhr + Voss Beteiligungsgesellschaft mbH, Rendsburg, Röhlingsweg 4, 24768 Rendsburg. Änderung zu Nr. 1: Liquidator: Kröger, Dieter, *04.07.1942, Itzehoe; mit der Befugnis die Gesellschaft allein zu vertreten; Ist ein Liquidator bestellt, so vertritt er die Gesellschaft allein. Sind mehrere Liquidatoren bestellt, wird die Gesellschaft durch sämtliche Liquidatoren gemeinsam vertreten; Rechtsverhaeltnis: Durch Beschluss der Gesellschafterversammlung vom 29.12.2017 ist die Gesellschaft mit Wirkung vom 31.12.2017 aufgelöst.",
        "gesellschafter": null,
        "inhaber": null,
        "name": "HRB 2515 RD: Grote",
        "notice_id": "225728",
        "posted_on": "2018-03-16",
        "rechtsform": null,
        "sitz": null,
        "url": "https://www.handelsregisterbekanntmachungen.de/en/skripte/hrb.php?rb_id=225728&land_abk=sh"
    },
    "parsed": {
        "flags": [
            {
                "flag": "with the power to represent the company alone",
                "text": "mit\\ der\\ Befugnis\\ die\\ Gesellschaft\\ allein\\ zu\\ vertreten"
            }
        ],
        "officers": [
            {
                "class": "Liquidator",
                "payload": {
                    "city": "Itzehoe",
                    "dob": "1942-04-07",
                    "lastname": "Kröger",
                    "name": "Dieter"
                },
                "text": " Kröger, Dieter, *04.07.1942, Itzehoe"
            }
        ]
    }
}