{
    "orig": {
        "aktenzeichen": "HRB 24478",
        "amtsgericht": "Leipzig",
        "event_date": "2017-02-07",
        "event_type": "Veränderungen",
        "federal_state": "sn",
        "full_text": "Amtsgericht Leipzig Aktenzeichen: HRB 24478 \nBekannt gemacht am: 07.02.2017 18:30 Uhr\n\n\n\n\nDie in () gesetzten Angaben der Geschäftsanschrift und des Unternehmensgegenstandes erfolgen ohne Gewähr.\nVeränderungen\n07.02.2017\n\nHRB 24478: FLD Flughafendienste Deutschland GmbH, Leipzig, Am Kraftwerk 1, 04435 Flughafen Leipzig/Halle. Ausgeschieden: Geschäftsführer: Hammerstädt, Wolfgang Edgar Heinz, Wiesenburg, *11.12.1965. Bestellt: Geschäftsführer: Körber, Robert, Kleinmachnow, *03.08.1958, einzelvertretungsberechtigt; mit der Befugnis, im Namen der Gesellschaft mit sich im eigenen Namen oder als Vertreter eines Dritten Rechtsgeschäfte abzuschließen.",
        "gesellschafter": null,
        "inhaber": null,
        "name": "HRB 24478: FLD Flughafendienste Deutschland GmbH",
        "notice_id": "227410",
        "posted_on": "2017-02-07",
        "rechtsform": null,
        "sitz": null,
        "url": "https://www.handelsregisterbekanntmachungen.de/en/skripte/hrb.php?rb_id=227410&land_abk=sn"
    },
    "parsed": {
        "flags": [
            {
                "flag": "with the power to enter into legal transactions on behalf of the Company with itself or as a representative of a third party",
                "text": "mit\\ der\\ Befugnis\\,\\ im\\ Namen\\ der\\ Gesellschaft\\ mit\\ sich\\ im\\ eigenen\\ Namen\\ oder\\ als\\ Vertreter\\ eines\\ Dritten\\ Rechtsgesch\\äfte\\ abzuschlie\\ßen\\."
            }
        ],
        "officers": [
            {
                "class": "RetiredManagingDirector",
                "payload": {
                    "city": "Wiesenburg",
                    "dismissed": true,
                    "dob": "1965-12-11",
                    "lastname": "Hammerstädt",
                    "name": "Wolfgang Edgar Heinz"
                },
                "text": " Hammerstädt, Wolfgang Edgar Heinz, Wiesenburg, *11.12.1965."
            },
            {
                "class": "AppointedManagingDirector",
                "payload": {
                    "city": "Kleinmachnow",
                    "dob": "1958-08-03",
                    "flag": "sole representation",
                    "lastname": "Körber",
                    "name": "Robert"
                },
                "text": " Körber, Robert, Kleinmachnow, *03.08.1958, einzelvertretungsberechtigt"
            },
            {
                "class": "AppointedManagingDirector",
                "payload": {
                    "lastname": "mit der Befugnis",
                    "name": "im Namen der Gesellschaft mit sich im eigenen Namen oder als Vertreter eines Dritten Rechtsgeschäfte abzuschließen"
                },
                "text": " mit der Befugnis, im Namen der Gesellschaft mit sich im eigenen Namen oder als Vertreter eines Dritten Rechtsgeschäfte abzuschließen."
            }
        ]
    }
}