{
    "orig": {
        "aktenzeichen": "HRB 21126",
        "amtsgericht": "Bad Kreuznach",
        "event_date": "2018-01-22",
        "event_type": "Veränderungen",
        "federal_state": "rp",
        "full_text": "Amtsgericht Bad Kreuznach Aktenzeichen: HRB 21126 \nBekannt gemacht am: 22.01.2018 20:06 Uhr\n\n\n\n\nDie in () gesetzten Angaben der Anschrift und des Geschäftszweiges erfolgen ohne Gewähr.\nVeränderungen\n22.01.2018\n\nHRB 21126: Dry-Tec Klein UG (haftungsbeschränkt), Schweppenhausen, Renzenbergstraße 1, 55444 Schweppenhausen. Geändert, nun: Ist nur ein Liquidator bestellt, so vertritt er die Gesellschaft allein. Sind mehrere Liquidatoren bestellt, so wird die Gesellschaft durch die Liquidatoren gemeinsam vertreten. Nicht mehr Geschäftsführer, nunmehr bestellt als Liquidator: Klein, Mario, Schweppenhausen, *21.06.1968. Die Gesellschaft ist aufgelöst.",
        "gesellschafter": null,
        "inhaber": null,
        "name": "HRB 21126: Dry-Tec Klein UG (haftungsbeschränkt)",
        "notice_id": "237251",
        "posted_on": "2018-01-22",
        "rechtsform": null,
        "sitz": null,
        "url": "https://www.handelsregisterbekanntmachungen.de/en/skripte/hrb.php?rb_id=237251&land_abk=rp"
    },
    "parsed": {
        "flags": [
            {
                "flag": "ignore_for_now",
                "text": "Die\\ Gesellschaft\\ ist\\ aufgel\\öst\\."
            }
        ],
        "officers": [
            {
                "class": "Liquidator",
                "payload": {
                    "city": "Schweppenhausen",
                    "dob": "1968-06-21",
                    "lastname": "Klein",
                    "name": "Mario"
                },
                "text": " Klein, Mario, Schweppenhausen, *21.06.1968."
            }
        ]
    }
}