{
    "orig": {
        "aktenzeichen": "HRB 23764",
        "amtsgericht": "Köln",
        "event_date": "2007-07-10",
        "event_type": "Veränderungen",
        "federal_state": "nw",
        "full_text": "Amtsgericht Köln Aktenzeichen: HRB 23764 \nBekannt gemacht am: 13.07.2007 10:06 Uhr\n\n\n\n\nDie in () gesetzten Angaben der Geschäftsanschrift und des Geschäftszweiges erfolgen ohne Gewähr.\nVeränderungen\n10.07.2007\n\nAXA Service AG, Köln (Colonia-Allee 10-20, 51067 Köln). Gesamtprokura gemeinsam mit einem Vorstandsmitglied oder einem anderen Prokuristen: Diesterweg, Fritz-Dieter, Neunkirchen, *19.04.1952; Feuerer, Bernhard, Nieder Hilbersheim, *25.09.1957; Gießing, Rainer, Hünstetten, *19.02.1961; Heider, Peter, Köln, *23.03.1961; Hoffmann, Arndt, Wiesbaden, *26.11.1971; Huppert, Lydia, Pulheim, *04.01.1972; Junghans, Mandy, Wiesbaden, *26.02.1969; Dr. Jurecka, Christoph, Wiesbaden, *22.11.1974; Lindenmayer, Karl, Eppstein, *11.11.1951; Meffert, Werner, Neustadt-Wied, *01.01.1960; Schröder, Kareen, Reinheim, *17.01.1970; Dr. Schöllhammer, Rainer, Köln, *11.06.1974. Nach Änderung des Wohnortes und des Vornamens; nunmehr: Gesamtprokura gemeinsam mit einem Vorstandsmitglied oder einem anderen Prokuristen beschränkt auf die Zweigniederlassung 20097 Hamburg: Müller, Johann, Köln, *05.04.1949. Nach Änderung des Wohnortes; nunmehr: Gesamtprokura gemeinsam mit einem Vorstandsmitglied oder einem anderen Prokuristen beschränkt auf die Hauptniederlassung: Garreaud, Ronnie, Köln, *14.01.1974.",
        "gesellschafter": null,
        "inhaber": null,
        "name": "AXA Service AG",
        "notice_id": "238232",
        "posted_on": "2007-07-13",
        "rechtsform": null,
        "sitz": null,
        "url": "https://www.handelsregisterbekanntmachungen.de/en/skripte/hrb.php?rb_id=238232&land_abk=nw"
    },
    "parsed": {
        "officers": [
            {
                "class": "CommonProcuration",
                "payload": {
                    "city": "Neunkirchen",
                    "dob": "1952-04-19",
                    "lastname": "Diesterweg",
                    "name": "Fritz-Dieter"
                },
                "text": " Diesterweg, Fritz-Dieter, Neunkirchen, *19.04.1952"
            },
            {
                "class": "CommonProcuration",
                "payload": {
                    "city": "Nieder Hilbersheim",
                    "dob": "1957-09-25",
                    "lastname": "Feuerer",
                    "name": "Bernhard"
                },
                "text": " Feuerer, Bernhard, Nieder Hilbersheim, *25.09.1957"
            },
            {
                "class": "CommonProcuration",
                "payload": {
                    "city": "Hünstetten",
                    "dob": "1961-02-19",
                    "lastname": "Gießing",
                    "name": "Rainer"
                },
                "text": " Gießing, Rainer, Hünstetten, *19.02.1961"
            },
            {
                "class": "CommonProcuration",
                "payload": {
                    "city": "Köln",
                    "dob": "1961-03-23",
                    "lastname": "Heider",
                    "name": "Peter"
                },
                "text": " Heider, Peter, Köln, *23.03.1961"
            },
            {
                "class": "CommonProcuration",
                "payload": {
                    "city": "Wiesbaden",
                    "dob": "1971-11-26",
                    "lastname": "Hoffmann",
                    "name": "Arndt"
                },
                "text": " Hoffmann, Arndt, Wiesbaden, *26.11.1971"
            },
            {
                "class": "CommonProcuration",
                "payload": {
                    "city": "Pulheim",
                    "dob": "1972-01-04",
                    "lastname": "Huppert",
                    "name": "Lydia"
                },
                "text": " Huppert, Lydia, Pulheim, *04.01.1972"
            },
            {
                "class": "CommonProcuration",
                "payload": {
                    "city": "Wiesbaden",
                    "dob": "1969-02-26",
                    "lastname": "Junghans",
                    "name": "Mandy"
                },
                "text": " Junghans, Mandy, Wiesbaden, *26.02.1969"
            },
            {
                "class": "CommonProcuration",
                "payload": {
                    "city": "Wiesbaden",
                    "dob": "1974-11-22",
                    "lastname": "Jurecka",
                    "name": "Christoph",
                    "prof_title": "doctor"
                },
                "text": " Doctor Jurecka, Christoph, Wiesbaden, *22.11.1974"
            },
            {
                "class": "CommonProcuration",
                "payload": {
                    "city": "Eppstein",
                    "dob": "1951-11-11",
                    "lastname": "Lindenmayer",
                    "name": "Karl"
                },
                "text": " Lindenmayer, Karl, Eppstein, *11.11.1951"
            },
            {
                "class": "CommonProcuration",
                "payload": {
                    "city": "Neustadt-Wied",
                    "dob": "1960-01-01",
                    "lastname": "Meffert",
                    "name": "Werner"
                },
                "text": " Meffert, Werner, Neustadt-Wied, *01.01.1960"
            },
            {
                "class": "CommonProcuration",
                "payload": {
                    "city": "Reinheim",
                    "dob": "1970-01-17",
                    "lastname": "Schröder",
                    "name": "Kareen"
                },
                "text": " Schröder, Kareen, Reinheim, *17.01.1970"
            },
            {
                "class": "CommonProcuration",
                "payload": {
                    "city": "Köln",
                    "dob": "1974-06-11",
                    "lastname": "Schöllhammer",
                    "name": "Rainer",
                    "prof_title": "doctor"
                },
                "text": " Doctor Schöllhammer, Rainer, Köln, *11.06.1974."
            }
        ]
    }
}