{
    "orig": {
        "aktenzeichen": "HRB 1343",
        "amtsgericht": "Mainz",
        "event_date": "2018-02-08",
        "event_type": "Veränderungen",
        "federal_state": "rp",
        "full_text": "Amtsgericht Mainz Aktenzeichen: HRB 1343 \nBekannt gemacht am: 08.02.2018 15:05 Uhr\n\n\n\n\nDie in () gesetzten Angaben der Anschrift und des Geschäftszweiges erfolgen ohne Gewähr.\nVeränderungen\n08.02.2018\n\nHRB 1343: Darius Grundstücksverwaltungsgesellschaft mbH, Mainz, Emy-Roeder-Straße 2, 55129 Mainz. Ist nur ein Liquidator bestellt, so vertritt er die Gesellschaft allein. Sind mehrere Liquidatoren bestellt, so wird die Gesellschaft durch zwei Liquidatoren oder durch einen Liquidator gemeinsam mit einem Prokuristen vertreten. Jeder Liquidator ist befugt, im Namen der Gesellschaft mit sich im eigenen Namen oder als Vertreter eines Dritten Rechtsgeschäfte vorzunehmen. Bestellt als Liquidator: Dahlhaus, Hermann, Bingen am Rhein, *05.04.1947, einzelvertretungsberechtigt. Nicht mehr Geschäftsführer, jetzt Liquidator: Höhne, Heinz Günter, Mainz, *01.05.1957, einzelvertretungsberechtigt. Nicht mehr Geschäftsführer: Noll, Ralf Paul, Rockenberg, *02.02.1967; Rudnik, Oliver, Hofheim am Taunus, *08.03.1973; Trapp, Birgit, Friedrichsdorf, *10.05.1960. Prokura erloschen: Naumann, Christoph, Wiesbaden, *09.10.1969. Die Gesellschaft ist aufgelöst.",
        "gesellschafter": null,
        "inhaber": null,
        "name": "HRB 1343: Darius Grundstücksverwaltungsgesellschaft mbH",
        "notice_id": "238602",
        "posted_on": "2018-02-08",
        "rechtsform": null,
        "sitz": null,
        "url": "https://www.handelsregisterbekanntmachungen.de/en/skripte/hrb.php?rb_id=238602&land_abk=rp"
    },
    "parsed": {
        "flags": [
            {
                "flag": "CompanyClosed",
                "text": "Die\\ Gesellschaft\\ ist\\ aufgel\\öst\\."
            }
        ],
        "officers": [
            {
                "class": "Liquidator",
                "payload": {
                    "city": "Bingen am Rhein",
                    "dob": "1947-04-05",
                    "flag": "sole representation",
                    "lastname": "Dahlhaus",
                    "name": "Hermann"
                },
                "text": " Dahlhaus, Hermann, Bingen am Rhein, *05.04.1947, einzelvertretungsberechtigt."
            },
            {
                "class": "Liquidator",
                "payload": {
                    "city": "Mainz",
                    "dob": "1957-05-01",
                    "flag": "sole representation",
                    "lastname": "Höhne",
                    "name": "Heinz Günter"
                },
                "text": " Höhne, Heinz Günter, Mainz, *01.05.1957, einzelvertretungsberechtigt."
            },
            {
                "class": "DismissedManagingDirector",
                "payload": {
                    "city": "Rockenberg",
                    "dismissed": true,
                    "dob": "1967-02-02",
                    "lastname": "Noll",
                    "name": "Ralf Paul"
                },
                "text": " Noll, Ralf Paul, Rockenberg, *02.02.1967"
            },
            {
                "class": "DismissedManagingDirector",
                "payload": {
                    "city": "Hofheim am Taunus",
                    "dismissed": true,
                    "dob": "1973-03-08",
                    "lastname": "Rudnik",
                    "name": "Oliver"
                },
                "text": " Rudnik, Oliver, Hofheim am Taunus, *08.03.1973"
            },
            {
                "class": "DismissedManagingDirector",
                "payload": {
                    "city": "Friedrichsdorf",
                    "dismissed": true,
                    "dob": "1960-05-10",
                    "lastname": "Trapp",
                    "name": "Birgit"
                },
                "text": " Trapp, Birgit, Friedrichsdorf, *10.05.1960."
            },
            {
                "class": "ProcurationCancelled",
                "payload": {
                    "city": "Wiesbaden",
                    "dismissed": true,
                    "dob": "1969-10-09",
                    "lastname": "Naumann",
                    "name": "Christoph"
                },
                "text": " Naumann, Christoph, Wiesbaden, *09.10.1969."
            }
        ]
    }
}