{
    "orig": {
        "aktenzeichen": "HRA 17355",
        "amtsgericht": "Leipzig",
        "event_date": "2018-01-24",
        "event_type": "Veränderungen",
        "federal_state": "sn",
        "full_text": "Amtsgericht Leipzig Aktenzeichen: HRA 17355 \nBekannt gemacht am: 24.01.2018 18:30 Uhr\n\n\n\n\nDie in () gesetzten Angaben der Geschäftsanschrift und des Unternehmensgegenstandes erfolgen ohne Gewähr.\nVeränderungen\n24.01.2018\n\nHRA 17355: SIHAG - Sächsische Industriegüter Georg Pasternak e.K., Wurzen, Dehnitzer Weg 4b, 04808 Wurzen. Geändert, nun: Neue Firma: SIHAG - Sächsische Industriegüter Georg Pasternak e.K. Inhaberin Petra Plotzki. Nicht mehr Inhaber: Pasternak, Georg, Lossatal OT Mark Schönstädt, *19.09.1950. Nunmehr Inhaber: Plotzki, Petra, Machern OT Gerichshain, *19.04.1976. Der Übergang der im Betrieb des Geschäfts des früheren Inhabers Georg Pasternak begründeten Forderungen und Verbindlichkeiten auf den neuen Inhaber Petra Plotzki ist ausgeschlossen.",
        "gesellschafter": null,
        "inhaber": null,
        "name": "HRA 17355: SIHAG - Sächsische Industriegüter Georg Pasternak e.K.",
        "notice_id": "246239",
        "posted_on": "2018-01-24",
        "rechtsform": null,
        "sitz": null,
        "url": "https://www.handelsregisterbekanntmachungen.de/en/skripte/hrb.php?rb_id=246239&land_abk=sn"
    },
    "parsed": {
        "officers": [
            {
                "class": "NotLongerOwner",
                "payload": {
                    "city": "Lossatal OT Mark Schönstädt",
                    "dismissed": true,
                    "dob": "1950-09-19",
                    "lastname": "Pasternak",
                    "name": "Georg"
                },
                "text": " Pasternak, Georg, Lossatal OT Mark Schönstädt, *19.09.1950."
            },
            {
                "class": "Owner",
                "payload": {
                    "city": "Machern OT Gerichshain",
                    "dob": "1976-04-19",
                    "lastname": "Plotzki",
                    "name": "Petra"
                },
                "text": " Plotzki, Petra, Machern OT Gerichshain, *19.04.1976."
            }
        ]
    }
}