{
    "orig": {
        "aktenzeichen": "HRB 22555",
        "amtsgericht": "Chemnitz",
        "event_date": "2018-05-04",
        "event_type": "Veränderungen",
        "federal_state": "sn",
        "full_text": "Amtsgericht Chemnitz Aktenzeichen: HRB 22555 \nBekannt gemacht am: 04.05.2018 18:00 Uhr\n\n\n\n\nDie in () gesetzten Angaben der Geschäftsanschrift und des  Unternehmensgegenstandes erfolgen ohne Gewähr.\nVeränderungen\n04.05.2018\n\nHRB 22555: ASG - Anerkannte Schulgesellschaft Sachsen mbH, Annaberg-Buchholz, Lessingstraße 2, 09456 Annaberg-Buchholz. Ausgeschieden: Geschäftsführer: Richter, Peter, Leipzig, *23.09.1971. Vertretung und Wohnort geändert Geschäftsführer: Bretschneider, Toni, Bergen, *08.10.1982, einzelvertretungsberechtigt; mit der Befugnis, im Namen der Gesellschaft mit sich als Vertreter eines Dritten Rechtsgeschäfte abzuschließen.",
        "gesellschafter": null,
        "inhaber": null,
        "name": "HRB 22555: ASG - Anerkannte Schulgesellschaft Sachsen mbH",
        "notice_id": "251764",
        "posted_on": "2018-05-04",
        "rechtsform": null,
        "sitz": null,
        "url": "https://www.handelsregisterbekanntmachungen.de/en/skripte/hrb.php?rb_id=251764&land_abk=sn"
    },
    "parsed": {
        "officers": [
            {
                "class": "RetiredManagingDirector",
                "payload": {
                    "city": "Leipzig",
                    "dismissed": true,
                    "dob": "1971-09-23",
                    "lastname": "Richter",
                    "name": "Peter"
                },
                "text": " Richter, Peter, Leipzig, *23.09.1971."
            },
            {
                "class": "ManagingDirector",
                "payload": {
                    "city": "Bergen",
                    "dob": "1982-10-08",
                    "flag": "sole representation",
                    "lastname": "Bretschneider",
                    "name": "Toni"
                },
                "text": " Bretschneider, Toni, Bergen, *08.10.1982, einzelvertretungsberechtigt"
            },
            {
                "class": "ManagingDirector",
                "payload": {
                    "lastname": "mit der Befugnis",
                    "name": "im Namen der Gesellschaft mit sich als Vertreter eines Dritten Rechtsgeschäfte abzuschließen"
                },
                "text": " mit der Befugnis, im Namen der Gesellschaft mit sich als Vertreter eines Dritten Rechtsgeschäfte abzuschließen."
            }
        ]
    }
}