{
    "orig": {
        "aktenzeichen": "HRB 480962",
        "amtsgericht": "Stuttgart",
        "event_date": "2011-08-22",
        "event_type": "Veränderungen",
        "federal_state": "bw",
        "full_text": "Amtsgericht Stuttgart Aktenzeichen: HRB 480962   \nBekannt gemacht am: 29.08.2011 12:00 Uhr\n\n\n\n\nIn () gesetzte Angaben der Anschrift und des Geschäftszweiges erfolgen ohne Gewähr.\nVeränderungen\n22.08.2011\n\nGrossmann Verwaltungsgesellschaft mit beschränkter Haftung, Oberndorf am Neckar, Austraße 53, 78727 Oberndorf am Neckar. Die Gesellschafterversammlung vom 05.05.2011 hat die Neufassung des Gesellschaftsvertrages beschlossen. Durch Beschluss der Gesellschafterversammlung vom 05.05.2011 ist das Stammkapital auf Euro umgestellt. Das Stammkapital ist durch Beschluss der Gesellschafterversammlung vom gleichen Tag um 35,40 EUR auf 25.600,00 EUR erhöht. Stammkapital nun: 25.600,00 EUR. Bestellt als Geschäftsführer: Benedix, Christian, Fluorn-Winzeln, *23.04.1980; Maier, Vadim, Villingen-Schwenningen, *17.07.1977. Prokura erloschen: Benedix, Christian, Fluorn-Winzeln, *23.04.1980.",
        "gesellschafter": null,
        "inhaber": null,
        "name": "Grossmann Verwaltungsgesellschaft mit beschränkter Haftung",
        "notice_id": "263029",
        "posted_on": "2011-08-29",
        "rechtsform": null,
        "sitz": null,
        "url": "https://www.handelsregisterbekanntmachungen.de/en/skripte/hrb.php?rb_id=263029&land_abk=bw"
    },
    "parsed": {
        "officers": [
            {
                "class": "AppointedManagingDirector",
                "payload": {
                    "city": "Fluorn-Winzeln",
                    "dob": "1980-04-23",
                    "lastname": "Benedix",
                    "name": "Christian"
                },
                "text": " Benedix, Christian, Fluorn-Winzeln, *23.04.1980"
            },
            {
                "class": "AppointedManagingDirector",
                "payload": {
                    "city": "Villingen-Schwenningen",
                    "dob": "1977-07-17",
                    "lastname": "Maier",
                    "name": "Vadim"
                },
                "text": " Maier, Vadim, Villingen-Schwenningen, *17.07.1977."
            },
            {
                "class": "ProcurationCancelled",
                "payload": {
                    "city": "Fluorn-Winzeln",
                    "dismissed": true,
                    "dob": "1980-04-23",
                    "lastname": "Benedix",
                    "name": "Christian"
                },
                "text": " Benedix, Christian, Fluorn-Winzeln, *23.04.1980."
            }
        ]
    }
}