{
    "orig": {
        "aktenzeichen": "HRB 2987",
        "amtsgericht": "Oldenburg",
        "event_date": "2013-08-01",
        "event_type": "Veränderungen",
        "federal_state": "ni",
        "full_text": "Amtsgericht Oldenburg Aktenzeichen: HRB 2987   \nBekannt gemacht am: 02.08.2013 12:00 Uhr\n\n\n\n\nIn () gesetzte Angaben der Anschrift und des Geschäftszweiges erfolgen ohne Gewähr.\nVeränderungen\n01.08.2013\n\nVFNV Vertriebsgesellschaft für Wasseraufbereitungsanlagen mbH, Oldenburg, Diedrich-Dannemann-Straße 255, 26203 Wardenburg. Neue Geschäftsanschrift: Prinzessinweg 118, 26122 Oldenburg. Bestellt als Geschäftsführer: Höfermann, Thomas, Worpswede, *08.11.1956, einzelvertretungsberechtigt; mit der Befugnis, im Namen der Gesellschaft mit sich im eigenen Namen oder als Vertreter eines Dritten Rechtsgeschäfte abzuschließen. Nicht mehr Geschäftsführer: Schmidt, Torsten, Stadland, *30.05.1966; Vetter, Ernst, Varel.",
        "gesellschafter": null,
        "inhaber": null,
        "name": "VFNV Vertriebsgesellschaft für Wasseraufbereitungsanlagen mbH",
        "notice_id": "265078",
        "posted_on": "2013-08-02",
        "rechtsform": null,
        "sitz": null,
        "url": "https://www.handelsregisterbekanntmachungen.de/en/skripte/hrb.php?rb_id=265078&land_abk=ni"
    },
    "parsed": {
        "flags": [
            {
                "flag": "with the power to enter into legal transactions on behalf of the Company with itself or as a representative of a third party",
                "text": "mit\\ der\\ Befugnis\\,\\ im\\ Namen\\ der\\ Gesellschaft\\ mit\\ sich\\ im\\ eigenen\\ Namen\\ oder\\ als\\ Vertreter\\ eines\\ Dritten\\ Rechtsgesch\\äfte\\ abzuschlie\\ßen\\."
            }
        ],
        "labels": [
            {
                "label": "address",
                "text": " Prinzessinweg 118, 26122 Oldenburg."
            }
        ],
        "officers": [
            {
                "class": "AppointedManagingDirector",
                "payload": {
                    "city": "Worpswede",
                    "dob": "1956-11-08",
                    "flag": "sole representation",
                    "lastname": "Höfermann",
                    "name": "Thomas"
                },
                "text": " Höfermann, Thomas, Worpswede, *08.11.1956, einzelvertretungsberechtigt"
            },
            {
                "class": "AppointedManagingDirector",
                "payload": {
                    "lastname": "mit der Befugnis",
                    "name": "im Namen der Gesellschaft mit sich im eigenen Namen oder als Vertreter eines Dritten Rechtsgeschäfte abzuschließen"
                },
                "text": " mit der Befugnis, im Namen der Gesellschaft mit sich im eigenen Namen oder als Vertreter eines Dritten Rechtsgeschäfte abzuschließen."
            },
            {
                "class": "DismissedManagingDirector",
                "payload": {
                    "city": "Stadland",
                    "dismissed": true,
                    "dob": "1966-05-30",
                    "lastname": "Schmidt",
                    "name": "Torsten"
                },
                "text": " Schmidt, Torsten, Stadland, *30.05.1966"
            },
            {
                "class": "DismissedManagingDirector",
                "payload": {
                    "city": "Varel",
                    "dismissed": true,
                    "lastname": "Vetter",
                    "name": "Ernst"
                },
                "text": " Vetter, Ernst, Varel."
            }
        ]
    }
}