{
    "orig": {
        "aktenzeichen": "HRB 91090",
        "amtsgericht": "Hamburg",
        "event_date": "2015-08-07",
        "event_type": "Veränderungen",
        "federal_state": "hh",
        "full_text": "Amtsgericht Hamburg Aktenzeichen: HRB 91090 \nBekannt gemacht am: 07.08.2015 15:04 Uhr\n\n\n\n\nIn () gesetzte Angaben der Anschrift und des Geschäftszweiges erfolgen ohne Gewähr.\nVeränderungen\n07.08.2015\n\nHRB 91090: GIS Getränkeindustrieservice GmbH, Hamburg, Kronskamp 132, 22880 Wedel. Ausgeschieden Geschäftsführer: Wörner, Armin, Hamburg, *04.03.1940. Bestellt Geschäftsführer: Heinz, Eberhard, Siegen, *20.05.1959; Kalle, Andreas, Hattingen, *02.04.1963, jeweils einzelvertretungsberechtigt; mit der Befugnis, im Namen der Gesellschaft mit sich als Vertreter eines Dritten Rechtsgeschäfte abzuschließen.",
        "gesellschafter": null,
        "inhaber": null,
        "name": "HRB 91090: GIS Getränkeindustrieservice GmbH",
        "notice_id": "273152",
        "posted_on": "2015-08-07",
        "rechtsform": null,
        "sitz": null,
        "url": "https://www.handelsregisterbekanntmachungen.de/en/skripte/hrb.php?rb_id=273152&land_abk=hh"
    },
    "parsed": {
        "officers": [
            {
                "class": "RetiredManagingDirector",
                "payload": {
                    "city": "Hamburg",
                    "dismissed": true,
                    "dob": "1940-04-03",
                    "lastname": "Wörner",
                    "name": "Armin"
                },
                "text": " Wörner, Armin, Hamburg, *04.03.1940."
            },
            {
                "class": "AppointedManagingDirector",
                "payload": {
                    "city": "Siegen",
                    "dob": "1959-05-20",
                    "lastname": "Heinz",
                    "name": "Eberhard"
                },
                "text": " Heinz, Eberhard, Siegen, *20.05.1959"
            }
        ]
    }
}