{
    "orig": {
        "aktenzeichen": "HRB 206228",
        "amtsgericht": "Stuttgart",
        "event_date": "2011-11-22",
        "event_type": "Veränderungen",
        "federal_state": "bw",
        "full_text": "Amtsgericht Stuttgart Aktenzeichen: HRB 206228   \nBekannt gemacht am: 28.11.2011 12:00 Uhr\n\n\n\n\nIn () gesetzte Angaben der Anschrift und des Geschäftszweiges erfolgen ohne Gewähr.\nVeränderungen\n22.11.2011\n\nTSP Totally Service Packages GmbH, Markgröningen, Maybachstr. 34, 71706 Markgröningen. Die aufgelöste Gesellschaft wird nicht mehr durch den bzw. die Geschäftsführer, sondern durch den bzw. die Liquidatoren vertreten. Gem. § 384 Absatz 2 FamFG von Amts wegen vermerkt. Gem. § 384 Absatz 2 FamFG von Amts wegen vermerkt: Der bisherige Geschäftsführer ist nunmehr Liquidator: Berroth, Kurt, Markgröningen, *17.11.1947. Durch rechtskräftigen Beschluss des Amtsgerichts Ludwigsburg vom 18.10.2011 (5 IN 282/11-j) wurde die Eröffnung des Insolvenzverfahrens über das Vermögen der Gesellschaft mangels einer den Kosten des Verfahrens entsprechenden Masse abgewiesen. Die Gesellschaft ist hierdurch aufgelöst. Gemäß § 60 Abs. 1 GmbHG i.V. § 65 Abs. 1 GmbHG von Amts wegen eingetragen. Die am 19.09.2011 eingetragenen Sicherungsmaßnahmen sind durch diesen Beschluss aufgehoben worden.",
        "gesellschafter": null,
        "inhaber": null,
        "name": "TSP Totally Service Packages GmbH",
        "notice_id": "276121",
        "posted_on": "2011-11-28",
        "rechtsform": null,
        "sitz": null,
        "url": "https://www.handelsregisterbekanntmachungen.de/en/skripte/hrb.php?rb_id=276121&land_abk=bw"
    },
    "parsed": {
        "officers": [
            {
                "class": "Liquidator",
                "payload": {
                    "city": "Markgröningen",
                    "dob": "1947-11-17",
                    "lastname": "Berroth",
                    "name": "Kurt"
                },
                "text": " Berroth, Kurt, Markgröningen, *17.11.1947."
            }
        ]
    }
}