{
    "orig": {
        "aktenzeichen": "HRB 19715 HB",
        "amtsgericht": "Bremen",
        "event_date": "2011-09-01",
        "event_type": "Veränderungen",
        "federal_state": "hb",
        "full_text": "Amtsgericht Bremen Aktenzeichen: HRB 19715 HB  \nBekannt gemacht am: 02.09.2011 22:00 Uhr\n\n\n\n\nIn () gesetzte Angaben der Anschrift und des Geschäftszweiges erfolgen ohne Gewähr.\nVeränderungen\n01.09.2011\n\nMuehlhan Bremen GmbH, Bremen, Zur Westpier 40, 28755 Bremen. Geschäftsanschrift: Zur Westpier 40, 28755 Bremen. Geschäftsführer: Schaak, Michael; nunmehr mit der Befugnis die Gesellschaft mit einem anderen Geschäftsführer oder einem Prokuristen zu vertreten, mit der Befugnis Rechtsgeschäfte als Vertreter Dritter abzuschließen. Durch Beschluss der Gesellschafterversammlung vom 04.08.2011 wurde das Stammkapital zum Zwecke der Verschmelzung mit der Muehlhan GmbH mit Sitz in Emden (Amtsgericht Aurich HRB 100377) und der Muehlhan Rostock GmbH mit Sitz in Rostock (Amtsgericht Rostock HRB 10628)um 700.000 Euro auf 1.000.000 Euro erhöht sowie die Firma geändert und entsprechend § 1 und § 4 des Gesellschaftsvertrags geändert. Die Firma ist geändert in: Muehlhan Deutschland GmbH..",
        "gesellschafter": null,
        "inhaber": null,
        "name": "Muehlhan Bremen GmbH",
        "notice_id": "27691",
        "posted_on": "2011-09-02",
        "rechtsform": null,
        "sitz": null,
        "url": "https://www.handelsregisterbekanntmachungen.de/en/skripte/hrb.php?rb_id=27691&land_abk=hb"
    },
    "parsed": {
        "labels": [
            {
                "label": "address",
                "text": " Zur Westpier 40, 28755 Bremen."
            }
        ],
        "officers": [
            {
                "class": "ManagingDirector",
                "payload": {
                    "lastname": "Schaak",
                    "name": "Michael"
                },
                "text": " Schaak, Michael"
            },
            {
                "class": "ManagingDirector",
                "payload": {
                    "lastname": "nunmehr mit der Befugnis die Gesellschaft mit einem anderen Geschäftsführer oder einem Prokuristen zu vertreten",
                    "name": "mit der Befugnis Rechtsgeschäfte als Vertreter Dritter abzuschließen"
                },
                "text": " nunmehr mit der Befugnis die Gesellschaft mit einem anderen Geschäftsführer oder einem Prokuristen zu vertreten, mit der Befugnis Rechtsgeschäfte als Vertreter Dritter abzuschließen."
            }
        ]
    }
}