{
    "orig": {
        "aktenzeichen": "HRB 201555",
        "amtsgericht": "Jena",
        "event_date": "2009-06-30",
        "event_type": "Veränderungen",
        "federal_state": "th",
        "full_text": "Amtsgericht Jena Aktenzeichen: HRB 201555 \nBekannt gemacht am: 01.07.2009 12:00 Uhr\n\n\n\n\nDie in () gesetzten Angaben der Geschäftsanschrift und des Unternehmensgegenstandes erfolgen ohne Gewähr.\nVeränderungen\n30.06.2009\n\nHM - Bau GmbH, Hirschberg, (Lobensteiner Str. 25, 07927 Hirschberg).Die Gesellschaft wird durch den/die Liquidator/en vertreten. Geändert, nun: Liquidator: Härtl-Müller, Helfried, Döhlau, *05.01.1943. Das Gesamtvollstreckungsverfahren ist durch Beschluss des Amtsgerichts Gera vom 16.04.2009 (Az. 8 N 389/97) nach Verteilung des Erlöses und nach Prüfung des Abschlussberichts eingestellt. Von Amts wegen eingetragen. Die Gesellschaft ist infolge der Eröffnung des Gesamtvollstreckungsverfahrens aufgelöst. Von Amts wegen eingetragen gem. § 65 GmbHG.",
        "gesellschafter": null,
        "inhaber": null,
        "name": "HM - Bau GmbH",
        "notice_id": "28280",
        "posted_on": "2009-07-01",
        "rechtsform": null,
        "sitz": null,
        "url": "https://www.handelsregisterbekanntmachungen.de/en/skripte/hrb.php?rb_id=28280&land_abk=th"
    },
    "parsed": {
        "officers": [
            {
                "class": "Liquidator",
                "payload": {
                    "city": "Döhlau",
                    "dob": "1943-01-05",
                    "lastname": "Härtl-Müller",
                    "name": "Helfried"
                },
                "text": ": Härtl-Müller, Helfried, Döhlau, *05.01.1943."
            }
        ]
    }
}