{
    "orig": {
        "aktenzeichen": "HRA 84715",
        "amtsgericht": "Darmstadt",
        "event_date": "2012-06-18",
        "event_type": "Neueintragungen",
        "federal_state": "he",
        "full_text": "Amtsgericht Darmstadt Aktenzeichen: HRA 84715   \nBekannt gemacht am: 19.06.2012 12:00 Uhr\n\n\n\n\nVeröffentlichungen des Amtsgerichts Darmstadt\r\r\rIn () gesetzte Angaben der Anschrift und des Geschäftszweiges erfolgen ohne Gewähr.\nNeueintragungen\n18.06.2012\n\nSchaaf & Väth OHG, Beerfelden, Gebhardshütte 14, 64743 Beerfelden. (die Herstellung und der Vertrieb von Gartenartikeln). Offene Handelsgesellschaft. Geschäftsanschrift: Gebhardshütte 14, 64743 Beerfelden. Allgemeine Vertretungsregelung: Jeder persönlich haftende Gesellschafter vertritt einzeln. Jeder persönlich haftende Gesellschafter ist befugt, im Namen der Gesellschaft mit sich im eigenen Namen oder als Vertreter eines Dritten Rechtsgeschäfte vorzunehmen. Persönlich haftender Gesellschafter: Schaaf, Petra, Beerfelden, *28.02.1968; Väth, Thomas Anton, Beerfelden, *12.11.1964.",
        "gesellschafter": null,
        "inhaber": null,
        "name": "Schaaf & Väth OHG",
        "notice_id": "285527",
        "posted_on": "2012-06-19",
        "rechtsform": null,
        "sitz": null,
        "url": "https://www.handelsregisterbekanntmachungen.de/en/skripte/hrb.php?rb_id=285527&land_abk=he"
    },
    "parsed": {
        "labels": [
            {
                "label": "address",
                "text": " Gebhardshütte 14, 64743 Beerfelden."
            }
        ],
        "officers": [
            {
                "class": "PersonalPartner",
                "payload": {
                    "city": "Beerfelden",
                    "dob": "1968-02-28",
                    "lastname": "Schaaf",
                    "name": "Petra"
                },
                "text": " Schaaf, Petra, Beerfelden, *28.02.1968"
            },
            {
                "class": "PersonalPartner",
                "payload": {
                    "city": "Beerfelden",
                    "dob": "1964-11-12",
                    "lastname": "Väth",
                    "name": "Thomas Anton"
                },
                "text": " Väth, Thomas Anton, Beerfelden, *12.11.1964."
            }
        ]
    }
}