{
    "orig": {
        "aktenzeichen": "HRB 7353",
        "amtsgericht": "Arnsberg",
        "event_date": "2008-02-28",
        "event_type": "Veränderungen",
        "federal_state": "nw",
        "full_text": "Amtsgericht Arnsberg Aktenzeichen: HRB 7353 \nBekannt gemacht am: 05.03.2008 12:00 Uhr\n\n\n\n\nDie in () gesetzten Angaben der Geschäftsanschrift und des Unternehmensgegenstandes erfolgen ohne Gewähr.\nVeränderungen\n28.02.2008\n\nWepa Professional Verwaltungs-GmbH, Arnsberg (Rönkhauser Str. 26, 59757 Arnsberg). Gesamtprokura gemeinsam mit einem Geschäftsführer oder einem anderen Prokuristen: Fraikin, Michael, Arnsberg, *15.01.1955; Meier, Manfred, Niederkassel, *08.08.1951; Rohde, Martin, Arnsberg, *24.07.1963; Smietana, Hartmut, Schalksmühle, *27.07.1958; Zecher, Hans-Jürgen, Neu-Isenburg, *09.04.1963.",
        "gesellschafter": null,
        "inhaber": null,
        "name": "Wepa Professional Verwaltungs-GmbH",
        "notice_id": "302996",
        "posted_on": "2008-03-05",
        "rechtsform": null,
        "sitz": null,
        "url": "https://www.handelsregisterbekanntmachungen.de/en/skripte/hrb.php?rb_id=302996&land_abk=nw"
    },
    "parsed": {
        "officers": [
            {
                "class": "CommonProcuration",
                "payload": {
                    "city": "Arnsberg",
                    "dob": "1955-01-15",
                    "lastname": "Fraikin",
                    "name": "Michael"
                },
                "text": " Fraikin, Michael, Arnsberg, *15.01.1955"
            },
            {
                "class": "CommonProcuration",
                "payload": {
                    "city": "Niederkassel",
                    "dob": "1951-08-08",
                    "lastname": "Meier",
                    "name": "Manfred"
                },
                "text": " Meier, Manfred, Niederkassel, *08.08.1951"
            },
            {
                "class": "CommonProcuration",
                "payload": {
                    "city": "Arnsberg",
                    "dob": "1963-07-24",
                    "lastname": "Rohde",
                    "name": "Martin"
                },
                "text": " Rohde, Martin, Arnsberg, *24.07.1963"
            },
            {
                "class": "CommonProcuration",
                "payload": {
                    "city": "Schalksmühle",
                    "dob": "1958-07-27",
                    "lastname": "Smietana",
                    "name": "Hartmut"
                },
                "text": " Smietana, Hartmut, Schalksmühle, *27.07.1958"
            },
            {
                "class": "CommonProcuration",
                "payload": {
                    "city": "Neu-Isenburg",
                    "dob": "1963-04-09",
                    "lastname": "Zecher",
                    "name": "Hans-Jürgen"
                },
                "text": " Zecher, Hans-Jürgen, Neu-Isenburg, *09.04.1963."
            }
        ]
    }
}