{
    "orig": {
        "aktenzeichen": "HRB 157361 B",
        "amtsgericht": "Charlottenburg (Berlin)",
        "event_date": "2014-10-21",
        "event_type": "Veränderungen",
        "federal_state": "be",
        "full_text": "Amtsgericht Charlottenburg (Berlin) Aktenzeichen: HRB 157361 B \nBekannt gemacht am: 22.10.2014 10:08 Uhr\n\n\n\n\nIn () gesetzte Angaben der Anschrift und des Unternehmensgegenstandes erfolgen ohne Gewähr:\nVeränderungen\n21.10.2014\n\nHRB 157361 B: Firma / Name vormals: Blitz B14-340 GmbH, Berlin, Potsdamer Platz 5, 10785 Berlin. Firma: GoTech Internet GmbH; Sitz / Zweigniederlassung: Geschäftsanschrift: Potsdamer Platz 5, 10785 Berlin; Gegenstand: Handel und Vertrieb von Getränken aller Art über Onlineshops sowie Konzeption, Entwicklung und Programmierung von Hard- und Software und alle damit im Zusammenhang stehenden Tätigkeiten.  Nicht mehr Geschäftsführer: 1. Gogalla, Katja; Nicht mehr Geschäftsführer: 2. Selnes, Randi Mette; Geschäftsführer: 3.\nTran, Le Thien Phuc, *03.01.1984, Berlin; Rechtsform: Durch Beschluss der Gesellschafterversammlung vom 04. September 2014 ist der Gesellschaftsvertrag geändert in § 1 (Firma), § 4 (Unternehmensgegenstand) und § 5 (Stammkapital).",
        "gesellschafter": null,
        "inhaber": null,
        "name": "Tran",
        "notice_id": "306780",
        "posted_on": "2014-10-22",
        "rechtsform": null,
        "sitz": null,
        "url": "https://www.handelsregisterbekanntmachungen.de/en/skripte/hrb.php?rb_id=306780&land_abk=be"
    },
    "parsed": {
        "labels": [
            {
                "label": "WHUT",
                "text": " Firma / Name vormals: Blitz B14-340 GmbH, Berlin, Potsdamer Platz 5, 10785 Berlin."
            },
            {
                "label": "company",
                "text": " Geschäftsanschrift: Potsdamer Platz 5, 10785 Berlin"
            },
            {
                "label": "address",
                "text": " Potsdamer Platz 5, 10785 Berlin"
            }
        ],
        "officers": [
            {
                "class": "DismissedManagingDirector",
                "payload": {
                    "dismissed": true,
                    "lastname": "Gogalla",
                    "name": "Katja"
                },
                "text": " Gogalla, Katja"
            },
            {
                "class": "DismissedManagingDirector",
                "payload": {
                    "dismissed": true,
                    "lastname": "Selnes",
                    "name": "Randi Mette"
                },
                "text": " Selnes, Randi Mette"
            },
            {
                "class": "ManagingDirector",
                "payload": {
                    "city": "Berlin",
                    "dob": "1984-03-01",
                    "lastname": "Tran",
                    "name": "Le Thien Phuc"
                },
                "text": " Tran, Le Thien Phuc, *03.01.1984, Berlin"
            }
        ]
    }
}