{
    "orig": {
        "aktenzeichen": "HRB 22694",
        "amtsgericht": "Wiesbaden",
        "event_date": "2012-12-18",
        "event_type": "Veränderungen",
        "federal_state": "he",
        "full_text": "Amtsgericht Wiesbaden Aktenzeichen: HRB 22694   \nBekannt gemacht am: 21.12.2012 12:00 Uhr\n\n\n\n\nVeröffentlichungen des Amtsgerichts Wiesbaden\r\r\rIn () gesetzte Angaben der Anschrift und des Geschäftszweiges erfolgen ohne Gewähr.\nVeränderungen\n18.12.2012\n\nCommerz Real Western Europe GmbH, Wiesbaden, Friedrichstraße 25, 65185 Wiesbaden. Nicht mehr Geschäftsführer: Siegel, Carl-Christian, Frankfurt am Main, *12.02.1966; Weinbrenner, Martin, Weilburg, *22.11.1965. Bestellt als Geschäftsführerin: Becker, Gitta, Frankfurt am Main, *12.01.1962. Bestellt als Geschäftsführer: Feix, Sebastian, London (Großbritannien), *10.11.1983. Prokura erloschen: Feix, Sebastian, London (Großbritanien), *10.11.1983; Hafner, Jonas, Wiesbaden, *24.09.1976.",
        "gesellschafter": null,
        "inhaber": null,
        "name": "Commerz Real Western Europe GmbH",
        "notice_id": "310816",
        "posted_on": "2012-12-21",
        "rechtsform": null,
        "sitz": null,
        "url": "https://www.handelsregisterbekanntmachungen.de/en/skripte/hrb.php?rb_id=310816&land_abk=he"
    },
    "parsed": {
        "officers": [
            {
                "class": "DismissedManagingDirector",
                "payload": {
                    "city": "Frankfurt am Main",
                    "dismissed": true,
                    "dob": "1966-12-02",
                    "lastname": "Siegel",
                    "name": "Carl-Christian"
                },
                "text": " Siegel, Carl-Christian, Frankfurt am Main, *12.02.1966"
            },
            {
                "class": "ManagingDirector",
                "payload": {
                    "city": "Frankfurt am Main",
                    "dob": "1962-12-01",
                    "lastname": "Becker",
                    "name": "Gitta"
                },
                "text": " Becker, Gitta, Frankfurt am Main, *12.01.1962."
            },
            {
                "class": "AppointedManagingDirector",
                "payload": {
                    "city": "London (Großbritannien)",
                    "dob": "1983-10-11",
                    "lastname": "Feix",
                    "name": "Sebastian"
                },
                "text": " Feix, Sebastian, London (Großbritannien), *10.11.1983."
            },
            {
                "class": "ProcurationCancelled",
                "payload": {
                    "city": "London (Großbritanien)",
                    "dismissed": true,
                    "dob": "1983-10-11",
                    "lastname": "Feix",
                    "name": "Sebastian"
                },
                "text": " Feix, Sebastian, London (Großbritanien), *10.11.1983"
            }
        ]
    }
}