{
    "orig": {
        "aktenzeichen": "HRB 140504",
        "amtsgericht": "Hamburg",
        "event_date": "2016-10-12",
        "event_type": "Veränderungen",
        "federal_state": "hh",
        "full_text": "Amtsgericht Hamburg Aktenzeichen: HRB 140504 \nBekannt gemacht am: 12.10.2016 15:04 Uhr\n\n\n\n\nIn () gesetzte Angaben der Anschrift und des Geschäftszweiges erfolgen ohne Gewähr.\nVeränderungen\n12.10.2016\n\nHRB 140504: PROMOVIA Fünfundachtzigste Verwaltungsgesellschaft mbH, Hamburg, New-York-Ring 13, 22297 Hamburg. Die Gesellschafterversammlung vom 04.08.2016 hat die Änderung des Gesellschaftsvertrages in den §§ 1 Abs. 1 (Firma), 2 (Gegenstand) und 3 sowie die ersatzlose Streichung des § 6 beschlossen. Neue Firma: Idean Enterprises GmbH. Änderung zur Geschäftsanschrift: Friedrichstraße 68, floor 7, office 773, 10117 Berlin. Neuer Unternehmensgegenstand: Gegenstand des Unternehmens ist die Gestaltung, Entwicklung und Produktion digitaler Nutzererfahrungen und digitaler Dienstleistungen sowie der Handel mit allen hiermit im Zusammenhang stehenden Waren und Dienstleistungen. Ausgeschieden Geschäftsführer: Witt, Uwe, Hamburg, *28.12.1958. Bestellt Geschäftsführer: Bell, Cameron Hunter, Berlin, *22.10.1982; Lähdesmäki, Risto, Los Altos / Vereinigte Staaten, *11.11.1972, jeweils einzelvertretungsberechtigt.",
        "gesellschafter": null,
        "inhaber": null,
        "name": "HRB 140504: PROMOVIA Fünfundachtzigste Verwaltungsgesellschaft mbH",
        "notice_id": "310983",
        "posted_on": "2016-10-12",
        "rechtsform": null,
        "sitz": null,
        "url": "https://www.handelsregisterbekanntmachungen.de/en/skripte/hrb.php?rb_id=310983&land_abk=hh"
    },
    "parsed": {
        "labels": [
            {
                "label": "address",
                "text": " Friedrichstraße 68, floor 7, office 773, 10117 Berlin."
            }
        ],
        "officers": [
            {
                "class": "RetiredManagingDirector",
                "payload": {
                    "city": "Hamburg",
                    "dismissed": true,
                    "dob": "1958-12-28",
                    "lastname": "Witt",
                    "name": "Uwe"
                },
                "text": " Witt, Uwe, Hamburg, *28.12.1958."
            },
            {
                "class": "AppointedManagingDirector",
                "payload": {
                    "city": "Berlin",
                    "dob": "1982-10-22",
                    "lastname": "Bell",
                    "name": "Cameron Hunter"
                },
                "text": " Bell, Cameron Hunter, Berlin, *22.10.1982"
            }
        ]
    }
}