{
    "orig": {
        "aktenzeichen": "HRA 492 B",
        "amtsgericht": "Charlottenburg (Berlin)",
        "event_date": "2014-12-01",
        "event_type": "Veränderungen",
        "federal_state": "be",
        "full_text": "Amtsgericht Charlottenburg (Berlin) Aktenzeichen: HRA 492 B \nBekannt gemacht am: 02.12.2014 12:43 Uhr\n\n\n\n\nIn () gesetzte Angaben der Anschrift und des Unternehmensgegenstandes erfolgen ohne Gewähr:\nVeränderungen\n01.12.2014\n\nHRA 492 B: DekaBank Deutsche Girozentrale, Berlin und Frankfurt (Mainzer Landstr. 16, 60325 Frankfurt am Main). Nicht mehr Vorstand: 9. Behrens, Oliver Markus; Prokura: Nicht mehr Prokurist: 47. Kühl, Volkmar; Nicht mehr Prokurist: 133. Kern, Helmut; Nicht mehr Prokurist: 194. Sommerfeld, Dietmar; Nicht mehr Prokurist: 345. Schmal, Dirk; Nicht mehr Prokurist: 437. Böhme, Klaus-Dieter; Nicht mehr Prokurist: 480. Sperling, Ulrike; Nicht mehr Prokurist: 557. Langrock, Sabine; Nicht mehr Prokurist: 618. Knezovic, Mateo; 634.\nRasmussen, Niels, *09.01.1967, Flensburg; Prokura gemeinsam mit einem Vorstand oder einem weiteren Prokuristen; 635.\nSchütt, Stefan, *09.09.1976, Mainz; Prokura gemeinsam mit einem Vorstand oder einem weiteren Prokuristen; 636.\nWeydert, Patrick, *23.11.1966, Gonderange/Luxemburg; Prokura gemeinsam mit einem Vorstand oder einem weiteren Prokuristen",
        "gesellschafter": null,
        "inhaber": null,
        "name": "Weydert",
        "notice_id": "311342",
        "posted_on": "2014-12-02",
        "rechtsform": null,
        "sitz": null,
        "url": "https://www.handelsregisterbekanntmachungen.de/en/skripte/hrb.php?rb_id=311342&land_abk=be"
    },
    "parsed": {
        "errors": [
            {
                "kls": "ParsingError",
                "text": "Cannot parse a Person from  634., error text was a person without DOB, number of chunks: 1"
            }
        ],
        "labels": [
            {
                "label": "WHUT",
                "text": " DekaBank Deutsche Girozentrale, Berlin und Frankfurt (Mainzer Landstr 16, 60325 Frankfurt am Main)."
            }
        ],
        "officers": [
            {
                "class": "Person",
                "payload": {
                    "lastname": "Behrens",
                    "name": "Oliver Markus",
                    "ref": 9
                },
                "text": "9) Behrens, Oliver Markus"
            },
            {
                "class": "NotAProcurator",
                "payload": {
                    "dismissed": true,
                    "lastname": "Kühl",
                    "name": "Volkmar",
                    "ref": 47
                },
                "text": "47) Kühl, Volkmar"
            },
            {
                "class": "NotAProcurator",
                "payload": {
                    "dismissed": true,
                    "lastname": "Kern",
                    "name": "Helmut",
                    "ref": 133
                },
                "text": "133) Kern, Helmut"
            },
            {
                "class": "NotAProcurator",
                "payload": {
                    "dismissed": true,
                    "lastname": "Sommerfeld",
                    "name": "Dietmar",
                    "ref": 194
                },
                "text": "194) Sommerfeld, Dietmar"
            },
            {
                "class": "NotAProcurator",
                "payload": {
                    "dismissed": true,
                    "lastname": "Schmal",
                    "name": "Dirk",
                    "ref": 345
                },
                "text": "345) Schmal, Dirk"
            },
            {
                "class": "NotAProcurator",
                "payload": {
                    "dismissed": true,
                    "lastname": "Böhme",
                    "name": "Klaus-Dieter",
                    "ref": 437
                },
                "text": "437) Böhme, Klaus-Dieter"
            },
            {
                "class": "NotAProcurator",
                "payload": {
                    "dismissed": true,
                    "lastname": "Sperling",
                    "name": "Ulrike",
                    "ref": 480
                },
                "text": "480) Sperling, Ulrike"
            },
            {
                "class": "NotAProcurator",
                "payload": {
                    "dismissed": true,
                    "lastname": "Langrock",
                    "name": "Sabine",
                    "ref": 557
                },
                "text": "557) Langrock, Sabine"
            },
            {
                "class": "NotAProcurator",
                "payload": {
                    "dismissed": true,
                    "lastname": "Knezovic",
                    "name": "Mateo",
                    "ref": 618
                },
                "text": "618) Knezovic, Mateo"
            }
        ]
    }
}