{
    "orig": {
        "aktenzeichen": "HRB 82839",
        "amtsgericht": "Hamburg",
        "event_date": "2017-02-20",
        "event_type": "Veränderungen",
        "federal_state": "hh",
        "full_text": "Amtsgericht Hamburg Aktenzeichen: HRB 82839 \nBekannt gemacht am: 20.02.2017 11:16 Uhr\n\n\n\n\nIn () gesetzte Angaben der Anschrift und des Geschäftszweiges erfolgen ohne Gewähr.\nVeränderungen\n20.02.2017\n\nHRB 82839: Verwaltung IFÖ Zweite Immobilienfonds für Österreich GmbH, Hamburg, Königstraße 28, 22767 Hamburg. Bestellt Liquidator: Scharenberg, Oliver, Hamburg, *14.04.1964, einzelvertretungsberechtigt; mit der Befugnis, im Namen der Gesellschaft mit sich im eigenen Namen oder als Vertreter eines Dritten Rechtsgeschäfte abzuschließen. Ausgeschieden Liquidator: Riemer, Carsten Helmut, Klein Nordende, *23.06.1960.",
        "gesellschafter": null,
        "inhaber": null,
        "name": "HRB 82839: Verwaltung IFÖ Zweite Immobilienfonds für Österreich GmbH",
        "notice_id": "323534",
        "posted_on": "2017-02-20",
        "rechtsform": null,
        "sitz": null,
        "url": "https://www.handelsregisterbekanntmachungen.de/en/skripte/hrb.php?rb_id=323534&land_abk=hh"
    },
    "parsed": {
        "flags": [
            {
                "flag": "with the power to enter into legal transactions on behalf of the Company with itself or as a representative of a third party",
                "text": "mit\\ der\\ Befugnis\\,\\ im\\ Namen\\ der\\ Gesellschaft\\ mit\\ sich\\ im\\ eigenen\\ Namen\\ oder\\ als\\ Vertreter\\ eines\\ Dritten\\ Rechtsgesch\\äfte\\ abzuschlie\\ßen\\."
            }
        ],
        "officers": [
            {
                "class": "Liquidator",
                "payload": {
                    "city": "Hamburg",
                    "dob": "1964-04-14",
                    "flag": "sole representation",
                    "lastname": "Scharenberg",
                    "name": "Oliver"
                },
                "text": " Scharenberg, Oliver, Hamburg, *14.04.1964, einzelvertretungsberechtigt"
            },
            {
                "class": "Liquidator",
                "payload": {
                    "lastname": "mit der Befugnis",
                    "name": "im Namen der Gesellschaft mit sich im eigenen Namen oder als Vertreter eines Dritten Rechtsgeschäfte abzuschließen"
                },
                "text": " mit der Befugnis, im Namen der Gesellschaft mit sich im eigenen Namen oder als Vertreter eines Dritten Rechtsgeschäfte abzuschließen."
            },
            {
                "class": "Liquidator",
                "payload": {
                    "city": "Klein Nordende",
                    "dob": "1960-06-23",
                    "lastname": "Riemer",
                    "name": "Carsten Helmut"
                },
                "text": " Riemer, Carsten Helmut, Klein Nordende, *23.06.1960."
            }
        ]
    }
}