{
    "orig": {
        "aktenzeichen": "HRB 17350",
        "amtsgericht": "Saarbrücken",
        "event_date": "2011-08-24",
        "event_type": "Veränderungen",
        "federal_state": "sl",
        "full_text": "Amtsgericht Saarbrücken Aktenzeichen: HRB 17350   \nBekannt gemacht am: 25.08.2011 12:00 Uhr\n\n\n\n\nIn () gesetzte Angaben der Anschrift und des Geschäftszweiges erfolgen ohne Gewähr.\nVeränderungen\n24.08.2011\n\nTechnicon Engineering GmbH, Dillingen/Saar, Industriestraße 9, 66763 Dillingen/Saar. Ist nur ein Liquidator bestellt, so vertritt er die Gesellschaft allein. Sind mehrere Liquidatoren bestellt, so wird die Gesellschaft durch die Liquidatoren gemeinsam vertreten. Nicht mehr Geschäftsführer: Veit, Gerd Josef, Heusweiler, *17.03.1949. Bestellt zum Liquidator: Theobald, Norbert, Beckingen, *29.04.1966. Die Gesellschafterversammlung vom 05.07.2011 hat die Auflösung der Gesellschaft beschlossen.",
        "gesellschafter": null,
        "inhaber": null,
        "name": "Technicon Engineering GmbH",
        "notice_id": "32492",
        "posted_on": "2011-08-25",
        "rechtsform": null,
        "sitz": null,
        "url": "https://www.handelsregisterbekanntmachungen.de/en/skripte/hrb.php?rb_id=32492&land_abk=sl"
    },
    "parsed": {
        "officers": [
            {
                "class": "DismissedManagingDirector",
                "payload": {
                    "city": "Heusweiler",
                    "dismissed": true,
                    "dob": "1949-03-17",
                    "lastname": "Veit",
                    "name": "Gerd Josef"
                },
                "text": " Veit, Gerd Josef, Heusweiler, *17.03.1949."
            },
            {
                "class": "Liquidator",
                "payload": {
                    "city": "Beckingen",
                    "dob": "1966-04-29",
                    "lastname": "Theobald",
                    "name": "Norbert"
                },
                "text": " Theobald, Norbert, Beckingen, *29.04.1966."
            }
        ]
    }
}