{
    "orig": {
        "aktenzeichen": "HRB 5356",
        "amtsgericht": "Gelsenkirchen",
        "event_date": "2008-05-20",
        "event_type": "Veränderungen",
        "federal_state": "nw",
        "full_text": "Amtsgericht Gelsenkirchen Aktenzeichen: HRB 5356 \nBekannt gemacht am: 30.05.2008 12:00 Uhr\n\n\n\n\nDie in () gesetzten Angaben der Geschäftsanschrift und des Unternehmensgegenstandes erfolgen ohne Gewähr.\nVeränderungen\n20.05.2008\n\nRothrist Rohr (Deutschland) GmbH, Bottrop (An der Knippenburg 65, 46238 Bottrop). Gesamtprokura gemeinsam mit einem Geschäftsführer oder einem anderen Prokuristen: Brinkmann, Bernd, Paderborn, *09.03.1967; Brüseke, Annette, Paderborn, *20.03.1969; Ohse, Joachim, Borchen, *30.05.1950; Dr. Peters, Bernd-Michael, Paderborn, *28.02.1957; Schwabe, Frank, Delbrück, *02.02.1960; Wüschem, Franz-Josef, Paderborn, *29.04.1959. Prokura geändert; nunmehr: Gesamtprokura gemeinsam mit einem Geschäftsführer oder einem anderen Prokuristen: Hinrichs, Thomas, Schwerte, *19.02.1959.",
        "gesellschafter": null,
        "inhaber": null,
        "name": "Rothrist Rohr (Deutschland) GmbH",
        "notice_id": "327097",
        "posted_on": "2008-05-30",
        "rechtsform": null,
        "sitz": null,
        "url": "https://www.handelsregisterbekanntmachungen.de/en/skripte/hrb.php?rb_id=327097&land_abk=nw"
    },
    "parsed": {
        "officers": [
            {
                "class": "CommonProcuration",
                "payload": {
                    "city": "Paderborn",
                    "dob": "1967-03-09",
                    "lastname": "Brinkmann",
                    "name": "Bernd"
                },
                "text": " Brinkmann, Bernd, Paderborn, *09.03.1967"
            },
            {
                "class": "CommonProcuration",
                "payload": {
                    "city": "Paderborn",
                    "dob": "1969-03-20",
                    "lastname": "Brüseke",
                    "name": "Annette"
                },
                "text": " Brüseke, Annette, Paderborn, *20.03.1969"
            },
            {
                "class": "CommonProcuration",
                "payload": {
                    "city": "Borchen",
                    "dob": "1950-05-30",
                    "lastname": "Ohse",
                    "name": "Joachim"
                },
                "text": " Ohse, Joachim, Borchen, *30.05.1950"
            },
            {
                "class": "CommonProcuration",
                "payload": {
                    "city": "Paderborn",
                    "dob": "1957-02-28",
                    "lastname": "Peters",
                    "name": "Bernd-Michael",
                    "prof_title": "doctor"
                },
                "text": " Doctor Peters, Bernd-Michael, Paderborn, *28.02.1957"
            },
            {
                "class": "CommonProcuration",
                "payload": {
                    "city": "Delbrück",
                    "dob": "1960-02-02",
                    "lastname": "Schwabe",
                    "name": "Frank"
                },
                "text": " Schwabe, Frank, Delbrück, *02.02.1960"
            },
            {
                "class": "CommonProcuration",
                "payload": {
                    "city": "Paderborn",
                    "dob": "1959-04-29",
                    "lastname": "Wüschem",
                    "name": "Franz-Josef"
                },
                "text": " Wüschem, Franz-Josef, Paderborn, *29.04.1959."
            },
            {
                "class": "CommonProcuration",
                "payload": {
                    "city": "Schwerte",
                    "dob": "1959-02-19",
                    "lastname": "Hinrichs",
                    "name": "Thomas"
                },
                "text": " Hinrichs, Thomas, Schwerte, *19.02.1959."
            }
        ]
    }
}