{
    "orig": {
        "aktenzeichen": "HRB 137187",
        "amtsgericht": "Hamburg",
        "event_date": "2017-04-10",
        "event_type": "Veränderungen",
        "federal_state": "hh",
        "full_text": "Amtsgericht Hamburg Aktenzeichen: HRB 137187 \nBekannt gemacht am: 10.04.2017 09:16 Uhr\n\n\n\n\nIn () gesetzte Angaben der Anschrift und des Geschäftszweiges erfolgen ohne Gewähr.\nVeränderungen\n10.04.2017\n\nHRB 137187: Senvion GmbH, Hamburg, Überseering 10 (Oval Office), 22297 Hamburg. Prokura erloschen Köncke, Klaus, Krefeld, *25.03.1959. Gesamtprokura gemeinsam mit einem Geschäftsführer oder einem anderen Prokuristen: Ochernal, Susanne, Berlin, *31.07.1971. Wohnort geändert, nun Gesamtprokura gemeinsam mit einem Geschäftsführer oder einem anderen Prokuristen: Magerfleisch, Klaus Jochen, Hamburg, *08.09.1961.",
        "gesellschafter": null,
        "inhaber": null,
        "name": "HRB 137187: Senvion GmbH",
        "notice_id": "328032",
        "posted_on": "2017-04-10",
        "rechtsform": null,
        "sitz": null,
        "url": "https://www.handelsregisterbekanntmachungen.de/en/skripte/hrb.php?rb_id=328032&land_abk=hh"
    },
    "parsed": {
        "officers": [
            {
                "class": "CommonProcuration",
                "payload": {
                    "city": "Berlin",
                    "dob": "1971-07-31",
                    "lastname": "Ochernal",
                    "name": "Susanne"
                },
                "text": " Ochernal, Susanne, Berlin, *31.07.1971."
            },
            {
                "class": "CommonProcuration",
                "payload": {
                    "city": "Hamburg",
                    "dob": "1961-08-09",
                    "lastname": "Magerfleisch",
                    "name": "Klaus Jochen"
                },
                "text": " Magerfleisch, Klaus Jochen, Hamburg, *08.09.1961."
            }
        ]
    }
}