{
    "orig": {
        "aktenzeichen": "HRB 205733",
        "amtsgericht": "Osnabrück",
        "event_date": "2015-01-19",
        "event_type": "Veränderungen",
        "federal_state": "ni",
        "full_text": "Amtsgericht Osnabrück Aktenzeichen: HRB 205733 \nBekannt gemacht am: 19.01.2015 19:00 Uhr\n\n\n\n\nIn () gesetzte Angaben der Anschrift und des Geschäftszweiges erfolgen ohne Gewähr:\nVeränderungen\n19.01.2015\n\nHRB 205733:ASKLEP - Heilpraktikerausbildungsstätte UG (haftungsbeschränkt), Melle, Schlossallee 10, 49326 Melle.Ist nur ein Liquidator bestellt, so vertritt er die Gesellschaft allein. Sind mehrere Liquidatoren bestellt, so wird die Gesellschaft durch die Liquidatoren gemeinsam vertreten. Geändert, nicht mehr Geschäftsführerin, sondern nun Liquidator: Wittemöller, Marie-Luise, Melle, *18.09.1960. Die Gesellschaft ist mit Beschluss der Gesellschafterversammlung vom 28.11.2014 aufgelöst.",
        "gesellschafter": null,
        "inhaber": null,
        "name": "HRB 205733:ASKLEP - Heilpraktikerausbildungsstätte UG (haftungsbeschränkt)",
        "notice_id": "330118",
        "posted_on": "2015-01-19",
        "rechtsform": null,
        "sitz": null,
        "url": "https://www.handelsregisterbekanntmachungen.de/en/skripte/hrb.php?rb_id=330118&land_abk=ni"
    },
    "parsed": {
        "officers": [
            {
                "class": "Liquidator",
                "payload": {
                    "city": "Melle",
                    "dob": "1960-09-18",
                    "lastname": "Wittemöller",
                    "name": "Marie-Luise"
                },
                "text": " Wittemöller, Marie-Luise, Melle, *18.09.1960."
            }
        ]
    }
}