{
    "orig": {
        "aktenzeichen": "HRB 204216",
        "amtsgericht": "Braunschweig",
        "event_date": "2015-02-04",
        "event_type": "Veränderungen",
        "federal_state": "ni",
        "full_text": "Amtsgericht Braunschweig Aktenzeichen: HRB 204216 \nBekannt gemacht am: 04.02.2015 19:00 Uhr\n\n\n\n\nDie in () gesetzten Angaben der Geschäftsanschrift und des Unternehmensgegenstandes erfolgen ohne Gewähr.\nVeränderungen\n04.02.2015\n\nHRB 204216:Nordmann GmbH, Goslar, Stapelner Str. 4, 38644 Goslar.Allgemeine Vertretungsregelung geändert, nun: Ist nur ein Liquidator bestellt, so vertritt er die Gesellschaft allein. Sind mehrere Liquidatoren bestellt, so wird die Gesellschaft durch die Liquidatoren gemeinsam vertreten. Geändert, nun: Liquidator: Nordmann, Jürgen, Gieboldehausen, *18.07.1967. Die Gesellschaft ist aufgelöst.",
        "gesellschafter": null,
        "inhaber": null,
        "name": "HRB 204216:Nordmann GmbH",
        "notice_id": "332608",
        "posted_on": "2015-02-04",
        "rechtsform": null,
        "sitz": null,
        "url": "https://www.handelsregisterbekanntmachungen.de/en/skripte/hrb.php?rb_id=332608&land_abk=ni"
    },
    "parsed": {
        "flags": [
            {
                "flag": "ignore_for_now",
                "text": "Die\\ Gesellschaft\\ ist\\ aufgel\\öst\\."
            }
        ],
        "officers": [
            {
                "class": "Liquidator",
                "payload": {
                    "city": "Gieboldehausen",
                    "dob": "1967-07-18",
                    "lastname": ": Nordmann",
                    "name": "Jürgen"
                },
                "text": ": Nordmann, Jürgen, Gieboldehausen, *18.07.1967."
            }
        ]
    }
}