{
    "orig": {
        "aktenzeichen": "HRB 6794",
        "amtsgericht": "Bonn",
        "event_date": "2008-06-16",
        "event_type": "Veränderungen",
        "federal_state": "nw",
        "full_text": "Amtsgericht Bonn Aktenzeichen: HRB 6794 \nBekannt gemacht am: 23.06.2008 12:00 Uhr\n\n\n\n\nDie in () gesetzten Angaben der Geschäftsanschrift und des Geschäftszweiges erfolgen ohne Gewähr.\nVeränderungen\n16.06.2008\n\nDeutsche Telekom AG, Bonn (Friedrich-Ebert-Allee 140, 53113 Bonn). Prokura erloschen: Bettin, Peter Angelo, Sinzig, *09.08.1962; Bosse, Henning, Königswinter, *09.07.1963; Freund, Arne, Bonn, *14.05.1968; Götz, Norbert, Wachtberg, *20.07.1951; Johnen, Jürgen, Darmstadt-Eberstadt; Kuhlmey, Maren, Lahnstein, *20.08.1962; Maassen, Markus, Würselen, *30.11.1962; Dr. Schloter, Stefan, Goldbach, *03.04.1971; Sonnert, Martin, Bad Honnef, *28.03.1965; Dr. Vondenhoff-Mertens, Renate, Bonn, *16.07.1966. Gesamtprokura gemeinsam mit einem Vorstandsmitglied oder einem anderen Prokuristen mit der Ermächtigung zur Veräußerung und Belastung von Grundstücken: Dähn, Martina, Bonn, *13.02.1971; Henn, Albert, Linz, *24.04.1968; Pobloth, Petra, Euskirchen, *02.02.1970; Popken-Froeschle, Claudia, Köln, *08.05.1963; Schönberg, Wulf, Bonn, *24.08.1970; Senker, Sigrid, Köln, *06.08.1960; Vogel, Olaf, Dreieich-Sprendlingen, *23.06.1967.",
        "gesellschafter": null,
        "inhaber": null,
        "name": "Deutsche Telekom AG",
        "notice_id": "333464",
        "posted_on": "2008-06-23",
        "rechtsform": null,
        "sitz": null,
        "url": "https://www.handelsregisterbekanntmachungen.de/en/skripte/hrb.php?rb_id=333464&land_abk=nw"
    },
    "parsed": {
        "officers": [
            {
                "class": "ProcurationCancelled",
                "payload": {
                    "city": "Sinzig",
                    "dismissed": true,
                    "dob": "1962-08-09",
                    "lastname": "Bettin",
                    "name": "Peter Angelo"
                },
                "text": " Bettin, Peter Angelo, Sinzig, *09.08.1962"
            },
            {
                "class": "ProcurationCancelled",
                "payload": {
                    "city": "Königswinter",
                    "dismissed": true,
                    "dob": "1963-07-09",
                    "lastname": "Bosse",
                    "name": "Henning"
                },
                "text": " Bosse, Henning, Königswinter, *09.07.1963"
            },
            {
                "class": "ProcurationCancelled",
                "payload": {
                    "city": "Bonn",
                    "dismissed": true,
                    "dob": "1968-05-14",
                    "lastname": "Freund",
                    "name": "Arne"
                },
                "text": " Freund, Arne, Bonn, *14.05.1968"
            },
            {
                "class": "ProcurationCancelled",
                "payload": {
                    "city": "Wachtberg",
                    "dismissed": true,
                    "dob": "1951-07-20",
                    "lastname": "Götz",
                    "name": "Norbert"
                },
                "text": " Götz, Norbert, Wachtberg, *20.07.1951"
            },
            {
                "class": "ProcurationCancelled",
                "payload": {
                    "city": "Darmstadt-Eberstadt",
                    "dismissed": true,
                    "lastname": "Johnen",
                    "name": "Jürgen"
                },
                "text": " Johnen, Jürgen, Darmstadt-Eberstadt"
            },
            {
                "class": "ProcurationCancelled",
                "payload": {
                    "city": "Lahnstein",
                    "dismissed": true,
                    "dob": "1962-08-20",
                    "lastname": "Kuhlmey",
                    "name": "Maren"
                },
                "text": " Kuhlmey, Maren, Lahnstein, *20.08.1962"
            },
            {
                "class": "ProcurationCancelled",
                "payload": {
                    "city": "Würselen",
                    "dismissed": true,
                    "dob": "1962-11-30",
                    "lastname": "Maassen",
                    "name": "Markus"
                },
                "text": " Maassen, Markus, Würselen, *30.11.1962"
            },
            {
                "class": "ProcurationCancelled",
                "payload": {
                    "city": "Goldbach",
                    "dismissed": true,
                    "dob": "1971-04-03",
                    "lastname": "Schloter",
                    "name": "Stefan",
                    "prof_title": "doctor"
                },
                "text": " Doctor Schloter, Stefan, Goldbach, *03.04.1971"
            },
            {
                "class": "ProcurationCancelled",
                "payload": {
                    "city": "Bad Honnef",
                    "dismissed": true,
                    "dob": "1965-03-28",
                    "lastname": "Sonnert",
                    "name": "Martin"
                },
                "text": " Sonnert, Martin, Bad Honnef, *28.03.1965"
            },
            {
                "class": "ProcurationCancelled",
                "payload": {
                    "city": "Bonn",
                    "dismissed": true,
                    "dob": "1966-07-16",
                    "lastname": "Vondenhoff-Mertens",
                    "name": "Renate",
                    "prof_title": "doctor"
                },
                "text": " Doctor Vondenhoff-Mertens, Renate, Bonn, *16.07.1966."
            }
        ]
    }
}