{
    "orig": {
        "aktenzeichen": "HRB 44885",
        "amtsgericht": "Hamburg",
        "event_date": "2017-09-13",
        "event_type": "Veränderungen",
        "federal_state": "hh",
        "full_text": "Amtsgericht Hamburg Aktenzeichen: HRB 44885 \nBekannt gemacht am: 13.09.2017 09:18 Uhr\n\n\n\n\nIn () gesetzte Angaben der Anschrift und des Geschäftszweiges erfolgen ohne Gewähr.\nVeränderungen\n13.09.2017\n\nHRB 44885: Jungheinrich Aktiengesellschaft, Hamburg, Friedrich-Ebert-Damm 129, 22047 Hamburg. Gesamtprokura gemeinsam mit einem Vorstandsmitglied oder einem anderen Prokuristen: Dürfeldt, Axel, Norderstedt, *29.04.1965; Leisering, Markus, Alveslohe, *14.02.1972. Prokura erloschen Guntermann, Hanne, Hamburg, *26.09.1956; Sawall, Jörn, Hamburg, *13.06.1972; Özbahadir, Alexander, Hamburg, *16.03.1978.",
        "gesellschafter": null,
        "inhaber": null,
        "name": "HRB 44885: Jungheinrich Aktiengesellschaft",
        "notice_id": "341898",
        "posted_on": "2017-09-13",
        "rechtsform": null,
        "sitz": null,
        "url": "https://www.handelsregisterbekanntmachungen.de/en/skripte/hrb.php?rb_id=341898&land_abk=hh"
    },
    "parsed": {
        "officers": [
            {
                "class": "CommonProcuration",
                "payload": {
                    "city": "Norderstedt",
                    "dob": "1965-04-29",
                    "lastname": "Dürfeldt",
                    "name": "Axel"
                },
                "text": " Dürfeldt, Axel, Norderstedt, *29.04.1965"
            },
            {
                "class": "CommonProcuration",
                "payload": {
                    "city": "Alveslohe",
                    "dob": "1972-02-14",
                    "lastname": "Leisering",
                    "name": "Markus"
                },
                "text": " Leisering, Markus, Alveslohe, *14.02.1972."
            }
        ]
    }
}