{
    "orig": {
        "aktenzeichen": "HRB 41742",
        "amtsgericht": "Düsseldorf",
        "event_date": "2008-08-06",
        "event_type": "Veränderungen",
        "federal_state": "nw",
        "full_text": "Amtsgericht Düsseldorf Aktenzeichen: HRB 41742 \nBekannt gemacht am: 12.08.2008 12:00 Uhr\n\n\n\n\nDie in () gesetzten Angaben der Geschäftsanschrift und des Geschäftszweiges erfolgen ohne Gewähr.\nVeränderungen\n06.08.2008\n\nFOLA Grundstücks-Vermietungsgesellschaft mbH, Düsseldorf (Uerdinger Straße 90, 40474 Düsseldorf). Nicht mehr Geschäftsführer: Graf, Ursula Anna, Mönchengladbach, *30.07.1965; Dr. Waldeyer, Hans, Düsseldorf, *01.08.1953. Bestellt als Geschäftsführer: Ramjoué, Heinz Christian, Wuppertal, *18.09.1972; Schmidt, Ronald Hans, Tönisvorst, *28.09.1963, jeweils mit der Befugnis im Namen der Gesellschaft mit sich im eigenen Namen oder als Vertreter eines Dritten Rechtsgeschäfte abzuschließen.",
        "gesellschafter": null,
        "inhaber": null,
        "name": "FOLA Grundstücks-Vermietungsgesellschaft mbH",
        "notice_id": "347590",
        "posted_on": "2008-08-12",
        "rechtsform": null,
        "sitz": null,
        "url": "https://www.handelsregisterbekanntmachungen.de/en/skripte/hrb.php?rb_id=347590&land_abk=nw"
    },
    "parsed": {
        "officers": [
            {
                "class": "DismissedManagingDirector",
                "payload": {
                    "city": "Mönchengladbach",
                    "dismissed": true,
                    "dob": "1965-07-30",
                    "lastname": "Graf",
                    "name": "Ursula Anna"
                },
                "text": " Graf, Ursula Anna, Mönchengladbach, *30.07.1965"
            },
            {
                "class": "AppointedManagingDirector",
                "payload": {
                    "city": "Wuppertal",
                    "dob": "1972-09-18",
                    "lastname": "Ramjoué",
                    "name": "Heinz Christian"
                },
                "text": " Ramjoué, Heinz Christian, Wuppertal, *18.09.1972"
            }
        ]
    }
}