{
    "orig": {
        "aktenzeichen": "HRB 131758 B",
        "amtsgericht": "Charlottenburg (Berlin)",
        "event_date": "2015-09-16",
        "event_type": "Veränderungen",
        "federal_state": "be",
        "full_text": "Amtsgericht Charlottenburg (Berlin) Aktenzeichen: HRB 131758 B \nBekannt gemacht am: 17.09.2015 09:38 Uhr\n\n\n\n\nIn () gesetzte Angaben der Anschrift und des Unternehmensgegenstandes erfolgen ohne Gewähr:\nVeränderungen\n16.09.2015\n\nHRB 131758 B: Immeo Bennet UG (haftungsbeschränkt), Berlin, Keplerstraße 110-112, 45147 Essen. Firma: Immeo Bennet UG (haftungsbeschränkt); Sitz / Zweigniederlassung: Geschäftsanschrift: Keplerstraße 110-112, 45147 Essen;  Nicht mehr Geschäftsführer: 2. Richter, Dan; Geschäftsführer: 3.\nDr. Frey, Daniel, *13.11.1967, Stuttgart; mit der Befugnis Rechtsgeschäfte als Vertreter Dritter abzuschließen; Geschäftsführer: 4.\nDr. Hutner, Armin, *06.07.1970, Bochum; mit der Befugnis Rechtsgeschäfte als Vertreter Dritter abzuschließen; Geschäftsführer: 5.\nLangenhorst, Rainer, *21.06.1967, Dorsten; mit der Befugnis Rechtsgeschäfte als Vertreter Dritter abzuschließen; Geschäftsführer: 6.\nZiegler, Walter, *14.05.1956, Korschenbroich; mit der Befugnis Rechtsgeschäfte als Vertreter Dritter abzuschließen; Prokura: 1.\nBartenstein, Marcus, *21.03.1978, Stuttgart; Prokura gemeinsam mit einem Geschäftsführer oder einem weiteren Prokuristen\nmit der Befugnis Rechtsgeschäfte als Vertreter Dritter abzuschließen\nmit der Befugnis zur Veräußerung und Belastung von Grundstücken; Rechtsform: Durch Beschluss der Gesellschafterversammlung vom 17.08.2015 ist der Gesellschaftsvertrag geändert in § 1 (Firma).",
        "gesellschafter": null,
        "inhaber": null,
        "name": "mit der Befugnis zur Veräußerung und Belastung von Grundstücken; Rechtsform: Durch Beschluss der Gesellschafterversammlung vom 17.08.2015 ist der Gesellschaftsvertrag geändert in § 1 (Firma).",
        "notice_id": "347707",
        "posted_on": "2015-09-17",
        "rechtsform": null,
        "sitz": null,
        "url": "https://www.handelsregisterbekanntmachungen.de/en/skripte/hrb.php?rb_id=347707&land_abk=be"
    },
    "parsed": {
        "labels": [
            {
                "label": "WHUT",
                "text": " Immeo Bennet UG (haftungsbeschränkt), Berlin, Keplerstraße 110-112, 45147 Essen."
            },
            {
                "label": "company",
                "text": " Geschäftsanschrift: Keplerstraße 110-112, 45147 Essen"
            },
            {
                "label": "address",
                "text": " Keplerstraße 110-112, 45147 Essen"
            }
        ],
        "officers": [
            {
                "class": "DismissedManagingDirector",
                "payload": {
                    "dismissed": true,
                    "lastname": "Richter",
                    "name": "Dan"
                },
                "text": " Richter, Dan"
            },
            {
                "class": "ManagingDirector",
                "payload": {
                    "city": "Stuttgart",
                    "dob": "1967-11-13",
                    "lastname": "Dr. Frey",
                    "name": "Daniel"
                },
                "text": " Dr. Frey, Daniel, *13.11.1967, Stuttgart"
            },
            {
                "class": "ManagingDirector",
                "payload": {
                    "city": "Bochum",
                    "dob": "1970-06-07",
                    "lastname": "Dr. Hutner",
                    "name": "Armin"
                },
                "text": " Dr. Hutner, Armin, *06.07.1970, Bochum"
            },
            {
                "class": "ManagingDirector",
                "payload": {
                    "city": "Dorsten",
                    "dob": "1967-06-21",
                    "lastname": "Langenhorst",
                    "name": "Rainer"
                },
                "text": " Langenhorst, Rainer, *21.06.1967, Dorsten"
            },
            {
                "class": "ManagingDirector",
                "payload": {
                    "city": "Korschenbroich",
                    "dob": "1956-05-14",
                    "lastname": "Ziegler",
                    "name": "Walter"
                },
                "text": " Ziegler, Walter, *14.05.1956, Korschenbroich"
            },
            {
                "class": "Procuration",
                "payload": {
                    "city": "Stuttgart",
                    "dob": "1978-03-21",
                    "lastname": "Bartenstein",
                    "name": "Marcus"
                },
                "text": " Bartenstein, Marcus, *21.03.1978, Stuttgart"
            }
        ]
    }
}