{
    "orig": {
        "aktenzeichen": "HRB 593 B",
        "amtsgericht": "Charlottenburg (Berlin)",
        "event_date": "2007-03-26",
        "event_type": "Veränderungen",
        "federal_state": "be",
        "full_text": "Amtsgericht Charlottenburg (Berlin) Aktenzeichen: HRB 593 B  \nBekannt gemacht am: 29.03.2007 08:17 Uhr\n\n\n\n\nFür die Angaben in (), die den Unternehmensgegenstand und die Anschrift betreffen, keine Gewähr. In das Handelsregister ist folgendes eingetragen worden.\nVeränderungen\n26.03.2007\n\nDBV Deutsche Beamten-Versicherung Aktiengesellschaft, Berlin und Wiesbaden(Frankfurter Straße 50, 65178  Wiesbaden). Nicht mehr Vorstand:; 10. Dr. Verhoeven, Paul; Nicht mehr Vorstand:; 3. Krauß, Hans-Joachim; Nicht mehr Vorstand:; 7. Dr. Schaaf, Andreas; Nicht mehr Vorstand:; 4. Leicht, Thomas; Vorstand:; 11. Brune, Rainer, *03.01.1966, Köln; Vorstand:; 12. Nießen, Ulrich C., *09.09.1964, Bonn Prokura: 62. Hasselbächer, Jens, *07.12.1971, Idstein; Prokura gemeinsam mit einem Vorstand; 63. Thedens, Ingo, *19.03.1943, Hamburg; Prokura gemeinsam mit einem Vorstand; Nicht mehr Prokurist:; 54. Kettnaker, Frank.",
        "gesellschafter": null,
        "inhaber": null,
        "name": "DBV Deutsche Beamten-Versicherung Aktiengesellschaft",
        "notice_id": "35985",
        "posted_on": "2007-03-29",
        "rechtsform": null,
        "sitz": null,
        "url": "https://www.handelsregisterbekanntmachungen.de/en/skripte/hrb.php?rb_id=35985&land_abk=be"
    },
    "parsed": {
        "officers": [
            {
                "class": "Procuration",
                "payload": {
                    "city": "Idstein",
                    "dob": "1971-07-12",
                    "lastname": "Hasselbächer",
                    "name": "Jens"
                },
                "text": " Hasselbächer, Jens, *07.12.1971, Idstein"
            },
            {
                "class": "NotAProcurator",
                "payload": {
                    "dismissed": true,
                    "lastname": "Kettnaker",
                    "name": "Frank"
                },
                "text": " Kettnaker, Frank."
            }
        ]
    }
}