{
    "orig": {
        "aktenzeichen": "HRB 90124",
        "amtsgericht": "Hanau",
        "event_date": "2013-12-04",
        "event_type": "Veränderungen",
        "federal_state": "he",
        "full_text": "Amtsgericht Hanau Aktenzeichen: HRB 90124   \nBekannt gemacht am: 18.12.2013 12:00 Uhr\n\n\n\n\nVeröffentlichungen des Amtsgerichts #Re.OrtZustell\r\r\rIn () gesetzte Angaben der Anschrift und des Geschäftszweiges erfolgen ohne Gewähr.\nVeränderungen\n04.12.2013\n\nALSA-GmbH, Steinau an der Straße, Heideküppel 2, 36396 Steinau an der Straße. Die Gesellschafterversammlung vom 30.10.2013 hat die Neufassung des Gesellschaftsvertrages, insbesondere die Änderung in § 2 - neu § 3 (Gegenstand des Unternehmens) beschlossen. Neuer Gegenstand: die Herstellung und der Vertrieb/Verkauf von Artikeln für die Fußgesundheit aller Art. Hierzu gehört auch die Abwicklung aller artverwandten Geschäfte und die Erbringung aller damit zusammenhängenden Dienstleistungen, und zwar unter Ausschluss erlaubnispflichtiger Tätigkeiten. Nicht mehr Geschäftsführer: Stegmaier, Wolfram, Ortenberg, *23.06.1962. Personenbezogene Daten ergänzt, nun: Geschäftsführer: Herber, Karl-Heinrich, Sinntal, *05.04.1955. Gesamtprokura gemeinsam mit einem Geschäftsführer: Friedrich, Steffen, Wolfenbüttel, *16.12.1964.",
        "gesellschafter": null,
        "inhaber": null,
        "name": "ALSA-GmbH",
        "notice_id": "360963",
        "posted_on": "2013-12-18",
        "rechtsform": null,
        "sitz": null,
        "url": "https://www.handelsregisterbekanntmachungen.de/en/skripte/hrb.php?rb_id=360963&land_abk=he"
    },
    "parsed": {
        "officers": [
            {
                "class": "DismissedManagingDirector",
                "payload": {
                    "city": "Ortenberg",
                    "dismissed": true,
                    "dob": "1962-06-23",
                    "lastname": "Stegmaier",
                    "name": "Wolfram"
                },
                "text": " Stegmaier, Wolfram, Ortenberg, *23.06.1962."
            },
            {
                "class": "ManagingDirector",
                "payload": {
                    "city": "Sinntal",
                    "dob": "1955-05-04",
                    "lastname": "Herber",
                    "name": "Karl-Heinrich"
                },
                "text": " Herber, Karl-Heinrich, Sinntal, *05.04.1955."
            },
            {
                "class": "ManagingDirector",
                "payload": {
                    "city": "Wolfenbüttel",
                    "dob": "1964-12-16",
                    "lastname": "Friedrich",
                    "name": "Steffen"
                },
                "text": " Friedrich, Steffen, Wolfenbüttel, *16.12.1964."
            }
        ]
    }
}