{
    "orig": {
        "aktenzeichen": "HRB 204391",
        "amtsgericht": "Tostedt",
        "event_date": "2015-11-02",
        "event_type": "Veränderungen",
        "federal_state": "ni",
        "full_text": "Amtsgericht Tostedt Aktenzeichen: HRB 204391 \nBekannt gemacht am: 02.11.2015 19:00 Uhr\n\n\n\n\nDie in () gesetzten Angaben der Geschäftsanschrift und des Unternehmensgegenstandes erfolgen ohne Gewähr.\nVeränderungen\n02.11.2015\n\nHRB 204391:BUXFUTURE Verwaltungs- und Bereederungs GmbH, Buxtehude, Harburger Str. 47-51, 21614 Buxtehude.Nicht mehr Geschäftsführer: Weber, Lutz, Hamburg, *05.02.1968. Vertretungsregelung geändert, nun: Geschäftsführer: Ponath, Tim, Buxtehude, *18.12.1972, einzelvertretungsberechtigt; mit der Befugnis, im Namen der Gesellschaft mit sich im eigenen Namen oder als Vertreter eines Dritten Rechtsgeschäfte abzuschließen.",
        "gesellschafter": null,
        "inhaber": null,
        "name": "HRB 204391:BUXFUTURE Verwaltungs- und Bereederungs GmbH",
        "notice_id": "365152",
        "posted_on": "2015-11-02",
        "rechtsform": null,
        "sitz": null,
        "url": "https://www.handelsregisterbekanntmachungen.de/en/skripte/hrb.php?rb_id=365152&land_abk=ni"
    },
    "parsed": {
        "flags": [
            {
                "flag": "with the power to enter into legal transactions on behalf of the Company with itself or as a representative of a third party",
                "text": "mit\\ der\\ Befugnis\\,\\ im\\ Namen\\ der\\ Gesellschaft\\ mit\\ sich\\ im\\ eigenen\\ Namen\\ oder\\ als\\ Vertreter\\ eines\\ Dritten\\ Rechtsgesch\\äfte\\ abzuschlie\\ßen\\."
            }
        ],
        "officers": [
            {
                "class": "DismissedManagingDirector",
                "payload": {
                    "city": "Hamburg",
                    "dismissed": true,
                    "dob": "1968-02-05",
                    "lastname": "Weber",
                    "name": "Lutz"
                },
                "text": " Weber, Lutz, Hamburg, *05.02.1968."
            },
            {
                "class": "ManagingDirector",
                "payload": {
                    "city": "Buxtehude",
                    "dob": "1972-12-18",
                    "flag": "sole representation",
                    "lastname": "Ponath",
                    "name": "Tim"
                },
                "text": " Ponath, Tim, Buxtehude, *18.12.1972, einzelvertretungsberechtigt"
            },
            {
                "class": "ManagingDirector",
                "payload": {
                    "lastname": "mit der Befugnis",
                    "name": "im Namen der Gesellschaft mit sich im eigenen Namen oder als Vertreter eines Dritten Rechtsgeschäfte abzuschließen"
                },
                "text": " mit der Befugnis, im Namen der Gesellschaft mit sich im eigenen Namen oder als Vertreter eines Dritten Rechtsgeschäfte abzuschließen."
            }
        ]
    }
}