{
    "orig": {
        "aktenzeichen": "HRB 1346",
        "amtsgericht": "Lüneburg",
        "event_date": "2015-12-08",
        "event_type": "Veränderungen",
        "federal_state": "ni",
        "full_text": "Amtsgericht Lüneburg Aktenzeichen: HRB 1346 \nBekannt gemacht am: 08.12.2015 19:00 Uhr\n\n\n\n\nIn () gesetzte Angaben der Anschrift und des Geschäftszweiges erfolgen ohne Gewähr:\nVeränderungen\n08.12.2015\n\nHRB 1346: Cordt von Brandis Telekomtechnik GmbH, Barendorf, Landkreis Lüneburg, Imkerweg 1, 21397 Barendorf. Die Gesellschafterversammlung vom 26.11.2015 hat die Änderung des Gesellschaftsvertrages in § 3 (Stammkapital und Stammeinlagen) und mit ihr die Erhöhung des Stammkapitals um 435,41 EUR auf 26.000,00 EUR beschlossen. Bestellt als Geschäftsführer: von Brandis, Christoffer, Barendorf, *08.12.1988.",
        "gesellschafter": null,
        "inhaber": null,
        "name": "HRB 1346: Cordt von Brandis Telekomtechnik GmbH",
        "notice_id": "369331",
        "posted_on": "2015-12-08",
        "rechtsform": null,
        "sitz": null,
        "url": "https://www.handelsregisterbekanntmachungen.de/en/skripte/hrb.php?rb_id=369331&land_abk=ni"
    },
    "parsed": {
        "officers": [
            {
                "class": "AppointedManagingDirector",
                "payload": {
                    "city": "Barendorf",
                    "dob": "1988-08-12",
                    "lastname": "von Brandis",
                    "name": "Christoffer"
                },
                "text": " von Brandis, Christoffer, Barendorf, *08.12.1988."
            }
        ]
    }
}