{
    "orig": {
        "aktenzeichen": "HRB 207386",
        "amtsgericht": "Oldenburg",
        "event_date": "2015-12-16",
        "event_type": "Veränderungen",
        "federal_state": "ni",
        "full_text": "Amtsgericht Oldenburg Aktenzeichen: HRB 207386 \nBekannt gemacht am: 16.12.2015 19:00 Uhr\n\n\n\n\nIn () gesetzte Angaben der Anschrift und des Geschäftszweiges erfolgen ohne Gewähr:\nVeränderungen\n16.12.2015\n\nHRB 207386: SGS Umweltgutachtergesellschaft mbH, Emstek, Europa Allee 12, 49685 Emstek. Nicht mehr Geschäftsführer: Westermann, Ralph, Osnabrück, *10.07.1958. Die Gesellschaft ist als übertragender Rechtsträger nach Maßgabe des Verschmelzungsvertrages vom 09.12.2015 sowie der Zustimmungsbeschlüsse ihrer Gesellschafterversammlung vom 09.12.2015 und der Gesellschafterversammlung des übernehmenden Rechtsträgers vom 09.12.2015 mit der SGS Germany GmbH mit Sitz in Hamburg (Amtsgericht Hamburg HRB 4951) verschmolzen. Die Verschmelzung wird erst wirksam mit Eintragung auf dem Registerblatt des übernehmenden Rechtsträgers. Als nicht eingetragen wird bekanntgemacht: Den Gläubigern der an der Verschmelzung beteiligten Rechtsträger ist, wenn sie binnen sechs Monaten nach dem Tag, an dem die Eintragung der Verschmelzung in das Register des Sitzes desjenigen Rechtsträgers, dessen Gläubiger sie sind, nach § 19 Abs. 3 UmwG als bekannt gemacht gilt, ihren Anspruch nach Grund und Höhe schriftlich anmelden, Sicherheit zu leisten, soweit sie nicht Befriedigung verlangen können. Dieses Recht steht den Gläubigern jedoch nur zu, wenn sie glaubhaft machen, dass durch die Verschmelzung die Erfüllung der Forderung gefährdet wird.",
        "gesellschafter": null,
        "inhaber": null,
        "name": "HRB 207386: SGS Umweltgutachtergesellschaft mbH",
        "notice_id": "371058",
        "posted_on": "2015-12-16",
        "rechtsform": null,
        "sitz": null,
        "url": "https://www.handelsregisterbekanntmachungen.de/en/skripte/hrb.php?rb_id=371058&land_abk=ni"
    },
    "parsed": {
        "officers": [
            {
                "class": "DismissedManagingDirector",
                "payload": {
                    "city": "Osnabrück",
                    "dismissed": true,
                    "dob": "1958-10-07",
                    "lastname": "Westermann",
                    "name": "Ralph"
                },
                "text": " Westermann, Ralph, Osnabrück, *10.07.1958."
            }
        ]
    }
}