{
    "orig": {
        "aktenzeichen": "HRB 204161",
        "amtsgericht": "Tostedt",
        "event_date": "2016-01-05",
        "event_type": "Veränderungen",
        "federal_state": "ni",
        "full_text": "Amtsgericht Tostedt Aktenzeichen: HRB 204161 \nBekannt gemacht am: 05.01.2016 19:02 Uhr\n\n\n\n\nDie in () gesetzten Angaben der Geschäftsanschrift und des Unternehmensgegenstandes erfolgen ohne Gewähr.\nVeränderungen\n05.01.2016\n\nHRB 204161: MS \"Maron\" Verwaltungs GmbH, Oldendorf, Wilhelm-Schröder-Straße 3, 21726 Oldendorf. Allgemeine Vertretungsregelung geändert, nun: Jeder Liquidator vertritt einzeln. Jeder Liquidator ist befugt, im Namen der Gesellschaft mit sich im eigenen Namen oder als Vertreter eines Dritten Rechtsgeschäfte vorzunehmen. Geändert, nun Liquidator: tom Wörden, Klaus, Estorf-Gräpel, *31.03.1956. Die Gesellschaft ist aufgelöst.",
        "gesellschafter": null,
        "inhaber": null,
        "name": "HRB 204161: MS \"Maron\" Verwaltungs GmbH",
        "notice_id": "373647",
        "posted_on": "2016-01-05",
        "rechtsform": null,
        "sitz": null,
        "url": "https://www.handelsregisterbekanntmachungen.de/en/skripte/hrb.php?rb_id=373647&land_abk=ni"
    },
    "parsed": {
        "flags": [
            {
                "flag": "CompanyClosed",
                "text": "Die\\ Gesellschaft\\ ist\\ aufgel\\öst\\."
            }
        ],
        "officers": [
            {
                "class": "Liquidator",
                "payload": {
                    "city": "Estorf-Gräpel",
                    "dob": "1956-03-31",
                    "lastname": "tom Wörden",
                    "name": "Klaus"
                },
                "text": " tom Wörden, Klaus, Estorf-Gräpel, *31.03.1956."
            }
        ]
    }
}