{
    "orig": {
        "aktenzeichen": "HRB 175100 B",
        "amtsgericht": "Charlottenburg (Berlin)",
        "event_date": "2016-05-09",
        "event_type": "Veränderungen",
        "federal_state": "be",
        "full_text": "Amtsgericht Charlottenburg (Berlin) Aktenzeichen: HRB 175100 B \nBekannt gemacht am: 09.05.2016 12:22 Uhr\n\n\n\n\nIn () gesetzte Angaben der Anschrift und des Unternehmensgegenstandes erfolgen ohne Gewähr:\nVeränderungen\n09.05.2016\n\nHRB 175100 B: CWB Coral World Berlin GmbH, Berlin, Bleibtreustraße 41, 10623 Berlin. Firma: CWB Coral World Berlin GmbH; Sitz / Zweigniederlassung: Geschäftsanschrift: Bleibtreustraße 41, 10623 Berlin; Gegenstand: Der Erwerb, das Entwickeln und das Halten und Verwalten von Grundstücken und grundstücksgleichen Rechten, insbesondere, aber nicht beschränkt hierauf, solcher, die zur Nutzung als Betrieb eines Ausstellungshauses (Wasserhaus) nebst Außenanlagen geeignet sind, welches Erlebnisbereiche zu den Themen Wasser, Lebensräume für Fauna und Flora, Naturschutz, Ökologie enthält sowie Informationen für Bildungseinrichtungen zum Inhalt hat. Eine genehmigungsbedürftige Tätigkeit wird nicht ausgeübt.  Nicht mehr Geschäftsführer: 1. Vieth, Julia; Geschäftsführer: 2.\nDolev, Ben Zion, *05.11.1953, Tel-Aviv/Israel; Geschäftsführer: 3.\nErez, Ben-Nun, *08.02.1962, Tel-Aviv/Israel; Rechtsform: Durch Beschluss der Gesellschafterversammlung vom 18.04.2016 mit Änderung vom 20.04.2016 in Ziff. 13 (Gründungskosten) ist der Gesellschaftsvertrag insgesamt neu gefasst.",
        "gesellschafter": null,
        "inhaber": null,
        "name": "Erez",
        "notice_id": "378468",
        "posted_on": "2016-05-09",
        "rechtsform": null,
        "sitz": null,
        "url": "https://www.handelsregisterbekanntmachungen.de/en/skripte/hrb.php?rb_id=378468&land_abk=be"
    },
    "parsed": {
        "labels": [
            {
                "label": "WHUT",
                "text": " CWB Coral World Berlin GmbH, Berlin, Bleibtreustraße 41, 10623 Berlin."
            },
            {
                "label": "company",
                "text": " Geschäftsanschrift: Bleibtreustraße 41, 10623 Berlin"
            },
            {
                "label": "address",
                "text": " Bleibtreustraße 41, 10623 Berlin"
            }
        ],
        "officers": [
            {
                "class": "DismissedManagingDirector",
                "payload": {
                    "dismissed": true,
                    "lastname": "Vieth",
                    "name": "Julia"
                },
                "text": " Vieth, Julia"
            },
            {
                "class": "ManagingDirector",
                "payload": {
                    "city": "Tel-Aviv/Israel",
                    "dob": "1953-05-11",
                    "lastname": "Dolev",
                    "name": "Ben Zion"
                },
                "text": " Dolev, Ben Zion, *05.11.1953, Tel-Aviv/Israel"
            },
            {
                "class": "ManagingDirector",
                "payload": {
                    "city": "Tel-Aviv/Israel",
                    "dob": "1962-08-02",
                    "lastname": "Erez",
                    "name": "Ben-Nun"
                },
                "text": " Erez, Ben-Nun, *08.02.1962, Tel-Aviv/Israel"
            }
        ]
    }
}