{
    "orig": {
        "aktenzeichen": "HRB 202946",
        "amtsgericht": "Braunschweig",
        "event_date": "2016-04-19",
        "event_type": "Veränderungen",
        "federal_state": "ni",
        "full_text": "Amtsgericht Braunschweig Aktenzeichen: HRB 202946 \nBekannt gemacht am: 19.04.2016 19:00 Uhr\n\n\n\n\nDie in () gesetzten Angaben der Geschäftsanschrift und des Unternehmensgegenstandes erfolgen ohne Gewähr.\nVeränderungen\n19.04.2016\n\nHRB 202946: Zeitungs-Vertriebs-GmbH Wolfsburg, Wolfsburg, Seilerstr. 19, 38440 Wolfsburg. Die Gesellschafterversammlung vom 25.02.2016 hat die Neufassung des Gesellschaftsvertrages, insbesondere in § 2 (Gegenstand), beschlossen. Neuer Gegenstand: Vertrieb und Verteilung in erster Linie von Abonnementszeitungen, daneben, soweit eine Beeinträchtigung der Zustellqualität für diese nicht zu besorgen ist, auch von Zeitschriften, Anzeigenblättern und Werbemitteln sowie von Postdienstleistungen etc. und zwar auch im Zusammenwirken mit Drittunternehmen. Nicht mehr Geschäftsführer: Firl, Gordon, Hannover, *07.08.1975; Kuttkat, Christian, Söhlde, *03.09.1973. Bestellt als Geschäftsführer: Müller, Klaus-Peter, Nettetal, *07.04.1958.",
        "gesellschafter": null,
        "inhaber": null,
        "name": "HRB 202946: Zeitungs-Vertriebs-GmbH Wolfsburg",
        "notice_id": "387992",
        "posted_on": "2016-04-19",
        "rechtsform": null,
        "sitz": null,
        "url": "https://www.handelsregisterbekanntmachungen.de/en/skripte/hrb.php?rb_id=387992&land_abk=ni"
    },
    "parsed": {
        "officers": [
            {
                "class": "DismissedManagingDirector",
                "payload": {
                    "city": "Hannover",
                    "dismissed": true,
                    "dob": "1975-07-08",
                    "lastname": "Firl",
                    "name": "Gordon"
                },
                "text": " Firl, Gordon, Hannover, *07.08.1975"
            },
            {
                "class": "AppointedManagingDirector",
                "payload": {
                    "city": "Nettetal",
                    "dob": "1958-07-04",
                    "lastname": "Müller",
                    "name": "Klaus-Peter"
                },
                "text": " Müller, Klaus-Peter, Nettetal, *07.04.1958."
            }
        ]
    }
}