{
    "orig": {
        "aktenzeichen": "HRB 24754 HB",
        "amtsgericht": "Bremen",
        "event_date": "2013-05-21",
        "event_type": "Veränderungen",
        "federal_state": "hb",
        "full_text": "Amtsgericht Bremen Aktenzeichen: HRB 24754 HB \nBekannt gemacht am: 21.05.2013 20:00 Uhr\n\n\n\n\nIn () gesetzte Angaben der Anschrift und des Unternehmensgegenstandes erfolgen ohne Gewähr:\nVeränderungen\n21.05.2013\n\nHRB 24754 HB: Suhling & Suhr´s Fruchtimport GmbH, Bremen, Am Waller Freihafen 1, 28217 Bremen. Geschäftsanschrift: Am Waller Freihafen 1, 28217 Bremen;  Die Eintragung betreffend die allgemeine Vertretungsbefugnis ist von Amts wegen wie folgt berichtigt: Die Gesellschaft wird durch den/die Liquidatoren vertreten.  Die Eintragung zu Nr. 1 ist von Amts wegen wie folgt berichtigt: Liquidator: Suhling, Jan-Günter, *11.06.1961, Bremen;  Die Gesellschaft ist auf Grund der Eröffnung des Insolvenzverfahrens gemäß § 60 Abs. 1 Nr. 4 GmbHG aufgelöst.",
        "gesellschafter": null,
        "inhaber": null,
        "name": "HRB 24754 HB: Suhling & Suhr´s Fruchtimport GmbH",
        "notice_id": "39121",
        "posted_on": "2013-05-21",
        "rechtsform": null,
        "sitz": null,
        "url": "https://www.handelsregisterbekanntmachungen.de/en/skripte/hrb.php?rb_id=39121&land_abk=hb"
    },
    "parsed": {
        "labels": [
            {
                "label": "WHUT",
                "text": " Suhling & Suhr´s Fruchtimport GmbH, Bremen, Am Waller Freihafen 1, 28217 Bremen."
            },
            {
                "label": "address",
                "text": " Am Waller Freihafen 1, 28217 Bremen"
            }
        ],
        "officers": [
            {
                "class": "Liquidator",
                "payload": {
                    "city": "Bremen",
                    "dob": "1961-11-06",
                    "lastname": "Suhling",
                    "name": "Jan-Günter"
                },
                "text": " Suhling, Jan-Günter, *11.06.1961, Bremen"
            }
        ]
    }
}