{
    "orig": {
        "aktenzeichen": "HRB 205541",
        "amtsgericht": "Braunschweig",
        "event_date": "2016-06-03",
        "event_type": "Veränderungen",
        "federal_state": "ni",
        "full_text": "Amtsgericht Braunschweig Aktenzeichen: HRB 205541 \nBekannt gemacht am: 03.06.2016 19:01 Uhr\n\n\n\n\nDie in () gesetzten Angaben der Geschäftsanschrift und des Unternehmensgegenstandes erfolgen ohne Gewähr.\nVeränderungen\n03.06.2016\n\nHRB 205541: Porsche Erste Vermögensverwaltung GmbH, Wolfsburg, Berliner Ring 2, 38440 Wolfsburg. Die Gesellschafterversammlung vom 12.05.2016 hat eine Neufassung des Gesellschaftsvertrages, insbesondere in § 1 (Firma), § 2 (Sitz, nunmehr § 1) und § 4 (Gegenstand, nunmehr § 2), beschlossen. Neue Firma: Volkswagen New Mobility GmbH. Neuer Unternehmensgegenstand: Beteiligung an Unternehmen sowie die Erbringung von Mobilitätsdiestleistungen aller Art. Nicht mehr Geschäftsführer: Dr. Holst, Berend, Wolfsburg, *29.10.1960; Möhle, Albrecht, Wasbüttel, *11.05.1958; von Hammerstein-Gesmold, Gerko, Meine, *21.12.1972. Bestellt als Geschäftsführer: de Neidels, Gabriele Regina, Cremlingen, *28.01.1966; Harms, Ole, Hannover, *27.12.1974. Prokura erloschen: Dr. Lattwein, Johannes, Esslingen am Neckar, *23.05.1973.",
        "gesellschafter": null,
        "inhaber": null,
        "name": "HRB 205541: Porsche Erste Vermögensverwaltung GmbH",
        "notice_id": "393270",
        "posted_on": "2016-06-03",
        "rechtsform": null,
        "sitz": null,
        "url": "https://www.handelsregisterbekanntmachungen.de/en/skripte/hrb.php?rb_id=393270&land_abk=ni"
    },
    "parsed": {
        "officers": [
            {
                "class": "DismissedManagingDirector",
                "payload": {
                    "city": "Wolfsburg",
                    "dismissed": true,
                    "dob": "1960-10-29",
                    "lastname": "Doctor Holst",
                    "name": "Berend"
                },
                "text": " Doctor Holst, Berend, Wolfsburg, *29.10.1960"
            },
            {
                "class": "DismissedManagingDirector",
                "payload": {
                    "city": "Wasbüttel",
                    "dismissed": true,
                    "dob": "1958-05-11",
                    "lastname": "Möhle",
                    "name": "Albrecht"
                },
                "text": " Möhle, Albrecht, Wasbüttel, *11.05.1958"
            },
            {
                "class": "DismissedManagingDirector",
                "payload": {
                    "city": "Meine",
                    "dismissed": true,
                    "dob": "1972-12-21",
                    "lastname": "von Hammerstein-Gesmold",
                    "name": "Gerko"
                },
                "text": " von Hammerstein-Gesmold, Gerko, Meine, *21.12.1972."
            },
            {
                "class": "AppointedManagingDirector",
                "payload": {
                    "city": "Cremlingen",
                    "dob": "1966-01-28",
                    "lastname": "de Neidels",
                    "name": "Gabriele Regina"
                },
                "text": " de Neidels, Gabriele Regina, Cremlingen, *28.01.1966"
            },
            {
                "class": "AppointedManagingDirector",
                "payload": {
                    "city": "Hannover",
                    "dob": "1974-12-27",
                    "lastname": "Harms",
                    "name": "Ole"
                },
                "text": " Harms, Ole, Hannover, *27.12.1974."
            },
            {
                "class": "ProcurationCancelled",
                "payload": {
                    "city": "Esslingen am Neckar",
                    "dismissed": true,
                    "dob": "1973-05-23",
                    "lastname": "Doctor Lattwein",
                    "name": "Johannes"
                },
                "text": " Doctor Lattwein, Johannes, Esslingen am Neckar, *23.05.1973."
            }
        ]
    }
}