{
    "orig": {
        "aktenzeichen": "HRB 732098",
        "amtsgericht": "Stuttgart",
        "event_date": "2014-01-08",
        "event_type": "Veränderungen",
        "federal_state": "bw",
        "full_text": "Amtsgericht Stuttgart Aktenzeichen: HRB 732098 \nBekannt gemacht am: 08.01.2014 11:40 Uhr\n\n\n\n\nIn () gesetzte Angaben der Anschrift und des Geschäftszweiges erfolgen ohne Gewähr:\nVeränderungen\n08.01.2014\n\nHRB 732098:Eumorphed Unternehmergesellschaft (haftungsbeschränkt), Nürtingen, Schlesierstr. 85, 72622 Nürtingen.Ist nur ein Liquidator bestellt, vertritt er allein. Sind mehrere Liquidatoren bestellt, vertreten sie gemeinsam. Nicht mehr Geschäftsführer; nun bestellt als: Liquidator: Chlis, Dimitrios, Nürtingen, *21.04.1979; Emmanouilidis, Charalampos, Fellbach, *13.08.1979. Die Gesellschaft ist aufgelöst.",
        "gesellschafter": null,
        "inhaber": null,
        "name": "HRB 732098:Eumorphed Unternehmergesellschaft (haftungsbeschränkt)",
        "notice_id": "403954",
        "posted_on": "2014-01-08",
        "rechtsform": null,
        "sitz": null,
        "url": "https://www.handelsregisterbekanntmachungen.de/en/skripte/hrb.php?rb_id=403954&land_abk=bw"
    },
    "parsed": {
        "flags": [
            {
                "flag": "CompanyClosed",
                "text": "Die\\ Gesellschaft\\ ist\\ aufgel\\öst\\."
            }
        ],
        "officers": [
            {
                "class": "Liquidator",
                "payload": {
                    "city": "Nürtingen",
                    "dob": "1979-04-21",
                    "lastname": "Chlis",
                    "name": "Dimitrios"
                },
                "text": " Chlis, Dimitrios, Nürtingen, *21.04.1979"
            }
        ]
    }
}