{
    "orig": {
        "aktenzeichen": "HRB 4238",
        "amtsgericht": "Stralsund",
        "event_date": "2012-09-13",
        "event_type": "Veränderungen",
        "federal_state": "mv",
        "full_text": "Amtsgericht Stralsund Aktenzeichen: HRB 4238   \nBekannt gemacht am: 14.09.2012 12:00 Uhr\n\n\n\n\nIn ( ) gesetzte Angaben der Anschrift und des Geschäftszweiges erfolgen ohne Gewähr.\nVeränderungen\n13.09.2012\n\nEURO-Campus Prerow Freizeit- und Bildungseinrichtungs-Betriebsgesellschaft mbH, Prerow, Am Dörpsdiek 7, 24109 Melsdorf. Ist nur ein Liquidator bestellt, so vertritt er die Gesellschaft allein. Sind mehrere Liquidatoren bestellt, so wird die Gesellschaft durch zwei Liquidatoren gemeinsam vertreten. Geändert, nun: Liquidator: Lang, Gerhard R., Melsdorf, *01.07.1944. Die Gesellschaft ist durch Gesellschafterbeschluss zum 31.08.2012 aufgelöst.",
        "gesellschafter": null,
        "inhaber": null,
        "name": "EURO-Campus Prerow Freizeit- und Bildungseinrichtungs-Betriebsgesellschaft mbH",
        "notice_id": "40794",
        "posted_on": "2012-09-14",
        "rechtsform": null,
        "sitz": null,
        "url": "https://www.handelsregisterbekanntmachungen.de/en/skripte/hrb.php?rb_id=40794&land_abk=mv"
    },
    "parsed": {
        "officers": [
            {
                "class": "Liquidator",
                "payload": {
                    "city": "Melsdorf",
                    "dob": "1944-07-01",
                    "lastname": "Lang",
                    "name": "Gerhard R"
                },
                "text": ": Lang, Gerhard R., Melsdorf, *01.07.1944."
            }
        ]
    }
}