{
    "orig": {
        "aktenzeichen": "HRB 17586",
        "amtsgericht": "Saarbrücken",
        "event_date": "2013-04-28",
        "event_type": "Veränderungen",
        "federal_state": "sl",
        "full_text": "Amtsgericht Saarbrücken Aktenzeichen: HRB 17586   \nBekannt gemacht am: 02.05.2013 12:00 Uhr\n\n\n\n\nIn () gesetzte Angaben der Anschrift und des Geschäftszweiges erfolgen ohne Gewähr.\nVeränderungen\n28.04.2013\n\nMetalux D UG (haftungsbeschränkt), Saarbrücken, Bodelschwinghstraße 8, 66125 Saarbrücken. Allgemeine Vertretungsregelung geändert, nun: Ist nur ein Liquidator bestellt, so vertritt er die Gesellschaft allein. Sind mehrere Liquidatoren bestellt, so wird die Gesellschaft durch die Liquidatoren gemeinsam vertreten.Nicht mehr Geschäftsführer, nun bestellt als Liquidator: Wirsum, Rosa, Saarbrücken, *08.01.1973. Die Gesellschafterversammlung vom 24.04.2013 hat die Auflösung der Gesellschaft beschlossen.",
        "gesellschafter": null,
        "inhaber": null,
        "name": "Metalux D UG (haftungsbeschränkt)",
        "notice_id": "41388",
        "posted_on": "2013-05-02",
        "rechtsform": null,
        "sitz": null,
        "url": "https://www.handelsregisterbekanntmachungen.de/en/skripte/hrb.php?rb_id=41388&land_abk=sl"
    },
    "parsed": {
        "officers": [
            {
                "class": "Liquidator",
                "payload": {
                    "city": "Saarbrücken",
                    "dob": "1973-01-08",
                    "lastname": "Wirsum",
                    "name": "Rosa"
                },
                "text": " Wirsum, Rosa, Saarbrücken, *08.01.1973."
            }
        ]
    }
}