{
    "orig": {
        "aktenzeichen": "HRB 3302",
        "amtsgericht": "Tostedt",
        "event_date": "2017-01-12",
        "event_type": "Veränderungen",
        "federal_state": "ni",
        "full_text": "Amtsgericht Tostedt Aktenzeichen: HRB 3302 \nBekannt gemacht am: 12.01.2017 19:01 Uhr\n\n\n\n\nDie in () gesetzten Angaben der Geschäftsanschrift und des Unternehmensgegenstandes erfolgen ohne Gewähr.\nVeränderungen\n12.01.2017\n\nHRB 3302: Rohn Verwaltungs-GmbH, Buchholz, Meilsener Str. 2, 21244 Buchholz. Bestellt als Geschäftsführer: Bohn, Oliver, Buchholz, *24.05.1967; Rommel, Jan-Frederik, Jesteburg, *20.03.1974, jeweils einzelvertretungsberechtigt mit der Befugnis, im Namen der Gesellschaft mit sich im eigenen Namen oder als Vertreter eines Dritten Rechtsgeschäfte abzuschließen. Nicht mehr Geschäftsführer: Köhnke, Norbert, Dipl. Kaufmann, Buchholz.",
        "gesellschafter": null,
        "inhaber": null,
        "name": "HRB 3302: Rohn Verwaltungs-GmbH",
        "notice_id": "421021",
        "posted_on": "2017-01-12",
        "rechtsform": null,
        "sitz": null,
        "url": "https://www.handelsregisterbekanntmachungen.de/en/skripte/hrb.php?rb_id=421021&land_abk=ni"
    },
    "parsed": {
        "flags": [
            {
                "flag": "with the power to enter into legal transactions on behalf of the Company with itself or as a representative of a third party",
                "text": "mit\\ der\\ Befugnis\\,\\ im\\ Namen\\ der\\ Gesellschaft\\ mit\\ sich\\ im\\ eigenen\\ Namen\\ oder\\ als\\ Vertreter\\ eines\\ Dritten\\ Rechtsgesch\\äfte\\ abzuschlie\\ßen\\."
            }
        ],
        "officers": [
            {
                "class": "AppointedManagingDirector",
                "payload": {
                    "city": "Buchholz",
                    "dob": "1967-05-24",
                    "lastname": "Bohn",
                    "name": "Oliver"
                },
                "text": " Bohn, Oliver, Buchholz, *24.05.1967"
            },
            {
                "class": "DismissedManagingDirector",
                "payload": {
                    "city": "Dipl",
                    "dismissed": true,
                    "lastname": "Köhnke",
                    "name": "Norbert"
                },
                "text": " Köhnke, Norbert, Dipl."
            }
        ]
    }
}