{
    "orig": {
        "aktenzeichen": "HRB 29152 HB",
        "amtsgericht": "Bremen",
        "event_date": "2013-12-16",
        "event_type": "Neueintragungen",
        "federal_state": "hb",
        "full_text": "Amtsgericht Bremen Aktenzeichen: HRB 29152 HB \nBekannt gemacht am: 16.12.2013 20:00 Uhr\n\n\n\n\nIn () gesetzte Angaben der Anschrift und des Unternehmensgegenstandes erfolgen ohne Gewähr:\nNeueintragungen\n16.12.2013\n\nHRB 29152 HB: BFJ Invest KGaA, Bremen, Fedelhören 76, 28203 Bremen. Gegenstand: Die Verwaltung eigener Vermögenswerte sowie die Vornahme aller damit im Zusammenhang stehenden Geschäfte, ausgenommen erlaubnispflichtige Geschäfte. Grundkapital: 50.000 EUR. Jeder persönlich haftende Gesellschafter vertritt die Gesellschaft allein. Jeder persönlich haftende Gesellschafter darf Rechtsgeschäfte als Vertreter Dritter abschließen. Persönlich haftender Gesellschafter: Fix, Frank, *26.08.1970, Remchingen; Gaddum, Bernd, *14.04.1971, Mannheim; Kälber, Jürgen Heinz, *04.08.1962, Hügelsheim. Kommanditgesellschaft auf Aktien. Satzung vom 12.12.2013.",
        "gesellschafter": null,
        "inhaber": null,
        "name": "HRB 29152 HB: BFJ Invest KGaA",
        "notice_id": "42493",
        "posted_on": "2013-12-16",
        "rechtsform": null,
        "sitz": null,
        "url": "https://www.handelsregisterbekanntmachungen.de/en/skripte/hrb.php?rb_id=42493&land_abk=hb"
    },
    "parsed": {
        "labels": [
            {
                "label": "WHUT",
                "text": " BFJ Invest KGaA, Bremen, Fedelhören 76, 28203 Bremen."
            }
        ],
        "officers": [
            {
                "class": "PersonalPartner",
                "payload": {
                    "city": "Remchingen",
                    "dob": "1970-08-26",
                    "lastname": "Fix",
                    "name": "Frank"
                },
                "text": " Fix, Frank, *26.08.1970, Remchingen"
            },
            {
                "class": "PersonalPartner",
                "payload": {
                    "city": "Mannheim",
                    "dob": "1971-04-14",
                    "lastname": "Gaddum",
                    "name": "Bernd"
                },
                "text": " Gaddum, Bernd, *14.04.1971, Mannheim"
            },
            {
                "class": "PersonalPartner",
                "payload": {
                    "city": "Hügelsheim",
                    "dob": "1962-08-04",
                    "lastname": "Kälber",
                    "name": "Jürgen Heinz"
                },
                "text": " Kälber, Jürgen Heinz, *04.08.1962, Hügelsheim."
            }
        ]
    }
}