{
    "orig": {
        "aktenzeichen": "HRB 200925",
        "amtsgericht": "Osnabrück",
        "event_date": "2017-03-09",
        "event_type": "Veränderungen",
        "federal_state": "ni",
        "full_text": "Amtsgericht Osnabrück Aktenzeichen: HRB 200925 \nBekannt gemacht am: 09.03.2017 19:00 Uhr\n\n\n\n\nIn () gesetzte Angaben der Anschrift und des Geschäftszweiges erfolgen ohne Gewähr:\nVeränderungen\n09.03.2017\n\nHRB 200925: VARIO Caravaning Center GmbH, Bohmte, An Teckners Tannen 1, 49163 Bohmte. Allgemeine Vertretungsregelung geändert, nun: Ist nur ein Liquidator bestellt, so vertritt er die Gesellschaft allein. Sind mehrere Liquidatoren bestellt, so wird die Gesellschaft durch zwei Liquidatoren oder durch einen Liquidator gemeinsam mit einem Prokuristen vertreten. Geändert, nun: Liquidator: Mix, Frank, Bad Essen, *19.09.1962, einzelvertretungsberechtigt; mit der Befugnis, im Namen der Gesellschaft mit sich im eigenen Namen oder als Vertreter eines Dritten Rechtsgeschäfte abzuschließen. Nicht mehr Geschäftsführer: Rothgänger, Kerstin, Bremen, *22.09.1969. Die Gesellschaft ist mit Beschluss der Gesellschafterversammlung vom 19.12.2016 aufgelöst.",
        "gesellschafter": null,
        "inhaber": null,
        "name": "HRB 200925: VARIO Caravaning Center GmbH",
        "notice_id": "429106",
        "posted_on": "2017-03-09",
        "rechtsform": null,
        "sitz": null,
        "url": "https://www.handelsregisterbekanntmachungen.de/en/skripte/hrb.php?rb_id=429106&land_abk=ni"
    },
    "parsed": {
        "flags": [
            {
                "flag": "with the power to enter into legal transactions on behalf of the Company with itself or as a representative of a third party",
                "text": "mit\\ der\\ Befugnis\\,\\ im\\ Namen\\ der\\ Gesellschaft\\ mit\\ sich\\ im\\ eigenen\\ Namen\\ oder\\ als\\ Vertreter\\ eines\\ Dritten\\ Rechtsgesch\\äfte\\ abzuschlie\\ßen\\."
            }
        ],
        "officers": [
            {
                "class": "Liquidator",
                "payload": {
                    "city": "Bad Essen",
                    "dob": "1962-09-19",
                    "flag": "sole representation",
                    "lastname": ": Mix",
                    "name": "Frank"
                },
                "text": ": Mix, Frank, Bad Essen, *19.09.1962, einzelvertretungsberechtigt"
            },
            {
                "class": "Liquidator",
                "payload": {
                    "lastname": "mit der Befugnis",
                    "name": "im Namen der Gesellschaft mit sich im eigenen Namen oder als Vertreter eines Dritten Rechtsgeschäfte abzuschließen"
                },
                "text": " mit der Befugnis, im Namen der Gesellschaft mit sich im eigenen Namen oder als Vertreter eines Dritten Rechtsgeschäfte abzuschließen."
            },
            {
                "class": "DismissedManagingDirector",
                "payload": {
                    "city": "Bremen",
                    "dismissed": true,
                    "dob": "1969-09-22",
                    "lastname": "Rothgänger",
                    "name": "Kerstin"
                },
                "text": " Rothgänger, Kerstin, Bremen, *22.09.1969."
            }
        ]
    }
}