{
    "orig": {
        "aktenzeichen": "HRB 15",
        "amtsgericht": "Essen",
        "event_date": "2009-05-13",
        "event_type": "Veränderungen",
        "federal_state": "nw",
        "full_text": "Amtsgericht Essen Aktenzeichen: HRB 15 \nBekannt gemacht am: 14.05.2009 12:00 Uhr\n\n\n\n\nIn () gesetzte Angaben der Anschrift und des Geschäftszweiges erfolgen ohne Gewähr.\nVeränderungen\n13.05.2009\n\nEisenbau Essen, Gesellschaft mit beschränkter Haftung, Essen, Hohenzollernstraße 24, 45128 Essen.Geschäftsanschrift: Hohenzollernstraße 24, 45128 Essen. Nicht mehr Geschäftsführer: Alber, Heinz, Düsseldorf, *20.11.1947. Gesamtprokura gemeinsam mit einem Geschäftsführer oder einem anderen Prokuristen: Baumgarten, Christian, Essen, *04.01.1966; Mattusch, Michael, Essen, *20.05.1958. Nach Änderung der Vertretungsbefugnis nunmehr: Gesamtprokura gemeinsam mit einem Geschäftsführer oder einem anderen Prokuristen: Gesamtprokura gemeinsam mit einem Geschäftsführer oder einem anderen Prokuristen: Sövegjarto, Ralf, Düsseldorf, *21.05.1972.",
        "gesellschafter": null,
        "inhaber": null,
        "name": "Eisenbau Essen",
        "notice_id": "433113",
        "posted_on": "2009-05-14",
        "rechtsform": null,
        "sitz": null,
        "url": "https://www.handelsregisterbekanntmachungen.de/en/skripte/hrb.php?rb_id=433113&land_abk=nw"
    },
    "parsed": {
        "labels": [
            {
                "label": "address",
                "text": " Hohenzollernstraße 24, 45128 Essen."
            }
        ],
        "officers": [
            {
                "class": "DismissedManagingDirector",
                "payload": {
                    "city": "Düsseldorf",
                    "dismissed": true,
                    "dob": "1947-11-20",
                    "lastname": "Alber",
                    "name": "Heinz"
                },
                "text": " Alber, Heinz, Düsseldorf, *20.11.1947."
            },
            {
                "class": "CommonProcuration",
                "payload": {
                    "city": "Essen",
                    "dob": "1966-01-04",
                    "lastname": "Baumgarten",
                    "name": "Christian"
                },
                "text": " Baumgarten, Christian, Essen, *04.01.1966"
            },
            {
                "class": "CommonProcuration",
                "payload": {
                    "city": "Essen",
                    "dob": "1958-05-20",
                    "lastname": "Mattusch",
                    "name": "Michael"
                },
                "text": " Mattusch, Michael, Essen, *20.05.1958."
            },
            {
                "class": "CommonProcuration",
                "payload": {
                    "city": "Düsseldorf",
                    "dob": "1972-05-21",
                    "lastname": "Gesamtprokura gemeinsam mit einem Geschäftsführer oder einem anderen Prokuristen: Sövegjarto",
                    "name": "Ralf"
                },
                "text": " Gesamtprokura gemeinsam mit einem Geschäftsführer oder einem anderen Prokuristen: Sövegjarto, Ralf, Düsseldorf, *21.05.1972."
            }
        ]
    }
}