{
    "orig": {
        "aktenzeichen": "HRB 2612",
        "amtsgericht": "Freiburg",
        "event_date": "2014-07-01",
        "event_type": "Veränderungen",
        "federal_state": "bw",
        "full_text": "Amtsgericht Freiburg Aktenzeichen: HRB 2612 \nBekannt gemacht am: 01.07.2014 11:39 Uhr\n\n\n\n\nIn () gesetzte Angaben der Anschrift und des Geschäftszweiges erfolgen ohne Gewähr:\nVeränderungen\n01.07.2014\n\nHRB 2612:Erzherzog Albrecht Gaststätten GmbH, Freiburg im Breisgau, Bertoldstraße 17, 79098 Freiburg im Breisgau.Allgemeine Vertretungsregelung geändert; nun: Ist nur ein Liquidator bestellt, vertritt er allein. Sind mehrere Liquidatoren bestellt, vertreten sie gemeinsam. Bestellt als Liquidator: Burtsche, Richard Roland, Freiburg im Breisgau, *29.08.1939. Nicht mehr Geschäftsführer: Burtsche, Roland, Freiburg im Breisgau, *29.08.1939. Die Gesellschaft ist aufgelöst.",
        "gesellschafter": null,
        "inhaber": null,
        "name": "HRB 2612:Erzherzog Albrecht Gaststätten GmbH",
        "notice_id": "433749",
        "posted_on": "2014-07-01",
        "rechtsform": null,
        "sitz": null,
        "url": "https://www.handelsregisterbekanntmachungen.de/en/skripte/hrb.php?rb_id=433749&land_abk=bw"
    },
    "parsed": {
        "flags": [
            {
                "flag": "CompanyClosed",
                "text": "Die\\ Gesellschaft\\ ist\\ aufgel\\öst\\."
            }
        ],
        "officers": [
            {
                "class": "Liquidator",
                "payload": {
                    "city": "Freiburg im Breisgau",
                    "dob": "1939-08-29",
                    "lastname": "Burtsche",
                    "name": "Richard Roland"
                },
                "text": " Burtsche, Richard Roland, Freiburg im Breisgau, *29.08.1939."
            },
            {
                "class": "DismissedManagingDirector",
                "payload": {
                    "city": "Freiburg im Breisgau",
                    "dismissed": true,
                    "dob": "1939-08-29",
                    "lastname": "Burtsche",
                    "name": "Roland"
                },
                "text": " Burtsche, Roland, Freiburg im Breisgau, *29.08.1939."
            }
        ]
    }
}