{
    "orig": {
        "aktenzeichen": "HRB 621548",
        "amtsgericht": "Freiburg",
        "event_date": "2014-07-18",
        "event_type": "Veränderungen",
        "federal_state": "bw",
        "full_text": "Amtsgericht Freiburg Aktenzeichen: HRB 621548 \nBekannt gemacht am: 18.07.2014 07:14 Uhr\n\n\n\n\nIn () gesetzte Angaben der Anschrift und des Geschäftszweiges erfolgen ohne Gewähr:\nVeränderungen\n18.07.2014\n\nHRB 621548:Simply'n Blue GmbH, Waldshut-Tiengen, Klettgaustraße 9, 79761 Waldshut-Tiengen.Allgemeine Vertretungsregelung von Amts wegen gem. § 384 Abs. 2 FamFG berichtigt in: Ist nur ein Liquidator bestellt, vertritt er allein. Sind mehrere Liquidatoren bestellt, vertreten sie gemeinsam. Personenbezogene Daten von Amts wegen gem. § 384 Abs. 2 FamFG berichtigt bei Liquidator: Tefert, Philipp, Rickenbach, *19.09.1968. Durch rechtskräftigen Beschluss des Amtsgerichts Waldshut-Tiengen vom 05.06.2014 (4 IN 178/13) wurde die Eröffnung des Insolvenzverfahrens über das Vermögen der Gesellschaft mangels einer den Kosten des Verfahrens entsprechenden Masse abgewiesen. Die Gesellschaft ist hierdurch aufgelöst. Gemäß § 60 Abs. 1 GmbHG i.V. § 65 Abs. 1 GmbHG von Amts wegen eingetragen.",
        "gesellschafter": null,
        "inhaber": null,
        "name": "HRB 621548:Simply'n Blue GmbH",
        "notice_id": "437051",
        "posted_on": "2014-07-18",
        "rechtsform": null,
        "sitz": null,
        "url": "https://www.handelsregisterbekanntmachungen.de/en/skripte/hrb.php?rb_id=437051&land_abk=bw"
    },
    "parsed": {
        "officers": [
            {
                "class": "Liquidator",
                "payload": {
                    "city": "Rickenbach",
                    "dob": "1968-09-19",
                    "lastname": "Tefert",
                    "name": "Philipp"
                },
                "text": " Tefert, Philipp, Rickenbach, *19.09.1968."
            }
        ]
    }
}