{
    "orig": {
        "aktenzeichen": "HRB 100531",
        "amtsgericht": "Oldenburg",
        "event_date": "2017-06-01",
        "event_type": "Veränderungen",
        "federal_state": "ni",
        "full_text": "Amtsgericht Oldenburg Aktenzeichen: HRB 100531 \nBekannt gemacht am: 01.06.2017 19:00 Uhr\n\n\n\n\nIn () gesetzte Angaben der Anschrift und des Geschäftszweiges erfolgen ohne Gewähr:\nVeränderungen\n01.06.2017\n\nHRB 100531: Melka GmbH, Nordenham, Deichstr. 25 b, 26954 Nordenham. Ist nur ein Liquidator bestellt, so vertritt er die Gesellschaft allein. Sind mehrere Liquidatoren bestellt, so wird die Gesellschaft durch die Liquidatoren gemeinsam vertreten. Geändert, nun: Liquidator: Müller, Gerd, Nordenham, *02.10.1955. Die Gesellschaft ist mit Beschluss der Gesellschafterversammlung vom 07.12.2016 aufgelöst.",
        "gesellschafter": null,
        "inhaber": null,
        "name": "HRB 100531: Melka GmbH",
        "notice_id": "438863",
        "posted_on": "2017-06-01",
        "rechtsform": null,
        "sitz": null,
        "url": "https://www.handelsregisterbekanntmachungen.de/en/skripte/hrb.php?rb_id=438863&land_abk=ni"
    },
    "parsed": {
        "officers": [
            {
                "class": "Liquidator",
                "payload": {
                    "city": "Nordenham",
                    "dob": "1955-02-10",
                    "lastname": ": Müller",
                    "name": "Gerd"
                },
                "text": ": Müller, Gerd, Nordenham, *02.10.1955."
            }
        ]
    }
}