{
    "orig": {
        "aktenzeichen": "HRB 95143",
        "amtsgericht": "Frankfurt am Main",
        "event_date": "2015-07-28",
        "event_type": "Veränderungen",
        "federal_state": "he",
        "full_text": "Amtsgericht Frankfurt am Main Aktenzeichen: HRB 95143 \nBekannt gemacht am: 28.07.2015 22:01 Uhr\n\n\n\n\nVeröffentlichungen des Amtsgerichts Frankfurt am Main\n\n\nIn () gesetzte Angaben der Anschrift und des Geschäftszweiges erfolgen ohne Gewähr.\nVeränderungen\n28.07.2015\n\nHRB 95143: AIG Europe Limited, Direktion für Deutschland, Frankfurt am Main, Speicherstraße 55, 60327 Frankfurt. Prokura erloschen: Bauer, Andreas, Königstein im Taunus, *04.03.1971; Höhn, Wolfgang, Frankfurt am Main, *13.07.1966; Mauch, Gerhard, Heilbronn, *22.06.1954; Pölig, Torsten, Frankfurt am Main, *14.08.1968; Rigby, William, Frankfurt am Main, *05.04.1948; Thijs, Kris, Mörlenbach, *29.08.1974; Ziegler, Holger, Heilbronn, *04.08.1956. Gesamtprokura gemeinsam mit einem anderen Prokuristen: Johnston, Graham Thomas, Küsnacht/Schweiz, *17.10.1959; Loesti, Johannes Nepomuk, Frankfurt am Main, *31.05.1979. Einzelprokura: Krause, Andreas, Zürich, *04.08.1976; Reinhard, Arndt, Zürich, *15.02.1972.",
        "gesellschafter": null,
        "inhaber": null,
        "name": "HRB 95143: AIG Europe Limited",
        "notice_id": "445017",
        "posted_on": "2015-07-28",
        "rechtsform": null,
        "sitz": null,
        "url": "https://www.handelsregisterbekanntmachungen.de/en/skripte/hrb.php?rb_id=445017&land_abk=he"
    },
    "parsed": {
        "officers": [
            {
                "class": "ProcurationCancelled",
                "payload": {
                    "city": "Königstein im Taunus",
                    "dismissed": true,
                    "dob": "1971-04-03",
                    "lastname": "Bauer",
                    "name": "Andreas"
                },
                "text": " Bauer, Andreas, Königstein im Taunus, *04.03.1971"
            },
            {
                "class": "SingleProcuration",
                "payload": {
                    "city": "Zürich",
                    "dob": "1976-04-08",
                    "lastname": "Krause",
                    "name": "Andreas"
                },
                "text": " Krause, Andreas, Zürich, *04.08.1976"
            }
        ]
    }
}