{
    "orig": {
        "aktenzeichen": "HRB 8642",
        "amtsgericht": "Mannheim",
        "event_date": "2014-09-16",
        "event_type": "Veränderungen",
        "federal_state": "bw",
        "full_text": "Amtsgericht Mannheim Aktenzeichen: HRB 8642 \nBekannt gemacht am: 16.09.2014 13:56 Uhr\n\n\n\n\nIn () gesetzte Angaben der Anschrift und des Geschäftszweiges erfolgen ohne Gewähr:\nVeränderungen\n16.09.2014\n\nHRB 8642:L-Immobilien GmbH, Mannheim, Weinheimer Str. 64 a, 68309 Mannheim.Personenbezogene Daten geändert bei Geschäftsführer: Kellermann, Ernst, Denkendorf, *21.05.1956. Der zwischen der Gesellschaft und der \"Landesbank Baden-Württemberg\" mit Sitz in Karlsruhe, Mannheim, Stuttgart und Mainz (Amtsgericht Karlsruhe HRA 104440, Amtsgericht Mannheim HRA 4356, Amtsgericht Stuttgart HRA 12704 und Amtsgericht Mainz HRA 40687) am 21.12.2000 abgeschlossene Beherrschungs- und Ergebnisabführungsvertrag wurde am 04./18.08.2014 geändert. Die Gesellschafterversammlung hat der Änderung am 29.08.2014 zugestimmt. Auf die bei Gericht eingereichten Urkunden wird Bezug genommen.",
        "gesellschafter": null,
        "inhaber": null,
        "name": "HRB 8642:L-Immobilien GmbH",
        "notice_id": "447023",
        "posted_on": "2014-09-16",
        "rechtsform": null,
        "sitz": null,
        "url": "https://www.handelsregisterbekanntmachungen.de/en/skripte/hrb.php?rb_id=447023&land_abk=bw"
    },
    "parsed": {
        "officers": [
            {
                "class": "ManagingDirector",
                "payload": {
                    "city": "Denkendorf",
                    "dob": "1956-05-21",
                    "lastname": "Kellermann",
                    "name": "Ernst"
                },
                "text": " Kellermann, Ernst, Denkendorf, *21.05.1956."
            }
        ]
    }
}