{
    "orig": {
        "aktenzeichen": "HRB 3235",
        "amtsgericht": "Wetzlar",
        "event_date": "2015-09-09",
        "event_type": "Veränderungen",
        "federal_state": "he",
        "full_text": "Amtsgericht Wetzlar Aktenzeichen: HRB 3235 \nBekannt gemacht am: 09.09.2015 22:01 Uhr\n\n\n\n\nVeröffentlichungen des Amtsgerichts Wetzlar\n\n\nIn () gesetzte Angaben der Anschrift und des Geschäftszweiges erfolgen ohne Gewähr.\nVeränderungen\n09.09.2015\n\nHRB 3235: Gebr. Michel GmbH Metallbau, Eschenburg-Simmersbach, Am Forsthaus 6, 35713 Eschenburg. Die Gesellschafterversammlung vom 01.07.2015 hat die Änderung des Gesellschaftsvertrages in § 10 (Gesellschafterbeschlüsse) und 14 (Einziehung von Geschäftsanteilen) beschlossen. Nicht mehr Geschäftsführer: Michel, Helmut, Eschenburg-Simmersbach, *02.10.1941. Einzelprokura: Mevius, Peter, Dautphetal, *27.08.1974.",
        "gesellschafter": null,
        "inhaber": null,
        "name": "HRB 3235: Gebr. Michel GmbH Metallbau",
        "notice_id": "451191",
        "posted_on": "2015-09-09",
        "rechtsform": null,
        "sitz": null,
        "url": "https://www.handelsregisterbekanntmachungen.de/en/skripte/hrb.php?rb_id=451191&land_abk=he"
    },
    "parsed": {
        "flags": [
            {
                "flag": "Single procuration",
                "text": "Einzelprokura"
            }
        ],
        "officers": [
            {
                "class": "DismissedManagingDirector",
                "payload": {
                    "city": "Eschenburg-Simmersbach",
                    "dismissed": true,
                    "dob": "1941-02-10",
                    "lastname": "Michel",
                    "name": "Helmut"
                },
                "text": " Michel, Helmut, Eschenburg-Simmersbach, *02.10.1941."
            },
            {
                "class": "SingleProcuration",
                "payload": {
                    "city": "Dautphetal",
                    "dob": "1974-08-27",
                    "lastname": "Mevius",
                    "name": "Peter"
                },
                "text": " Mevius, Peter, Dautphetal, *27.08.1974."
            }
        ]
    }
}