{
    "orig": {
        "aktenzeichen": "HRB 211355",
        "amtsgericht": "Osnabrück",
        "event_date": "2017-09-21",
        "event_type": "Veränderungen",
        "federal_state": "ni",
        "full_text": "Amtsgericht Osnabrück Aktenzeichen: HRB 211355 \nBekannt gemacht am: 21.09.2017 19:00 Uhr\n\n\n\n\nIn () gesetzte Angaben der Anschrift und des Geschäftszweiges erfolgen ohne Gewähr:\nVeränderungen\n21.09.2017\n\nHRB 211355: Pilkington Glasveredelung GmbH, Bad Bentheim, Wiener Straße 33, 48455 Bad Bentheim. Nicht mehr Geschäftsführer: Aveskamp, Laurentius Gerhardus Maria, Denekamp / Niederlande, *11.09.1967. Bestellt als Geschäftsführer: Arens, Claudius, Gelsenkirchen, *20.12.1967; Breil, Tobias, Dorsten, *26.05.1979, jeweils vertretungsberechtigt gemeinsam mit einem anderen Geschäftsführer oder einem Prokuristen. Gesamtprokura gemeinsam mit einem Geschäftsführer oder einem anderen Prokuristen: Aveskamp, Laurentius Gerhardus Maria, Denekamp, *11.09.1967. Mit der Pilkington Holding GmbH, Gelsenkirchen (Amtsgericht Gelsenkirchen HRB 8997) als herrschendem Unternehmen ist am 06.09.2017 ein Beherrschungs- und Gewinnabführungsvertrag geschlossen. Ihm hat die Gesellschafterversammlung vom 06.09.2017 zugestimmt.",
        "gesellschafter": null,
        "inhaber": null,
        "name": "HRB 211355: Pilkington Glasveredelung GmbH",
        "notice_id": "452163",
        "posted_on": "2017-09-21",
        "rechtsform": null,
        "sitz": null,
        "url": "https://www.handelsregisterbekanntmachungen.de/en/skripte/hrb.php?rb_id=452163&land_abk=ni"
    },
    "parsed": {
        "officers": [
            {
                "class": "DismissedManagingDirector",
                "payload": {
                    "city": "Denekamp / Niederlande",
                    "dismissed": true,
                    "dob": "1967-11-09",
                    "lastname": "Aveskamp",
                    "name": "Laurentius Gerhardus Maria"
                },
                "text": " Aveskamp, Laurentius Gerhardus Maria, Denekamp / Niederlande, *11.09.1967."
            },
            {
                "class": "AppointedManagingDirector",
                "payload": {
                    "city": "Gelsenkirchen",
                    "dob": "1967-12-20",
                    "lastname": "Arens",
                    "name": "Claudius"
                },
                "text": " Arens, Claudius, Gelsenkirchen, *20.12.1967"
            },
            {
                "class": "CommonProcuration",
                "payload": {
                    "city": "Denekamp",
                    "dob": "1967-11-09",
                    "lastname": "Aveskamp",
                    "name": "Laurentius Gerhardus Maria"
                },
                "text": " Aveskamp, Laurentius Gerhardus Maria, Denekamp, *11.09.1967."
            }
        ]
    }
}