{
    "orig": {
        "aktenzeichen": "HRB 741640",
        "amtsgericht": "Stuttgart",
        "event_date": "2014-11-03",
        "event_type": "Veränderungen",
        "federal_state": "bw",
        "full_text": "Amtsgericht Stuttgart Aktenzeichen: HRB 741640 \nBekannt gemacht am: 03.11.2014 09:14 Uhr\n\n\n\n\nIn () gesetzte Angaben der Anschrift und des Geschäftszweiges erfolgen ohne Gewähr:\nVeränderungen\n03.11.2014\n\nHRB 741640:COMMUNICATION FOR ARCHITECTURE UG (haftungsbeschränkt), Tuttlingen, Zollernstraße 14/1, 78532 Tuttlingen.Die Gesellschafterversammlung vom 02.10.2014 hat die Änderung des Gesellschaftsvertrages in Ziffer 1 (Firma) und Ziffer 3 (Stammkapital) beschlossen. Das Stammkapital ist um 24.900,00 EUR auf 25.000,00 EUR erhöht. Die Gesellschafterversammlung vom 30.10.2014 hat die Änderung des Gesellschaftsvertrages in Ziffer 2 (Gegenstand) beschlossen. Firma geändert; nun: Herzberg Ingenieure GmbH. Gegenstand geändert; nun: Der Betrieb eines Ingenieurbüros für Projektsteuerung, Projektentwicklung und Konzeptplanung. Stammkapital nun: 25.000,00 EUR. Nicht mehr Geschäftsführer: Beyer, Corinna-Mercedes, Tuttlingen, *13.03.1970. Einzelprokura mit der Befugnis, im Namen der Gesellschaft mit sich im eigenen Namen oder als Vertreter eines Dritten Rechtsgeschäfte abzuschließen: Beyer, Corinna-Mercedes, Tuttlingen, *13.03.1970.",
        "gesellschafter": null,
        "inhaber": null,
        "name": "HRB 741640:COMMUNICATION FOR ARCHITECTURE UG (haftungsbeschränkt)",
        "notice_id": "454283",
        "posted_on": "2014-11-03",
        "rechtsform": null,
        "sitz": null,
        "url": "https://www.handelsregisterbekanntmachungen.de/en/skripte/hrb.php?rb_id=454283&land_abk=bw"
    },
    "parsed": {
        "flags": [
            {
                "flag": "Single procuration",
                "text": "Einzelprokura"
            }
        ],
        "officers": [
            {
                "class": "DismissedManagingDirector",
                "payload": {
                    "city": "Tuttlingen",
                    "dismissed": true,
                    "dob": "1970-03-13",
                    "lastname": "Beyer",
                    "name": "Corinna-Mercedes"
                },
                "text": " Beyer, Corinna-Mercedes, Tuttlingen, *13.03.1970."
            }
        ]
    }
}