{
    "orig": {
        "aktenzeichen": "HRB 28757",
        "amtsgericht": "Düsseldorf",
        "event_date": "2009-07-20",
        "event_type": "Veränderungen",
        "federal_state": "nw",
        "full_text": "Amtsgericht Düsseldorf Aktenzeichen: HRB 28757 \nBekannt gemacht am: 28.07.2009 12:00 Uhr\n\n\n\n\nIn () gesetzte Angaben der Anschrift und des Geschäftszweiges erfolgen ohne Gewähr.\nVeränderungen\n20.07.2009\n\nECOLAB Holding GmbH, Düsseldorf, Reisholzer Werftstraße 38-42, 40589 Düsseldorf.Die Gesellschafterversammlung vom 14.07.2009 hat Änderungen des Gesellschaftsvertrages beschlossen; insbesondere wurde § 1 Abs. 3 (Gegenstand des Unternehmens) geändert. Die bisherigen §§ 7 bis 9 werden §§ 8 bis 10. Der Gesellschaftsvertrag erhält einen neuen § 7 (Aufsichtsrat). Geschäftsanschrift: Reisholzer Werftstr. 38-42, 40589 Düsseldorf. Neuer Unternehmensgegenstand: Gegenstand des Unternehmens ist die Entwicklung, Herstellung und der Vertrieb von Wasch-, Spül-, Reinigungs-, Desinfektions- und Körperpflegemitteln sowie von Reinigungsgeräten und -maschinen für institutionelle, industrielle, gewerbliche und freiberufliche Verbraucher sowie die Erbringung von damit zusammenhängenden Dienstleistungen. Nicht mehr Geschäftsführer: Bolien, Frank Thomas, Jüchen, *20.08.1960. Bestellt als Geschäftsführer: Gichtbrock, Ralph, Meerbusch, *05.03.1956; Jörgens, Boris, Köln, *22.12.1970; Stöhr, Karl Alfred, Monheim, *16.11.1961. Gesamtprokura gemeinsam mit einem Geschäftsführer oder einem anderen Prokuristen: Weber, Andreas, Ratingen, *02.06.1967. Die Gesellschaft ist als übernehmender Rechtsträger nach Maßgabe des Verschmelzungsvertrages vom 14.07.2009 sowie der Zustimmungsbeschlüsse ihrer Gesellschafterversammlung vom 14.07.2009 und der Gesellschafterversammlung des übertragenden Rechtsträgers vom 14.07.2009 mit der Ecolab Beteiligungs GmbH mit Sitz in Düsseldorf (AG Düsseldorf HRB 27253) verschmolzen. Als nicht eingetragen wird bekanntgemacht:Den Gläubigern der an der Verschmelzung beteiligten Gesellschaften ist, wenn sie binnen sechs Monaten nach dem Tag, an dem die Eintragung der Verschmelzung in das Register des Sitzes desjenigen Rechtsträgers, dessen Gläubiger sie sind, nach § 19 Absatz 3 UmwG als bekanntgemacht gilt, ihren Anspruch nach Grund und Höhe schriftlich anmelden, Sicherheit zu leisten, soweit sie nicht Befriedigung verlangen können. Dieses Recht steht den Gläubigern jedoch nur zu, wenn sie glaubhaft machen, dass durch die Verschmelzung die Erfüllung ihrer Forderung gefährdet wird.",
        "gesellschafter": null,
        "inhaber": null,
        "name": "ECOLAB Holding GmbH",
        "notice_id": "455134",
        "posted_on": "2009-07-28",
        "rechtsform": null,
        "sitz": null,
        "url": "https://www.handelsregisterbekanntmachungen.de/en/skripte/hrb.php?rb_id=455134&land_abk=nw"
    },
    "parsed": {
        "labels": [
            {
                "label": "address",
                "text": " Reisholzer Werftstr."
            }
        ],
        "officers": [
            {
                "class": "DismissedManagingDirector",
                "payload": {
                    "city": "Jüchen",
                    "dismissed": true,
                    "dob": "1960-08-20",
                    "lastname": "Bolien",
                    "name": "Frank Thomas"
                },
                "text": " Bolien, Frank Thomas, Jüchen, *20.08.1960."
            },
            {
                "class": "AppointedManagingDirector",
                "payload": {
                    "city": "Meerbusch",
                    "dob": "1956-05-03",
                    "lastname": "Gichtbrock",
                    "name": "Ralph"
                },
                "text": " Gichtbrock, Ralph, Meerbusch, *05.03.1956"
            },
            {
                "class": "CommonProcuration",
                "payload": {
                    "city": "Ratingen",
                    "dob": "1967-02-06",
                    "lastname": "Weber",
                    "name": "Andreas"
                },
                "text": " Weber, Andreas, Ratingen, *02.06.1967."
            }
        ]
    }
}