{
    "orig": {
        "aktenzeichen": "HRA 703937",
        "amtsgericht": "Freiburg",
        "event_date": "2014-12-01",
        "event_type": "Neueintragungen",
        "federal_state": "bw",
        "full_text": "Amtsgericht Freiburg Aktenzeichen: HRA 703937 \nBekannt gemacht am: 01.12.2014 15:27 Uhr\n\n\n\n\nIn () gesetzte Angaben der Anschrift und des Geschäftszweiges erfolgen ohne Gewähr:\nNeueintragungen\n01.12.2014\n\nHRA 703937:HAM Hofmann, Albrecht und Meyer OHG, Laufenburg Baden, Joseph-Tröndlin-Weg 6b, 79725 Laufenburg Baden.(Internethandel mit verschiedenen, auch selbst hergestellten und verarbeiteten Produkten, den Betrieb von Ladengeschäften des Einzelhandels verschiedener auch selbst hergestellter und verarbeiteter Produkte, die Erbringung von Leistungen einer Postfiliale und andere Dienstleistungen.). Offene Handelsgesellschaft. Geschäftsanschrift: Joseph-Tröndlin-Weg 6b, 79725 Laufenburg Baden. Allgemeine Vertretungsregelung: Jeder persönlich haftende Gesellschafter vertritt einzeln. Persönlich haftender Gesellschafter: Albrecht, Hendrik, Rheinfelden Baden, *20.02.1976; Hofmann, Michael, Laufenburg Baden, *09.10.1975; Meyer, Thomas, Laufenburg Baden, *17.03.1982.",
        "gesellschafter": null,
        "inhaber": null,
        "name": "HRA 703937:HAM Hofmann",
        "notice_id": "459164",
        "posted_on": "2014-12-01",
        "rechtsform": null,
        "sitz": null,
        "url": "https://www.handelsregisterbekanntmachungen.de/en/skripte/hrb.php?rb_id=459164&land_abk=bw"
    },
    "parsed": {
        "labels": [
            {
                "label": "address",
                "text": " Joseph-Tröndlin-Weg 6b, 79725 Laufenburg Baden."
            }
        ],
        "officers": [
            {
                "class": "PersonalPartner",
                "payload": {
                    "city": "Rheinfelden Baden",
                    "dob": "1976-02-20",
                    "lastname": "Albrecht",
                    "name": "Hendrik"
                },
                "text": " Albrecht, Hendrik, Rheinfelden Baden, *20.02.1976"
            }
        ]
    }
}