{
    "orig": {
        "aktenzeichen": "HRB 6424",
        "amtsgericht": "Darmstadt",
        "event_date": "2015-12-01",
        "event_type": "Veränderungen",
        "federal_state": "he",
        "full_text": "Amtsgericht Darmstadt Aktenzeichen: HRB 6424 \nBekannt gemacht am: 01.12.2015 22:01 Uhr\n\n\n\n\nVeröffentlichungen des Amtsgerichts Darmstadt\n\n\nIn () gesetzte Angaben der Anschrift und des Geschäftszweiges erfolgen ohne Gewähr.\nVeränderungen\n01.12.2015\n\nHRB 6424: HSE Medianet GmbH, Darmstadt, Frankfurter Staße 100, 64293 Darmstadt. Nicht mehr Geschäftsführerin: Sauder, Beate, Darmstadt, *09.10.1962. Bestellt als Geschäftsführer: Grey, Frank, Essenheim, *25.07.1967; Schmidt, Thomas, Hofheim am Taunus, *13.06.1967, jeweils mit der Befugnis, im Namen der Gesellschaft mit sich als Vertreter eines Dritten Rechtsgeschäfte abzuschließen.",
        "gesellschafter": null,
        "inhaber": null,
        "name": "HRB 6424: HSE Medianet GmbH",
        "notice_id": "462531",
        "posted_on": "2015-12-01",
        "rechtsform": null,
        "sitz": null,
        "url": "https://www.handelsregisterbekanntmachungen.de/en/skripte/hrb.php?rb_id=462531&land_abk=he"
    },
    "parsed": {
        "officers": [
            {
                "class": "DismissedManagingDirector",
                "payload": {
                    "city": "Darmstadt",
                    "dismissed": true,
                    "dob": "1962-09-10",
                    "lastname": "Sauder",
                    "name": "Beate"
                },
                "text": " Sauder, Beate, Darmstadt, *09.10.1962."
            },
            {
                "class": "AppointedManagingDirector",
                "payload": {
                    "city": "Essenheim",
                    "dob": "1967-07-25",
                    "lastname": "Grey",
                    "name": "Frank"
                },
                "text": " Grey, Frank, Essenheim, *25.07.1967"
            }
        ]
    }
}