{
    "orig": {
        "aktenzeichen": "HRB 130026",
        "amtsgericht": "Osnabrück",
        "event_date": "2018-01-09",
        "event_type": "Veränderungen",
        "federal_state": "ni",
        "full_text": "Amtsgericht Osnabrück Aktenzeichen: HRB 130026 \nBekannt gemacht am: 09.01.2018 19:01 Uhr\n\n\n\n\nIn () gesetzte Angaben der Anschrift und des Geschäftszweiges erfolgen ohne Gewähr:\nVeränderungen\n09.01.2018\n\nHRB 130026: Emsland-Stärke Gesellschaft mit beschränkter Haftung, Emlichheim, Emslandstraße 58, 49824 Emlichheim. Bestellt als Geschäftsführer: Hannemann, Stefan, Bispingen, *18.11.1967; Kemper, Christian, Münster, *06.11.1968, jeweils mit der Befugnis, im Namen der Gesellschaft mit sich als Vertreter eines Dritten Rechtsgeschäfte abzuschließen. Prokura erloschen: Hannemann, Stefan, Bispingen, *18.11.1967; Kemper, Christian, Münster, *06.11.1968.",
        "gesellschafter": null,
        "inhaber": null,
        "name": "HRB 130026: Emsland-Stärke Gesellschaft mit beschränkter Haftung",
        "notice_id": "465436",
        "posted_on": "2018-01-09",
        "rechtsform": null,
        "sitz": null,
        "url": "https://www.handelsregisterbekanntmachungen.de/en/skripte/hrb.php?rb_id=465436&land_abk=ni"
    },
    "parsed": {
        "officers": [
            {
                "class": "AppointedManagingDirector",
                "payload": {
                    "city": "Bispingen",
                    "dob": "1967-11-18",
                    "lastname": "Hannemann",
                    "name": "Stefan"
                },
                "text": " Hannemann, Stefan, Bispingen, *18.11.1967"
            },
            {
                "class": "AppointedManagingDirector",
                "payload": {
                    "city": "Münster",
                    "dob": "1968-11-06",
                    "flag": "jeweils mit der Befugnis im Namen der Gesellschaft mit sich als Vertreter eines Dritten Rechtsgeschäfte abzuschließen",
                    "lastname": "Kemper",
                    "name": "Christian"
                },
                "text": " Kemper, Christian, Münster, *06.11.1968, jeweils mit der Befugnis, im Namen der Gesellschaft mit sich als Vertreter eines Dritten Rechtsgeschäfte abzuschließen."
            },
            {
                "class": "ProcurationCancelled",
                "payload": {
                    "city": "Bispingen",
                    "dismissed": true,
                    "dob": "1967-11-18",
                    "lastname": "Hannemann",
                    "name": "Stefan"
                },
                "text": " Hannemann, Stefan, Bispingen, *18.11.1967"
            },
            {
                "class": "ProcurationCancelled",
                "payload": {
                    "city": "Münster",
                    "dismissed": true,
                    "dob": "1968-11-06",
                    "lastname": "Kemper",
                    "name": "Christian"
                },
                "text": " Kemper, Christian, Münster, *06.11.1968."
            }
        ]
    }
}