{
    "orig": {
        "aktenzeichen": "HRB 209397",
        "amtsgericht": "Jena",
        "event_date": "2006-03-23",
        "event_type": "Veränderungen",
        "federal_state": "th",
        "full_text": "Amtsgericht Jena Aktenzeichen: HRB 209397 \nBekannt gemacht am: 28.03.2006 09:40 Uhr\n\n\n\n\nDie in () gesetzten Angaben der Geschäftsanschrift und des Unternehmensgegenstandes erfolgen ohne Gewähr.\nVeränderungen\n23.03.2006\n\nService GmbH FENRICH, Rudolstadt (Schwarzburger Str. 71, 07407 Rudolstadt). Die Gesellschaft ist durch rechtskräftige Abweisung eines Antrags auf Eröffnung des Insolvenzverfahrens mangels Masse aufgelöst (Az. 8 IN 916/05 Amtsgericht Gera). Von Amts wegen eingetragen. Die Gesellschaft wird durch den/die Liquidator/en vertreten. Geändert, nun: Liquidator: Fenrich, Jürgen Bernd, Rottenbach, *19.07.1956.",
        "gesellschafter": null,
        "inhaber": null,
        "name": "Service GmbH FENRICH",
        "notice_id": "473",
        "posted_on": "2006-03-28",
        "rechtsform": null,
        "sitz": null,
        "url": "https://www.handelsregisterbekanntmachungen.de/en/skripte/hrb.php?rb_id=473&land_abk=th"
    },
    "parsed": {
        "officers": [
            {
                "class": "Liquidator",
                "payload": {
                    "city": "Rottenbach",
                    "dob": "1956-07-19",
                    "lastname": ": Fenrich",
                    "name": "Jürgen Bernd"
                },
                "text": ": Fenrich, Jürgen Bernd, Rottenbach, *19.07.1956."
            }
        ]
    }
}