{
    "orig": {
        "aktenzeichen": "HRB 702987",
        "amtsgericht": "Mannheim",
        "event_date": "2015-02-18",
        "event_type": "Veränderungen",
        "federal_state": "bw",
        "full_text": "Amtsgericht Mannheim Aktenzeichen: HRB 702987 \nBekannt gemacht am: 18.02.2015 17:04 Uhr\n\n\n\n\nIn () gesetzte Angaben der Anschrift und des Geschäftszweiges erfolgen ohne Gewähr:\nVeränderungen\n18.02.2015\n\nHRB 702987:e-volo GmbH, Karlsruhe, Östliche Rheinbrückenstraße 50 Gebäude 5415b EG R58, 76187 Karlsruhe.Die Gesellschafterversammlung vom 27.01.2015 hat die Änderung des Gesellschaftsvertrages in § 2 (Gegenstand) beschlossen. Gegenstand geändert; nun: Die Entwicklung, die Produktion, die Vermarktung und der Vertrieb von Luftfahrtgeräten und Drohnen sowie die Neuentwicklung und Pflege von Software in Auftragsarbeit. Gegenstand der Gesellschaft ist weiter die Ausnutzung und Verwertung von eigenen und fremden Rechten insbesondere von Urheberrechten und sonstigen gewerblichen Schutzrechten, die Fortentwicklung von eigenen Rechten sowie Neuentwicklung und Pflege von Produkten und Diensten zur Erlangung von gewerblichen Schutzrechten. Bestellt als Geschäftsführer: Reuter, Florian, Dossenheim, *16.08.1979.",
        "gesellschafter": null,
        "inhaber": null,
        "name": "HRB 702987:e-volo GmbH",
        "notice_id": "474900",
        "posted_on": "2015-02-18",
        "rechtsform": null,
        "sitz": null,
        "url": "https://www.handelsregisterbekanntmachungen.de/en/skripte/hrb.php?rb_id=474900&land_abk=bw"
    },
    "parsed": {
        "officers": [
            {
                "class": "AppointedManagingDirector",
                "payload": {
                    "city": "Dossenheim",
                    "dob": "1979-08-16",
                    "lastname": "Reuter",
                    "name": "Florian"
                },
                "text": " Reuter, Florian, Dossenheim, *16.08.1979."
            }
        ]
    }
}