{
    "orig": {
        "aktenzeichen": "HRB 145470 B",
        "amtsgericht": "Charlottenburg (Berlin)",
        "event_date": "2018-04-23",
        "event_type": "Veränderungen",
        "federal_state": "be",
        "full_text": "Amtsgericht Charlottenburg (Berlin) Aktenzeichen: HRB 145470 B \nBekannt gemacht am: 24.04.2018 11:25 Uhr\n\n\n\n\nIn () gesetzte Angaben der Anschrift und des Unternehmensgegenstandes erfolgen ohne Gewähr:\nVeränderungen\n23.04.2018\n\nHRB 145470 B: Mepadi UG (haftungsbeschränkt), Berlin, Auguststraße 58, 10119 Berlin. Vertretungsregelung: Ist ein Liquidator bestellt, so vertritt er die Gesellschaft allein. Sind mehrere Liquidatoren bestellt, wird die Gesellschaft gemeinschaftlich durch zwei Liquidatoren vertreten.  Nicht mehr Geschäftsführer: 1. Brill-Völkle, Keenan Hugo Lawrence Helmut; Nicht mehr Geschäftsführer: 2. Hüsgen, Jasper; Nicht mehr Geschäftsführer: 4. Nagel, Julian Philipp; Änderung zu Nr. 3: Nunmehr: Liquidator: Nagel, Frederik, *05.03.1991, Kiel; Rechtsverhaeltnis: Die Gesellschaft ist durch Gesellschafterbeschluss aufgelöst.",
        "gesellschafter": null,
        "inhaber": null,
        "name": "HRB 145470 B: Mepadi UG (haftungsbeschränkt)",
        "notice_id": "475324",
        "posted_on": "2018-04-24",
        "rechtsform": null,
        "sitz": null,
        "url": "https://www.handelsregisterbekanntmachungen.de/en/skripte/hrb.php?rb_id=475324&land_abk=be"
    },
    "parsed": {
        "labels": [
            {
                "label": "WHUT",
                "text": " Mepadi UG (haftungsbeschränkt), Berlin, Auguststraße 58, 10119 Berlin."
            }
        ],
        "officers": [
            {
                "class": "DismissedManagingDirector",
                "payload": {
                    "dismissed": true,
                    "lastname": "Brill-Völkle",
                    "name": "Keenan Hugo Lawrence Helmut"
                },
                "text": " Brill-Völkle, Keenan Hugo Lawrence Helmut"
            },
            {
                "class": "DismissedManagingDirector",
                "payload": {
                    "dismissed": true,
                    "lastname": "Hüsgen",
                    "name": "Jasper"
                },
                "text": " Hüsgen, Jasper"
            },
            {
                "class": "DismissedManagingDirector",
                "payload": {
                    "dismissed": true,
                    "lastname": "Nagel",
                    "name": "Julian Philipp"
                },
                "text": " Nagel, Julian Philipp"
            },
            {
                "class": "Liquidator",
                "payload": {
                    "city": "Kiel",
                    "dob": "1991-05-03",
                    "lastname": "Nagel",
                    "name": "Frederik"
                },
                "text": " Nagel, Frederik, *05.03.1991, Kiel"
            }
        ]
    }
}