{
    "orig": {
        "aktenzeichen": "HRB 4211",
        "amtsgericht": "Kassel",
        "event_date": "2016-02-26",
        "event_type": "Veränderungen",
        "federal_state": "he",
        "full_text": "Amtsgericht Kassel Aktenzeichen: HRB 4211 \nBekannt gemacht am: 26.02.2016 22:02 Uhr\n\n\n\n\nVeröffentlichungen des Amtsgerichts Kassel\n\n\nIn () gesetzte Angaben der Anschrift und des Geschäftszweiges erfolgen ohne Gewähr.\nVeränderungen\n26.02.2016\n\nHRB 4211: \"Haus an der Sternwarte\" Pädagogische Kinder- und Jugendeinrichtung GmbH, Fuldatal, Auf dem Hasenstock 52, 34233 Fuldatal. Die Gesellschafterversammlung vom 14.01.2016 hat die Änderung des Gesellschaftsvertrages in § 17 beschlossen. Die Gesellschafterversammlung vom 01.02.2016 hat die Änderung des Gesellschaftsvertrages in den §§ 1 (Firma und Sitz der Gesellschaft) und 7 (Geschäftsführung und Vertretung) beschlossen. Firma geändert, nun: Neue Firma: \"Haus an der Sternwarte\" Pädagogische Kinder- und Jugendeinrichtung Gemeinnützige GmbH. Sitz verlegt, nun: Kassel. Geschäftsanschrift: Querallee 1, 34119 Kassel. Nicht mehr Geschäftsführer: Jepsen, Henning, Kassel. Nicht mehr Geschäftsführerin: Eberl-Jepsen, Ulrike Albine, Kassel. Bestellt als Geschäftsführerin: Pfaab, Christa, Kassel, *17.09.1954, einzelvertretungsberechtigt.",
        "gesellschafter": null,
        "inhaber": null,
        "name": "HRB 4211: \"Haus an der Sternwarte\" Pädagogische Kinder- und Jugendeinrichtung GmbH",
        "notice_id": "476659",
        "posted_on": "2016-02-26",
        "rechtsform": null,
        "sitz": null,
        "url": "https://www.handelsregisterbekanntmachungen.de/en/skripte/hrb.php?rb_id=476659&land_abk=he"
    },
    "parsed": {
        "labels": [
            {
                "label": "address",
                "text": " Querallee 1, 34119 Kassel."
            }
        ],
        "notices": [
            {
                "registration": "predecessor",
                "text": ", nun: Kassel.",
                "used_regex": ""
            }
        ],
        "officers": [
            {
                "class": "DismissedManagingDirector",
                "payload": {
                    "city": "Kassel",
                    "dismissed": true,
                    "lastname": "Jepsen",
                    "name": "Henning"
                },
                "text": " Jepsen, Henning, Kassel."
            },
            {
                "class": "DismissedManagingDirector",
                "payload": {
                    "city": "Kassel",
                    "dismissed": true,
                    "lastname": "Eberl-Jepsen",
                    "name": "Ulrike Albine"
                },
                "text": " Eberl-Jepsen, Ulrike Albine, Kassel."
            },
            {
                "class": "ManagingDirector",
                "payload": {
                    "city": "Kassel",
                    "dob": "1954-09-17",
                    "flag": "sole representation",
                    "lastname": "Pfaab",
                    "name": "Christa"
                },
                "text": " Pfaab, Christa, Kassel, *17.09.1954, einzelvertretungsberechtigt."
            }
        ]
    }
}