{
    "orig": {
        "aktenzeichen": "HRB 25667",
        "amtsgericht": "Darmstadt",
        "event_date": "2016-03-29",
        "event_type": "Veränderungen",
        "federal_state": "he",
        "full_text": "Amtsgericht Darmstadt Aktenzeichen: HRB 25667 \nBekannt gemacht am: 29.03.2016 22:01 Uhr\n\n\n\n\nVeröffentlichungen des Amtsgerichts Darmstadt\n\n\nIn () gesetzte Angaben der Anschrift und des Geschäftszweiges erfolgen ohne Gewähr.\nVeränderungen\n29.03.2016\n\nHRB 25667: GELPAG Gesellschaft für elektrotechnische Produkte und Anlagen mbH, Lorsch, Bauhofstraße 20, 68623 Lampertheim. Die Gesellschafterversammlung vom 02.03.2016 hat die Änderung des Gesellschaftsvertrages in dem § 1 (Firma, Sitz) und mit ihr die Sitzverlegung nach Lampertheim sowie in § 2 (Gegenstand des Unternehmens) beschlossen. GELPAG Advanced Technology GmbH. Sitz verlegt, nun: Neuer Sitz: Lampertheim. Handel, die Entwicklung und das Investment von elektrotechnischen und mechanischen Produkten, Komponenten und Anlagen jeglicher Art für den nationalen und internationalen Markt, sowie Forschung, Entwicklung, Intellectual Property Management, Markenmanagement, Herstellung, Vertrieb und Marketing von Nanomaterialien, Solarfilm- und -beschichtungsprodukten sowie Vertrieb und Marketing von pharmazeutischen Produkten.",
        "gesellschafter": null,
        "inhaber": null,
        "name": "HRB 25667: GELPAG Gesellschaft für elektrotechnische Produkte und Anlagen mbH",
        "notice_id": "480842",
        "posted_on": "2016-03-29",
        "rechtsform": null,
        "sitz": null,
        "url": "https://www.handelsregisterbekanntmachungen.de/en/skripte/hrb.php?rb_id=480842&land_abk=he"
    },
    "parsed": {
        "notices": [
            {
                "text": " nach Lampertheim sowie in § 2 (Gegenstand des Unternehmens) beschlossen.",
                "to": "Lampertheim",
                "used_regex": "to_regex"
            }
        ]
    }
}