{
    "orig": {
        "aktenzeichen": "HRA 13933",
        "amtsgericht": "Nürnberg",
        "event_date": "2005-08-30",
        "event_type": "Neueintragungen",
        "federal_state": "by",
        "full_text": "Amtsgericht Nürnberg Aktenzeichen: HRA 13933 \nBekannt gemacht am: 02.09.2005 12:54 Uhr\n\n\n\n\nDie in ( ) gesetzten Angaben der Geschäftsanschrift und des Geschäftszweiges erfolgen ohne Gewähr.\nNeueintragungen\n30.08.2005\n\nCraft-IT OHG, Rückersdorf (Laufer Str. 69, 90607 Rückersdorf, Design von digitalen und Printmedien, Handel mit digitalen und Printmedien, Webhosting, Handel mit Computern und Computerteilen, Erstellung/ Programmierung und Handel mit Software, Schulung und Beratung im IT-Bereich und Design-Bereich.). Offene Handelsgesellschaft. Jeder persönlich haftende Gesellschafter vertritt einzeln. Persönlich haftender Gesellschafter: Baier, Jürgen, Bayreuth, *10.04.1974; Kluczewski, Eveline, Rückersdorf, *30.01.1978.",
        "gesellschafter": null,
        "inhaber": null,
        "name": "Craft-IT OHG",
        "notice_id": "48288",
        "posted_on": "2005-09-02",
        "rechtsform": null,
        "sitz": null,
        "url": "https://www.handelsregisterbekanntmachungen.de/en/skripte/hrb.php?rb_id=48288&land_abk=by"
    },
    "parsed": {
        "officers": [
            {
                "class": "PersonalPartner",
                "payload": {
                    "city": "Bayreuth",
                    "dob": "1974-04-10",
                    "lastname": "Baier",
                    "name": "Jürgen"
                },
                "text": " Baier, Jürgen, Bayreuth, *10.04.1974"
            },
            {
                "class": "PersonalPartner",
                "payload": {
                    "city": "Rückersdorf",
                    "dob": "1978-01-30",
                    "lastname": "Kluczewski",
                    "name": "Eveline"
                },
                "text": " Kluczewski, Eveline, Rückersdorf, *30.01.1978."
            }
        ]
    }
}