{
    "orig": {
        "aktenzeichen": "HRA 620481",
        "amtsgericht": "Ulm",
        "event_date": "2015-05-04",
        "event_type": "Veränderungen",
        "federal_state": "bw",
        "full_text": "Amtsgericht Ulm Aktenzeichen: HRA 620481 \nBekannt gemacht am: 04.05.2015 15:40 Uhr\n\n\n\n\nIn () gesetzte Angaben der Anschrift und des Geschäftszweiges erfolgen ohne Gewähr:\nVeränderungen\n04.05.2015\n\nHRA 620481:Maria Hölz Witwe Kommanditgesellschaft, Wangen im Allgäu, Herrenstr. 23, 88239 Wangen im Allgäu.Eingetreten als Persönlich haftender Gesellschafter: Karrer, Annette Frieda, Argenbühl, *12.05.1977; Müller, Gisela, Kempten, *12.02.1952; Müller, Christian, Wangen im Allgäu, *20.10.1973; Müller, Elisabeth, Argenbühl, *16.02.1975; Neidhart, Cornelia, Wangen im Allgäu, *20.05.1976. Ausgeschieden als Persönlich haftender Gesellschafter: Müller, Karl, Wangen im Allgäu, *07.12.1942.",
        "gesellschafter": null,
        "inhaber": null,
        "name": "HRA 620481:Maria Hölz Witwe Kommanditgesellschaft",
        "notice_id": "486690",
        "posted_on": "2015-05-04",
        "rechtsform": null,
        "sitz": null,
        "url": "https://www.handelsregisterbekanntmachungen.de/en/skripte/hrb.php?rb_id=486690&land_abk=bw"
    },
    "parsed": {
        "officers": [
            {
                "class": "PersonalPartner",
                "payload": {
                    "city": "Argenbühl",
                    "dob": "1977-12-05",
                    "lastname": "Karrer",
                    "name": "Annette Frieda"
                },
                "text": " Karrer, Annette Frieda, Argenbühl, *12.05.1977"
            },
            {
                "class": "RetiredPersonalPartner",
                "payload": {
                    "city": "Wangen im Allgäu",
                    "dismissed": true,
                    "dob": "1942-07-12",
                    "lastname": "Müller",
                    "name": "Karl"
                },
                "text": " Müller, Karl, Wangen im Allgäu, *07.12.1942."
            }
        ]
    }
}