{
    "orig": {
        "aktenzeichen": "HRB 9742",
        "amtsgericht": "Kempten",
        "event_date": "2011-02-28",
        "event_type": "Veränderungen",
        "federal_state": "by",
        "full_text": "Amtsgericht Kempten  Aktenzeichen: HRB 9742 \nBekannt gemacht am: 04.03.2011 22:00 Uhr\n\n\n\n\nIn ( ) gesetzte Angaben der Anschrift und des Geschäftszweiges erfolgen ohne Gewähr.\nVeränderungen\n28.02.2011\n\nSeigerschmidt, Honsell & Collegen GmbH Steuerberatungsgesellschaft, Lindau (Bodensee), Laubeggengasse 11, 88131 Lindau (Bodensee). Die Gesellschafterversammlung vom 29.12.2010 hat die Änderung der §§ 1 (Firma) und 5 (Stammkapital) der Satzung beschlossen. Neue Firma: Seigerschmidt, Kinz & Collegen GmbH Steuerberatungsgesellschaft. Ausgeschieden: Geschäftsführer: Honsell, Christoph, Konstanz, *15.10.1976; Schmidt, Elke, Konstanz, *03.04.1961. Bestellt: Geschäftsführer: Kinz, Alexandra Stefanie, Rankweil (Österreich), *03.07.1976, einzelvertretungsberechtigt; mit der Befugnis, im Namen der Gesellschaft mit sich im eigenen Namen oder als Vertreter eines Dritten Rechtsgeschäfte abzuschließen.",
        "gesellschafter": null,
        "inhaber": null,
        "name": "Seigerschmidt",
        "notice_id": "487638",
        "posted_on": "2011-03-04",
        "rechtsform": null,
        "sitz": null,
        "url": "https://www.handelsregisterbekanntmachungen.de/en/skripte/hrb.php?rb_id=487638&land_abk=by"
    },
    "parsed": {
        "flags": [
            {
                "flag": "with the power to enter into legal transactions on behalf of the Company with itself or as a representative of a third party",
                "text": "mit\\ der\\ Befugnis\\,\\ im\\ Namen\\ der\\ Gesellschaft\\ mit\\ sich\\ im\\ eigenen\\ Namen\\ oder\\ als\\ Vertreter\\ eines\\ Dritten\\ Rechtsgesch\\äfte\\ abzuschlie\\ßen\\."
            }
        ],
        "officers": [
            {
                "class": "RetiredManagingDirector",
                "payload": {
                    "city": "Konstanz",
                    "dismissed": true,
                    "dob": "1976-10-15",
                    "lastname": "Honsell",
                    "name": "Christoph"
                },
                "text": " Honsell, Christoph, Konstanz, *15.10.1976"
            },
            {
                "class": "RetiredManagingDirector",
                "payload": {
                    "city": "Konstanz",
                    "dismissed": true,
                    "dob": "1961-04-03",
                    "lastname": "Schmidt",
                    "name": "Elke"
                },
                "text": " Schmidt, Elke, Konstanz, *03.04.1961."
            },
            {
                "class": "AppointedManagingDirector",
                "payload": {
                    "city": "Rankweil (Österreich)",
                    "dob": "1976-07-03",
                    "flag": "sole representation",
                    "lastname": "Kinz",
                    "name": "Alexandra Stefanie"
                },
                "text": " Kinz, Alexandra Stefanie, Rankweil (Österreich), *03.07.1976, einzelvertretungsberechtigt"
            },
            {
                "class": "AppointedManagingDirector",
                "payload": {
                    "lastname": "mit der Befugnis",
                    "name": "im Namen der Gesellschaft mit sich im eigenen Namen oder als Vertreter eines Dritten Rechtsgeschäfte abzuschließen"
                },
                "text": " mit der Befugnis, im Namen der Gesellschaft mit sich im eigenen Namen oder als Vertreter eines Dritten Rechtsgeschäfte abzuschließen."
            }
        ]
    }
}