{
    "orig": {
        "aktenzeichen": "HRA 44560",
        "amtsgericht": "München",
        "event_date": "2011-03-04",
        "event_type": "Veränderungen",
        "federal_state": "by",
        "full_text": "Amtsgericht München Aktenzeichen: HRA 44560 \nBekannt gemacht am: 11.03.2011 12:00 Uhr\n\n\n\n\nIn ( ) gesetzte Angaben der Anschrift und des Geschäftszweiges erfolgen ohne Gewähr.\nVeränderungen\n04.03.2011\n\nALDO Kälte-Wärme-Klima Inh. Alfred Dodel, Seehausen, Landkreis Garmisch-Partenkirchen, Roßpoint 15, 82418 Seehausen. Firma nun: ALDO Kälte-Wärme-Klima Inh. André Dodel e.K. Nicht mehr Inhaber: Dodel, Alfred, techn. Kaufmann, Murnau. Neuer Inhaber: Dodel, André, Murnau, *13.11.1968. Der Übergang der in dem Betrieb des Geschäfts begründeten Forderungen und Verbindlichkeiten ist bei dem Erwerb des Geschäfts durch den neuen Inhaber ausgeschlossen.",
        "gesellschafter": null,
        "inhaber": null,
        "name": "ALDO Kälte-Wärme-Klima Inh. Alfred Dodel",
        "notice_id": "488222",
        "posted_on": "2011-03-11",
        "rechtsform": null,
        "sitz": null,
        "url": "https://www.handelsregisterbekanntmachungen.de/en/skripte/hrb.php?rb_id=488222&land_abk=by"
    },
    "parsed": {
        "officers": [
            {
                "class": "NotLongerOwner",
                "payload": {
                    "city": "techn",
                    "dismissed": true,
                    "lastname": "Dodel",
                    "name": "Alfred"
                },
                "text": " Dodel, Alfred, techn."
            },
            {
                "class": "Owner",
                "payload": {
                    "city": "Murnau",
                    "dob": "1968-11-13",
                    "lastname": "Dodel",
                    "name": "André"
                },
                "text": " Dodel, André, Murnau, *13.11.1968."
            }
        ]
    }
}