{
    "orig": {
        "aktenzeichen": "HRB 43170",
        "amtsgericht": "Offenbach am Main",
        "event_date": "2016-06-10",
        "event_type": "Veränderungen",
        "federal_state": "he",
        "full_text": "Amtsgericht Offenbach am Main Aktenzeichen: HRB 43170 \nBekannt gemacht am: 10.06.2016 22:01 Uhr\n\n\n\n\nVeröffentlichungen des Amtsgerichts Offenbach am Main\n\n\nIn () gesetzte Angaben der Anschrift und des Geschäftszweiges erfolgen ohne Gewähr.\nVeränderungen\n10.06.2016\n\nHRB 43170: Panasonic Automotive & Industrial Systems Europe GmbH, Langen (Hessen), Robert-Bosch-Straße 27 - 29, 63225 Langen (Hessen). Geschäftsführer: Spatz, Johannes, Holzkirchen, *09.09.1962; Yamanaka, Takeyuki, Frankfurt am Main, *29.03.1969. Prokura erloschen: Spatz, Johannes, Holzkirchen, *09.09.1962; Yamanaka, Takeyuki, Langen (Hessen), *29.03.1969.",
        "gesellschafter": null,
        "inhaber": null,
        "name": "HRB 43170: Panasonic Automotive & Industrial Systems Europe GmbH",
        "notice_id": "490677",
        "posted_on": "2016-06-10",
        "rechtsform": null,
        "sitz": null,
        "url": "https://www.handelsregisterbekanntmachungen.de/en/skripte/hrb.php?rb_id=490677&land_abk=he"
    },
    "parsed": {
        "officers": [
            {
                "class": "ManagingDirector",
                "payload": {
                    "city": "Holzkirchen",
                    "dob": "1962-09-09",
                    "lastname": "Spatz",
                    "name": "Johannes"
                },
                "text": " Spatz, Johannes, Holzkirchen, *09.09.1962"
            },
            {
                "class": "ManagingDirector",
                "payload": {
                    "city": "Frankfurt am Main",
                    "dob": "1969-03-29",
                    "lastname": "Yamanaka",
                    "name": "Takeyuki"
                },
                "text": " Yamanaka, Takeyuki, Frankfurt am Main, *29.03.1969."
            },
            {
                "class": "ProcurationCancelled",
                "payload": {
                    "city": "Holzkirchen",
                    "dismissed": true,
                    "dob": "1962-09-09",
                    "lastname": "Spatz",
                    "name": "Johannes"
                },
                "text": " Spatz, Johannes, Holzkirchen, *09.09.1962"
            },
            {
                "class": "ProcurationCancelled",
                "payload": {
                    "city": "Langen (Hessen)",
                    "dismissed": true,
                    "dob": "1969-03-29",
                    "lastname": "Yamanaka",
                    "name": "Takeyuki"
                },
                "text": " Yamanaka, Takeyuki, Langen (Hessen), *29.03.1969."
            }
        ]
    }
}