{
    "orig": {
        "aktenzeichen": "HRB 57565",
        "amtsgericht": "Frankfurt am Main",
        "event_date": "2016-08-12",
        "event_type": "Veränderungen",
        "federal_state": "he",
        "full_text": "Amtsgericht Frankfurt am Main Aktenzeichen: HRB 57565 \nBekannt gemacht am: 12.08.2016 22:01 Uhr\n\n\n\n\nVeröffentlichungen des Amtsgerichts Frankfurt am Main\n\n\nIn () gesetzte Angaben der Anschrift und des Geschäftszweiges erfolgen ohne Gewähr.\nVeränderungen\n12.08.2016\n\nHRB 57565: Bethmann Bank AG, Frankfurt am Main, Bethmannstraße 7-9, 60311 Frankfurt am Main. Gesamtprokura gemeinsam mit einem Vorstandsmitglied oder einem anderen Prokuristen: van der Deijl, Eric, Kronberg im Taunus, *05.03.1972; Schebela, Oliver, Frankfurt am Main, *10.05.1975. Prokura erloschen: Große, Walter, Birkenau, *08.04.1954; van Oord, Jaap, Langen, *10.09.1964; Wolter, Christian, Berlin, *09.07.1965.",
        "gesellschafter": null,
        "inhaber": null,
        "name": "HRB 57565: Bethmann Bank AG",
        "notice_id": "500095",
        "posted_on": "2016-08-12",
        "rechtsform": null,
        "sitz": null,
        "url": "https://www.handelsregisterbekanntmachungen.de/en/skripte/hrb.php?rb_id=500095&land_abk=he"
    },
    "parsed": {
        "officers": [
            {
                "class": "CommonProcuration",
                "payload": {
                    "city": "Kronberg im Taunus",
                    "dob": "1972-05-03",
                    "lastname": "van der Deijl",
                    "name": "Eric"
                },
                "text": " van der Deijl, Eric, Kronberg im Taunus, *05.03.1972"
            },
            {
                "class": "ProcurationCancelled",
                "payload": {
                    "city": "Birkenau",
                    "dismissed": true,
                    "dob": "1954-08-04",
                    "lastname": "Große",
                    "name": "Walter"
                },
                "text": " Große, Walter, Birkenau, *08.04.1954"
            }
        ]
    }
}