{
    "orig": {
        "aktenzeichen": "HRB 14161",
        "amtsgericht": "Stendal",
        "event_date": "2011-12-21",
        "event_type": "Veränderungen",
        "federal_state": "st",
        "full_text": "Amtsgericht Stendal Aktenzeichen: HRB 14161   \nBekannt gemacht am: 27.12.2011 12:00 Uhr\n\n\n\n\nDie in () gesetzten Angaben der Geschäftsanschrift und des Geschäftszweiges erfolgen ohne Gewähr.\nVeränderungen\n21.12.2011\n\nTischlerei Schneider GmbH, Leitzkau, Karl-Marx-Straße 27, 39279 Leitzkau. Gemäß § 3 EGGmbHG von Amts wegen ergänzt als Geschäftsanschrift: Karl-Marx-Straße 27, 39279 Leitzkau. Von Amts wegen geändert: Liquidator: Schneider, Christoph, Leitzkau; Schneider, Torsten, Nedlitz. Das Insolvenzverfahren ist durch Beschluss des Amtsgerichts Dessau-Roßlau vom 19.09.2011 (Az.: 2 IN 165/02) mangels einer die Kosten des Verfahrens deckenden Masse eingestellt. Allgemeine Vertretungsregelung und besondere Vertretungsbefugnis von Amts wegen gem. § 384 FamFG als unrichtig gekennzeichnet.",
        "gesellschafter": null,
        "inhaber": null,
        "name": "Tischlerei Schneider GmbH",
        "notice_id": "50110",
        "posted_on": "2011-12-27",
        "rechtsform": null,
        "sitz": null,
        "url": "https://www.handelsregisterbekanntmachungen.de/en/skripte/hrb.php?rb_id=50110&land_abk=st"
    },
    "parsed": {
        "labels": [
            {
                "label": "address",
                "text": " Karl-Marx-Straße 27, 39279 Leitzkau."
            }
        ],
        "officers": [
            {
                "class": "Liquidator",
                "payload": {
                    "city": "Leitzkau",
                    "lastname": "Schneider",
                    "name": "Christoph"
                },
                "text": " Schneider, Christoph, Leitzkau"
            },
            {
                "class": "Liquidator",
                "payload": {
                    "city": "Nedlitz",
                    "lastname": "Schneider",
                    "name": "Torsten"
                },
                "text": " Schneider, Torsten, Nedlitz."
            }
        ]
    }
}