{
    "orig": {
        "aktenzeichen": "HRB 17501",
        "amtsgericht": "Saarbrücken",
        "event_date": "2015-01-09",
        "event_type": "Veränderungen",
        "federal_state": "sl",
        "full_text": "Amtsgericht Saarbrücken Aktenzeichen: HRB 17501 \nBekannt gemacht am: 09.01.2015 14:33 Uhr\n\n\n\n\nIn () gesetzte Angaben der Anschrift und des Geschäftszweiges erfolgen ohne Gewähr.\nVeränderungen\n09.01.2015\n\nHRB 17501:Nogacom GmbH, Wadgassen, Lindenstr. 57, 66787 Wadgassen.Ist nur ein Liquidator bestellt, so vertritt er die Gesellschaft allein. Sind mehrere Liquidatoren bestellt, so wird die Gesellschaft durch die Liquidatoren gemeinsam vertreten.Nicht mehr Geschäftsführer, nun bestellt als Liquidator: Quednau, Thomas Michael Emil, Hamburg, *23.02.1962. Die Gesellschafterversammlung vom 05.12.2014 hat die Auflösung der Gesellschaft beschlossen.",
        "gesellschafter": null,
        "inhaber": null,
        "name": "HRB 17501:Nogacom GmbH",
        "notice_id": "50399",
        "posted_on": "2015-01-09",
        "rechtsform": null,
        "sitz": null,
        "url": "https://www.handelsregisterbekanntmachungen.de/en/skripte/hrb.php?rb_id=50399&land_abk=sl"
    },
    "parsed": {
        "officers": [
            {
                "class": "Liquidator",
                "payload": {
                    "city": "Hamburg",
                    "dob": "1962-02-23",
                    "lastname": "Quednau",
                    "name": "Thomas Michael Emil"
                },
                "text": " Quednau, Thomas Michael Emil, Hamburg, *23.02.1962."
            }
        ]
    }
}