{
    "orig": {
        "aktenzeichen": "HRB 2989",
        "amtsgericht": "Steinfurt",
        "event_date": "2010-01-08",
        "event_type": "Veränderungen",
        "federal_state": "nw",
        "full_text": "Amtsgericht Steinfurt Aktenzeichen: HRB 2989 \nBekannt gemacht am: 13.01.2010 12:00 Uhr\n\n\n\n\nIn () gesetzte Angaben der Anschrift und des Geschäftszweiges erfolgen ohne Gewähr.\nVeränderungen\n08.01.2010\n\nPlanbau Bauträger GmbH, Ochtrup, Oster 10, 48607 Ochtrup.Die Gesellschafterversammlung vom 07.12.2009 mit Nachtrag vom 23.12.2009 hat eine Änderung des Gesellschaftsvertrages in §§ 1 (Firma), 2 (Sitz), 5 (Stammkapital), 6 (Geschäftsanteile) und mit ihr die Änderung der Firma beschlossen. Neue Firma: IB Projekt GmbH. Gemäß § 3 EGGmbHG von Amts wegen ergänzt als Geschäftsanschrift: Oster 107, 48607 Ochtrup. Nicht mehr Geschäftsführer: ter Avest, Hermannus, Nijverdal/NL, *13.10.1954. Prokura erloschen: Bode, Jürgen, Ochtrup.",
        "gesellschafter": null,
        "inhaber": null,
        "name": "Planbau Bauträger GmbH",
        "notice_id": "511130",
        "posted_on": "2010-01-13",
        "rechtsform": null,
        "sitz": null,
        "url": "https://www.handelsregisterbekanntmachungen.de/en/skripte/hrb.php?rb_id=511130&land_abk=nw"
    },
    "parsed": {
        "addresses": [
            {
                "kls": "Address",
                "text": "Oster 107, 48607 Ochtrup"
            }
        ],
        "officers": [
            {
                "class": "DismissedManagingDirector",
                "payload": {
                    "city": "Nijverdal/NL",
                    "dismissed": true,
                    "dob": "1954-10-13",
                    "lastname": "ter Avest",
                    "name": "Hermannus"
                },
                "text": " ter Avest, Hermannus, Nijverdal/NL, *13.10.1954."
            },
            {
                "class": "ProcurationCancelled",
                "payload": {
                    "city": "Ochtrup",
                    "dismissed": true,
                    "lastname": "Bode",
                    "name": "Jürgen"
                },
                "text": " Bode, Jürgen, Ochtrup."
            }
        ]
    }
}