{
    "orig": {
        "aktenzeichen": "HRB 410434",
        "amtsgericht": "Freiburg",
        "event_date": "2015-10-21",
        "event_type": "Veränderungen",
        "federal_state": "bw",
        "full_text": "Amtsgericht Freiburg Aktenzeichen: HRB 410434 \nBekannt gemacht am: 21.10.2015 10:35 Uhr\n\n\n\n\nIn () gesetzte Angaben der Anschrift und des Geschäftszweiges erfolgen ohne Gewähr:\nVeränderungen\n21.10.2015\n\nHRB 410434: Energiedienst AG, Rheinfelden (Baden), Schönenbergerstraße 10, 79618 Rheinfelden Baden. Gesamtprokura gemeinsam mit einem Vorstandsmitglied oder einem anderen Prokuristen mit der Ermächtigung zur Veräußerung und Belastung von Grundstücken: Knauber, Irene, Schwörstadt, *02.04.1956; Daten (Wohnsitz) geändert bei Philippeit, Boris, Müllheim, *27.12.1967. Prokura erloschen: Eckerle, Claus Michael, Willstätt, *05.09.1956.",
        "gesellschafter": null,
        "inhaber": null,
        "name": "HRB 410434: Energiedienst AG",
        "notice_id": "513997",
        "posted_on": "2015-10-21",
        "rechtsform": null,
        "sitz": null,
        "url": "https://www.handelsregisterbekanntmachungen.de/en/skripte/hrb.php?rb_id=513997&land_abk=bw"
    },
    "parsed": {
        "officers": [
            {
                "class": "ProcurationCancelled",
                "payload": {
                    "city": "Willstätt",
                    "dismissed": true,
                    "dob": "1956-09-05",
                    "lastname": "Eckerle",
                    "name": "Claus Michael"
                },
                "text": " Eckerle, Claus Michael, Willstätt, *05.09.1956."
            }
        ]
    }
}