{
    "orig": {
        "aktenzeichen": "HRB 251566",
        "amtsgericht": "Stuttgart",
        "event_date": "2015-10-26",
        "event_type": "Veränderungen",
        "federal_state": "bw",
        "full_text": "Amtsgericht Stuttgart Aktenzeichen: HRB 251566 \nBekannt gemacht am: 26.10.2015 14:35 Uhr\n\n\n\n\nIn () gesetzte Angaben der Anschrift und des Geschäftszweiges erfolgen ohne Gewähr:\nVeränderungen\n26.10.2015\n\nHRB 251566: Volksbank Region Leonberg Immobilien-Beteiligungsgesellschaft mbH, Leonberg, Römerstraße 109, 71229 Leonberg. Bestellt als Geschäftsführer: Ernst, Wolfgang, Eberdingen, *11.05.1971, einzelvertretungsberechtigt mit der Befugnis, im Namen der Gesellschaft mit sich als Vertreter eines Dritten Rechtsgeschäfte abzuschließen. Nicht mehr Geschäftsführer: Luz, Werner, Leonberg, *29.01.1953.",
        "gesellschafter": null,
        "inhaber": null,
        "name": "HRB 251566: Volksbank Region Leonberg Immobilien-Beteiligungsgesellschaft mbH",
        "notice_id": "514685",
        "posted_on": "2015-10-26",
        "rechtsform": null,
        "sitz": null,
        "url": "https://www.handelsregisterbekanntmachungen.de/en/skripte/hrb.php?rb_id=514685&land_abk=bw"
    },
    "parsed": {
        "officers": [
            {
                "class": "AppointedManagingDirector",
                "payload": {
                    "city": "Eberdingen",
                    "dob": "1971-11-05",
                    "flag": "einzelvertretungsberechtigt mit der Befugnis im Namen der Gesellschaft mit sich als Vertreter eines Dritten Rechtsgeschäfte abzuschließen",
                    "lastname": "Ernst",
                    "name": "Wolfgang"
                },
                "text": " Ernst, Wolfgang, Eberdingen, *11.05.1971, einzelvertretungsberechtigt mit der Befugnis, im Namen der Gesellschaft mit sich als Vertreter eines Dritten Rechtsgeschäfte abzuschließen."
            },
            {
                "class": "DismissedManagingDirector",
                "payload": {
                    "city": "Leonberg",
                    "dismissed": true,
                    "dob": "1953-01-29",
                    "lastname": "Luz",
                    "name": "Werner"
                },
                "text": " Luz, Werner, Leonberg, *29.01.1953."
            }
        ]
    }
}