{
    "orig": {
        "aktenzeichen": "HRA 5305 KI",
        "amtsgericht": "Kiel",
        "event_date": "2009-04-03",
        "event_type": "Veränderungen",
        "federal_state": "sh",
        "full_text": "Amtsgericht Kiel Aktenzeichen: HRA 5305 KI \nBekannt gemacht am: 08.04.2009 12:00 Uhr\n\n\n\n\nFür die Angaben in (), die den Unternehmensgegenstand und die Anschrift betreffen, keine Gewähr. In das Handelsregister ist folgendes eingetragen worden.\nVeränderungen\n03.04.2009\n\nLoxxess Henstedt-Ulzburg GmbH & Co. KG, Henstedt-UlzburgSiebenstücken 2, 24558 Henstedt-Ulzburg. Prokura: Nicht mehr Prokurist: 1. Franz, Andrea; Nicht mehr Prokurist: 2. Wiechern, Volker; Nicht mehr Prokurist: 4. Marten, Claudia. Die Gesellschaft ist auf Grund des Verschmelzungsvertrages vom 26.03.2009 und der Zustimmungsbeschlüsse vom selben Tage durch Übertragung ihres Vermögens als Ganzes unter Auflösung ohne Abwicklung auf die Loxxess Hannover GmbH & Co. KG, Hannover (Amtsgericht Hannover, HRA 200153) verschmolzen. Die Verschmelzung wird erst mit der Eintragung in das Register des Sitzes des übernehmenden Rechtsträgers wirksam..",
        "gesellschafter": null,
        "inhaber": null,
        "name": "Loxxess Henstedt-Ulzburg GmbH & Co. KG",
        "notice_id": "51713",
        "posted_on": "2009-04-08",
        "rechtsform": null,
        "sitz": null,
        "url": "https://www.handelsregisterbekanntmachungen.de/en/skripte/hrb.php?rb_id=51713&land_abk=sh"
    },
    "parsed": {
        "officers": [
            {
                "class": "NotAProcurator",
                "payload": {
                    "dismissed": true,
                    "lastname": "Franz",
                    "name": "Andrea"
                },
                "text": " Franz, Andrea"
            },
            {
                "class": "NotAProcurator",
                "payload": {
                    "dismissed": true,
                    "lastname": "Wiechern",
                    "name": "Volker"
                },
                "text": " Wiechern, Volker"
            },
            {
                "class": "NotAProcurator",
                "payload": {
                    "dismissed": true,
                    "lastname": "Marten",
                    "name": "Claudia"
                },
                "text": " Marten, Claudia."
            }
        ]
    }
}