{
    "orig": {
        "aktenzeichen": "HRA 602421",
        "amtsgericht": "Freiburg",
        "event_date": "2015-11-11",
        "event_type": "Veränderungen",
        "federal_state": "bw",
        "full_text": "Amtsgericht Freiburg Aktenzeichen: HRA 602421 \nBekannt gemacht am: 11.11.2015 14:26 Uhr\n\n\n\n\nIn () gesetzte Angaben der Anschrift und des Geschäftszweiges erfolgen ohne Gewähr:\nVeränderungen\n11.11.2015\n\nHRA 602421: Willi Aker Transport GmbH & Co KG, Schonach im Schwarzwald, Wiesenstraße 14, 78136 Schonach im Schwarzwald. Allgemeine Vertretungsregelung von Amts wegen nach § 384 Abs. 2 FamFG berichtigt in: Die Liquidatoren vertreten gemeinsam. Vertretungsbefugnis von Amts wegen berichtigt bei Persönlich haftender Gesellschafter: Willi Aker Verwaltungsgesellschaft mbH, Triberg im Schwarzwald (Amtsgericht Freiburg im Breisgau HRB 602244). Jetzt Liquidator: Aker, Wilhelm gen. Willi, Triberg, *19.04.1940. Jetzt auch Liquidatorin: Willi Aker Verwaltungsgesellschaft mbH, Triberg im Schwarzwald (Amtsgericht Freiburg i. Br. HRB 602244)",
        "gesellschafter": null,
        "inhaber": null,
        "name": "HRA 602421: Willi Aker Transport GmbH & Co KG",
        "notice_id": "517404",
        "posted_on": "2015-11-11",
        "rechtsform": null,
        "sitz": null,
        "url": "https://www.handelsregisterbekanntmachungen.de/en/skripte/hrb.php?rb_id=517404&land_abk=bw"
    },
    "parsed": {
        "officers": [
            {
                "class": "PersonalPartner",
                "payload": {
                    "company_name": " Willi Aker Verwaltungsgesellschaft mbH, Triberg im Schwarzwald (Amtsgericht Freiburg im Breisgau HRB 602244)."
                },
                "text": " Willi Aker Verwaltungsgesellschaft mbH, Triberg im Schwarzwald (Amtsgericht Freiburg im Breisgau HRB 602244)."
            },
            {
                "class": "Liquidator",
                "payload": {
                    "lastname": "Aker",
                    "name": "Wilhelm gen"
                },
                "text": " Aker, Wilhelm gen."
            }
        ]
    }
}