{
    "orig": {
        "aktenzeichen": "HRB 3859",
        "amtsgericht": "Neubrandenburg",
        "event_date": "2014-02-25",
        "event_type": "Veränderungen",
        "federal_state": "mv",
        "full_text": "Amtsgericht Neubrandenburg Aktenzeichen: HRB 3859 \nBekannt gemacht am: 25.02.2014 22:00 Uhr\n\n\n\n\nIn ( ) gesetzte Angaben der Anschrift und des Geschäftszweiges erfolgen ohne Gewähr:\nVeränderungen\n25.02.2014\n\nHRB 3859:TOP - Gartengestaltung GmbH, Krümmel, Im Dörp 4, 17248 Lärz OT Krümmel.Gemäß § 3 Absatz 1 EGGmbHG von Amts wegen ergänzt: Geschäftsanschrift: Im Dörp 4, 17248 Lärz OT Krümmel. Ist nur ein Liquidator bestellt, so vertritt er die Gesellschaft allein. Sind mehrere Liquidatoren bestellt, so wird die Gesellschaft durch die Liquidatoren gemeinsam vertreten. Nicht mehr Geschäftsführer: Hansen, Dirk, Damm. Geändert, nun: Liquidator: Wartmann, Peter, Krümmel. Die Gesellschaft ist aufgelöst.",
        "gesellschafter": null,
        "inhaber": null,
        "name": "HRB 3859:TOP - Gartengestaltung GmbH",
        "notice_id": "51782",
        "posted_on": "2014-02-25",
        "rechtsform": null,
        "sitz": null,
        "url": "https://www.handelsregisterbekanntmachungen.de/en/skripte/hrb.php?rb_id=51782&land_abk=mv"
    },
    "parsed": {
        "flags": [
            {
                "flag": "ignore_for_now",
                "text": "Die\\ Gesellschaft\\ ist\\ aufgel\\öst\\."
            }
        ],
        "labels": [
            {
                "label": "address",
                "text": " Im Dörp 4, 17248 Lärz OT Krümmel."
            }
        ],
        "officers": [
            {
                "class": "DismissedManagingDirector",
                "payload": {
                    "city": "Damm",
                    "dismissed": true,
                    "lastname": "Hansen",
                    "name": "Dirk"
                },
                "text": " Hansen, Dirk, Damm."
            },
            {
                "class": "Liquidator",
                "payload": {
                    "city": "Krümmel",
                    "lastname": ": Wartmann",
                    "name": "Peter"
                },
                "text": ": Wartmann, Peter, Krümmel."
            }
        ]
    }
}