{
    "orig": {
        "aktenzeichen": "HRB 108270",
        "amtsgericht": "Stuttgart",
        "event_date": "2015-11-26",
        "event_type": "Veränderungen",
        "federal_state": "bw",
        "full_text": "Amtsgericht Stuttgart Aktenzeichen: HRB 108270 \nBekannt gemacht am: 26.11.2015 11:57 Uhr\n\n\n\n\nIn () gesetzte Angaben der Anschrift und des Geschäftszweiges erfolgen ohne Gewähr:\nVeränderungen\n26.11.2015\n\nHRB 108270: Isotek GmbH, Möckmühl, Nordstraße 32, 74219 Möckmühl. Die Gesellschafterversammlung vom 17.11.2015 hat die Neufassung des Gesellschaftsvertrages beschlossen. Das Stammkapital ist durch Beschluss der Gesellschafterversammlung vom gleichen Tag um 26.000,00 EUR auf 51.000,00 EUR erhöht. Stammkapital nun: 51.000,00 EUR. Vertretungsbefugnis geändert bei Geschäftsführer: Föll, Klaus, Möckmühl, *14.10.1957; Gieser, Harald, Möckmühl, *26.07.1964, jeweils einzelvertretungsberechtigt.",
        "gesellschafter": null,
        "inhaber": null,
        "name": "HRB 108270: Isotek GmbH",
        "notice_id": "519956",
        "posted_on": "2015-11-26",
        "rechtsform": null,
        "sitz": null,
        "url": "https://www.handelsregisterbekanntmachungen.de/en/skripte/hrb.php?rb_id=519956&land_abk=bw"
    },
    "parsed": {
        "officers": [
            {
                "class": "ManagingDirector",
                "payload": {
                    "city": "Möckmühl",
                    "dob": "1957-10-14",
                    "lastname": "Föll",
                    "name": "Klaus"
                },
                "text": " Föll, Klaus, Möckmühl, *14.10.1957"
            }
        ]
    }
}