{
    "orig": {
        "aktenzeichen": "HRB 2566",
        "amtsgericht": "Gelsenkirchen",
        "event_date": "2010-02-10",
        "event_type": "Veränderungen",
        "federal_state": "nw",
        "full_text": "Amtsgericht Gelsenkirchen Aktenzeichen: HRB 2566 \nBekannt gemacht am: 23.02.2010 22:00 Uhr\n\n\n\n\nIn () gesetzte Angaben der Anschrift und des Geschäftszweiges erfolgen ohne Gewähr.\nVeränderungen\n10.02.2010\n\n\"Küppersbusch Hausgeräte AG\", Gelsenkirchen, Küppersbuschstraße 16, 45883 Gelsenkirchen.Geschäftsanschrift: Küppersbuschstraße 16, 45883 Gelsenkirchen. Nicht mehr Vorstand: Johanning-Meiners, Harald, Köln, *31.10.1960; Keller, Michael, Hohenahr, *04.05.1965; Lawrence, Mark, Gelsenkirchen, *29.01.1951; Struß, Horst, Hannover, *29.07.1953. Prokura erloschen: Huber, Michael, Bochum, *22.07.1960.",
        "gesellschafter": null,
        "inhaber": null,
        "name": "\"Küppersbusch Hausgeräte AG\"",
        "notice_id": "525630",
        "posted_on": "2010-02-23",
        "rechtsform": null,
        "sitz": null,
        "url": "https://www.handelsregisterbekanntmachungen.de/en/skripte/hrb.php?rb_id=525630&land_abk=nw"
    },
    "parsed": {
        "labels": [
            {
                "label": "address",
                "text": " Küppersbuschstraße 16, 45883 Gelsenkirchen."
            }
        ],
        "officers": [
            {
                "class": "Person",
                "payload": {
                    "city": "Köln",
                    "dob": "1960-10-31",
                    "lastname": "Johanning-Meiners",
                    "name": "Harald"
                },
                "text": " Johanning-Meiners, Harald, Köln, *31.10.1960"
            },
            {
                "class": "Person",
                "payload": {
                    "city": "Hohenahr",
                    "dob": "1965-05-04",
                    "lastname": "Keller",
                    "name": "Michael"
                },
                "text": " Keller, Michael, Hohenahr, *04.05.1965"
            },
            {
                "class": "Person",
                "payload": {
                    "city": "Gelsenkirchen",
                    "dob": "1951-01-29",
                    "lastname": "Lawrence",
                    "name": "Mark"
                },
                "text": " Lawrence, Mark, Gelsenkirchen, *29.01.1951"
            },
            {
                "class": "Person",
                "payload": {
                    "city": "Hannover",
                    "dob": "1953-07-29",
                    "lastname": "Struß",
                    "name": "Horst"
                },
                "text": " Struß, Horst, Hannover, *29.07.1953."
            },
            {
                "class": "ProcurationCancelled",
                "payload": {
                    "city": "Bochum",
                    "dismissed": true,
                    "dob": "1960-07-22",
                    "lastname": "Huber",
                    "name": "Michael"
                },
                "text": " Huber, Michael, Bochum, *22.07.1960."
            }
        ]
    }
}