{
    "orig": {
        "aktenzeichen": "HRB 11063",
        "amtsgericht": "Bad Homburg",
        "event_date": "2017-06-30",
        "event_type": "Veränderungen",
        "federal_state": "he",
        "full_text": "Amtsgericht Bad Homburg Aktenzeichen: HRB 11063 \nBekannt gemacht am: 30.06.2017 22:00 Uhr\n\n\n\n\nVeröffentlichungen des Amtsgerichts Bad Homburg v.d. Höhe\n\n\nIn () gesetzte Angaben der Anschrift und des Geschäftszweiges erfolgen ohne Gewähr.\nVeränderungen\n30.06.2017\n\nHRB 11063: Casa Reha Holding GmbH, Oberursel (Taunus), Gablonzer Straße 35, 61440 Oberursel (Taunus). Bestellt als Geschäftsführer: Oberreuter, Peter, Glashütten, *18.04.1963, mit der Befugnis, im Namen der Gesellschaft mit sich als Vertreter eines Dritten Rechtsgeschäfte abzuschließen. Nicht mehr Geschäftsführer: Misteli, Philippe, Paris / Frankreich, *13.04.1955; Wenzel, Torsten, Berlin, *13.02.1962.",
        "gesellschafter": null,
        "inhaber": null,
        "name": "HRB 11063: Casa Reha Holding GmbH",
        "notice_id": "546104",
        "posted_on": "2017-06-30",
        "rechtsform": null,
        "sitz": null,
        "url": "https://www.handelsregisterbekanntmachungen.de/en/skripte/hrb.php?rb_id=546104&land_abk=he"
    },
    "parsed": {
        "officers": [
            {
                "class": "AppointedManagingDirector",
                "payload": {
                    "city": "Glashütten",
                    "dob": "1963-04-18",
                    "flag": "mit der Befugnis im Namen der Gesellschaft mit sich als Vertreter eines Dritten Rechtsgeschäfte abzuschließen",
                    "lastname": "Oberreuter",
                    "name": "Peter"
                },
                "text": " Oberreuter, Peter, Glashütten, *18.04.1963, mit der Befugnis, im Namen der Gesellschaft mit sich als Vertreter eines Dritten Rechtsgeschäfte abzuschließen."
            },
            {
                "class": "DismissedManagingDirector",
                "payload": {
                    "city": "Paris / Frankreich",
                    "dismissed": true,
                    "dob": "1955-04-13",
                    "lastname": "Misteli",
                    "name": "Philippe"
                },
                "text": " Misteli, Philippe, Paris / Frankreich, *13.04.1955"
            }
        ]
    }
}