{
    "orig": {
        "aktenzeichen": "HRB 29090",
        "amtsgericht": "Wiesbaden",
        "event_date": "2017-08-09",
        "event_type": "Veränderungen",
        "federal_state": "he",
        "full_text": "Amtsgericht Wiesbaden Aktenzeichen: HRB 29090 \nBekannt gemacht am: 09.08.2017 22:00 Uhr\n\n\n\n\nVeröffentlichungen des Amtsgerichts Wiesbaden\n\n\nIn () gesetzte Angaben der Anschrift und des Geschäftszweiges erfolgen ohne Gewähr.\nVeränderungen\n09.08.2017\n\nHRB 29090: Kalle Management GmbH, Wiesbaden, Rheingaustraße 190-196, 65203 Wiesbaden. Prokura erloschen: Brockmann, Marie-Rose, Bremen, *05.03.1965. Gesamtprokura gemeinsam mit einem Geschäftsführer oder einem anderen Prokuristen mit der Befugnis, im Namen der Gesellschaft mit sich im eigenen Namen oder als Vertreter eines Dritten Rechtsgeschäfte abzuschließen: Thies, Holger, Neu-Anspach, *22.10.1962.",
        "gesellschafter": null,
        "inhaber": null,
        "name": "HRB 29090: Kalle Management GmbH",
        "notice_id": "551941",
        "posted_on": "2017-08-09",
        "rechtsform": null,
        "sitz": null,
        "url": "https://www.handelsregisterbekanntmachungen.de/en/skripte/hrb.php?rb_id=551941&land_abk=he"
    },
    "parsed": {
        "officers": [
            {
                "class": "ProcurationCancelled",
                "payload": {
                    "city": "Bremen",
                    "dismissed": true,
                    "dob": "1965-05-03",
                    "lastname": "Brockmann",
                    "name": "Marie-Rose"
                },
                "text": " Brockmann, Marie-Rose, Bremen, *05.03.1965."
            }
        ]
    }
}