{
    "orig": {
        "aktenzeichen": "HRB 42904",
        "amtsgericht": "Offenbach am Main",
        "event_date": "2017-08-30",
        "event_type": "Veränderungen",
        "federal_state": "he",
        "full_text": "Amtsgericht Offenbach am Main Aktenzeichen: HRB 42904 \nBekannt gemacht am: 30.08.2017 22:00 Uhr\n\n\n\n\nVeröffentlichungen des Amtsgerichts Offenbach am Main\n\n\nIn () gesetzte Angaben der Anschrift und des Geschäftszweiges erfolgen ohne Gewähr.\nVeränderungen\n30.08.2017\n\nHRB 42904: Dematic GmbH, Heusenstamm, Martinseestraße 1, 63150 Heusenstamm. Bestellt als Geschäftsführer: Steigerwald, Notker, Heusenstamm, *21.06.1962; Vercammen, Jan, Heusenstamm, *23.05.1968, jeweils mit der Befugnis, im Namen der Gesellschaft mit sich als Vertreter eines Dritten Rechtsgeschäfte abzuschließen. Nicht mehr Geschäftsführerin: Wladarz, Barbara, Schwerte, *08.06.1964. Gesamtprokura gemeinsam mit einem Geschäftsführer oder einem anderen Prokuristen: Croneiß, Andrea, Kleinostheim, *19.02.1979; De Backer, Francis, Heusenstamm, *31.01.1958.",
        "gesellschafter": null,
        "inhaber": null,
        "name": "HRB 42904: Dematic GmbH",
        "notice_id": "554896",
        "posted_on": "2017-08-30",
        "rechtsform": null,
        "sitz": null,
        "url": "https://www.handelsregisterbekanntmachungen.de/en/skripte/hrb.php?rb_id=554896&land_abk=he"
    },
    "parsed": {
        "officers": [
            {
                "class": "AppointedManagingDirector",
                "payload": {
                    "city": "Heusenstamm",
                    "dob": "1962-06-21",
                    "lastname": "Steigerwald",
                    "name": "Notker"
                },
                "text": " Steigerwald, Notker, Heusenstamm, *21.06.1962"
            },
            {
                "class": "DismissedManagingDirector",
                "payload": {
                    "city": "Schwerte",
                    "dismissed": true,
                    "dob": "1964-08-06",
                    "lastname": "Wladarz",
                    "name": "Barbara"
                },
                "text": " Wladarz, Barbara, Schwerte, *08.06.1964."
            },
            {
                "class": "CommonProcuration",
                "payload": {
                    "city": "Kleinostheim",
                    "dob": "1979-02-19",
                    "lastname": "Croneiß",
                    "name": "Andrea"
                },
                "text": " Croneiß, Andrea, Kleinostheim, *19.02.1979"
            }
        ]
    }
}