{
    "orig": {
        "aktenzeichen": "HRB 12989",
        "amtsgericht": "Frankfurt am Main",
        "event_date": "2017-10-17",
        "event_type": "Veränderungen",
        "federal_state": "he",
        "full_text": "Amtsgericht Frankfurt am Main Aktenzeichen: HRB 12989 \nBekannt gemacht am: 17.10.2017 22:01 Uhr\n\n\n\n\nVeröffentlichungen des Amtsgerichts Frankfurt am Main\n\n\nIn () gesetzte Angaben der Anschrift und des Geschäftszweiges erfolgen ohne Gewähr.\nVeränderungen\n17.10.2017\n\nHRB 12989: Banco Santander, S.A. Filiale Frankfurt, Frankfurt am Main, Bockenheimer Landstraße 39, 60325 Frankfurt am Main. Bestellt als Ständiger Vertreter: Völker-Albert, Peter, Kronberg im Taunus, *14.01.1968, vertretungsberechtigt gemeinsam mit einem anderen ständigen Vertreter oder einem Prokuristen. Nicht mehr Ständiger Vertreter: Roser Escudero, Joaquín Juan, Jossgrund-Lettgenbrunn, *10.07.1961. Prokura erloschen: Völker-Albert, Peter, Kronberg im Taunus, *14.01.1968. Gesamtprokura gemeinsam mit einem ständigen Vertreter oder einem anderen Prokuristen: Kienz, Alain, Dietzenbach, *10.10.1978.",
        "gesellschafter": null,
        "inhaber": null,
        "name": "HRB 12989: Banco Santander",
        "notice_id": "562069",
        "posted_on": "2017-10-17",
        "rechtsform": null,
        "sitz": null,
        "url": "https://www.handelsregisterbekanntmachungen.de/en/skripte/hrb.php?rb_id=562069&land_abk=he"
    },
    "parsed": {
        "officers": [
            {
                "class": "ProcurationCancelled",
                "payload": {
                    "city": "Kronberg im Taunus",
                    "dismissed": true,
                    "dob": "1968-01-14",
                    "lastname": "Völker-Albert",
                    "name": "Peter"
                },
                "text": " Völker-Albert, Peter, Kronberg im Taunus, *14.01.1968."
            }
        ]
    }
}