{
    "orig": {
        "aktenzeichen": "HRB 4268",
        "amtsgericht": "Stendal",
        "event_date": "2012-10-01",
        "event_type": "Veränderungen",
        "federal_state": "st",
        "full_text": "Amtsgericht Stendal Aktenzeichen: HRB 4268   \nBekannt gemacht am: 08.10.2012 22:00 Uhr\n\n\n\n\nDie in () gesetzten Angaben der Geschäftsanschrift und des Geschäftszweiges erfolgen ohne Gewähr.\nVeränderungen\n01.10.2012\n\nTransportbeton & Recycling Zerbst GmbH, Zerbst/Anhalt, Biaser Straße 31, 39261 Zerbst/Anhalt. Geändert, nun: Ist nur ein Liquidator bestellt, so vertritt er die Gesellschaft allein. Sind mehrere Liquidatoren bestellt, so wird die Gesellschaft durch die Liquidatoren gemeinsam vertreten. Geändert, nun: Liquidator: Hönl, Peter, Möckern OT Isterbies, *26.05.1961, einzelvertretungsberechtigt. Das Insolvenzverfahren ist durch Beschluss des Amtsgerichts Dessau-Roßlau vom 07.09.2011 (Az. 2 IN 484/08) mit Zustimmung der Gläubiger eingestellt.",
        "gesellschafter": null,
        "inhaber": null,
        "name": "Transportbeton & Recycling Zerbst GmbH",
        "notice_id": "57340",
        "posted_on": "2012-10-08",
        "rechtsform": null,
        "sitz": null,
        "url": "https://www.handelsregisterbekanntmachungen.de/en/skripte/hrb.php?rb_id=57340&land_abk=st"
    },
    "parsed": {
        "officers": [
            {
                "class": "Liquidator",
                "payload": {
                    "city": "Möckern OT Isterbies",
                    "dob": "1961-05-26",
                    "flag": "sole representation",
                    "lastname": "Hönl",
                    "name": "Peter"
                },
                "text": ": Hönl, Peter, Möckern OT Isterbies, *26.05.1961, einzelvertretungsberechtigt."
            }
        ]
    }
}