{
    "orig": {
        "aktenzeichen": "HRB 10279",
        "amtsgericht": "Frankfurt am Main",
        "event_date": "2018-01-10",
        "event_type": "Veränderungen",
        "federal_state": "he",
        "full_text": "Amtsgericht Frankfurt am Main Aktenzeichen: HRB 10279 \nBekannt gemacht am: 10.01.2018 22:01 Uhr\n\n\n\n\nVeröffentlichungen des Amtsgerichts Frankfurt am Main\n\n\nIn () gesetzte Angaben der Anschrift und des Geschäftszweiges erfolgen ohne Gewähr.\nVeränderungen\n10.01.2018\n\nHRB 10279: Frankfurt Danube Hotels Gesellschaft mit beschränkter Haftung, Frankfurt am Main, Grüneburgweg 58-62, 60322 Frankfurt am Main. Geändert, nun: Geschäftsanschrift: Wittestraße 30, 13509 Berlin. Nicht mehr Geschäftsführer: Al-Mulla, Hamad Abdulla A, Doha / Katar, *07.06.1972; Fernandes, Ashley Leslie John, Doha / Katar, *15.10.1968; Rhazali, Kamal, Doha / Katar, *17.09.1979; Thul, Harald, Fell, *13.03.1972. Bestellt als Geschäftsführer: Hupfer, Christian, Berlin, *21.04.1982.",
        "gesellschafter": null,
        "inhaber": null,
        "name": "HRB 10279: Frankfurt Danube Hotels Gesellschaft mit beschränkter Haftung",
        "notice_id": "574468",
        "posted_on": "2018-01-10",
        "rechtsform": null,
        "sitz": null,
        "url": "https://www.handelsregisterbekanntmachungen.de/en/skripte/hrb.php?rb_id=574468&land_abk=he"
    },
    "parsed": {
        "labels": [
            {
                "label": "address",
                "text": " Wittestraße 30, 13509 Berlin."
            }
        ],
        "officers": [
            {
                "class": "DismissedManagingDirector",
                "payload": {
                    "city": "Doha / Katar",
                    "dismissed": true,
                    "dob": "1972-06-07",
                    "lastname": "Al-Mulla",
                    "name": "Hamad Abdulla A"
                },
                "text": " Al-Mulla, Hamad Abdulla A, Doha / Katar, *07.06.1972"
            },
            {
                "class": "DismissedManagingDirector",
                "payload": {
                    "city": "Doha / Katar",
                    "dismissed": true,
                    "dob": "1968-10-15",
                    "lastname": "Fernandes",
                    "name": "Ashley Leslie John"
                },
                "text": " Fernandes, Ashley Leslie John, Doha / Katar, *15.10.1968"
            },
            {
                "class": "DismissedManagingDirector",
                "payload": {
                    "city": "Doha / Katar",
                    "dismissed": true,
                    "dob": "1979-09-17",
                    "lastname": "Rhazali",
                    "name": "Kamal"
                },
                "text": " Rhazali, Kamal, Doha / Katar, *17.09.1979"
            },
            {
                "class": "DismissedManagingDirector",
                "payload": {
                    "city": "Fell",
                    "dismissed": true,
                    "dob": "1972-03-13",
                    "lastname": "Thul",
                    "name": "Harald"
                },
                "text": " Thul, Harald, Fell, *13.03.1972."
            },
            {
                "class": "AppointedManagingDirector",
                "payload": {
                    "city": "Berlin",
                    "dob": "1982-04-21",
                    "lastname": "Hupfer",
                    "name": "Christian"
                },
                "text": " Hupfer, Christian, Berlin, *21.04.1982."
            }
        ]
    }
}