{
    "orig": {
        "aktenzeichen": "HRB 101512",
        "amtsgericht": "Saarbrücken",
        "event_date": "2016-06-02",
        "event_type": "Veränderungen",
        "federal_state": "sl",
        "full_text": "Amtsgericht Saarbrücken Aktenzeichen: HRB 101512 \nBekannt gemacht am: 02.06.2016 17:04 Uhr\n\n\n\n\nIn () gesetzte Angaben der Anschrift und des Geschäftszweiges erfolgen ohne Gewähr.\nVeränderungen\n02.06.2016\n\nHRB 101512: Becker Consulting GmbH, Saarbrücken, Ober der Deutschmühl 5a, 66117 Saarbrücken. Allgemeine Vertretungsregelung: Ist nur ein Liquidator bestellt, so vertritt er die Gesellschaft allein. Sind mehrere Liquidatoren bestellt, so wird die Gesellschaft durch die Liquidatoren gemeinsam vertreten. Nicht mehr Geschäftsführer, nun: Liquidator: Becker, Detlef, Saarbrücken, *15.01.1960. Nicht mehr Geschäftsführer: Becker, Corinne, Saarbrücken, *21.01.1967. Die Gesellschafterversammlung vom 11.05.2016 hat die Auflösung der Gesellschaft beschlossen.",
        "gesellschafter": null,
        "inhaber": null,
        "name": "HRB 101512: Becker Consulting GmbH",
        "notice_id": "57443",
        "posted_on": "2016-06-02",
        "rechtsform": null,
        "sitz": null,
        "url": "https://www.handelsregisterbekanntmachungen.de/en/skripte/hrb.php?rb_id=57443&land_abk=sl"
    },
    "parsed": {
        "officers": [
            {
                "class": "Liquidator",
                "payload": {
                    "city": "Saarbrücken",
                    "dob": "1960-01-15",
                    "lastname": "Becker",
                    "name": "Detlef"
                },
                "text": " Becker, Detlef, Saarbrücken, *15.01.1960."
            },
            {
                "class": "DismissedManagingDirector",
                "payload": {
                    "city": "Saarbrücken",
                    "dismissed": true,
                    "dob": "1967-01-21",
                    "lastname": "Becker",
                    "name": "Corinne"
                },
                "text": " Becker, Corinne, Saarbrücken, *21.01.1967."
            }
        ]
    }
}