{
    "orig": {
        "aktenzeichen": "HRB 196497",
        "amtsgericht": "München",
        "event_date": "2012-02-14",
        "event_type": "Veränderungen",
        "federal_state": "by",
        "full_text": "Amtsgericht München Aktenzeichen: HRB 196497   \nBekannt gemacht am: 15.02.2012 12:00 Uhr\n\n\n\n\nIn ( ) gesetzte Angaben der Anschrift und des Geschäftszweiges erfolgen ohne Gewähr.\nVeränderungen\n14.02.2012\n\nBlitz 12-541 GmbH, München, Bavariaring 29, c/o Blitzstart Holding AG, 80336 München. Geändert, nun: Geschäftsanschrift: Liebigstraße 11, 60323 Frankfurt am Main. Ausgeschieden: Geschäftsführer: Gogalla, Katja, München, *11.04.1968; Selnes, Randi Mette, München, *02.03.1978. Bestellt: Geschäftsführer: Moser, Matthias, Dieburg, *04.10.1963, einzelvertretungsberechtigt; mit der Befugnis, im Namen der Gesellschaft mit sich als Vertreter eines Dritten Rechtsgeschäfte abzuschließen.",
        "gesellschafter": null,
        "inhaber": null,
        "name": "Blitz 12-541 GmbH",
        "notice_id": "576528",
        "posted_on": "2012-02-15",
        "rechtsform": null,
        "sitz": null,
        "url": "https://www.handelsregisterbekanntmachungen.de/en/skripte/hrb.php?rb_id=576528&land_abk=by"
    },
    "parsed": {
        "labels": [
            {
                "label": "address",
                "text": " Liebigstraße 11, 60323 Frankfurt am Main."
            }
        ],
        "officers": [
            {
                "class": "RetiredManagingDirector",
                "payload": {
                    "city": "München",
                    "dismissed": true,
                    "dob": "1968-04-11",
                    "lastname": "Gogalla",
                    "name": "Katja"
                },
                "text": " Gogalla, Katja, München, *11.04.1968"
            },
            {
                "class": "RetiredManagingDirector",
                "payload": {
                    "city": "München",
                    "dismissed": true,
                    "dob": "1978-03-02",
                    "lastname": "Selnes",
                    "name": "Randi Mette"
                },
                "text": " Selnes, Randi Mette, München, *02.03.1978."
            },
            {
                "class": "AppointedManagingDirector",
                "payload": {
                    "city": "Dieburg",
                    "dob": "1963-10-04",
                    "flag": "sole representation",
                    "lastname": "Moser",
                    "name": "Matthias"
                },
                "text": " Moser, Matthias, Dieburg, *04.10.1963, einzelvertretungsberechtigt"
            },
            {
                "class": "AppointedManagingDirector",
                "payload": {
                    "lastname": "mit der Befugnis",
                    "name": "im Namen der Gesellschaft mit sich als Vertreter eines Dritten Rechtsgeschäfte abzuschließen"
                },
                "text": " mit der Befugnis, im Namen der Gesellschaft mit sich als Vertreter eines Dritten Rechtsgeschäfte abzuschließen."
            }
        ]
    }
}