{
    "orig": {
        "aktenzeichen": "HRB 715212",
        "amtsgericht": "Mannheim",
        "event_date": "2016-10-18",
        "event_type": "Veränderungen",
        "federal_state": "bw",
        "full_text": "Amtsgericht Mannheim Aktenzeichen: HRB 715212 \nBekannt gemacht am: 18.10.2016 16:25 Uhr\n\n\n\n\nIn () gesetzte Angaben der Anschrift und des Geschäftszweiges erfolgen ohne Gewähr:\nVeränderungen\n18.10.2016\n\nHRB 715212: planFabrik2M UG (haftungsbeschränkt), Ilvesheim, Ahornring 7, 68549 Ilvesheim. Die Gesellschafterversammlung vom 13.10.2016 hat die Neufassung des Gesellschaftsvertrages beschlossen. Das Stammkapital ist durch Beschluss der Gesellschafterversammlung vom gleichen Tag um 24.000,00 EUR auf 25.000,00 EUR erhöht. Firma geändert; nun: planFabrik2M GmbH. Stammkapital nun: 25.000,00 EUR. Allgemeine Vertretungsregelung geändert; nun: Ist nur ein Geschäftsführer bestellt, vertritt er allein. Sind mehrere Geschäftsführer bestellt, vertreten zwei gemeinsam oder ein Geschäftsführer mit einem Prokuristen. Jeder Geschäftsführer ist befugt, im Namen der Gesellschaft mit sich im eigenen Namen oder als Vertreter eines Dritten Rechtsgeschäfte vorzunehmen. Vertretungsbefugnis von Amts wegen berichtigt bei Geschäftsführer: Mayer, Michael Anton, Ilvesheim, *08.11.1965.",
        "gesellschafter": null,
        "inhaber": null,
        "name": "HRB 715212: planFabrik2M UG (haftungsbeschränkt)",
        "notice_id": "576551",
        "posted_on": "2016-10-18",
        "rechtsform": null,
        "sitz": null,
        "url": "https://www.handelsregisterbekanntmachungen.de/en/skripte/hrb.php?rb_id=576551&land_abk=bw"
    },
    "parsed": {
        "officers": [
            {
                "class": "ManagingDirector",
                "payload": {
                    "city": "Ilvesheim",
                    "dob": "1965-08-11",
                    "lastname": "Mayer",
                    "name": "Michael Anton"
                },
                "text": " Mayer, Michael Anton, Ilvesheim, *08.11.1965."
            }
        ]
    }
}