{
    "orig": {
        "aktenzeichen": "HRA 65595",
        "amtsgericht": "München",
        "event_date": "2012-03-19",
        "event_type": "Veränderungen",
        "federal_state": "by",
        "full_text": "Amtsgericht München Aktenzeichen: HRA 65595   \nBekannt gemacht am: 21.03.2012 12:00 Uhr\n\n\n\n\nIn ( ) gesetzte Angaben der Anschrift und des Geschäftszweiges erfolgen ohne Gewähr.\nVeränderungen\n19.03.2012\n\nTrachten Werner-Leichtl OHG, Murnau, Landkreis Garmisch-Partenkirchen, Schlossbergstr. 37, 82418 Murnau. Geschäftsanschrift eingetragen. Eingetreten: Persönlich haftender Gesellschafter: Leichtl, Kerstin, Uffing, *20.02.1980; Leichtl, Thomas, Seehausen, *17.11.1982. Personendaten von Amts wegen ergänzt: Persönlich haftender Gesellschafter: Leichtl, Helmut, Murnau, *20.01.1949; Werner-Leichtl, Petra, Murnau, *06.08.1953.",
        "gesellschafter": null,
        "inhaber": null,
        "name": "Trachten Werner-Leichtl OHG",
        "notice_id": "585341",
        "posted_on": "2012-03-21",
        "rechtsform": null,
        "sitz": null,
        "url": "https://www.handelsregisterbekanntmachungen.de/en/skripte/hrb.php?rb_id=585341&land_abk=by"
    },
    "parsed": {
        "officers": [
            {
                "class": "PersonalPartner",
                "payload": {
                    "city": "Uffing",
                    "dob": "1980-02-20",
                    "lastname": "Leichtl",
                    "name": "Kerstin"
                },
                "text": " Leichtl, Kerstin, Uffing, *20.02.1980"
            },
            {
                "class": "PersonalPartner",
                "payload": {
                    "city": "Murnau",
                    "dob": "1949-01-20",
                    "lastname": "Leichtl",
                    "name": "Helmut"
                },
                "text": " Leichtl, Helmut, Murnau, *20.01.1949"
            }
        ]
    }
}