{
    "orig": {
        "aktenzeichen": "HRB 11273",
        "amtsgericht": "Stendal",
        "event_date": "2013-01-10",
        "event_type": "Veränderungen",
        "federal_state": "st",
        "full_text": "Amtsgericht Stendal Aktenzeichen: HRB 11273   \nBekannt gemacht am: 14.01.2013 12:00 Uhr\n\n\n\n\nDie in () gesetzten Angaben der Geschäftsanschrift und des Geschäftszweiges erfolgen ohne Gewähr.\nVeränderungen\n10.01.2013\n\nObjektgesellschaft Schwalbach GmbH, Braunsbedra, Naumburger Straße 7, 06259 Frankleben. Von Amts wegen geändert: Die Gesellschaft wird durch den/die Liquidator/en vertreten. Von Amts wegen geändert: Liquidator: Igler, Roman, Bad Münstereifel, *24.01.1965. Die Gesellschaft ist durch rechtskräftige Abweisung eines Antrags auf Eröffnung des Insolvenzverfahrens mangels Masse aufgelöst (Az.: 59 IN 344/12 Amtsgericht Halle (Saale)). Von Amts wegen eingetragen. Allgemeine Vertretungsregelung und besondere Vertretungsbefugnis von Amts wegen gem. § 384 Abs. 2 FamFG als unrichtig gekennzeichnet.",
        "gesellschafter": null,
        "inhaber": null,
        "name": "Objektgesellschaft Schwalbach GmbH",
        "notice_id": "59772",
        "posted_on": "2013-01-14",
        "rechtsform": null,
        "sitz": null,
        "url": "https://www.handelsregisterbekanntmachungen.de/en/skripte/hrb.php?rb_id=59772&land_abk=st"
    },
    "parsed": {
        "officers": [
            {
                "class": "Liquidator",
                "payload": {
                    "city": "Bad Münstereifel",
                    "dob": "1965-01-24",
                    "lastname": "Igler",
                    "name": "Roman"
                },
                "text": " Igler, Roman, Bad Münstereifel, *24.01.1965."
            }
        ]
    }
}