{
    "orig": {
        "aktenzeichen": "HRB 18663",
        "amtsgericht": "Stendal",
        "event_date": "2013-01-11",
        "event_type": "Veränderungen",
        "federal_state": "st",
        "full_text": "Amtsgericht Stendal Aktenzeichen: HRB 18663   \nBekannt gemacht am: 14.01.2013 12:00 Uhr\n\n\n\n\nDie in () gesetzten Angaben der Geschäftsanschrift und des Geschäftszweiges erfolgen ohne Gewähr.\nVeränderungen\n11.01.2013\n\nHanwha Q.CELLS GmbH, Bitterfeld-Wolfen, Sonnenallee 17-21, 06766 Bitterfeld-Wolfen OT Thalheim. Bestellt: Geschäftsführer: Lee, Koo Yung, München, *07.04.1964; Son, Kye Chun, Gräfelfing, *26.01.1968; Dr. von Zitzewitz, Andreas, Maitenbeth, *14.01.1960. Bestellt: Geschäftsführer: Kim, Hee Cheul, Seongnam (Korea), *10.10.1964, einzelvertretungsberechtigt. Ausgeschieden: Geschäftsführer: Kim, Suyeong, Seoul (Korea), *16.03.1965.",
        "gesellschafter": null,
        "inhaber": null,
        "name": "Hanwha Q.CELLS GmbH",
        "notice_id": "59811",
        "posted_on": "2013-01-14",
        "rechtsform": null,
        "sitz": null,
        "url": "https://www.handelsregisterbekanntmachungen.de/en/skripte/hrb.php?rb_id=59811&land_abk=st"
    },
    "parsed": {
        "officers": [
            {
                "class": "AppointedManagingDirector",
                "payload": {
                    "city": "München",
                    "dob": "1964-07-04",
                    "lastname": "Lee",
                    "name": "Koo Yung"
                },
                "text": " Lee, Koo Yung, München, *07.04.1964"
            },
            {
                "class": "AppointedManagingDirector",
                "payload": {
                    "city": "Seongnam (Korea)",
                    "dob": "1964-10-10",
                    "flag": "sole representation",
                    "lastname": "Kim",
                    "name": "Hee Cheul"
                },
                "text": " Kim, Hee Cheul, Seongnam (Korea), *10.10.1964, einzelvertretungsberechtigt."
            },
            {
                "class": "RetiredManagingDirector",
                "payload": {
                    "city": "Seoul (Korea)",
                    "dismissed": true,
                    "dob": "1965-03-16",
                    "lastname": "Kim",
                    "name": "Suyeong"
                },
                "text": " Kim, Suyeong, Seoul (Korea), *16.03.1965."
            }
        ]
    }
}