{
    "orig": {
        "aktenzeichen": "HRB 54999",
        "amtsgericht": "Düsseldorf",
        "event_date": "2010-10-22",
        "event_type": "Veränderungen",
        "federal_state": "nw",
        "full_text": "Amtsgericht Düsseldorf Aktenzeichen: HRB 54999 \nBekannt gemacht am: 26.10.2010 12:00 Uhr\n\n\n\n\nIn () gesetzte Angaben der Anschrift und des Geschäftszweiges erfolgen ohne Gewähr.\nVeränderungen\n22.10.2010\n\nVIERTE Fonds-Beteiligungsgesellschaft mbH, Düsseldorf, Königsallee 106, 40215 Düsseldorf. Prokura erloschen: Kreß, Hans-Georg, Mülheim d.d. Ruhr, *08.12.1948. Gesamtprokura gemeinsam mit einem Geschäftsführer oder einem anderen Prokuristen mit der Befugnis im Namen der Gesellschaft mit sich im eigenen Namen oder als Vertreter eines Dritten Rechtsgeschäfte abzuschließen mit der Ermächtigung zur Veräußerung und Belastung von Grundstücken: Mohren, Norbert Maria, Rheinberg, *20.04.1963.",
        "gesellschafter": null,
        "inhaber": null,
        "name": "VIERTE Fonds-Beteiligungsgesellschaft mbH",
        "notice_id": "605019",
        "posted_on": "2010-10-26",
        "rechtsform": null,
        "sitz": null,
        "url": "https://www.handelsregisterbekanntmachungen.de/en/skripte/hrb.php?rb_id=605019&land_abk=nw"
    },
    "parsed": {
        "officers": [
            {
                "class": "ProcurationCancelled",
                "payload": {
                    "city": "Mülheim d.d",
                    "dismissed": true,
                    "lastname": "Kreß",
                    "name": "Hans-Georg"
                },
                "text": " Kreß, Hans-Georg, Mülheim d.d."
            }
        ]
    }
}