{
    "orig": {
        "aktenzeichen": "HRB 100072",
        "amtsgericht": "Saarbrücken",
        "event_date": "2017-02-06",
        "event_type": "Veränderungen",
        "federal_state": "sl",
        "full_text": "Amtsgericht Saarbrücken Aktenzeichen: HRB 100072 \nBekannt gemacht am: 06.02.2017 10:22 Uhr\n\n\n\n\nIn () gesetzte Angaben der Anschrift und des Geschäftszweiges erfolgen ohne Gewähr.\nVeränderungen\n06.02.2017\n\nHRB 100072: M-Divizion Werbeagentur UG (haftungsbeschränkt), Saarbrücken, Bismarckstraße 22, 66111 Saarbrücken. Ist nur ein Liquidator bestellt, so vertritt er die Gesellschaft allein. Sind mehrere Liquidatoren bestellt, so wird die Gesellschaft durch die Liquidatoren gemeinsam vertreten. Nicht mehr Geschäftsführer, nun: Liquidator: Schoen, Peter, Oppenheim, *11.10.1965. Die Gesellschafterversammlung vom 23.12.2016 hat die Auflösung der Gesellschaft beschlossen. Änderung zur Geschäftsanschrift: Aschbachring 15, 66127 Saarbrücken.",
        "gesellschafter": null,
        "inhaber": null,
        "name": "HRB 100072: M-Divizion Werbeagentur UG (haftungsbeschränkt)",
        "notice_id": "60873",
        "posted_on": "2017-02-06",
        "rechtsform": null,
        "sitz": null,
        "url": "https://www.handelsregisterbekanntmachungen.de/en/skripte/hrb.php?rb_id=60873&land_abk=sl"
    },
    "parsed": {
        "labels": [
            {
                "label": "address",
                "text": " Aschbachring 15, 66127 Saarbrücken."
            }
        ],
        "officers": [
            {
                "class": "Liquidator",
                "payload": {
                    "city": "Oppenheim",
                    "dob": "1965-10-11",
                    "lastname": "Schoen",
                    "name": "Peter"
                },
                "text": " Schoen, Peter, Oppenheim, *11.10.1965."
            }
        ]
    }
}