{
    "orig": {
        "aktenzeichen": "HRB 33059",
        "amtsgericht": "Düsseldorf",
        "event_date": "2010-11-19",
        "event_type": "Veränderungen",
        "federal_state": "nw",
        "full_text": "Amtsgericht Düsseldorf Aktenzeichen: HRB 33059 \nBekannt gemacht am: 23.11.2010 12:00 Uhr\n\n\n\n\nIn () gesetzte Angaben der Anschrift und des Geschäftszweiges erfolgen ohne Gewähr.\nVeränderungen\n19.11.2010\n\nTASD Grundstücks-Vermietungsgesellschaft mbH, Düsseldorf, Uerdinger Str. 90, 40474 Düsseldorf. Nicht mehr Geschäftsführer: Lehn, Wolfgang, Friesenheim, *14.10.1955; Rosenkranz, Wilfried, Kaarst, *24.08.1948. Bestellt als Geschäftsführer: Guske, Manfred, Tutzing, *26.03.1959; Ramjoué, Christian, Wuppertal, *18.09.1972; Schnittker, Kerstin, Köln, *19.12.1969, jeweils mit der Befugnis im Namen der Gesellschaft mit sich im eigenen Namen oder als Vertreter eines Dritten Rechtsgeschäfte abzuschließen. Gesamtprokura gemeinsam mit einem Geschäftsführer mit der Befugnis im Namen der Gesellschaft mit sich als Vertreter eines Dritten Rechtsgeschäfte abzuschließen mit der Ermächtigung zur Veräußerung und Belastung von Grundstücken: Elbert, Bernd, Köln, *30.10.1964; Rohsiepe, Ulrich, Ratingen, *26.02.1959; Wegemann, Uwe, Moers, *24.12.1958.",
        "gesellschafter": null,
        "inhaber": null,
        "name": "TASD Grundstücks-Vermietungsgesellschaft mbH",
        "notice_id": "613400",
        "posted_on": "2010-11-23",
        "rechtsform": null,
        "sitz": null,
        "url": "https://www.handelsregisterbekanntmachungen.de/en/skripte/hrb.php?rb_id=613400&land_abk=nw"
    },
    "parsed": {
        "officers": [
            {
                "class": "DismissedManagingDirector",
                "payload": {
                    "city": "Friesenheim",
                    "dismissed": true,
                    "dob": "1955-10-14",
                    "lastname": "Lehn",
                    "name": "Wolfgang"
                },
                "text": " Lehn, Wolfgang, Friesenheim, *14.10.1955"
            },
            {
                "class": "AppointedManagingDirector",
                "payload": {
                    "city": "Tutzing",
                    "dob": "1959-03-26",
                    "lastname": "Guske",
                    "name": "Manfred"
                },
                "text": " Guske, Manfred, Tutzing, *26.03.1959"
            }
        ]
    }
}