{
    "orig": {
        "aktenzeichen": "HRB 4304",
        "amtsgericht": "Ulm",
        "event_date": "2017-08-07",
        "event_type": "Veränderungen",
        "federal_state": "bw",
        "full_text": "Amtsgericht Ulm Aktenzeichen: HRB 4304 \nBekannt gemacht am: 07.08.2017 14:53 Uhr\n\n\n\n\nIn () gesetzte Angaben der Anschrift und des Geschäftszweiges erfolgen ohne Gewähr:\nVeränderungen\n07.08.2017\n\nHRB 4304: Holzbau Bunz GmbH, Neenstetten, Langenauer Weg 17, 89189 Neenstetten. Die Gesellschafterversammlung vom 10.07.2017 hat die Änderung des Gesellschaftsvertrages in §§ 4 (Geschäftsführung, Vertretung) und 8 (Einziehung von Geschäftsanteilen) beschlossen. Einzelprokura mit der Befugnis, im Namen der Gesellschaft mit sich im eigenen Namen oder als Vertreter eines Dritten Rechtsgeschäfte abzuschließen: Junginger, Tanja, Neenstetten, *11.06.1975.",
        "gesellschafter": null,
        "inhaber": null,
        "name": "HRB 4304: Holzbau Bunz GmbH",
        "notice_id": "627772",
        "posted_on": "2017-08-07",
        "rechtsform": null,
        "sitz": null,
        "url": "https://www.handelsregisterbekanntmachungen.de/en/skripte/hrb.php?rb_id=627772&land_abk=bw"
    },
    "parsed": {
        "flags": [
            {
                "flag": "Single procuration",
                "text": "Einzelprokura"
            }
        ],
        "officers": [
            {
                "class": "SingleProcuration",
                "payload": {
                    "city": "Neenstetten",
                    "dob": "1975-06-11",
                    "lastname": "Junginger",
                    "name": "Tanja"
                },
                "text": " Junginger, Tanja, Neenstetten, *11.06.1975."
            }
        ]
    }
}