{
    "orig": {
        "aktenzeichen": "HRB 533832",
        "amtsgericht": "Ulm",
        "event_date": "2017-08-17",
        "event_type": "Löschungen von Amts wegen",
        "federal_state": "bw",
        "full_text": "Amtsgericht Ulm Aktenzeichen: HRB 533832 \nBekannt gemacht am: 17.08.2017 15:33 Uhr\n\n\n\n\nIn () gesetzte Angaben der Anschrift und des Geschäftszweiges erfolgen ohne Gewähr:\nLöschungen von Amts wegen\n17.08.2017\n\nHRB 533832: NOWOtech Alu Verwaltungs GmbH, Eislingen, Industriestr. 5, 73054 Eislingen. Von Amts wegen nach § 395 FamFG gelöscht als Geschäftsführer: Nowotny, Jürgen, Süßen, *10.12.1959. Das Gericht beabsichtigt, die Eintragung der Gesellschaft im Handelsregister wegen des Mangels einer wesentlichen Voraussetzung von Amts wegen nach § 395 FamFG als unzulässig zu löschen. Die Frist zur Geltendmachung eines Widerspruchs gegen die beabsichtigte Löschung ist auf einen Monat ab Veröffentlichung bestimmt.",
        "gesellschafter": null,
        "inhaber": null,
        "name": "HRB 533832: NOWOtech Alu Verwaltungs GmbH",
        "notice_id": "629823",
        "posted_on": "2017-08-17",
        "rechtsform": null,
        "sitz": null,
        "url": "https://www.handelsregisterbekanntmachungen.de/en/skripte/hrb.php?rb_id=629823&land_abk=bw"
    },
    "parsed": {
        "officers": [
            {
                "class": "ManagingDirector",
                "payload": {
                    "city": "Süßen",
                    "dob": "1959-10-12",
                    "lastname": "Nowotny",
                    "name": "Jürgen"
                },
                "text": " Nowotny, Jürgen, Süßen, *10.12.1959."
            }
        ]
    }
}