{
    "orig": {
        "aktenzeichen": "HRB 354535",
        "amtsgericht": "Stuttgart",
        "event_date": "2017-08-31",
        "event_type": "Veränderungen",
        "federal_state": "bw",
        "full_text": "Amtsgericht Stuttgart Aktenzeichen: HRB 354535 \nBekannt gemacht am: 31.08.2017 13:20 Uhr\n\n\n\n\nIn () gesetzte Angaben der Anschrift und des Geschäftszweiges erfolgen ohne Gewähr:\nVeränderungen\n31.08.2017\n\nHRB 354535: bitbase Verwaltungs-GmbH, Reutlingen, Am Heilbrunnen 47, 72766 Reutlingen. Die Gesellschafterversammlung vom 10.08.2017 hat die Neufassung des Gesellschaftsvertrages beschlossen. Das Stammkapital ist durch Beschluss der Gesellschafterversammlung vom gleichen Tag zum Zwecke der Verschmelzung mit \"bitbase GmbH & Co. KG\", Reutlingen (Amtsgericht Stuttgart HRA 352300) um 11.000,00 EUR erhöht. Das Stammkapital ist durch Beschluss der Gesellschafterversammlung vom gleichen Tag zum Zwecke der Verschmelzung mit \"Coloratur GmbH\", Reutlingen (Amtsgericht Stuttgart HRB 737578) um 34.000,00 EUR erhöht. Das Stammkapital ist durch Beschluss der Gesellschafterversammlung vom gleichen Tag zum Zwecke der Verschmelzung mit \"kameon GmbH\", Reutlingen (Amtsgericht Stuttgart HRB 755297) um 30.000,00 EUR erhöht. Firma geändert; nun: bbg bitbase group GmbH. Gegenstand geändert; nun: Die Durchführung sämtlicher Geschäfte einer Softwareentwicklung, insbesondere die Fertigung von Softwareanwendungen sowie der Vertrieb der erstellten Produkte und die Ausführung aller damit zusammenhängenden Tätigkeiten, weiterhin die Durchführung von Programmierung, die Tätigkeiten im Bereich des Webdesigns, Erstellung von Applikationen und die Beratung, der Verkauf, die Vermittlungen und Installation von Rechnersystemen und Netzwerken, außerdem die Durchführung sämtlicher Geschäfte einer Medienagentur, insbesondere die Fertigung von grafischen Entwürfen jeglicher Art sowie die Gestaltung und Produktion jeglicher Medien und die Ausführung aller damit zusammenhängenden Tätigkeiten. Stammkapital nun: 100.000,00 EUR. Allgemeine Vertretungsregelung geändert; nun: Ist nur ein Geschäftsführer bestellt, vertritt er allein. Sind mehrere Geschäftsführer bestellt, vertreten zwei gemeinsam oder ein Geschäftsführer mit einem Prokuristen. Erteilt: Einzelprokura: Baisch, Volker, Reutlingen, *01.09.1979.",
        "gesellschafter": null,
        "inhaber": null,
        "name": "HRB 354535: bitbase Verwaltungs-GmbH",
        "notice_id": "632153",
        "posted_on": "2017-08-31",
        "rechtsform": null,
        "sitz": null,
        "url": "https://www.handelsregisterbekanntmachungen.de/en/skripte/hrb.php?rb_id=632153&land_abk=bw"
    },
    "parsed": {
        "officers": [
            {
                "class": "SingleProcuration",
                "payload": {
                    "city": "Reutlingen",
                    "dob": "1979-01-09",
                    "lastname": "Baisch",
                    "name": "Volker"
                },
                "text": " Baisch, Volker, Reutlingen, *01.09.1979."
            }
        ]
    }
}