{
    "orig": {
        "aktenzeichen": "HRB 8919",
        "amtsgericht": "Schwerin",
        "event_date": "2007-01-25",
        "event_type": "Veränderungen",
        "federal_state": "mv",
        "full_text": "Amtsgericht Schwerin Aktenzeichen: HRB 8919 \nBekannt gemacht am: 02.02.2007 14:50 Uhr\n\n\n\n\nDie in () gesetzten Angaben der Geschäftsanschrift und des Unternehmensgegenstandes erfolgen ohne Gewähr.\nVeränderungen\n25.01.2007\n\nHANSE -Klinikum Wismar GmbH, Wismar (Störtebekertsr. 6, 23966 Wismar). Gesamtprokura gemeinsam mit einem Geschäftsführer oder einem anderen Prokuristen: Blanke, Gerd, Damp, *01.10.1939; Dr. Bunzen, Nils, Dänischhagen, *26.09.1975; Helms-Ferlemann, Friedel, Proseken, *24.07.1947; Pansegrau, Peter, Eckernförde, *23.06.1970. Einzelprokura erloschen: Helms-Ferlemann, Friedel, Proseken, *24.07.1947.",
        "gesellschafter": null,
        "inhaber": null,
        "name": "HANSE -Klinikum Wismar GmbH",
        "notice_id": "641",
        "posted_on": "2007-02-02",
        "rechtsform": null,
        "sitz": null,
        "url": "https://www.handelsregisterbekanntmachungen.de/en/skripte/hrb.php?rb_id=641&land_abk=mv"
    },
    "parsed": {
        "flags": [
            {
                "flag": "Single procuration",
                "text": "Einzelprokura"
            }
        ],
        "officers": [
            {
                "class": "CommonProcuration",
                "payload": {
                    "city": "Damp",
                    "dob": "1939-10-01",
                    "lastname": "Blanke",
                    "name": "Gerd"
                },
                "text": " Blanke, Gerd, Damp, *01.10.1939"
            },
            {
                "class": "CommonProcuration",
                "payload": {
                    "city": "Dänischhagen",
                    "dob": "1975-09-26",
                    "lastname": "Doctor Bunzen",
                    "name": "Nils"
                },
                "text": " Doctor Bunzen, Nils, Dänischhagen, *26.09.1975"
            },
            {
                "class": "CommonProcuration",
                "payload": {
                    "city": "Proseken",
                    "dob": "1947-07-24",
                    "lastname": "Helms-Ferlemann",
                    "name": "Friedel"
                },
                "text": " Helms-Ferlemann, Friedel, Proseken, *24.07.1947"
            },
            {
                "class": "CommonProcuration",
                "payload": {
                    "city": "Eckernförde",
                    "dob": "1970-06-23",
                    "lastname": "Pansegrau",
                    "name": "Peter"
                },
                "text": " Pansegrau, Peter, Eckernförde, *23.06.1970."
            },
            {
                "class": "ProcurationCancelled",
                "payload": {
                    "city": "Proseken",
                    "dismissed": true,
                    "dob": "1947-07-24",
                    "lastname": "Helms-Ferlemann",
                    "name": "Friedel"
                },
                "text": " Helms-Ferlemann, Friedel, Proseken, *24.07.1947."
            }
        ]
    }
}