{
    "orig": {
        "aktenzeichen": "HRA 102314",
        "amtsgericht": "Stuttgart",
        "event_date": "2017-11-22",
        "event_type": "Veränderungen",
        "federal_state": "bw",
        "full_text": "Amtsgericht Stuttgart Aktenzeichen: HRA 102314 \nBekannt gemacht am: 22.11.2017 15:07 Uhr\n\n\n\n\nIn () gesetzte Angaben der Anschrift und des Geschäftszweiges erfolgen ohne Gewähr:\nVeränderungen\n22.11.2017\n\nHRA 102314: Lidl Stiftung & Co. KG, Neckarsulm, Stiftsbergstr. 1, 74172 Neckarsulm. Gesamtprokura gemeinsam mit einem persönlich haftenden Gesellschafter oder einem anderen Prokuristen mit der Befugnis, im Namen der Gesellschaft mit sich als Vertreter eines Dritten Rechtsgeschäfte abzuschließen: Aranda Y Pankow, Michael Werner Henning, Sant Guat, *02.02.1968. Personenbezogene Daten (Geburtsdatum) berichtigt bei Gesamtprokura gemeinsam mit einem persönlich haftenden Gesellschafter oder einem anderen Prokuristen mit der Befugnis, im Namen der Gesellschaft mit sich als Vertreter eines Dritten Rechtsgeschäfte abzuschließen: Kirscht, Matthias, Bad Rappenau, *09.08.1974. Prokura erloschen: Wiest, Arne, Leonberg, *31.08.1979.",
        "gesellschafter": null,
        "inhaber": null,
        "name": "HRA 102314: Lidl Stiftung & Co. KG",
        "notice_id": "644623",
        "posted_on": "2017-11-22",
        "rechtsform": null,
        "sitz": null,
        "url": "https://www.handelsregisterbekanntmachungen.de/en/skripte/hrb.php?rb_id=644623&land_abk=bw"
    },
    "parsed": {
        "officers": [
            {
                "class": "ProcurationCancelled",
                "payload": {
                    "city": "Leonberg",
                    "dismissed": true,
                    "dob": "1979-08-31",
                    "lastname": "Wiest",
                    "name": "Arne"
                },
                "text": " Wiest, Arne, Leonberg, *31.08.1979."
            }
        ]
    }
}