{
    "orig": {
        "aktenzeichen": "HRB 3195",
        "amtsgericht": "Stralsund",
        "event_date": "2015-12-04",
        "event_type": "Veränderungen",
        "federal_state": "mv",
        "full_text": "Amtsgericht Stralsund Aktenzeichen: HRB 3195 \nBekannt gemacht am: 04.12.2015 21:59 Uhr\n\n\n\n\nIn ( ) gesetzte Angaben der Anschrift und des Geschäftszweiges erfolgen ohne Gewähr:\nVeränderungen\n04.12.2015\n\nHRB 3195: NORDOST Fernsehproduktion GmbH, Greifswald, Bahnhofstr. 1, 17489 Greifswald. Allgemeine Vertretungsregelung geändert, nun: Ist nur ein Liquidator bestellt, so vertritt er die Gesellschaft allein. Sind mehrere Liquidatoren bestellt, so wird die Gesellschaft durch zwei Liquidatoren gemeinsam vertreten. Nicht mehr Liquidator: Merkel, Heinz, Kröslin, *15.01.1955. Bestellt als Liquidator: Krietsch, Tom, Weitenhagen, *11.02.1975.",
        "gesellschafter": null,
        "inhaber": null,
        "name": "HRB 3195: NORDOST Fernsehproduktion GmbH",
        "notice_id": "64643",
        "posted_on": "2015-12-04",
        "rechtsform": null,
        "sitz": null,
        "url": "https://www.handelsregisterbekanntmachungen.de/en/skripte/hrb.php?rb_id=64643&land_abk=mv"
    },
    "parsed": {
        "officers": [
            {
                "class": "NotALiquidator",
                "payload": {
                    "city": "Kröslin",
                    "dismissed": true,
                    "dob": "1955-01-15",
                    "lastname": ": Merkel",
                    "name": "Heinz"
                },
                "text": ": Merkel, Heinz, Kröslin, *15.01.1955."
            },
            {
                "class": "Liquidator",
                "payload": {
                    "city": "Weitenhagen",
                    "dob": "1975-02-11",
                    "lastname": "Krietsch",
                    "name": "Tom"
                },
                "text": " Krietsch, Tom, Weitenhagen, *11.02.1975."
            }
        ]
    }
}