{
    "orig": {
        "aktenzeichen": "HRB 24592",
        "amtsgericht": "Leipzig",
        "event_date": "2009-02-04",
        "event_type": "Veränderungen",
        "federal_state": "sn",
        "full_text": "Amtsgericht Leipzig Aktenzeichen: HRB 24592 \nBekannt gemacht am: 05.02.2009 12:00 Uhr\n\n\n\n\nDie in () gesetzten Angaben der Geschäftsanschrift und des Unternehmensgegenstandes erfolgen ohne Gewähr.\nVeränderungen\n04.02.2009\n\nBCK-Systeme Datentechnik GmbH, Zwenkau, Spenglerallee 12-14, 04442 Zwenkau.Die Gesellschafterversammlung vom 22.12.2008 hat den Gesellschaftsvertrag neu gefasst. Dabei wurde insbesondere geändert: Firma und Gegenstand des Unternehmens. Neue Firma: SSM euromicron GmbH - ein Unternehmen der euromicron Gruppe. Neuer Gegenstand: Planung, Errichtung, Einbau, Inbetriebnahme und Service von Produkten, Anlagen, Systemen und Netzwerken in den Bereichen Nachrichtentechnik, Elektrotechnik, Sicherheitstechnik, Brandmeldetechnik, Mobilfunktechnik sowie Daten- und Kommunikationstechnik und allen angrenzenden Systemen; Analyse, Überwachung, Restrukturierung und Optimierung von Anlagen und Netzwerken sowie deren Sicherheit und Leistungsfähigkeit; Handel und Vertrieb von Gütern und Dienstleistungen aller Art auf dem Gebiet der Nachrichten-, Sicherheits-, Informations-, Daten- und Kommunikationstechnik im In- und Ausland, sowie zugehörige Beratungsleistungen. Bestellt: Geschäftsführer: Büttner, Andreas, Kitzscher, *08.04.1952; Winkler, Ralf, Korschenbroich, *26.03.1963, jeweils vertretungsberechtigt gemeinsam mit einem anderen Geschäftsführer oder einem Prokuristen. Gesamtprokura gemeinsam mit einem Geschäftsführer oder einem anderen Prokuristen: Jahn, Tobias, Erfurt, *23.02.1966; Semmler, Gerhard, Beesenstedt, *25.05.1951; Wampfler, Rainer, Fockendorf, *20.05.1950. Die \"SSM euromicron GmbH - ein Unternehmen der euromicron Gruppe\" mit dem Sitz in Zwenkau (Amtsgericht Leipzig, HRB 14310) ist auf Grund des Verschmelzungsvertrages vom 22.12.2008 und des Beschlusses der Gesellschafterversammlung der übertragenden Gesellschaft vom selben Tag sowie des Beschlusses der Gesellschafterversammlung vom 22.12.2008 mit der Gesellschaft im Wege der Aufnahme verschmolzen. Als nicht eingetragen wird veröffentlicht: Den Gläubigern der an der Verschmelzung beteiligten Rechtsträger ist, wenn sie binnen sechs Monaten nach dem Tag, an dem die Eintragung der Verschmelzung in das Register des Sitzes desjenigen Rechträgers, dessen Gläubiger sie sind, nach § 19 Abs. 3 UmwG als bekannt gemacht gilt, ihren Anspruch nach Grund und Höhe schriftlich anmelden, Sicherheit zu leisten, soweit sie nicht Befriedigung verlangen können. Dieses Recht steht den Gläubigern jedoch nur zu, wenn sie glaubhaft machen, dass durch die Verschmelzung die Erfüllung der Forderung gefährdet wird.",
        "gesellschafter": null,
        "inhaber": null,
        "name": "BCK-Systeme Datentechnik GmbH",
        "notice_id": "65182",
        "posted_on": "2009-02-05",
        "rechtsform": null,
        "sitz": null,
        "url": "https://www.handelsregisterbekanntmachungen.de/en/skripte/hrb.php?rb_id=65182&land_abk=sn"
    },
    "parsed": {
        "officers": [
            {
                "class": "AppointedManagingDirector",
                "payload": {
                    "city": "Kitzscher",
                    "dob": "1952-08-04",
                    "lastname": "Büttner",
                    "name": "Andreas"
                },
                "text": " Büttner, Andreas, Kitzscher, *08.04.1952"
            },
            {
                "class": "CommonProcuration",
                "payload": {
                    "city": "Erfurt",
                    "dob": "1966-02-23",
                    "lastname": "Jahn",
                    "name": "Tobias"
                },
                "text": " Jahn, Tobias, Erfurt, *23.02.1966"
            }
        ]
    }
}