{
    "orig": {
        "aktenzeichen": "HRB 6063",
        "amtsgericht": "Nürnberg",
        "event_date": "2013-02-20",
        "event_type": "Veränderungen",
        "federal_state": "by",
        "full_text": "Amtsgericht Nürnberg Aktenzeichen: HRB 6063   \nBekannt gemacht am: 22.02.2013 12:00 Uhr\n\n\n\n\nIn ( ) gesetzte Angaben der Anschrift und des Geschäftszweiges erfolgen ohne Gewähr.\nVeränderungen\n20.02.2013\n\nGARANTA Versicherungs- Aktiengesellschaft, Nürnberg, Ostendstraße 100, 90334 Nürnberg. Ausgeschieden: Vorstand: Bockshecker, Walter, Heroldsberg, *18.01.1960; von der Forst, Henning, Nürnberg, *22.05.1955; Dr. Knocke, Wolf-Rüdiger, Lauf/Pegnitz, *25.02.1956; Dr. Zitzmann, Armin, Winkelhaid, *21.09.1960. Bestellt: Vorstand: Kreß, Stefan, Nürnberg, *07.06.1965; Schmidt, Fritz, Burgthann, *19.06.1958. Prokura erloschen: Kreß, Stefan, Nürnberg, *07.06.1965. Gesamtprokura gemeinsam mit einem Vorstandsmitglied oder einem anderen Prokuristen: Heusl, Bernhard, Nürnberg, *22.04.1960; Koch, Claudia, Nürnberg, *04.08.1963; Koßert, Oliver, Heßdorf, *18.09.1974.",
        "gesellschafter": null,
        "inhaber": null,
        "name": "GARANTA Versicherungs- Aktiengesellschaft",
        "notice_id": "670918",
        "posted_on": "2013-02-22",
        "rechtsform": null,
        "sitz": null,
        "url": "https://www.handelsregisterbekanntmachungen.de/en/skripte/hrb.php?rb_id=670918&land_abk=by"
    },
    "parsed": {
        "officers": [
            {
                "class": "ProcurationCancelled",
                "payload": {
                    "city": "Nürnberg",
                    "dismissed": true,
                    "dob": "1965-06-07",
                    "lastname": "Kreß",
                    "name": "Stefan"
                },
                "text": " Kreß, Stefan, Nürnberg, *07.06.1965."
            },
            {
                "class": "CommonProcuration",
                "payload": {
                    "city": "Nürnberg",
                    "dob": "1960-04-22",
                    "lastname": "Heusl",
                    "name": "Bernhard"
                },
                "text": " Heusl, Bernhard, Nürnberg, *22.04.1960"
            },
            {
                "class": "CommonProcuration",
                "payload": {
                    "city": "Nürnberg",
                    "dob": "1963-08-04",
                    "lastname": "Koch",
                    "name": "Claudia"
                },
                "text": " Koch, Claudia, Nürnberg, *04.08.1963"
            },
            {
                "class": "CommonProcuration",
                "payload": {
                    "city": "Heßdorf",
                    "dob": "1974-09-18",
                    "lastname": "Koßert",
                    "name": "Oliver"
                },
                "text": " Koßert, Oliver, Heßdorf, *18.09.1974."
            }
        ]
    }
}