{
    "orig": {
        "aktenzeichen": "HRB 134957",
        "amtsgericht": "München",
        "event_date": "2013-02-20",
        "event_type": "Veränderungen",
        "federal_state": "by",
        "full_text": "Amtsgericht München Aktenzeichen: HRB 134957   \nBekannt gemacht am: 27.02.2013 12:00 Uhr\n\n\n\n\nIn ( ) gesetzte Angaben der Anschrift und des Geschäftszweiges erfolgen ohne Gewähr.\nVeränderungen\n20.02.2013\n\nNAM Handels GmbH, München, Schleißheimer Str. 435 g, 80935 München. Ist nur ein Liquidator bestellt, so vertritt er die Gesellschaft allein. Sind mehrere Liquidatoren bestellt, so wird die Gesellschaft durch zwei Liquidatoren oder durch einen Liquidator gemeinsam mit einem Prokuristen vertreten. Geändert, nun: Liquidator: Colak, Mehmet Ali, München, *03.02.1955. Das Insolvenzverfahren ist durch Beschluss des Amtsgerichts München vom 15.02.2013 (Az. 1506 IN 2073/11) nach Schlussverteilung aufgehoben worden.",
        "gesellschafter": null,
        "inhaber": null,
        "name": "NAM Handels GmbH",
        "notice_id": "671834",
        "posted_on": "2013-02-27",
        "rechtsform": null,
        "sitz": null,
        "url": "https://www.handelsregisterbekanntmachungen.de/en/skripte/hrb.php?rb_id=671834&land_abk=by"
    },
    "parsed": {
        "officers": [
            {
                "class": "Liquidator",
                "payload": {
                    "city": "München",
                    "dob": "1955-03-02",
                    "lastname": ": Colak",
                    "name": "Mehmet Ali"
                },
                "text": ": Colak, Mehmet Ali, München, *03.02.1955."
            }
        ]
    }
}