{
    "orig": {
        "aktenzeichen": "HRB 7273",
        "amtsgericht": "Siegen",
        "event_date": "2011-06-17",
        "event_type": "Löschungen",
        "federal_state": "nw",
        "full_text": "Amtsgericht Siegen Aktenzeichen: HRB 7273 \nBekannt gemacht am: 20.06.2011 12:00 Uhr\n\n\n\n\nIn () gesetzte Angaben der Anschrift und des Geschäftszweiges erfolgen ohne Gewähr.\nLöschungen\n17.06.2011\n\nApparatebau Gesellschaft mit beschränkter Haftung, Drolshagen, Bergstraße 2, 57489 Drolshagen. Die Gesellschaft ist durch Gesellschafterbeschluss vom 15.06.2011 aufgelöst. Ist nur ein Liquidator bestellt, so vertritt er die Gesellschaft allein. Sind mehrere Liquidatoren bestellt, so wird die Gesellschaft durch die Liquidatoren gemeinsam vertreten. Nicht mehr Geschäftsführer sondern nunmehr Liquidator: Kadagies, Peter, Olpe, *03.09.1956, vertretungsberechtigt gemeinsam mit einem anderen Liquidator oder einem Prokuristen mit der Befugnis im Namen der Gesellschaft mit sich im eigenen Namen oder als Vertreter eines Dritten Rechtsgeschäfte abzuschließen. Die Gesellschaft ist gelöscht.",
        "gesellschafter": null,
        "inhaber": null,
        "name": "Apparatebau Gesellschaft mit beschränkter Haftung",
        "notice_id": "684528",
        "posted_on": "2011-06-20",
        "rechtsform": null,
        "sitz": null,
        "url": "https://www.handelsregisterbekanntmachungen.de/en/skripte/hrb.php?rb_id=684528&land_abk=nw"
    },
    "parsed": {
        "officers": [
            {
                "class": "Liquidator",
                "payload": {
                    "city": "Olpe",
                    "dob": "1956-03-09",
                    "flag": "vertretungsberechtigt gemeinsam mit einem anderen Liquidator oder einem Prokuristen mit der Befugnis im Namen der Gesellschaft mit sich im eigenen Namen oder als Vertreter eines Dritten Rechtsgeschäfte abzuschließen",
                    "lastname": "Kadagies",
                    "name": "Peter"
                },
                "text": " Kadagies , Peter , Olpe , * 03.09.1956 , vertretungsberechtigt gemeinsam mit einem anderen Liquidator oder einem Prokuristen mit der Befugnis im Namen der Gesellschaft mit sich im eigenen Namen oder als Vertreter eines Dritten Rechtsgeschäfte abzuschließen ."
            }
        ]
    }
}