{
    "orig": {
        "aktenzeichen": "HRB 30625 HB",
        "amtsgericht": "Bremen",
        "event_date": "2017-07-03",
        "event_type": "Veränderungen",
        "federal_state": "hb",
        "full_text": "Amtsgericht Bremen Aktenzeichen: HRB 30625 HB \nBekannt gemacht am: 04.07.2017 20:00 Uhr\n\n\n\n\nIn () gesetzte Angaben der Anschrift und des Unternehmensgegenstandes erfolgen ohne Gewähr:\nVeränderungen\n03.07.2017\n\nHRB 30625 HB: Zoubi General Trading GmbH, Bremen, Gutenberg Straße 37, 28217 Bremen. Die Eintragung betreffend die allgemeine Vertretungsbefugnis ist von Amts wegen wie folgt berichtigt: Die Gesellschaft wird durch den/die Liquidator(en) vertreten. Die Eintragung zu Nr. 1 ist von Amts wegen wie folgt berichtigt: Liquidator: Zoubi, Talal, *04.11.1992, Bremen. Die Gesellschaft ist durch rechtskräftige Abweisung eines Antrags auf Eröffnung des Insolvenzverfahrens mangels einer die Kosten des Verfahrens deckenden Masse auf Grund des § 60 Abs. 1 Nr. 5 GmbHG aufgelöst. (Beschluss des Amtsgerichts Bremen vom 06.06.2017 AZ: 530 IN 1/17) \nVon Amts wegen eingetragen.",
        "gesellschafter": null,
        "inhaber": null,
        "name": "Von Amts wegen eingetragen.",
        "notice_id": "69948",
        "posted_on": "2017-07-04",
        "rechtsform": null,
        "sitz": null,
        "url": "https://www.handelsregisterbekanntmachungen.de/en/skripte/hrb.php?rb_id=69948&land_abk=hb"
    },
    "parsed": {
        "labels": [
            {
                "label": "WHUT",
                "text": " Zoubi General Trading GmbH, Bremen, Gutenberg Straße 37, 28217 Bremen."
            }
        ],
        "officers": [
            {
                "class": "Liquidator",
                "payload": {
                    "city": "Bremen",
                    "dob": "1992-11-04",
                    "lastname": "Zoubi",
                    "name": "Talal"
                },
                "text": " Zoubi, Talal, *04.11.1992, Bremen."
            }
        ]
    }
}