{
    "orig": {
        "aktenzeichen": "HRB 7266",
        "amtsgericht": "Stendal",
        "event_date": "2014-01-22",
        "event_type": "Veränderungen",
        "federal_state": "st",
        "full_text": "Amtsgericht Stendal Aktenzeichen: HRB 7266   \nBekannt gemacht am: 27.01.2014 12:00 Uhr\n\n\n\n\nDie in () gesetzten Angaben der Geschäftsanschrift und des Geschäftszweiges erfolgen ohne Gewähr.\nVeränderungen\n22.01.2014\n\nQuerfurter Transport- und Handel GmbH, Querfurt, Obhäuser Weg 11, 06268 Querfurt. Geschäftsanschrift: Obhäuser Weg 11, 06268 Querfurt. Die Gesellschaft wird durch die Liquidatoren vertreten. Geändert, nun: Liquidator: Hausner, Herbert, Aseleben, *25.09.1948; Worg, Martin, Querfurt, *27.02.1957. Das Insolvenzverfahren ist durch Beschluss des Amtsgerichts Halle (Saale) vom 07.11.2013 (Az. 59 IN 44/09) nach Schlussverteilung aufgehoben worden. Allgemeine Vertretungsregelung und besondere Vertretungsbefugnis von Amts wegen gem. § 384 Abs. 2 FamFG als unrichtig gekennzeichnet.",
        "gesellschafter": null,
        "inhaber": null,
        "name": "Querfurter Transport- und Handel GmbH",
        "notice_id": "69954",
        "posted_on": "2014-01-27",
        "rechtsform": null,
        "sitz": null,
        "url": "https://www.handelsregisterbekanntmachungen.de/en/skripte/hrb.php?rb_id=69954&land_abk=st"
    },
    "parsed": {
        "labels": [
            {
                "label": "address",
                "text": " Obhäuser Weg 11, 06268 Querfurt."
            }
        ],
        "officers": [
            {
                "class": "Liquidator",
                "payload": {
                    "city": "Aseleben",
                    "dob": "1948-09-25",
                    "lastname": ": Hausner",
                    "name": "Herbert"
                },
                "text": ": Hausner, Herbert, Aseleben, *25.09.1948"
            }
        ]
    }
}