{
    "orig": {
        "aktenzeichen": "HRB 104931 B",
        "amtsgericht": "Charlottenburg (Berlin)",
        "event_date": "2008-06-26",
        "event_type": "Veränderungen",
        "federal_state": "be",
        "full_text": "Amtsgericht Charlottenburg (Berlin) Aktenzeichen: HRB 104931 B  \nBekannt gemacht am: 30.06.2008 12:00 Uhr\n\n\n\n\nFür die Angaben in (), die den Unternehmensgegenstand und die Anschrift betreffen, keine Gewähr. In das Handelsregister ist folgendes eingetragen worden.\nVeränderungen\n26.06.2008\n\nFranzensbader Projekt GmbH, Berlin(Hubertusallee 42-44, 14193  Berlin). Nicht mehr Geschäftsführer:; 1. Puyol Bejar, Luis Pascual; Nicht mehr Geschäftsführer:; 2. Garcia de Chiclana, Jesús; Geschäftsführer:; 4. Rodriguez Garcia, Francisco Javier, *22.01.1953, Madrid/Spanien; Geschäftsführer:; 5. Bonet de Luna, Jorge Federico, *29.04.1963, Madrid/Spanien.",
        "gesellschafter": null,
        "inhaber": null,
        "name": "Franzensbader Projekt GmbH",
        "notice_id": "70592",
        "posted_on": "2008-06-30",
        "rechtsform": null,
        "sitz": null,
        "url": "https://www.handelsregisterbekanntmachungen.de/en/skripte/hrb.php?rb_id=70592&land_abk=be"
    },
    "parsed": {
        "officers": [
            {
                "class": "DismissedManagingDirector",
                "payload": {
                    "dismissed": true,
                    "lastname": "Puyol Bejar",
                    "name": "Luis Pascual"
                },
                "text": " Puyol Bejar, Luis Pascual"
            },
            {
                "class": "DismissedManagingDirector",
                "payload": {
                    "dismissed": true,
                    "lastname": "Garcia de Chiclana",
                    "name": "Jesús"
                },
                "text": " Garcia de Chiclana, Jesús"
            },
            {
                "class": "ManagingDirector",
                "payload": {
                    "city": "Madrid/Spanien",
                    "dob": "1953-01-22",
                    "lastname": "Rodriguez Garcia",
                    "name": "Francisco Javier"
                },
                "text": " Rodriguez Garcia, Francisco Javier, *22.01.1953, Madrid/Spanien"
            },
            {
                "class": "ManagingDirector",
                "payload": {
                    "city": "Madrid/Spanien",
                    "dob": "1963-04-29",
                    "lastname": "Bonet de Luna",
                    "name": "Jorge Federico"
                },
                "text": " Bonet de Luna, Jorge Federico, *29.04.1963, Madrid/Spanien."
            }
        ]
    }
}