{
    "orig": {
        "aktenzeichen": "HRB 163552",
        "amtsgericht": "München",
        "event_date": "2013-07-22",
        "event_type": "Veränderungen",
        "federal_state": "by",
        "full_text": "Amtsgericht München Aktenzeichen: HRB 163552   \nBekannt gemacht am: 24.07.2013 12:00 Uhr\n\n\n\n\nIn ( ) gesetzte Angaben der Anschrift und des Geschäftszweiges erfolgen ohne Gewähr.\nVeränderungen\n22.07.2013\n\nBabcock & Brown Arkadia Verwaltungs GmbH, München, Weißenburger Str. 10, 81667 München. Ausgeschieden: Geschäftsführer: Badger, Dan, London/GB, *03.06.1946; Rey, Martin, Traunstein, *23.02.1957. Bestellt: Geschäftsführer: Reveliotis, Christos, London/Großbritannien, *03.01.1968, einzelvertretungsberechtigt; mit der Befugnis, im Namen der Gesellschaft mit sich im eigenen Namen oder als Vertreter eines Dritten Rechtsgeschäfte abzuschließen.",
        "gesellschafter": null,
        "inhaber": null,
        "name": "Babcock & Brown Arkadia Verwaltungs GmbH",
        "notice_id": "707045",
        "posted_on": "2013-07-24",
        "rechtsform": null,
        "sitz": null,
        "url": "https://www.handelsregisterbekanntmachungen.de/en/skripte/hrb.php?rb_id=707045&land_abk=by"
    },
    "parsed": {
        "flags": [
            {
                "flag": "with the power to enter into legal transactions on behalf of the Company with itself or as a representative of a third party",
                "text": "mit\\ der\\ Befugnis\\,\\ im\\ Namen\\ der\\ Gesellschaft\\ mit\\ sich\\ im\\ eigenen\\ Namen\\ oder\\ als\\ Vertreter\\ eines\\ Dritten\\ Rechtsgesch\\äfte\\ abzuschlie\\ßen\\."
            }
        ],
        "officers": [
            {
                "class": "RetiredManagingDirector",
                "payload": {
                    "city": "London/GB",
                    "dismissed": true,
                    "dob": "1946-06-03",
                    "lastname": "Badger",
                    "name": "Dan"
                },
                "text": " Badger, Dan, London/GB, *03.06.1946"
            },
            {
                "class": "RetiredManagingDirector",
                "payload": {
                    "city": "Traunstein",
                    "dismissed": true,
                    "dob": "1957-02-23",
                    "lastname": "Rey",
                    "name": "Martin"
                },
                "text": " Rey, Martin, Traunstein, *23.02.1957."
            },
            {
                "class": "AppointedManagingDirector",
                "payload": {
                    "city": "London/Großbritannien",
                    "dob": "1968-01-03",
                    "flag": "sole representation",
                    "lastname": "Reveliotis",
                    "name": "Christos"
                },
                "text": " Reveliotis, Christos, London/Großbritannien, *03.01.1968, einzelvertretungsberechtigt"
            },
            {
                "class": "AppointedManagingDirector",
                "payload": {
                    "lastname": "mit der Befugnis",
                    "name": "im Namen der Gesellschaft mit sich im eigenen Namen oder als Vertreter eines Dritten Rechtsgeschäfte abzuschließen"
                },
                "text": " mit der Befugnis, im Namen der Gesellschaft mit sich im eigenen Namen oder als Vertreter eines Dritten Rechtsgeschäfte abzuschließen."
            }
        ]
    }
}