{
    "orig": {
        "aktenzeichen": "HRB 5025",
        "amtsgericht": "Regensburg",
        "event_date": "2013-07-23",
        "event_type": "Veränderungen",
        "federal_state": "by",
        "full_text": "Amtsgericht Regensburg Aktenzeichen: HRB 5025   \nBekannt gemacht am: 25.07.2013 12:00 Uhr\n\n\n\n\nIn ( ) gesetzte Angaben der Anschrift und des Geschäftszweiges erfolgen ohne Gewähr.\nVeränderungen\n23.07.2013\n\nJohann Schmidbauer GmbH, Schorndorf (Chamer Str. 16, 93489 Schorndorf). Allgemeine Vertretungsregelung von Amts wegen berichtigt: Die Gesellschaft wird durch den/die Liquidator/en vertreten. Vertretungsbefugnis von Amts wegen berichtigt: Liquidator: Schmidbauer, Johann, Schorndorf, *25.05.1949. Das Insolvenzverfahren ist durch Beschluss des Amtsgerichts Regensburg vom 17.07.2013 (Az. 4 IN 585/05) nach Schlussverteilung aufgehoben worden. Die Gesellschaft bleibt aufgelöst.",
        "gesellschafter": null,
        "inhaber": null,
        "name": "Johann Schmidbauer GmbH",
        "notice_id": "707569",
        "posted_on": "2013-07-25",
        "rechtsform": null,
        "sitz": null,
        "url": "https://www.handelsregisterbekanntmachungen.de/en/skripte/hrb.php?rb_id=707569&land_abk=by"
    },
    "parsed": {
        "officers": [
            {
                "class": "Liquidator",
                "payload": {
                    "city": "Schorndorf",
                    "dob": "1949-05-25",
                    "lastname": "Schmidbauer",
                    "name": "Johann"
                },
                "text": " Schmidbauer, Johann, Schorndorf, *25.05.1949."
            }
        ]
    }
}