{
    "orig": {
        "aktenzeichen": "HRB 170043",
        "amtsgericht": "München",
        "event_date": "2013-08-27",
        "event_type": "Veränderungen",
        "federal_state": "by",
        "full_text": "Amtsgericht München Aktenzeichen: HRB 170043   \nBekannt gemacht am: 28.08.2013 12:00 Uhr\n\n\n\n\nIn ( ) gesetzte Angaben der Anschrift und des Geschäftszweiges erfolgen ohne Gewähr.\nVeränderungen\n27.08.2013\n\nAraca Merchandise Germany GmbH, München, Wittelsbacher Platz 1, c/o Kanzlei SKW RAe, 80333 München. Ist nur ein Liquidator bestellt, so vertritt er die Gesellschaft allein. Sind mehrere Liquidatoren bestellt, so wird die Gesellschaft durch zwei Liquidatoren gemeinsam vertreten. Ausgeschieden: Geschäftsführer: Nefzer, Katja, Tübingen, *21.03.1975; Rego, Michael Charles, New York/USA, *20.08.1968; Unger, Frederick Henry, New York/USA, *27.04.1968. Geändert, nun: Liquidator: Rego, Matthew Thomas, New York/USA, *19.02.1970, einzelvertretungsberechtigt. Die Gesellschaft ist aufgelöst.",
        "gesellschafter": null,
        "inhaber": null,
        "name": "Araca Merchandise Germany GmbH",
        "notice_id": "715729",
        "posted_on": "2013-08-28",
        "rechtsform": null,
        "sitz": null,
        "url": "https://www.handelsregisterbekanntmachungen.de/en/skripte/hrb.php?rb_id=715729&land_abk=by"
    },
    "parsed": {
        "flags": [
            {
                "flag": "CompanyClosed",
                "text": "Die\\ Gesellschaft\\ ist\\ aufgel\\öst\\."
            }
        ],
        "officers": [
            {
                "class": "RetiredManagingDirector",
                "payload": {
                    "city": "Tübingen",
                    "dismissed": true,
                    "dob": "1975-03-21",
                    "lastname": "Nefzer",
                    "name": "Katja"
                },
                "text": " Nefzer, Katja, Tübingen, *21.03.1975"
            },
            {
                "class": "RetiredManagingDirector",
                "payload": {
                    "city": "New York/USA",
                    "dismissed": true,
                    "dob": "1968-08-20",
                    "lastname": "Rego",
                    "name": "Michael Charles"
                },
                "text": " Rego, Michael Charles, New York/USA, *20.08.1968"
            },
            {
                "class": "RetiredManagingDirector",
                "payload": {
                    "city": "New York/USA",
                    "dismissed": true,
                    "dob": "1968-04-27",
                    "lastname": "Unger",
                    "name": "Frederick Henry"
                },
                "text": " Unger, Frederick Henry, New York/USA, *27.04.1968."
            },
            {
                "class": "Liquidator",
                "payload": {
                    "city": "New York/USA",
                    "dob": "1970-02-19",
                    "flag": "sole representation",
                    "lastname": ": Rego",
                    "name": "Matthew Thomas"
                },
                "text": ": Rego, Matthew Thomas, New York/USA, *19.02.1970, einzelvertretungsberechtigt."
            }
        ]
    }
}