{
    "orig": {
        "aktenzeichen": "HRB 10647",
        "amtsgericht": "Stendal",
        "event_date": "2014-03-14",
        "event_type": "Veränderungen",
        "federal_state": "st",
        "full_text": "Amtsgericht Stendal Aktenzeichen: HRB 10647 \nBekannt gemacht am: 14.03.2014 11:17 Uhr\n\n\n\n\nDie in () gesetzten Angaben der Geschäftsanschrift und des Geschäftszweiges erfolgen ohne Gewähr.\nVeränderungen\n14.03.2014\n\nHRB 10647:LABYRA Steuerberatungsgesellschaft mbH, Sangerhausen, Am Brandrain 1 a, 06526 Sangerhausen.Ist nur ein Liquidator bestellt, so vertritt er die Gesellschaft allein. Sind mehrere Liquidatoren bestellt, so wird die Gesellschaft durch die Liquidatoren gemeinsam vertreten. Geändert, nun: Liquidator: Kirchner, Andreas, Bad Frankenhausen, *01.09.1976. Die Gesellschaft ist aufgelöst.",
        "gesellschafter": null,
        "inhaber": null,
        "name": "HRB 10647:LABYRA Steuerberatungsgesellschaft mbH",
        "notice_id": "72450",
        "posted_on": "2014-03-14",
        "rechtsform": null,
        "sitz": null,
        "url": "https://www.handelsregisterbekanntmachungen.de/en/skripte/hrb.php?rb_id=72450&land_abk=st"
    },
    "parsed": {
        "flags": [
            {
                "flag": "ignore_for_now",
                "text": "Die\\ Gesellschaft\\ ist\\ aufgel\\öst\\."
            }
        ],
        "officers": [
            {
                "class": "Liquidator",
                "payload": {
                    "city": "Bad Frankenhausen",
                    "dob": "1976-01-09",
                    "lastname": ": Kirchner",
                    "name": "Andreas"
                },
                "text": ": Kirchner, Andreas, Bad Frankenhausen, *01.09.1976."
            }
        ]
    }
}