{
    "orig": {
        "aktenzeichen": "HRB 6884",
        "amtsgericht": "Ingolstadt",
        "event_date": "2013-10-28",
        "event_type": "Neueintragungen",
        "federal_state": "by",
        "full_text": "Amtsgericht Ingolstadt Aktenzeichen: HRB 6884   \nBekannt gemacht am: 04.11.2013 22:00 Uhr\n\n\n\n\nIn ( ) gesetzte Angaben der Anschrift und des Geschäftszweiges erfolgen ohne Gewähr.\nNeueintragungen\n28.10.2013\n\nXERVON Instandhaltung GmbH, Münchsmünster, Wolfswinkel 1, 85126 Münchsmünster. Gesellschaft mit beschränkter Haftung. Gesellschaftsvertrag vom 23.10.2013. Geschäftsanschrift: Wolfswinkel 1, 85126 Münchsmünster. Gegenstand des Unternehmens: Erbringung technischer Dienstleistungen im Zusammenhang mit der Instandhaltung / Instandsetzung insbesondere von Maschinen, Armaturen, Apparaten, Rohrleitungen und elektronischen Geräten; Betreiben von Chemie- und Industrieanlagen bzw. Chemie- und Industrieparks; begleitende Organisation und Ersatzteilversorgung, z.T. eigene Herstellung; Beratung, Planung und Übernahme von Managementfunktionen auf diesen Gebieten. Stammkapital: 25.000,00 EUR. Ist nur ein Geschäftsführer bestellt, so vertritt er die Gesellschaft allein. Sind mehrere Geschäftsführer bestellt, so wird die Gesellschaft durch zwei Geschäftsführer oder durch einen Geschäftsführer gemeinsam mit einem Prokuristen vertreten. Geschäftsführer: Herring, Peter, Wülfrath, *25.09.1973; Kramel, Thomas, Abensberg, *08.02.1968; Dr. Schnell, Marcus, Dortmund, *20.06.1973. Gesamtprokura gemeinsam mit einem Geschäftsführer oder einem anderen Prokuristen: Aßmann, Markus, Kürten, *24.10.1962; Enning, Alexa, Recklinghausen, *20.10.1983; Huber, Christian, Gangkofen, *03.09.1971; Mlecko, Michael, Hattingen, *14.04.1969; Schürken, Dietmar, Dinslaken, *12.11.1964.",
        "gesellschafter": null,
        "inhaber": null,
        "name": "XERVON Instandhaltung GmbH",
        "notice_id": "731510",
        "posted_on": "2013-11-04",
        "rechtsform": null,
        "sitz": null,
        "url": "https://www.handelsregisterbekanntmachungen.de/en/skripte/hrb.php?rb_id=731510&land_abk=by"
    },
    "parsed": {
        "flags": [
            {
                "flag": "Company with limited liability.",
                "text": "Gesellschaft\\ mit\\ beschr\\änkter\\ Haftung\\."
            },
            {
                "flag": "If only one managing director is appointed, he represents the company alone.",
                "text": "Ist\\ nur\\ ein\\ Gesch\\äftsf\\ührer\\ bestellt\\,\\ so\\ vertritt\\ er\\ die\\ Gesellschaft\\ allein\\."
            },
            {
                "flag": "If several managing directors are appointed, then the company is represented by two managing directors or by a managing director together with an authorized officer.",
                "text": "Sind\\ mehrere\\ Gesch\\äftsf\\ührer\\ bestellt\\,\\ so\\ wird\\ die\\ Gesellschaft\\ durch\\ zwei\\ Gesch\\äftsf\\ührer\\ oder\\ durch\\ einen\\ Gesch\\äftsf\\ührer\\ gemeinsam\\ mit\\ einem\\ Prokuristen\\ vertreten\\."
            }
        ],
        "labels": [
            {
                "label": "address",
                "text": " Wolfswinkel 1, 85126 Münchsmünster."
            }
        ],
        "officers": [
            {
                "class": "ManagingDirector",
                "payload": {
                    "city": "Wülfrath",
                    "dob": "1973-09-25",
                    "lastname": "Herring",
                    "name": "Peter"
                },
                "text": " Herring, Peter, Wülfrath, *25.09.1973"
            },
            {
                "class": "ManagingDirector",
                "payload": {
                    "city": "Abensberg",
                    "dob": "1968-02-08",
                    "lastname": "Kramel",
                    "name": "Thomas"
                },
                "text": " Kramel, Thomas, Abensberg, *08.02.1968"
            },
            {
                "class": "ManagingDirector",
                "payload": {
                    "city": "Dortmund",
                    "dob": "1973-06-20",
                    "lastname": "Schnell",
                    "name": "Marcus",
                    "prof_title": "doctor"
                },
                "text": " Doctor Schnell, Marcus, Dortmund, *20.06.1973."
            },
            {
                "class": "CommonProcuration",
                "payload": {
                    "city": "Kürten",
                    "dob": "1962-10-24",
                    "lastname": "Aßmann",
                    "name": "Markus"
                },
                "text": " Aßmann, Markus, Kürten, *24.10.1962"
            },
            {
                "class": "CommonProcuration",
                "payload": {
                    "city": "Recklinghausen",
                    "dob": "1983-10-20",
                    "lastname": "Enning",
                    "name": "Alexa"
                },
                "text": " Enning, Alexa, Recklinghausen, *20.10.1983"
            },
            {
                "class": "CommonProcuration",
                "payload": {
                    "city": "Gangkofen",
                    "dob": "1971-09-03",
                    "lastname": "Huber",
                    "name": "Christian"
                },
                "text": " Huber, Christian, Gangkofen, *03.09.1971"
            },
            {
                "class": "CommonProcuration",
                "payload": {
                    "city": "Hattingen",
                    "dob": "1969-04-14",
                    "lastname": "Mlecko",
                    "name": "Michael"
                },
                "text": " Mlecko, Michael, Hattingen, *14.04.1969"
            },
            {
                "class": "CommonProcuration",
                "payload": {
                    "city": "Dinslaken",
                    "dob": "1964-11-12",
                    "lastname": "Schürken",
                    "name": "Dietmar"
                },
                "text": " Schürken, Dietmar, Dinslaken, *12.11.1964."
            }
        ]
    }
}