{
    "orig": {
        "aktenzeichen": "HRB 71227",
        "amtsgericht": "Köln",
        "event_date": "2011-11-18",
        "event_type": "Veränderungen",
        "federal_state": "nw",
        "full_text": "Amtsgericht Köln Aktenzeichen: HRB 71227   \nBekannt gemacht am: 21.11.2011 22:00 Uhr\n\n\n\n\nIn () gesetzte Angaben der Anschrift und des Geschäftszweiges erfolgen ohne Gewähr.\nVeränderungen\n18.11.2011\n\nAKTIVA Beratung im Gesundheitswesen GmbH, Köln, Eupener Str. 70, 50933 Köln. Die Gesellschafterversammlung vom 08.11.2011 hat beschlossen, die Firma und entsprechend den Gesellschaftsvertrag in § 1 Abs. 1 zu ändern. Ferner wurde der Gesellschaftsvertrag in § 4 (Stammkapital), § 7 (Einziehung von Geschäftsanteilen), § 8 (Geschäftsführung und Vertretung) und § 12 (Gewinnverwendung) geändert. Neue Firma: aktiva Beratung im Gesundheitswesen GmbH. Gesamtprokura gemeinsam mit einem Geschäftsführer: Marth, Sven, Neukirchen-Vluyn, *21.01.1978; Zimolong, Agnes, Köln, *25.04.1976.",
        "gesellschafter": null,
        "inhaber": null,
        "name": "AKTIVA Beratung im Gesundheitswesen GmbH",
        "notice_id": "734041",
        "posted_on": "2011-11-21",
        "rechtsform": null,
        "sitz": null,
        "url": "https://www.handelsregisterbekanntmachungen.de/en/skripte/hrb.php?rb_id=734041&land_abk=nw"
    },
    "parsed": {
        "officers": [
            {
                "class": "ManagingDirector",
                "payload": {
                    "city": "Neukirchen-Vluyn",
                    "dob": "1978-01-21",
                    "lastname": "Marth",
                    "name": "Sven"
                },
                "text": " Marth, Sven, Neukirchen-Vluyn, *21.01.1978"
            },
            {
                "class": "ManagingDirector",
                "payload": {
                    "city": "Köln",
                    "dob": "1976-04-25",
                    "lastname": "Zimolong",
                    "name": "Agnes"
                },
                "text": " Zimolong, Agnes, Köln, *25.04.1976."
            }
        ]
    }
}