{
    "orig": {
        "aktenzeichen": "HRB 10773",
        "amtsgericht": "Kleve",
        "event_date": "2011-11-21",
        "event_type": "Veränderungen",
        "federal_state": "nw",
        "full_text": "Amtsgericht Kleve Aktenzeichen: HRB 10773   \nBekannt gemacht am: 25.11.2011 12:00 Uhr\n\n\n\n\nIn () gesetzte Angaben der Anschrift und des Geschäftszweiges erfolgen ohne Gewähr.\nVeränderungen\n21.11.2011\n\nID Immobilie Weeze Beteiligungsgesellschaft Uno UG (haftungsbeschränkt), Weeze, Flughafen-Ring 293, 47652 Weeze. Nicht mehr Geschäftsführer: Bergers, Norbert Helmut, Weeze, *02.03.1974; Bergers, Norbert, Weeze, *02.03.1974; van Wickeren, Georg, Weeze, *29.03.1968. Bestellt als Geschäftsführer: Koppers, Heinrich Wilhelm - gen. Heinz -, Weeze, *10.12.1949; Koppers, Johanna, Weeze, *10.12.1952, jeweils einzelvertretungsberechtigt mit der Befugnis im Namen der Gesellschaft mit sich im eigenen Namen oder als Vertreter eines Dritten Rechtsgeschäfte abzuschließen.",
        "gesellschafter": null,
        "inhaber": null,
        "name": "ID Immobilie Weeze Beteiligungsgesellschaft Uno UG (haftungsbeschränkt)",
        "notice_id": "735098",
        "posted_on": "2011-11-25",
        "rechtsform": null,
        "sitz": null,
        "url": "https://www.handelsregisterbekanntmachungen.de/en/skripte/hrb.php?rb_id=735098&land_abk=nw"
    },
    "parsed": {
        "officers": [
            {
                "class": "DismissedManagingDirector",
                "payload": {
                    "city": "Weeze",
                    "dismissed": true,
                    "dob": "1974-02-03",
                    "lastname": "Bergers",
                    "name": "Norbert Helmut"
                },
                "text": " Bergers, Norbert Helmut, Weeze, *02.03.1974"
            },
            {
                "class": "AppointedManagingDirector",
                "payload": {
                    "lastname": "Koppers",
                    "name": "Heinrich Wilhelm - gen"
                },
                "text": " Koppers, Heinrich Wilhelm - gen."
            }
        ]
    }
}