{
    "orig": {
        "aktenzeichen": "HRB 10966",
        "amtsgericht": "Gelsenkirchen",
        "event_date": "2011-11-25",
        "event_type": "Veränderungen",
        "federal_state": "nw",
        "full_text": "Amtsgericht Gelsenkirchen Aktenzeichen: HRB 10966   \nBekannt gemacht am: 29.11.2011 12:00 Uhr\n\n\n\n\nIn () gesetzte Angaben der Anschrift und des Geschäftszweiges erfolgen ohne Gewähr.\nVeränderungen\n25.11.2011\n\n6000media UG (haftungsbeschränkt), Dorsten, Halterner Straße 105, 46284 Dorsten. Nicht mehr Geschäftsführer: Paschold, Matthias, Bocholt, *31.08.1982. Bestellt als Geschäftsführer: Bellina, Michael, Dorsten, *14.06.1971; Heeger, Hendrik, Dorsten, *15.06.1981, jeweils mit der Befugnis im Namen der Gesellschaft mit sich im eigenen Namen oder als Vertreter eines Dritten Rechtsgeschäfte abzuschließen.",
        "gesellschafter": null,
        "inhaber": null,
        "name": "6000media UG (haftungsbeschränkt)",
        "notice_id": "736584",
        "posted_on": "2011-11-29",
        "rechtsform": null,
        "sitz": null,
        "url": "https://www.handelsregisterbekanntmachungen.de/en/skripte/hrb.php?rb_id=736584&land_abk=nw"
    },
    "parsed": {
        "officers": [
            {
                "class": "DismissedManagingDirector",
                "payload": {
                    "city": "Bocholt",
                    "dismissed": true,
                    "dob": "1982-08-31",
                    "lastname": "Paschold",
                    "name": "Matthias"
                },
                "text": " Paschold, Matthias, Bocholt, *31.08.1982."
            },
            {
                "class": "AppointedManagingDirector",
                "payload": {
                    "city": "Dorsten",
                    "dob": "1971-06-14",
                    "lastname": "Bellina",
                    "name": "Michael"
                },
                "text": " Bellina, Michael, Dorsten, *14.06.1971"
            }
        ]
    }
}