{
    "orig": {
        "aktenzeichen": "HRA 9779",
        "amtsgericht": "Kempten",
        "event_date": "2013-12-02",
        "event_type": "Neueintragungen",
        "federal_state": "by",
        "full_text": "Amtsgericht Kempten  Aktenzeichen: HRA 9779   \nBekannt gemacht am: 17.12.2013 12:00 Uhr\n\n\n\n\nIn ( ) gesetzte Angaben der Anschrift und des Geschäftszweiges erfolgen ohne Gewähr.\nNeueintragungen\n02.12.2013\n\nBKM Gebäudereinigung OHG, Kempten (Allgäu), Reinhartser Straße 20-22, 87437 Kempten. (der Handwerksbetrieb einer Gebäudereinigung). Offene Handelsgesellschaft. Geschäftsanschrift: Reinhartser Straße 20-22, 87437 Kempten. Jeder persönlich haftende Gesellschafter vertritt einzeln. Persönlich haftender Gesellschafter: Belaev, Andreas, Kempten (Allgäu), *14.05.1985; Moor, Eugen, Kempten (Allgäu), *20.11.1979.",
        "gesellschafter": null,
        "inhaber": null,
        "name": "BKM Gebäudereinigung OHG",
        "notice_id": "742174",
        "posted_on": "2013-12-17",
        "rechtsform": null,
        "sitz": null,
        "url": "https://www.handelsregisterbekanntmachungen.de/en/skripte/hrb.php?rb_id=742174&land_abk=by"
    },
    "parsed": {
        "labels": [
            {
                "label": "address",
                "text": " Reinhartser Straße 20-22, 87437 Kempten."
            }
        ],
        "officers": [
            {
                "class": "PersonalPartner",
                "payload": {
                    "city": "Kempten (Allgäu)",
                    "dob": "1985-05-14",
                    "lastname": "Belaev",
                    "name": "Andreas"
                },
                "text": " Belaev, Andreas, Kempten (Allgäu), *14.05.1985"
            },
            {
                "class": "PersonalPartner",
                "payload": {
                    "city": "Kempten (Allgäu)",
                    "dob": "1979-11-20",
                    "lastname": "Moor",
                    "name": "Eugen"
                },
                "text": " Moor, Eugen, Kempten (Allgäu), *20.11.1979."
            }
        ]
    }
}