{
    "orig": {
        "aktenzeichen": "GnR 30",
        "amtsgericht": "Schwerin",
        "event_date": "2017-03-02",
        "event_type": "Veränderungen",
        "federal_state": "mv",
        "full_text": "Amtsgericht Schwerin Aktenzeichen: GnR 30 \nBekannt gemacht am: 02.03.2017 22:01 Uhr\n\n\n\n\nIn ( ) gesetzte Angaben der Anschrift und des Geschäftszweiges erfolgen ohne Gewähr:\nVeränderungen\n02.03.2017\n\nGnR 30: Milch - Fleisch - Marktfrucht Agrargenossenschaft e.G., Neu Kaliß, Ernst-Thälmann-Str. 3, 19294 Neu Kaliß. Personenbezogene Daten geändert, nun: Vorstandsvorsitzender: Grandt, Norbert, *26.02.1963, mit der Befugnis, im Namen der Genossenschaft mit sich als Vertreter eines Dritten Rechtsgeschäfte abzuschließen. Prokura erloschen: Schneider, Helga, Heiddorf. Gesamtprokura gemeinsam mit einem Vorstandsmitglied mit der Ermächtigung zur Veräußerung und Belastung von Grundstücken: Mösinger, Jannika, Neu Kaliß OT Heiddorf, *12.12.1987.",
        "gesellschafter": null,
        "inhaber": null,
        "name": "GnR 30: Milch - Fleisch - Marktfrucht Agrargenossenschaft e.G.",
        "notice_id": "74621",
        "posted_on": "2017-03-02",
        "rechtsform": null,
        "sitz": null,
        "url": "https://www.handelsregisterbekanntmachungen.de/en/skripte/hrb.php?rb_id=74621&land_abk=mv"
    },
    "parsed": {
        "officers": [
            {
                "class": "ProcurationCancelled",
                "payload": {
                    "city": "Heiddorf",
                    "dismissed": true,
                    "lastname": "Schneider",
                    "name": "Helga"
                },
                "text": " Schneider, Helga, Heiddorf."
            }
        ]
    }
}