{
    "orig": {
        "aktenzeichen": "HRB 371634",
        "amtsgericht": "Freiburg",
        "event_date": "2008-05-19",
        "event_type": "Löschungen",
        "federal_state": "bw",
        "full_text": "Amtsgericht Freiburg Aktenzeichen: HRB 371634 \nBekannt gemacht am: 26.05.2008 12:00 Uhr\n\n\n\n\nDie in () gesetzten Angaben der Geschäftsanschrift und des Unternehmensgegenstandes erfolgen ohne Gewähr.\nLöschungen\n19.05.2008\n\nSteffen LeasFinanz GmbH, Kehl (Hebelstr. 8, 77694 Kehl). Allgemeine Vertretungsregelung geändert; nun: Ist nur ein Liquidator bestellt, vertritt er allein. Sind mehrere Liquidatoren bestellt, vertreten sie gemeinsam. Nicht mehr Geschäftsführer: Steffen, Udo, Odelshofen, *26.12.1947. Bestellt als Liquidator: Steffen, Udo Rolf Alfons, Kehl, *26.12.1947. Die Gesellschaft ist aufgelöst. Eine Liquidation findet nicht statt. Die Gesellschaft ist gelöscht. Das Registerblatt ist geschlossen.",
        "gesellschafter": null,
        "inhaber": null,
        "name": "Steffen LeasFinanz GmbH",
        "notice_id": "75027",
        "posted_on": "2008-05-26",
        "rechtsform": null,
        "sitz": null,
        "url": "https://www.handelsregisterbekanntmachungen.de/en/skripte/hrb.php?rb_id=75027&land_abk=bw"
    },
    "parsed": {
        "flags": [
            {
                "flag": "CompanyClosed",
                "text": "Die\\ Gesellschaft\\ ist\\ aufgel\\öst\\."
            }
        ],
        "officers": [
            {
                "class": "DismissedManagingDirector",
                "payload": {
                    "city": "Odelshofen",
                    "dismissed": true,
                    "dob": "1947-12-26",
                    "lastname": "Steffen",
                    "name": "Udo"
                },
                "text": " Steffen, Udo, Odelshofen, *26.12.1947."
            },
            {
                "class": "Liquidator",
                "payload": {
                    "city": "Kehl",
                    "dob": "1947-12-26",
                    "lastname": "Steffen",
                    "name": "Udo Rolf Alfons"
                },
                "text": " Steffen, Udo Rolf Alfons, Kehl, *26.12.1947."
            }
        ]
    }
}