{
    "orig": {
        "aktenzeichen": "HRB 11910",
        "amtsgericht": "Stendal",
        "event_date": "2014-07-29",
        "event_type": "Veränderungen",
        "federal_state": "st",
        "full_text": "Amtsgericht Stendal Aktenzeichen: HRB 11910 \nBekannt gemacht am: 29.07.2014 09:02 Uhr\n\n\n\n\nDie in () gesetzten Angaben der Geschäftsanschrift und des Geschäftszweiges erfolgen ohne Gewähr.\nVeränderungen\n29.07.2014\n\nHRB 11910:Belie GmbH Berlin Liegenschaften, Huy, Am Schloßteich 1a, 38838 Huy-Aderstedt.Von Amts wegen geändert: Die Gesellschaft wird durch den/die Liquidator/en vertreten. Von Amts wegen geändert: Liquidator: Lauer, Georg Eugen, Berlin, *30.05.1961. Über das Vermögen der Gesellschaft ist durch Beschluss des Amtsgerichts Magdeburg vom 04.02.2011 (Az.: 340 IN 845/10 (351)) das Insolvenzverfahren eröffnet worden. Die Gesellschaft ist dadurch aufgelöst. Von Amts wegen eingetragen nach § 65 GmbHG. Das Insolvenzverfahren ist durch Beschluss des Amtsgerichts Magdeburg vom 26.03.2014 (Az.: 340 IN 845/10 (351)) nach Schlussverteilung aufgehoben worden. Allgemeine Vertretungsregelung und besondere Vertretungsbefugnis von Amts wegen gem. § 384 Abs. 2 FamFG als unrichtig gekennzeichnet.",
        "gesellschafter": null,
        "inhaber": null,
        "name": "HRB 11910:Belie GmbH Berlin Liegenschaften",
        "notice_id": "75571",
        "posted_on": "2014-07-29",
        "rechtsform": null,
        "sitz": null,
        "url": "https://www.handelsregisterbekanntmachungen.de/en/skripte/hrb.php?rb_id=75571&land_abk=st"
    },
    "parsed": {
        "officers": [
            {
                "class": "Liquidator",
                "payload": {
                    "city": "Berlin",
                    "dob": "1961-05-30",
                    "lastname": "Lauer",
                    "name": "Georg Eugen"
                },
                "text": " Lauer , Georg Eugen , Berlin , * 30.05.1961 ."
            }
        ]
    }
}