{
    "orig": {
        "aktenzeichen": "HRA 18231",
        "amtsgericht": "Düsseldorf",
        "event_date": "2005-10-26",
        "event_type": "Veränderungen",
        "federal_state": "nw",
        "full_text": "Amtsgericht Düsseldorf Aktenzeichen: HRA 18231 \nBekannt gemacht am: 02.11.2005 09:38 Uhr\n\n\n\n\nDie in () gesetzten Angaben der Geschäftsanschrift und des Geschäftszweiges erfolgen ohne Gewähr.\nVeränderungen\n26.10.2005\n\nBS Bau- & Sanierungs oHG, Düsseldorf (Witzelstr. 150, 40225 Düsseldorf). Eingetreten als Persönlich haftender Gesellschafter: Bartusiak, Marek, Düsseldorf, *06.05.1961; Chlistun, Mariusz Krzystof, Düsseldorf, *02.03.1976; Puch, Kazimierz, Düsseldorf, *27.02.1953; Stefanek, Ryszard, Düsseldorf, *18.05.1952. Ausgeschieden als Persönlich haftender Gesellschafter: Schlamm, Karl, Berlin, *15.04.1954.",
        "gesellschafter": null,
        "inhaber": null,
        "name": "BS Bau- & Sanierungs oHG",
        "notice_id": "76892",
        "posted_on": "2005-11-02",
        "rechtsform": null,
        "sitz": null,
        "url": "https://www.handelsregisterbekanntmachungen.de/en/skripte/hrb.php?rb_id=76892&land_abk=nw"
    },
    "parsed": {
        "officers": [
            {
                "class": "PersonalPartner",
                "payload": {
                    "city": "Düsseldorf",
                    "dob": "1961-05-06",
                    "lastname": "Bartusiak",
                    "name": "Marek"
                },
                "text": " Bartusiak, Marek, Düsseldorf, *06.05.1961"
            },
            {
                "class": "PersonalPartner",
                "payload": {
                    "city": "Düsseldorf",
                    "dob": "1976-03-02",
                    "lastname": "Chlistun",
                    "name": "Mariusz Krzystof"
                },
                "text": " Chlistun, Mariusz Krzystof, Düsseldorf, *02.03.1976"
            },
            {
                "class": "PersonalPartner",
                "payload": {
                    "city": "Düsseldorf",
                    "dob": "1953-02-27",
                    "lastname": "Puch",
                    "name": "Kazimierz"
                },
                "text": " Puch, Kazimierz, Düsseldorf, *27.02.1953"
            },
            {
                "class": "PersonalPartner",
                "payload": {
                    "city": "Düsseldorf",
                    "dob": "1952-05-18",
                    "lastname": "Stefanek",
                    "name": "Ryszard"
                },
                "text": " Stefanek, Ryszard, Düsseldorf, *18.05.1952."
            },
            {
                "class": "RetiredPersonalPartner",
                "payload": {
                    "city": "Berlin",
                    "dismissed": true,
                    "dob": "1954-04-15",
                    "lastname": "Schlamm",
                    "name": "Karl"
                },
                "text": " Schlamm, Karl, Berlin, *15.04.1954."
            }
        ]
    }
}