{
    "orig": {
        "aktenzeichen": "HRA 20034 B",
        "amtsgericht": "Charlottenburg (Berlin)",
        "event_date": "2006-01-31",
        "event_type": "Veränderungen",
        "federal_state": "be",
        "full_text": "Amtsgericht Charlottenburg (Berlin) Aktenzeichen: HRA 20034 B  \nBekannt gemacht am: 02.02.2006 07:51 Uhr\n\n\n\n\nFür die Angaben in (), die den Unternehmensgegenstand und die Anschrift betreffen, keine Gewähr. In das Handelsregister ist folgendes eingetragen worden.\nVeränderungen\n31.01.2006\n\nJK optik, Jonck & Wilhelm OHG, Berlin(Senftenberger Ring 15, 13439  Berlin). Firma: JK Optik, Jörg Wilhelm e.K. Inhaber: Nicht mehr persönlich haftender Gesellschafter:; 1. Jonck, Ekhard; Nicht mehr persönlich haftender Gesellschafter:; 2. Wilhelm, Jörg; Inhaber:; Wilhelm, Jörg, *15.03.1945, Bergfelde Rechtsform: Die Firma ist geändert.; nunmehr: Einzelunternehmen.",
        "gesellschafter": null,
        "inhaber": null,
        "name": "JK optik",
        "notice_id": "7719",
        "posted_on": "2006-02-02",
        "rechtsform": null,
        "sitz": null,
        "url": "https://www.handelsregisterbekanntmachungen.de/en/skripte/hrb.php?rb_id=7719&land_abk=be"
    },
    "parsed": {
        "officers": [
            {
                "class": "PersonalPartner",
                "payload": {
                    "lastname": "Jonck",
                    "name": "Ekhard"
                },
                "text": " Jonck, Ekhard"
            },
            {
                "class": "PersonalPartner",
                "payload": {
                    "lastname": "Wilhelm",
                    "name": "Jörg"
                },
                "text": " Wilhelm, Jörg"
            },
            {
                "class": "Owner",
                "payload": {
                    "city": "Bergfelde Rechtsform: Die Firma ist geändert",
                    "dob": "1945-03-15",
                    "lastname": "Wilhelm",
                    "name": "Jörg"
                },
                "text": " Wilhelm, Jörg, *15.03.1945, Bergfelde Rechtsform: Die Firma ist geändert."
            }
        ]
    }
}