{
    "orig": {
        "aktenzeichen": "HRB 115509 B",
        "amtsgericht": "Charlottenburg (Berlin)",
        "event_date": "2008-09-23",
        "event_type": "Neueintragungen",
        "federal_state": "be",
        "full_text": "Amtsgericht Charlottenburg (Berlin) Aktenzeichen: HRB 115509 B  \nBekannt gemacht am: 25.09.2008 12:00 Uhr\n\n\n\n\nFür die Angaben in (), die den Unternehmensgegenstand und die Anschrift betreffen, keine Gewähr. In das Handelsregister ist folgendes eingetragen worden.\nNeueintragungen\n23.09.2008\n\nHRS Europe Limited, Berlin(Caspar-Theyß-Str. 34, 14193  Berlin). Firma: HRS Europe Limited Sitz / Zweigniederlassung: Berlin; Zweigniederlassung der unter der gleichen Firma in Birmingham/Großbritannien bestehenden Hauptniederlassung (Companies House Cardiff, Company No. 6632923). Gegenstand: Gegenstand der Zweigniederlassung: Die unabhängige Beratung von niedergelassenen Ärzten und Krankenhäusern zur Optimierung von Arbeitsabläufen und der Sicherstellung einer bestmöglichen Patientenversorgung, sowie die Beratung zur Optimierung der Außendarstellung in allen hierfür notwendigen Bereichen, die Beratung hinsichtlich der optimalen Verwendung von Medizintechnik, der Personalberatung, der Prozessanalyse und -optimierung, sowie die Vorbereitung von kleinen und mittelständischen Unternehmen (KMU) auf internationale Kapitalmärkte sowie alle damit in Verbindung stehenden Tätigkeiten. Stamm- bzw. Grundkapital: 100,00 GBP Vertretungsregelung: Ist ein Geschäftsführer (director) bestellt, so vertritt er die Gesellschaft allein. Sind mehrere Geschäftsführer (directors) bestellt, wird die Gesellschaft durch sämtliche Geschäftsführer (directors) gemeinschaftlich vertreten. Director:; 1. Kieselbach, Andreas Alfred, *15.10.1974, Berlin Rechtsform: Gesellschaft britischen Rechts mit beschränkter Haftung, Rechtsbereich England und Wales (private company limited by shares), gegründet am 30.06.2008..",
        "gesellschafter": null,
        "inhaber": null,
        "name": "HRS Europe Limited",
        "notice_id": "77245",
        "posted_on": "2008-09-25",
        "rechtsform": null,
        "sitz": null,
        "url": "https://www.handelsregisterbekanntmachungen.de/en/skripte/hrb.php?rb_id=77245&land_abk=be"
    },
    "parsed": {
        "labels": [
            {
                "label": "company",
                "text": " Berlin"
            }
        ],
        "officers": [
            {
                "class": "Person",
                "payload": {
                    "city": "Berlin Rechtsform: Gesellschaft britischen Rechts mit beschränkter Haftung",
                    "dob": "1974-10-15",
                    "flag": "Rechtsbereich England und Wales (private company limited by shares) gegründet am 30.06.2008",
                    "lastname": "Kieselbach",
                    "name": "Andreas Alfred",
                    "ref": 1
                },
                "text": "1) Kieselbach, Andreas Alfred, *15.10.1974, Berlin Rechtsform: Gesellschaft britischen Rechts mit beschränkter Haftung, Rechtsbereich England und Wales (private company limited by shares), gegründet am 30.06.2008.."
            }
        ]
    }
}