{
    "orig": {
        "aktenzeichen": "HRB 508813",
        "amtsgericht": "Jena",
        "event_date": "2014-05-27",
        "event_type": "Löschungen",
        "federal_state": "th",
        "full_text": "Amtsgericht Jena Aktenzeichen: HRB 508813 \nBekannt gemacht am: 27.05.2014 12:30 Uhr\n\n\n\n\nDie in () gesetzten Angaben der Geschäftsanschrift und des Unternehmensgegenstandes erfolgen ohne Gewähr.\nLöschungen\n27.05.2014\n\nHRB 508813:MG Workflow UG (haftungsbeschränkt), Eisenach, Große Wiegardt 7a, 99817 Eisenach.Ist nur ein Liquidator bestellt, so vertritt er die Gesellschaft allein. Sind mehrere Liquidatoren bestellt, so wird die Gesellschaft durch die Liquidatoren gemeinsam vertreten. Geändert, nun: Liquidator: Györe, Stefan, Eisenach, *14.08.1979. Die Gesellschaft ist aufgelöst. Die Firma ist erloschen.",
        "gesellschafter": null,
        "inhaber": null,
        "name": "HRB 508813:MG Workflow UG (haftungsbeschränkt)",
        "notice_id": "77764",
        "posted_on": "2014-05-27",
        "rechtsform": null,
        "sitz": null,
        "url": "https://www.handelsregisterbekanntmachungen.de/en/skripte/hrb.php?rb_id=77764&land_abk=th"
    },
    "parsed": {
        "flags": [
            {
                "flag": "CompanyClosed",
                "text": "Die\\ Gesellschaft\\ ist\\ aufgel\\öst\\."
            }
        ],
        "officers": [
            {
                "class": "Liquidator",
                "payload": {
                    "city": "Eisenach",
                    "dob": "1979-08-14",
                    "lastname": ": Györe",
                    "name": "Stefan"
                },
                "text": ": Györe, Stefan, Eisenach, *14.08.1979."
            }
        ]
    }
}