{
    "orig": {
        "aktenzeichen": "GnR 315",
        "amtsgericht": "Stralsund",
        "event_date": "2017-11-09",
        "event_type": "Veränderungen",
        "federal_state": "mv",
        "full_text": "Amtsgericht Stralsund Aktenzeichen: GnR 315 \nBekannt gemacht am: 09.11.2017 22:00 Uhr\n\n\n\n\nIn ( ) gesetzte Angaben der Anschrift und des Geschäftszweiges erfolgen ohne Gewähr:\nVeränderungen\n09.11.2017\n\nGnR 315: Inselwerke eG, Usedom (Swinemünder Straße 55, 17406 Usedom). Die Generalversammlung vom 13.05.2017 hat eine Änderung der Satzung in der Präambel und in § 1 und mit ihr die Änderung des Unternehmensgegenstandes beschlossen. Gegenstand geändert, nun: Förderung von Erneuerbarer Energie und Energieeffizienz, insbesondere durch a) Entwicklung, Planung und Realisierung von Projekten zur dezentralen Erzeugung regenerativer Energien, Energieversorgung und Energieeffizienz, b) Beschaffung, Erzeugung und den Verkauf von Energie c) Unterhaltung von entsprechenden Betriebsanlagen d) Beratung und Unterstützung bei der Erschließung der Potentiale erneuerbarer Energiesysteme vor Ort, einschließlich Nutzbarkeitsanalyse, e) Information der Mitglieder über Entwicklungen im Bereich der erneuerbaren Energien. Bestellt als Vorstand: Haney, Madlen, Stolpe auf Usedom, *25.08.1983. Wohnort geändert, nun: Vorstand: Haney, Frank, Stolpe auf Usedom, *03.04.1983.",
        "gesellschafter": null,
        "inhaber": null,
        "name": "GnR 315: Inselwerke eG",
        "notice_id": "79704",
        "posted_on": "2017-11-09",
        "rechtsform": null,
        "sitz": null,
        "url": "https://www.handelsregisterbekanntmachungen.de/en/skripte/hrb.php?rb_id=79704&land_abk=mv"
    },
    "parsed": {
        "officers": [
            {
                "class": "AppointedManagingDirector",
                "payload": {
                    "city": "Stolpe auf Usedom",
                    "dob": "1983-08-25",
                    "lastname": "Haney",
                    "name": "Madlen"
                },
                "text": ": Haney, Madlen, Stolpe auf Usedom, *25.08.1983."
            }
        ]
    }
}