{
    "orig": {
        "aktenzeichen": "HRB 3157",
        "amtsgericht": "Stralsund",
        "event_date": "2018-03-08",
        "event_type": "Veränderungen",
        "federal_state": "mv",
        "full_text": "Amtsgericht Stralsund Aktenzeichen: HRB 3157 \nBekannt gemacht am: 08.03.2018 22:00 Uhr\n\n\n\n\nIn ( ) gesetzte Angaben der Anschrift und des Geschäftszweiges erfolgen ohne Gewähr:\nVeränderungen\n08.03.2018\n\nHRB 3157: HEIZUNGS-SERVICE Peter Kapalczynski GmbH, Stralsund, Amselweg 1, 18437 Stralsund. Die Gesellschaft ist durch Gesellschafterbeschluss zum 28.02.2018 aufgelöst. Allgemeine Vertretungsregelung geändert, nun: Ist nur ein Liquidator bestellt, so vertritt er die Gesellschaft allein. Sind mehrere Liquidatoren bestellt, so wird die Gesellschaft durch die Liquidatoren gemeinsam vertreten. Geändert, nun: Liquidator: Kapalczynski, Peter, Stralsund, *24.05.1953. Nicht mehr Geschäftsführer: Kapalczynski, Kirsten, Stralsund, *21.12.1962.",
        "gesellschafter": null,
        "inhaber": null,
        "name": "HRB 3157: HEIZUNGS-SERVICE Peter Kapalczynski GmbH",
        "notice_id": "82562",
        "posted_on": "2018-03-08",
        "rechtsform": null,
        "sitz": null,
        "url": "https://www.handelsregisterbekanntmachungen.de/en/skripte/hrb.php?rb_id=82562&land_abk=mv"
    },
    "parsed": {
        "officers": [
            {
                "class": "Liquidator",
                "payload": {
                    "city": "Stralsund",
                    "dob": "1953-05-24",
                    "lastname": ": Kapalczynski",
                    "name": "Peter"
                },
                "text": ": Kapalczynski, Peter, Stralsund, *24.05.1953."
            },
            {
                "class": "DismissedManagingDirector",
                "payload": {
                    "city": "Stralsund",
                    "dismissed": true,
                    "dob": "1962-12-21",
                    "lastname": "Kapalczynski",
                    "name": "Kirsten"
                },
                "text": " Kapalczynski, Kirsten, Stralsund, *21.12.1962."
            }
        ]
    }
}