{
    "orig": {
        "aktenzeichen": "HRB 502765",
        "amtsgericht": "Jena",
        "event_date": "2015-04-30",
        "event_type": "Veränderungen",
        "federal_state": "th",
        "full_text": "Amtsgericht Jena Aktenzeichen: HRB 502765 \nBekannt gemacht am: 30.04.2015 12:30 Uhr\n\n\n\n\nDie in () gesetzten Angaben der Geschäftsanschrift und des Unternehmensgegenstandes erfolgen ohne Gewähr.\nVeränderungen\n30.04.2015\n\nHRB 502765:IHI Charging Systems International Germany GmbH, Amt Wachsenburg, Wolff-Knippenberg-Strasse 2, 99334 Amt Wachsenburg OT Ichtershausen.Ausgeschieden: Geschäftsführer: Kashimura, Tatsuya, Erfurt, *22.01.1964. Bestellt: Geschäftsführer: Akase, Kenjiro, Heidelberg, *12.11.1961. Gesamtprokura gemeinsam mit einem Geschäftsführer oder einem anderen Prokuristen: Saitoh, Michio, Heidelberg, *06.09.1948. Prokura geändert: Gesamtprokura gemeinsam mit einem Geschäftsführer oder einem anderen Prokuristen: Matsubara, Hidetsugu, Heidelberg, *14.07.1958.",
        "gesellschafter": null,
        "inhaber": null,
        "name": "HRB 502765:IHI Charging Systems International Germany GmbH",
        "notice_id": "86268",
        "posted_on": "2015-04-30",
        "rechtsform": null,
        "sitz": null,
        "url": "https://www.handelsregisterbekanntmachungen.de/en/skripte/hrb.php?rb_id=86268&land_abk=th"
    },
    "parsed": {
        "officers": [
            {
                "class": "RetiredManagingDirector",
                "payload": {
                    "city": "Erfurt",
                    "dismissed": true,
                    "dob": "1964-01-22",
                    "lastname": "Kashimura",
                    "name": "Tatsuya"
                },
                "text": " Kashimura, Tatsuya, Erfurt, *22.01.1964."
            },
            {
                "class": "AppointedManagingDirector",
                "payload": {
                    "city": "Heidelberg",
                    "dob": "1961-12-11",
                    "lastname": "Akase",
                    "name": "Kenjiro"
                },
                "text": " Akase, Kenjiro, Heidelberg, *12.11.1961."
            },
            {
                "class": "CommonProcuration",
                "payload": {
                    "city": "Heidelberg",
                    "dob": "1948-06-09",
                    "lastname": "Saitoh",
                    "name": "Michio"
                },
                "text": " Saitoh, Michio, Heidelberg, *06.09.1948."
            },
            {
                "class": "NewProcuration",
                "payload": {
                    "city": "Heidelberg",
                    "dob": "1958-07-14",
                    "lastname": "Matsubara",
                    "name": "Hidetsugu"
                },
                "text": " Matsubara, Hidetsugu, Heidelberg, *14.07.1958."
            }
        ]
    }
}