{
    "orig": {
        "aktenzeichen": "HRB 9044 KI",
        "amtsgericht": "Kiel",
        "event_date": "2011-01-18",
        "event_type": "Veränderungen",
        "federal_state": "sh",
        "full_text": "Amtsgericht Kiel Aktenzeichen: HRB 9044 KI \nBekannt gemacht am: 20.01.2011 12:00 Uhr\n\n\n\n\nIn () gesetzte Angaben der Anschrift und des Geschäftszweiges erfolgen ohne Gewähr.\nVeränderungen\n18.01.2011\n\nMarangoni Industrial Tyres GmbH, Henstedt-Ulzburg, Immenhacken 5, 24558 Henstedt-Ulzburg. Vertretungsregelung: Ist ein Liquidator bestellt, so vertritt er die Gesellschaft allein. Sind mehrere Liquidatoren bestellt, wird die Gesellschaft gemeinschaftlich durch zwei Liquidatoren vertreten. Einzelvertretungsbefugnis und Befreiung von den Beschränkungen des § 181 BGB kann erteilt werden. Vorstand: Änderung zu Nr. 2:; Liquidator:; Schlingmann, Wolfgang Klaus, *01.05.1948, Bremen Rechtsverhaeltnis: Durch Beschluss der Gesellschafterversammlung vom 23.11.2010 ist die Gesellschaft aufgelöst..",
        "gesellschafter": null,
        "inhaber": null,
        "name": "Marangoni Industrial Tyres GmbH",
        "notice_id": "87113",
        "posted_on": "2011-01-20",
        "rechtsform": null,
        "sitz": null,
        "url": "https://www.handelsregisterbekanntmachungen.de/en/skripte/hrb.php?rb_id=87113&land_abk=sh"
    },
    "parsed": {
        "officers": [
            {
                "class": "Liquidator",
                "payload": {
                    "city": "Bremen Rechtsverhaeltnis: Durch Beschluss der Gesellschafterversammlung vom 23.11.2010 ist die Gesellschaft aufgelöst",
                    "dob": "1948-05-01",
                    "lastname": "Schlingmann",
                    "name": "Wolfgang Klaus"
                },
                "text": " Schlingmann, Wolfgang Klaus, *01.05.1948, Bremen Rechtsverhaeltnis: Durch Beschluss der Gesellschafterversammlung vom 23.11.2010 ist die Gesellschaft aufgelöst.."
            }
        ]
    }
}