{
    "orig": {
        "aktenzeichen": "HRB 41953",
        "amtsgericht": "Frankfurt am Main",
        "event_date": "2008-05-28",
        "event_type": "Veränderungen",
        "federal_state": "he",
        "full_text": "Amtsgericht Frankfurt am Main Aktenzeichen: HRB 41953 \nBekannt gemacht am: 02.06.2008 12:00 Uhr\n\n\n\n\nVeröffentlichungen des Amtsgerichts Frankfurt am Main\r\r\rDie in () gesetzten Angaben der Geschäftsanschrift und des Geschäftszweiges erfolgen ohne Gewähr.\nVeränderungen\n28.05.2008\n\nH & H Unternehmens- und Personalberatung GmbH, Frankfurt am Main (Elkenbachstr. 2, 60316 Frankfurt am Main). Die Gesellschafterversammlung vom 16.05.2008 hat die Änderung des Gesellschaftsvertrages durch Streichung des § 10 (Tod eines Gesellschafters) beschlossen. Bestellt als Liquidator: Plein, Albert Hans, Frankfurt am Main, *28.10.1946.",
        "gesellschafter": null,
        "inhaber": null,
        "name": "H & H Unternehmens- und Personalberatung GmbH",
        "notice_id": "89221",
        "posted_on": "2008-06-02",
        "rechtsform": null,
        "sitz": null,
        "url": "https://www.handelsregisterbekanntmachungen.de/en/skripte/hrb.php?rb_id=89221&land_abk=he"
    },
    "parsed": {
        "officers": [
            {
                "class": "Liquidator",
                "payload": {
                    "city": "Frankfurt am Main",
                    "dob": "1946-10-28",
                    "lastname": "Plein",
                    "name": "Albert Hans"
                },
                "text": " Plein, Albert Hans, Frankfurt am Main, *28.10.1946."
            }
        ]
    }
}