{
    "orig": {
        "aktenzeichen": "HRA 5531",
        "amtsgericht": "Siegburg",
        "event_date": "2013-03-20",
        "event_type": "Veränderungen",
        "federal_state": "nw",
        "full_text": "Amtsgericht Siegburg Aktenzeichen: HRA 5531   \nBekannt gemacht am: 25.03.2013 12:00 Uhr\n\n\n\n\nIn () gesetzte Angaben der Anschrift und des Geschäftszweiges erfolgen ohne Gewähr.\nVeränderungen\n20.03.2013\n\nFlexbau GmbH & Co.KG, Sankt Augustin, An der Ziegelei 7, 53757 Sankt Augustin. Hennef. Geschäftsanschrift: Sanddornweg 10, 53773 Hennef. Lfd. Nr. 1 Sp. 3 b) nach Sitzverlegung von Amts wegen berichtigt: Persönlich haftender Gesellschafter: Flexbau Verwaltungs-GmbH, Hennef (Amtsgericht Siegburg HRB 12055), mit der Befugnis im Namen der Gesellschaft mit sich im eigenen Namen oder als Vertreter eines Dritten Rechtsgeschäfte abzuschließen. Der Sitz ist von Sankt Augustin nach Hennef verlegt.",
        "gesellschafter": null,
        "inhaber": null,
        "name": "Flexbau GmbH & Co.KG",
        "notice_id": "897743",
        "posted_on": "2013-03-25",
        "rechtsform": null,
        "sitz": null,
        "url": "https://www.handelsregisterbekanntmachungen.de/en/skripte/hrb.php?rb_id=897743&land_abk=nw"
    },
    "parsed": {
        "labels": [
            {
                "label": "address",
                "text": " Sanddornweg 10, 53773 Hennef."
            }
        ],
        "officers": [
            {
                "class": "PersonalPartner",
                "payload": {
                    "city": "mit der Befugnis im Namen der Gesellschaft mit sich im eigenen Namen oder als Vertreter eines Dritten Rechtsgeschäfte abzuschließen",
                    "lastname": "Flexbau Verwaltungs-GmbH",
                    "name": "Hennef (Amtsgericht Siegburg HRB 12055)"
                },
                "text": " Flexbau Verwaltungs-GmbH, Hennef (Amtsgericht Siegburg HRB 12055), mit der Befugnis im Namen der Gesellschaft mit sich im eigenen Namen oder als Vertreter eines Dritten Rechtsgeschäfte abzuschließen."
            }
        ]
    }
}