{
    "orig": {
        "aktenzeichen": "HRB 232780",
        "amtsgericht": "Mannheim",
        "event_date": "2008-09-16",
        "event_type": "Veränderungen",
        "federal_state": "bw",
        "full_text": "Amtsgericht Mannheim Aktenzeichen: HRB 232780 \nBekannt gemacht am: 18.09.2008 22:00 Uhr\n\n\n\n\nDie in () gesetzten Angaben der Geschäftsanschrift und des Unternehmensgegenstandes erfolgen ohne Gewähr.\nVeränderungen\n16.09.2008\n\nKF Engineering GmbH, Ubstadt-Weiher (Industriestr. 52, 76698 Ubstadt-Weiher). Die Gesellschafterversammlungen vom 25.07.2008 und 16.09.2008 haben die Neufassung des Gesellschaftsvertrages beschlossen; es wurden insbesondere die §§ 1 (Firma und Sitz), 2 (Gegenstand des Unternehmens) und 5 (Stammkapital) geändert. Das Stammkapital ist durch Beschluss der Gesellschafterversammlung vom gleichen Tag auf 300.000,00 EUR erhöht. Firma geändert; nun: VAN DER MOLEN Aseptic GmbH. Gegenstand geändert; nun: Die Planung, Lieferung und Montage von sowie die Wartung und der Service für Anlagen der Lebensmittelindustrie. 300.000,00 EUR. Bestellt als Geschäftsführer: Kiedrowski, Hans Werner, Neusäß, *26.12.1951. Gesamtprokura gemeinsam mit einem Geschäftsführer: Schultheiß, Werner Adolf, Edenkoben, *09.08.1952.",
        "gesellschafter": null,
        "inhaber": null,
        "name": "KF Engineering GmbH",
        "notice_id": "91450",
        "posted_on": "2008-09-18",
        "rechtsform": null,
        "sitz": null,
        "url": "https://www.handelsregisterbekanntmachungen.de/en/skripte/hrb.php?rb_id=91450&land_abk=bw"
    },
    "parsed": {
        "officers": [
            {
                "class": "AppointedManagingDirector",
                "payload": {
                    "city": "Neusäß",
                    "dob": "1951-12-26",
                    "lastname": "Kiedrowski",
                    "name": "Hans Werner"
                },
                "text": " Kiedrowski, Hans Werner, Neusäß, *26.12.1951."
            },
            {
                "class": "ManagingDirector",
                "payload": {
                    "city": "Edenkoben",
                    "dob": "1952-09-08",
                    "lastname": "Schultheiß",
                    "name": "Werner Adolf"
                },
                "text": " Schultheiß, Werner Adolf, Edenkoben, *09.08.1952."
            }
        ]
    }
}