{
    "orig": {
        "aktenzeichen": "HRB 8880",
        "amtsgericht": "Landshut",
        "event_date": "2015-10-28",
        "event_type": "Veränderungen",
        "federal_state": "by",
        "full_text": "Amtsgericht Landshut Aktenzeichen: HRB 8880 \nBekannt gemacht am: 29.10.2015 02:01 Uhr\n\n\n\n\nIn ( ) gesetzte Angaben der Anschrift und des Geschäftszweiges erfolgen ohne Gewähr:\nVeränderungen\n28.10.2015\n\nHRB 8880: PinkOrange Verwaltungs UG (haftungsbeschränkt), Vilsbiburg, Stadtplatz 19, 84137 Vilsbiburg. Geändert, nun: Geschäftsanschrift: Altstadt 299, 84028 Landshut. Ist nur ein Liquidator bestellt, so vertritt er die Gesellschaft allein. Sind mehrere Liquidatoren bestellt, so wird die Gesellschaft durch die Liquidatoren gemeinsam vertreten. Vertretungsbefugnis geändert, nun: Liquidator: Lehrmann, Marcus, Landshut, *03.05.1974. Die Gesellschafterversammlung vom 19.10.2015 hat die Auflösung der Gesellschaft beschlossen.",
        "gesellschafter": null,
        "inhaber": null,
        "name": "HRB 8880: PinkOrange Verwaltungs UG (haftungsbeschränkt)",
        "notice_id": "919839",
        "posted_on": "2015-10-29",
        "rechtsform": null,
        "sitz": null,
        "url": "https://www.handelsregisterbekanntmachungen.de/en/skripte/hrb.php?rb_id=919839&land_abk=by"
    },
    "parsed": {
        "labels": [
            {
                "label": "address",
                "text": " Altstadt 299, 84028 Landshut."
            }
        ],
        "officers": [
            {
                "class": "Liquidator",
                "payload": {
                    "city": "Landshut",
                    "dob": "1974-03-05",
                    "lastname": ": Lehrmann",
                    "name": "Marcus"
                },
                "text": ": Lehrmann, Marcus, Landshut, *03.05.1974."
            }
        ]
    }
}