{
    "orig": {
        "aktenzeichen": "HRB 510204",
        "amtsgericht": "Jena",
        "event_date": "2016-01-04",
        "event_type": "Veränderungen",
        "federal_state": "th",
        "full_text": "Amtsgericht Jena Aktenzeichen: HRB 510204 \nBekannt gemacht am: 04.01.2016 12:30 Uhr\n\n\n\n\nDie in () gesetzten Angaben der Geschäftsanschrift und des Unternehmensgegenstandes erfolgen ohne Gewähr.\nVeränderungen\n04.01.2016\n\nHRB 510204: Virologik GmbH, Jena, Karl-Liebknecht-Str. 22, 07749 Jena. Ist nur ein Liquidator bestellt, so vertritt er die Gesellschaft allein. Sind mehrere Liquidatoren bestellt, so wird die Gesellschaft durch zwei Liquidatoren oder durch einen Liquidator gemeinsam mit einem Prokuristen vertreten. Geändert, nun: Liquidator: Gül, Servet, Eggolsheim, *26.02.1981. Die Gesellschaft ist aufgelöst.",
        "gesellschafter": null,
        "inhaber": null,
        "name": "HRB 510204: Virologik GmbH",
        "notice_id": "92287",
        "posted_on": "2016-01-04",
        "rechtsform": null,
        "sitz": null,
        "url": "https://www.handelsregisterbekanntmachungen.de/en/skripte/hrb.php?rb_id=92287&land_abk=th"
    },
    "parsed": {
        "flags": [
            {
                "flag": "CompanyClosed",
                "text": "Die\\ Gesellschaft\\ ist\\ aufgel\\öst\\."
            }
        ],
        "officers": [
            {
                "class": "Liquidator",
                "payload": {
                    "city": "Eggolsheim",
                    "dob": "1981-02-26",
                    "lastname": ": Gül",
                    "name": "Servet"
                },
                "text": ": Gül, Servet, Eggolsheim, *26.02.1981."
            }
        ]
    }
}