{
    "orig": {
        "aktenzeichen": "HRB 509866",
        "amtsgericht": "Jena",
        "event_date": "2016-01-14",
        "event_type": "Veränderungen",
        "federal_state": "th",
        "full_text": "Amtsgericht Jena Aktenzeichen: HRB 509866 \nBekannt gemacht am: 14.01.2016 12:30 Uhr\n\n\n\n\nDie in () gesetzten Angaben der Geschäftsanschrift und des Unternehmensgegenstandes erfolgen ohne Gewähr.\nVeränderungen\n14.01.2016\n\nHRB 509866: Amplecta Europe GmbH, Jena, Am Steinborn 85, 07749 Jena. Ist nur ein Liquidator bestellt, so vertritt er die Gesellschaft allein. Sind mehrere Liquidatoren bestellt, so wird die Gesellschaft durch zwei Liquidatoren oder durch einen Liquidator gemeinsam mit einem Prokuristen vertreten. Geändert, nun: Liquidator: Ortner, Andreas, Bruckneudorf / Österreich, *05.12.1965. Die Gesellschaft ist aufgelöst.",
        "gesellschafter": null,
        "inhaber": null,
        "name": "HRB 509866: Amplecta Europe GmbH",
        "notice_id": "92749",
        "posted_on": "2016-01-14",
        "rechtsform": null,
        "sitz": null,
        "url": "https://www.handelsregisterbekanntmachungen.de/en/skripte/hrb.php?rb_id=92749&land_abk=th"
    },
    "parsed": {
        "flags": [
            {
                "flag": "CompanyClosed",
                "text": "Die\\ Gesellschaft\\ ist\\ aufgel\\öst\\."
            }
        ],
        "officers": [
            {
                "class": "Liquidator",
                "payload": {
                    "city": "Bruckneudorf / Österreich",
                    "dob": "1965-12-05",
                    "lastname": ": Ortner",
                    "name": "Andreas"
                },
                "text": ": Ortner, Andreas, Bruckneudorf / Österreich, *05.12.1965."
            }
        ]
    }
}