{
    "orig": {
        "aktenzeichen": "HRB 5395",
        "amtsgericht": "Königstein",
        "event_date": "2008-06-30",
        "event_type": "Veränderungen",
        "federal_state": "he",
        "full_text": "Amtsgericht Königstein Aktenzeichen: HRB 5395 \nBekannt gemacht am: 02.07.2008 22:00 Uhr\n\n\n\n\nVeröffentlichungen des Amtsgerichts Königstein im Taunus\r\r\rDie in () gesetzten Angaben der Geschäftsanschrift und des Geschäftszweiges erfolgen ohne Gewähr.\nVeränderungen\n30.06.2008\n\nAsklepios Klinik Pasewalk GmbH, Königstein im Taunus (Debusweg 3, 61462 Königstein im Taunus). Nicht mehr Geschäftsführer: Willebrand, Elmar, Friedrichsdorf, *09.06.1960. Bestellt als Geschäftsführer: Gnauck, Ulrich, Seesen, *30.08.1961. Bestellt als Geschäftsführer: Leonhard, Stephan, Frankfurt am Main, *01.02.1961, einzelvertretungsberechtigt.",
        "gesellschafter": null,
        "inhaber": null,
        "name": "Asklepios Klinik Pasewalk GmbH",
        "notice_id": "92846",
        "posted_on": "2008-07-02",
        "rechtsform": null,
        "sitz": null,
        "url": "https://www.handelsregisterbekanntmachungen.de/en/skripte/hrb.php?rb_id=92846&land_abk=he"
    },
    "parsed": {
        "officers": [
            {
                "class": "DismissedManagingDirector",
                "payload": {
                    "city": "Friedrichsdorf",
                    "dismissed": true,
                    "dob": "1960-06-09",
                    "lastname": "Willebrand",
                    "name": "Elmar"
                },
                "text": " Willebrand, Elmar, Friedrichsdorf, *09.06.1960."
            },
            {
                "class": "AppointedManagingDirector",
                "payload": {
                    "city": "Seesen",
                    "dob": "1961-08-30",
                    "lastname": "Gnauck",
                    "name": "Ulrich"
                },
                "text": " Gnauck, Ulrich, Seesen, *30.08.1961."
            },
            {
                "class": "AppointedManagingDirector",
                "payload": {
                    "city": "Frankfurt am Main",
                    "dob": "1961-02-01",
                    "flag": "sole representation",
                    "lastname": "Leonhard",
                    "name": "Stephan"
                },
                "text": " Leonhard, Stephan, Frankfurt am Main, *01.02.1961, einzelvertretungsberechtigt."
            }
        ]
    }
}