{
    "orig": {
        "aktenzeichen": "HRB 3117",
        "amtsgericht": "Coesfeld",
        "event_date": "2013-07-31",
        "event_type": "Veränderungen",
        "federal_state": "nw",
        "full_text": "Amtsgericht Coesfeld Aktenzeichen: HRB 3117   \nBekannt gemacht am: 07.08.2013 12:00 Uhr\n\n\n\n\nIn () gesetzte Angaben der Anschrift und des Geschäftszweiges erfolgen ohne Gewähr.\nVeränderungen\n31.07.2013\n\nASS Ahauser Säureschutzsysteme GmbH, Ahaus, Daimlerstraße 20, 48683 Ahaus. Bestellt als Geschäftsführer: Linke, Lothar, Nister-Möhrendorf, *14.04.1959; Wielens, Klaus-Dieter, Ahaus, *07.08.1959, jeweils einzelvertretungsberechtigt mit der Befugnis im Namen der Gesellschaft mit sich im eigenen Namen oder als Vertreter eines Dritten Rechtsgeschäfte abzuschließen. Nicht mehr Geschäftsführer: Wielens, Irmgard, Ahaus, *20.06.1962.",
        "gesellschafter": null,
        "inhaber": null,
        "name": "ASS Ahauser Säureschutzsysteme GmbH",
        "notice_id": "940742",
        "posted_on": "2013-08-07",
        "rechtsform": null,
        "sitz": null,
        "url": "https://www.handelsregisterbekanntmachungen.de/en/skripte/hrb.php?rb_id=940742&land_abk=nw"
    },
    "parsed": {
        "officers": [
            {
                "class": "AppointedManagingDirector",
                "payload": {
                    "city": "Nister-Möhrendorf",
                    "dob": "1959-04-14",
                    "lastname": "Linke",
                    "name": "Lothar"
                },
                "text": " Linke, Lothar, Nister-Möhrendorf, *14.04.1959"
            },
            {
                "class": "DismissedManagingDirector",
                "payload": {
                    "city": "Ahaus",
                    "dismissed": true,
                    "dob": "1962-06-20",
                    "lastname": "Wielens",
                    "name": "Irmgard"
                },
                "text": " Wielens, Irmgard, Ahaus, *20.06.1962."
            }
        ]
    }
}