{
    "orig": {
        "aktenzeichen": "HRB 12158",
        "amtsgericht": "Kleve",
        "event_date": "2013-09-25",
        "event_type": "Veränderungen",
        "federal_state": "nw",
        "full_text": "Amtsgericht Kleve Aktenzeichen: HRB 12158   \nBekannt gemacht am: 27.09.2013 12:00 Uhr\n\n\n\n\nIn () gesetzte Angaben der Anschrift und des Geschäftszweiges erfolgen ohne Gewähr.\nVeränderungen\n25.09.2013\n\nTango Shoes GmbH, Kleve, Hoffmannallee 53a, 47533 Kleve. Durch Beschluss der Gesellschafterversammlung vom 02.09.2013 ist die Gesellschaft aufgelöst. Ist nur ein Liquidator bestellt, so vertritt er die Gesellschaft allein. Sind mehrere Liquidatoren bestellt, so wird die Gesellschaft durch die Liquidatoren gemeinsam vertreten. Nunmehr bestellt als Liquidator: Goijarts, Gregorius Maria Hubertus, Oisterwijk/ Niederlande, *01.03.1945.",
        "gesellschafter": null,
        "inhaber": null,
        "name": "Tango Shoes GmbH",
        "notice_id": "956716",
        "posted_on": "2013-09-27",
        "rechtsform": null,
        "sitz": null,
        "url": "https://www.handelsregisterbekanntmachungen.de/en/skripte/hrb.php?rb_id=956716&land_abk=nw"
    },
    "parsed": {
        "officers": [
            {
                "class": "Liquidator",
                "payload": {
                    "city": "Oisterwijk/ Niederlande",
                    "dob": "1945-01-03",
                    "lastname": "Goijarts",
                    "name": "Gregorius Maria Hubertus"
                },
                "text": " Goijarts, Gregorius Maria Hubertus, Oisterwijk/ Niederlande, *01.03.1945."
            }
        ]
    }
}