{
    "orig": {
        "aktenzeichen": "HRB 14481",
        "amtsgericht": "Traunstein",
        "event_date": "2016-03-22",
        "event_type": "Veränderungen",
        "federal_state": "by",
        "full_text": "Amtsgericht Traunstein Aktenzeichen: HRB 14481 \nBekannt gemacht am: 23.03.2016 02:05 Uhr\n\n\n\n\nIn ( ) gesetzte Angaben der Anschrift und des Geschäftszweiges erfolgen ohne Gewähr:\nVeränderungen\n22.03.2016\n\nHRB 14481: Georg Utzinger GmbH, Heldenstein (Münchner Str. 15, 84431 Heldenstein). Allgemeine Vertretungsregelung gem. § 384 Abs. 2 FamFG von Amts wegen berichtigt: Die Gesellschaft wird durch den/die Liquidator/en vertreten. Vertretungsbefugnis gem. § 384 Abs. 2 FamFG von Amts wegen berichtigt: Liquidator: Wallner, Sibylle, Heldenstein, *03.06.1972. Das Insolvenzverfahren ist durch Beschluss des Amtsgerichts Mühldorf a. Inn vom 16.02.2016 (Az. IN 186/06) nach Schlussverteilung aufgehoben worden.",
        "gesellschafter": null,
        "inhaber": null,
        "name": "HRB 14481: Georg Utzinger GmbH",
        "notice_id": "961198",
        "posted_on": "2016-03-23",
        "rechtsform": null,
        "sitz": null,
        "url": "https://www.handelsregisterbekanntmachungen.de/en/skripte/hrb.php?rb_id=961198&land_abk=by"
    },
    "parsed": {
        "officers": [
            {
                "class": "Liquidator",
                "payload": {
                    "city": "Heldenstein",
                    "dob": "1972-06-03",
                    "lastname": "Wallner",
                    "name": "Sibylle"
                },
                "text": " Wallner, Sibylle, Heldenstein, *03.06.1972."
            }
        ]
    }
}